"A Single-Layer Low-Profile Broadband Metasurface Antenna Array for Sub-6 GHz 5G Communication Systems","J. d. D. Ntawangaheza; L. Sun; Z. Xie; Y. Pang; Z. Zheng; G. Rushingabigwi","Department of Electronic Engineering and Information Science, University of Science and Technology of China (USTC), Hefei, China; Department of Electronic Engineering and Information Science, University of Science and Technology of China (USTC), Hefei, China; Department of Electronic Engineering and Information Science, University of Science and Technology of China (USTC), Hefei, China; Department of Electronic Engineering and Information Science, University of Science and Technology of China (USTC), Hefei, China; Department of Electronic Engineering and Information Science, University of Science and Technology of China (USTC), Hefei, China; Department of Electronic Engineering and Information Science, University of Science and Technology of China (USTC), Hefei, China",IEEE Transactions on Antennas and Propagation,"6 Apr 2021","2021","69","4","2061","2071","This article presents a planar, low-profile, and single-layer metasurface (MTS)-based wideband 4 × 4 array antenna operating in the 5G sub-6 GHz band. The proposed antenna consists of 4 × 4 unequal size MTS unit cells fed by a simple parallel microstrip feed network in the form of a thin strip cross dipole. The wide impedance bandwidth (IBW) and improved boresight gain characteristics are realized due, respectively, to the excitation of multiple TM resonance modes that are closely spaced and the relatively large lateral size that supports in-phase currents. With an overall size of 1.40λ0×1.22λ0×0.054λ0 (where λ0 is the free-space wavelength at the center frequency of 5.64 GHz), the proposed antenna realizes an IBW of 41.13% (4.48-6.80 GHz), a peak boresight gain of 10.14 dBi, low cross-polarization in the E- and H-planes, and higher front-to-back ratio. Because of the advantages of low-profile, planar and single-layer structure, as well as equal E- and H-planes 3 dB beamwidth, the proposed antenna is a competitive candidate for several modern wireless communications systems, including 5G in the sub-6 GHz band.","1558-2221","","10.1109/TAP.2020.3027042","Chinese Scholarship Council; ","https://ieeexplore.ieee.org/stamp/stamp.jsp?arnumber=9211748","A microstrip patch antenna (MPA);artificial magnetic conductor (AMC);broadband;cross-polarization (X-pol);front-to-back ratio (FBR);high gain;magneto-electric (ME) dipole;metasurface (MTS);wideband antenna","Feeds;Dipole antennas;Antenna arrays;Microstrip;Microstrip antennas;Broadband antennas","","25","","42","IEEE","2 Oct 2020","","","IEEE","IEEE Journals"
"Arbitrary Near-Field Spatial Signal Processing","R. Liu; K. Wu","Poly-Grames Research Center, Polytechnique Montréal, Montreal, QC, Canada; Poly-Grames Research Center, Polytechnique Montréal, Montreal, QC, Canada",IEEE Transactions on Antennas and Propagation,"6 Apr 2021","2021","69","4","2072","2082","Electromagnetic waves have been widely exploited as signal, carrier, and power for wireless and wireline systems over the electromagnetic spectrum. As the classical approach, parametric interactions among localized or discrete signal processing devices are usually accomplished by electromagnetic fields or waves guided in conductor and/or dielectric bounded structures. These structures feature specific circuit functions in an electronic or photonic manner. Such electromagnetic circuits now face a number of application issues, such as geometrical complexity, power handling capability, and flexible reconfigurability, when they are used in certain large-scale electromagnetic systems, like in a massive multiple-input and multiple-output (MIMO). In this work, we propose and present an unconventional approach to realize a desired interaction or operation among devices. Such an interaction relies on wave or field interferences induced by a set of coherent antenna array over their near-field region where signal processing can be accomplished spatially. Fundamental functions and operation mechanisms of the proposed spatial signal processing approach are discussed and demonstrated in this work. It is worth mentioning that the proposed approach is universally applicable to all physical wave devices and systems, such as acoustic and electromagnetic waves.","1558-2221","","10.1109/TAP.2020.3026871","","https://ieeexplore.ieee.org/stamp/stamp.jsp?arnumber=9210856","Antenna array;coherent antenna array;near field;near-field antenna;near-field multifocus (NFMF);spatial signal processing","Array signal processing;Interference;Linear antenna arrays;Delays;Mathematical model","","4","","25","IEEE","1 Oct 2020","","","IEEE","IEEE Journals"
"Dual-Polarized Vivaldi Array on a Triangular Lattice","R. W. Kindt; B. T. Binder","The U.S. Naval Research Laboratory, Washington, DC, USA; The Office of Naval Research, Arlington, VA, USA",IEEE Transactions on Antennas and Propagation,"6 Apr 2021","2021","69","4","2083","2091","This article presents a dual-polarized Vivaldi array on a triangular lattice. The all-metal ultrawideband Vivaldi features offset radiator pairs that are precision-machined from aluminum stock as a modular tile, similar to earlier reports on more typical all-metal square-lattice Vivaldi arrays. The intent of this work is to validate the embedded element performance of the dual-polarized triangular-lattice Vivaldi, comparing one-to-one with results for a similarly sized dual-polarized all-metal Vivaldi array on a square (egg-crate) lattice, reported previously. The triangular-lattice Vivaldi array is optimally sampled for grating-lobe-free scans with a potential 15.5% reduction in element count compared to a corresponding optimally sampled square-lattice array of similar size. As such, the footprint of the manufactured triangular-lattice Vivaldi array is roughly 8% larger than the square-lattice array, yet has 7% fewer elements. Infinite array predictions are presented and shown to compare favorably with previous findings for the square-lattice Vivaldi array, noting minor performance compromises. Wideband and wide-scan simulations are validated with measurements of prototype hardware, demonstrating that embedded element performance of the triangular-lattice array correlates well with modeling predictions. All told, the triangular-lattice array has similar capability to the square-lattice Vivaldi array in a more efficiently sampled aperture.","1558-2221","","10.1109/TAP.2020.3037691","Office of Naval Research Code 312 in 2018–2019 as basic (6.1) research; ","https://ieeexplore.ieee.org/stamp/stamp.jsp?arnumber=9263349","Dual-polarized;flared notch;phased array;triangular lattice;ultrawideband;Vivaldi","Lattices;Phased arrays;Wideband;Apertures;Antenna arrays;Gratings;Geometry","","20","","40","IEEE","18 Nov 2020","","","IEEE","IEEE Journals"
"Synthesis of Angle Arrays by the NDF of the Radiation Integral","G. Leone; F. Munno; R. Pierri","Dipartimento di Ingegneria, Università della Campania “Luigi Vanvitelli”, Aversa, Italy; Dipartimento di Ingegneria, Università della Campania “Luigi Vanvitelli”, Aversa, Italy; Dipartimento di Ingegneria, Università della Campania “Luigi Vanvitelli”, Aversa, Italy",IEEE Transactions on Antennas and Propagation,"6 Apr 2021","2021","69","4","2092","2102","Linear arrays have been well studied for their widespread applications, but they suffer from severe limitations in the scanning capabilities due to the inherent main beam spreading. The combination of two linear arrays, radiating simultaneously, may provide the coverage of a wide angular domain by identical beams. More in general, first, we consider the radiation properties of a collection of continuous linear sources by following an inverse source approach which aims at investigating the spectral decomposition of the relevant radiation operator by discussing its singular value decomposition and the number of degrees of freedom of the source according to its geometry. Then, a connection with the known closed-form results of the single line case is established. Next, for an angle geometry, the discussion of the point spread function reveals the condition to be achieved for an angle source to radiate identical beams with a coverage larger than the one of a single linear source with the same total length. Finally, we consider the power synthesis of identical focusing beams by linear arrays, arranged in an angle geometry, also including the effect of the element factor, without excitation constraints, so to show how possibly to drive the design of electrically large arrays by such an analytical approach.","1558-2221","","10.1109/TAP.2020.3026910","Italian Ministry of University and Scientific Research through the PRIN 2017 Programme; ","https://ieeexplore.ieee.org/stamp/stamp.jsp?arnumber=9210868","Conformal antennas;electromagnetic scattering inverse problems;inverse source problem;multifaceted arrays;number of degrees of freedom (NDF);singular value decomposition (SVD)","Geometry;Linear antenna arrays;Antenna arrays;Antenna radiation patterns;Eigenvalues and eigenfunctions;Kernel;Estimation","","11","","23","IEEE","1 Oct 2020","","","IEEE","IEEE Journals"
"Mutual Coupling of Antennas With Overlapping Minimum Spheres Based on the Transformation Between Spherical and Plane Vector Waves","J. Rubio; R. Gómez-Alcalá","Escuela Politécnica, Universidad de Extremadura, Cáceres, Spain; Escuela Politécnica, Universidad de Extremadura, Cáceres, Spain",IEEE Transactions on Antennas and Propagation,"6 Apr 2021","2021","69","4","2103","2111","Mutual coupling in finite arrays of antennas with strongly overlapping minimum spheres is quickly calculated by computing the general translation matrix between spherical modes. This matrix is obtained by using the transformation properties of spherical and plane vector waves. Although this approach is less efficient than the classical one, which is based on addition theorems, it allows to overcome the well-known limitation of addition theorems that requires nonintersecting minimum spheres. Symmetry relations are provided for the translation coefficients that greatly increase the speed of computation of the general translation matrix. By computing the reflection and the transmission submatrices of the generalized scattering matrix of a finite antenna array, accurate results are obtained for the S-parameters and the radiation patterns of arrays, in comparison with commercial software or a purely numerical in-house full-wave method. For this purpose, different types of antennas with strongly overlapping hemispheres in an array environment on a ground plane are used, such as apertures, monopoles, cavity-backed patch antennas, or dielectric resonator antennas.","1558-2221","","10.1109/TAP.2020.3026882","Ministerio de Economía y Competitividad (MINECO)/Agencia Estatal de Investigación (AEI)/Fondo Europeo de Desarrollo Regional (FEDER), Unión Europea (UE), Spain(grant numbers:TEC2017-83352-C2-2-P,TEC2017-83352-C2-1-P); Junta de Extremadura and the FEDER Program (European Union)(grant numbers:GR18055); ","https://ieeexplore.ieee.org/stamp/stamp.jsp?arnumber=9210792","Addition theorems;finite arrays;generalized scattering matrix (GSM);mutual coupling;plane wave expansion;spherical wave expansion","Antenna arrays;Antenna theory;Transmission line matrix methods;Directive antennas;Mutual coupling;Dipole antennas","","5","","21","CCBY","1 Oct 2020","","","IEEE","IEEE Journals"
"A Partition-Based Method for Harmonic Beamforming of Time-Modulated Planar Array","Y. Ma; C. Miao; Y. -H. Li; W. Wu","Ministerial Key Laboratory of JGMT, School of Electronic Engineering and Optoelectronic Technology, Nanjing University of Science and Technology, Nanjing, China; Ministerial Key Laboratory of JGMT, School of Electronic Engineering and Optoelectronic Technology, Nanjing University of Science and Technology, Nanjing, China; Ministerial Key Laboratory of JGMT, School of Electronic Engineering and Optoelectronic Technology, Nanjing University of Science and Technology, Nanjing, China; Ministerial Key Laboratory of JGMT, School of Electronic Engineering and Optoelectronic Technology, Nanjing University of Science and Technology, Nanjing, China",IEEE Transactions on Antennas and Propagation,"6 Apr 2021","2021","69","4","2112","2121","Because of the multiplication of antennas, harmonic beamforming based on the time-modulated planar array (TMPA) requires a much longer modulation period than the time-modulated linear array (TMLA). Two additional constraints should also be fulfilled: 1) avoid aliasing in the frequency domain; the modulation frequency should be larger than the transmitted signal's bandwidth and 2) accurately extract harmonics; the bandpass filter (BPF) bandwidth should be no less than the modulation frequency. If the bandwidth of the transmitted signal increases, the processor and radio frequency (RF) switch should be accordingly improved, thus increasing the overall costs. In this article, we propose a method based on partition subarrays for TMPA harmonic beamforming. Upon modulating subarrays separately and simultaneously, we obtain an equivalent beam. In our scheme, a TMPA is divided into S subarrays, such that the modulation frequency and the maximum bandwidth of the transmitted signal can be S times the original ones, making filtering much easier. Our approach has three major advantages: 1) it greatly reduces the requirement of BPF by enlarging the frequency interval; 2) it allows the transmission of larger bandwidth signals with the same hardware; and 3) the efficiency of the antenna is improved. Numerical simulations verified the proposed method.","1558-2221","","10.1109/TAP.2020.3026893","","https://ieeexplore.ieee.org/stamp/stamp.jsp?arnumber=9210798","Bandpass filters (BPFs);beamforming;harmonic;radio frequency (RF) switch;subarray;time-modulated planar array (TMPA)","Harmonic analysis;Switches;Array signal processing;Band-pass filters","","9","","24","IEEE","1 Oct 2020","","","IEEE","IEEE Journals"
"Deep-Subwavelength and High-Q Trapped Mode Induced by Symmetry-Broken in Toroidal Plasmonic Resonator","X. Zhang; T. J. Cui","State Key Laboratory of Millimeter Waves, Southeast University, Nanjing, China; State Key Laboratory of Millimeter Waves, Southeast University, Nanjing, China",IEEE Transactions on Antennas and Propagation,"6 Apr 2021","2021","69","4","2122","2129","We propose a toroidal plasmonic resonator composed of double-layer concentric inward and outward spoke patterns, which tightly compacts all Mie resonance modes while reduces the radiation loss. Introducing a slit perturbation to the top spoke to break the in-plane symmetry, a trapped mode is excited and the confinement is double folded. The trapped mode behaves as a mixture of the electric and magnetic plasmon dipoles, realizing a quality factor ( Q-factor) of 104.8 within the diameter of 1/20 wavelength. On-chip excitation of the trapped mode is analyzed. Experimental results agree well with numerical simulations. The microstrip compatible structure, outstanding compactness, and high Q-factor of the proposed plasmonic resonator will find significant applications in fundamental cavity electrodynamics and on-chip microwave sensing.","1558-2221","","10.1109/TAP.2020.3026480","National Natural Science Foundation of China(grant numbers:61701108,61631007,61871127,61890544,61735010,61731010,61722106); National Key Research and Development Program of China(grant numbers:2017YFA0700201,2017YFA0700202,2017YFA0700203); Fundamental Research Funds for the Central Universities(grant numbers:2242020R20001); 111 Project(grant numbers:111-2-05); Fund for International Cooperation and Exchange of the National Natural Science Foundation of China(grant numbers:61761136007); ","https://ieeexplore.ieee.org/stamp/stamp.jsp?arnumber=9210200","Deep-subwavelength;metamaterials;microwave resonator;plasmonics;Q-factor","Plasmons;Optical resonators;Q-factor;Microstrip;Resonant frequency;Microwave filters;Substrates","","32","","39","IEEE","30 Sep 2020","","","IEEE","IEEE Journals"
"Single- and Dual-Band High-Order Bandpass Frequency Selective Surfaces Based on Aperture-Coupled Dual-Mode Patch Resonators","J. -M. Xie; B. Li; Y. -P. Lyu; L. Zhu","College of Electronics and Optical Engineering and the College of Microelectronics, Nanjing University of Posts and Telecommunications, Nanjing, China; College of Electronics and Optical Engineering and the College of Microelectronics, Nanjing University of Posts and Telecommunications, Nanjing, China; College of Telecommunications and Information Engineering, Nanjing University of Posts and Telecommunications, Nanjing, China; Department of Electrical and Computer Engineering, Faculty of Science and Technology, University of Macau, Macau, China",IEEE Transactions on Antennas and Propagation,"6 Apr 2021","2021","69","4","2130","2141","In this article, a class of bandpass frequency selective surfaces (FSSs) based on aperture-coupled dual-mode patch resonators (AC-DMPRs) are proposed to achieve single- and dual-band high-order filtering responses with low profiles. Initially, a basic resonator of a square patch with diagonal corner truncations is theoretically investigated so as to demonstrate that two orthogonal modes can be simultaneously excited in a single patch resonator. Then, to eliminate the cross-polarized reflection caused by the orthogonal modes, a composite resonator, including four of such corner-truncated patches with 90° rotation between each two adjacent patches, is constructed and analyzed. Furthermore, by arranging two of such composite resonators in a back-to-back manner through coupling apertures on the middle metallic layer, an FSS element of three-layer AC-DMPR is formed. Compared with traditional aperture-coupled patch resonators (AC-PRs), the resonant modes of AC-DMPR are increased twice, thus giving more design flexibility to achieve high-order performance. To validate the design concept, a single-band fourth-order bandpass FSS is designed by introducing magnetic couplings in the AC-DMPRs. Moreover, dual-band second-order bandpass FSSs with magnetic and/or electric couplings in the AC-DMPRs are also designed. Based on the even- and odd-mode analysis method, equivalent circuit models are established to explain the operating principles of the proposed structures. Finally, the designed FSSs are fabricated and measured. Good agreement between the measured and simulated results well validates the conceptual designs.","1558-2221","","10.1109/TAP.2020.3026863","National Nature Science Foundation of China(grant numbers:62071243,61971475,61901226); Nanjing University of Posts and Telecommunications Scientific Foundation(grant numbers:NY217002); Natural Science Foundation of Jiangsu Province(grant numbers:BK20190727); Science and Technology Development Fund of Macao(grant numbers:FDCT-0095/2019/A2); University of Macau(grant numbers:MYRG2017-00007-FST,MYRG2018-00073-FST); ","https://ieeexplore.ieee.org/stamp/stamp.jsp?arnumber=9210865","Aperture-coupled patch resonators (AC-PRs);dual-mode;frequency selective surface (FSS);high-order filtering response","Resonators;Reflection;Filtering;Frequency selective surfaces;Couplings;Dual band;Apertures","","54","","32","IEEE","1 Oct 2020","","","IEEE","IEEE Journals"
"Deeper Confinement of Electromagnetic Waves Beyond Spoof Surface Plasmon Polaritons","A. -Q. Zhang; W. -B. Lu; Z. -G. Liu; Y. Li","College of Electronic and Optical Engineering, Nanjing University of Posts and Telecommunications, Nanjing, China; State Key Laboratory of Millimeter Waves, School of Information Science and Engineering, Southeast University, Nanjing, China; State Key Laboratory of Millimeter Waves, School of Information Science and Engineering, Southeast University, Nanjing, China; Department of Electronic Engineering, Tsinghua University, Beijing, China",IEEE Transactions on Antennas and Propagation,"6 Apr 2021","2021","69","4","2142","2150","The physics of spoof surface plasmon polaritons (SSPPs) is widely studied for their intrinsic confinement of electromagnetic wave, leading to the useful applications of device miniaturization and signal integrity. As another imitation of surface plasmon polaritons (SPPs) in microwave, effective SPPs (ESPPs) are excited inside the waveguide based on structural dispersion. Without using lossy plasmonic materials, slow wave property is achieved inside the waveguide for the interface confinement. In this work, for further enhancing the field confinement of SSPPs, the waveguide dispersion method is utilized on the structure of SSPPs. In this way, the techniques of ESPPs and SSPPs are feasibly combined for the first time, coining the name of “effective SSPPs (ESSPPs).” The dispersion relation of the ESSPPs is analyzed theoretically and numerically with the obvious field confinement. The structural dispersion makes the wavelength of ESSPPs reach 1/18 of the wavelength of SSPPs, which has potential applications for device miniaturization and signal integrity. Finally, two prototypes of the ESSPPs waveguide are fabricated on the substrate integrated waveguide (SIW) platform. The experimental results of the prototypes verify the stronger field confinement, indicating new possibilities to slow down the wave propagation with controllable confinement.","1558-2221","","10.1109/TAP.2020.3027505","National Natural Science Foundation of China (NSFC)(grant numbers:61671150,61671147); National Science Fund for Distinguished Young Scholars(grant numbers:61925103); ","https://ieeexplore.ieee.org/stamp/stamp.jsp?arnumber=9212570","Deeper field confinement;effective dielectric;effective surface plasmon polaritons (ESPPs);grooves;structural dispersion;surface plasmon polaritons (SPPs)","Dispersion;Surface plasmon polaritons;Electromagnetic waveguides;Dielectrics;Antennas;Metamaterials","","2","","28","IEEE","5 Oct 2020","","","IEEE","IEEE Journals"
"Implementation and Characterization of a Two-Dimensional Printed Circuit Dynamic Metasurface Aperture for Computational Microwave Imaging","T. A. Sleasman; M. F. Imani; A. V. Diebold; M. Boyarsky; K. P. Trofatter; D. R. Smith","Department of Electrical and Computer Engineering, Duke University, Durham, NC, USA; Department of Electrical and Computer Engineering, Duke University, Durham, NC, USA; Department of Electrical and Computer Engineering, Duke University, Durham, NC, USA; Department of Electrical and Computer Engineering, Duke University, Durham, NC, USA; Department of Electrical and Computer Engineering, Duke University, Durham, NC, USA; Department of Electrical and Computer Engineering, Duke University, Durham, NC, USA",IEEE Transactions on Antennas and Propagation,"6 Apr 2021","2021","69","4","2151","2164","We present the design, fabrication, and experimental characterization of a 2-D, dynamically tuned, metasurface aperture, emphasizing its potential performance in computational imaging applications. The dynamic metasurface aperture (DMA) consists of an irregular, planar cavity that feeds a multitude of tunable metamaterial elements, all fabricated in a compact, multilayer printed circuit board process. The design considerations for the metamaterial element as a tunable radiator, the associated biasing circuitry, as well as cavity parameters are examined and discussed. A sensing matrix can be constructed from the measured transmit patterns, the singular value spectrum of which provides insight into the information capacity of the apertures. We investigate the singular value spectra of the sensing matrix over a variety of operating parameters, such as the number of metamaterial elements, number of masks (aka tuning states), and number of radiating elements. After optimizing over these key parameters, we demonstrate computational microwave imaging of simple test objects.","1558-2221","","10.1109/TAP.2020.3027188","Air Force Office of Scientific Research (AFOSR)(grant numbers:FA9550-12-1-0491 FA9550-18-1-0187); ","https://ieeexplore.ieee.org/stamp/stamp.jsp?arnumber=9211779","Aperture antennas;holography;image reconstruction;microwave antennas;microwave imaging;multiplexing;radar imaging;statistical distributions","Metamaterials;Imaging;Apertures;Resonant frequency;Two dimensional displays;Antenna radiation patterns","","58","","75","IEEE","2 Oct 2020","","","IEEE","IEEE Journals"
