"Stochastic Filtering in Electromagnetics","R. Bansal; S. Majumdar; H. Parthasarthy","Department of Electronics and Communication Engineering, Delhi Technological University, Delhi, India; Department of Electronics and Communication Engineering, Delhi Technological University, Delhi, India; Department of Electronics and Communication Engineering, Netaji Subhas University of Technology, Delhi, India",IEEE Transactions on Antennas and Propagation,"6 Apr 2021","2021","69","4","2165","2180","This article presents the estimation of electric and magnetic fields using the Kalman filter (KF). The electric and magnetic fields in the entire space have been estimated using the scalar and vector potential. For this estimation, the measurements at a sparse discrete set of spatial pixels have been used. To implement the KF, the state space model has been obtained using the wave equations with sources satisfied by the scalar and vector potential. The proposed method has been implemented on a Hertzian dipole antenna. The fields estimated using KF have been compared with the recursive least squares (RLS) method. The KF presents better estimation than RLS, as it is an optimal estimator. This work uses the Kronecker product for compact representation of discretized fields in the form of vectors and partial differential operators in the form of matrices.","1558-2221","","10.1109/TAP.2020.3027054","","https://ieeexplore.ieee.org/stamp/stamp.jsp?arnumber=9211799","Antenna;electromagnetic field;Kalman filter (KF);Kronecker product;recursive estimation","Estimation;Magnetic resonance imaging;Electric potential;Electromagnetics;Propagation;Maxwell equations;Antennas","","6","","36","IEEE","2 Oct 2020","","","IEEE","IEEE Journals"
"Dual-Band Reflective Metagratings With Interleaved Meta-Wires","G. Xu; S. V. Hum; G. V. Eleftheriades","Edward S. Rogers Senior Department of Electrical and Computer Engineering, University of Toronto, Toronto, ON, Canada; Department of Electrical and Computer Engineering, University of Toronto, Toronto, ON, Canada; Department of Electrical and Computer Engineering, University of Toronto, Toronto, ON, Canada",IEEE Transactions on Antennas and Propagation,"6 Apr 2021","2021","69","4","2181","2193","We propose a new topology for printed circuit board metagratings (MGs) for manipulation of electromagnetic waves at microwave frequencies. By interleaving two single-band segmented gratings (SGs), a composite device capable of performing dual-band operation is realized. The constituent SGs are designed independently, meaning the two operating frequencies need not be harmonically related. The SGs are shielded from one another through inclusion of via fences which suppress near-field coupling. They are each engineered to be inactive within the other's operating band, which helps retain their individually encoded functionalities. Using the proposed topology, a dual-band MG that performs perfect anomalous reflection of plane waves at 10 and 15.11 GHz is designed. The device is verified both numerically and experimentally.","1558-2221","","10.1109/TAP.2020.3026901","","https://ieeexplore.ieee.org/stamp/stamp.jsp?arnumber=9210795","Anomalous reflection;dual-band;metagratings (MGs);reflectarrays","Gratings;Dual band;Diffraction;Antennas;Electromagnetic scattering;Dielectrics;Wires","","26","","31","IEEE","1 Oct 2020","","","IEEE","IEEE Journals"
"Learning-Based Fast Electromagnetic Scattering Solver Through Generative Adversarial Network","Z. Ma; K. Xu; R. Song; C. -F. Wang; X. Chen","Engineering Research Center of Smart Microsensors and Microsystems, Ministry of Education, Hangzhou Dianzi University, Hangzhou, China; Engineering Research Center of Smart Microsensors and Microsystems, Ministry of Education, Hangzhou Dianzi University, Hangzhou, China; Department of Biomedical Engineering, Hefei University of Technology, Hefei, China; Temasek Laboratories, National University of Singapore, Singapore; Department of Electrical and Computer Engineering, National University of Singapore, Singapore",IEEE Transactions on Antennas and Propagation,"6 Apr 2021","2021","69","4","2194","2208","This article proposes a learning-based noniterative method to solve electromagnetic (EM) scattering problems utilizing pix2pix, a popular generative adversarial network (GAN). Instead of calculating induced currents directly from a matrix inversion, a forward-induced current learning method (FICLM) is introduced to calculate the induced current through a neural-network mapping. The scattered fields can be further calculated through a multiplication of the Green's function with the predicted induced currents. Inspired by wave physics of scattering problems, we have designed three kinds of input schemes, covering different combinations of the given incident field and permittivity contrast, to evaluate the performance of the FICLM model under both single-incidence and multi-incidence cases. Numerical results prove that the proposed FICLM outperforms the method of moments (MoM) in terms of both computational speed and accuracy by use of reference data with a higher precision. The FICLM with the direct sum of permittivity contrast and a so-called Born-type induced current, achieves the best calculation accuracy and generalization capability compared to the other two inputs. The comparison with other types of neural networks, such as U-net, also demonstrates the superior performance of FICLM for dealing with complex scatterers due to the use of adversarial framework in pix2pix. The proposed method paves a new way for the fast solution of EM-scattering problems through deep learning techniques.","1558-2221","","10.1109/TAP.2020.3026447","NSFC(grant numbers:61971174); Zhejiang Provincial Natural Science Foundation of China(grant numbers:LY19F010012); Talent Project of the Zhejiang Association for Science and Technology(grant numbers:SKX201901); China Post-Doctoral Science Foundation(grant numbers:2019M661984); ","https://ieeexplore.ieee.org/stamp/stamp.jsp?arnumber=9210205","Electromagnetic (EM) scattering;forward-induced current learning method (FICLM);generative adversarial network (GAN);induced currents;method of moments (MoM)","Method of moments;Machine learning;Generative adversarial networks;Electromagnetics;Electromagnetic scattering;Learning systems","","76","","44","IEEE","30 Sep 2020","","","IEEE","IEEE Journals"
"Maloney and Smith Method for Modeling Debye-Media Thin Sheets in the FDTD Grid","A. Alkandari; J. -P. Bérenger; R. Himeno; H. Yokota; F. Costen","Department of Electrical and Electronic Engineering, The University of Manchester, Manchester, U.K.; Department of Electrical and Electronic Engineering, The University of Manchester, Manchester, U.K.; Computational Astrophysics Laboratory, RIKEN, Saitama, Japan; Image Processing Research Team, Center for Advanced Photonics, RIKEN, Saitama, Japan; Department of Electrical and Electronic Engineering, The University of Manchester, Manchester, U.K.",IEEE Transactions on Antennas and Propagation,"6 Apr 2021","2021","69","4","2209","2217","The Maloney and Smith method used to account for sheets thinner than the cell size of the finite-difference time-domain (FDTD) method is extended to the case where both the sheet and the surrounding media are such dispersive Debye media as the Human Body tissues. The new method is then compared to the simpler Luebbers and Kuntz method that was previously extended to Debye media. The comparison relies on the reflection and transmission of plane waves and on 3-D experiments. It is concluded that the Maloney and Smith method permits a better accuracy to be achieved. It provides accurate reflection and transmission whatever may be the incidence angle of the wave that strikes the sheet.","1558-2221","","10.1109/TAP.2020.3026485","","https://ieeexplore.ieee.org/stamp/stamp.jsp?arnumber=9233997","Dispersive media;electromagnetic coupling;finite-difference time-domain (FDTD) methods;reflection coefficient","Media;Finite difference methods;Time-domain analysis;Mathematical model;Reflection;Permittivity;Indexes","","3","","11","IEEE","20 Oct 2020","","","IEEE","IEEE Journals"
"Stable and Accurate Marching-on-in-Time Solvers of Time Domain EFIE, MFIE, and CFIE Based on Quasi-Exact Integration Technique","X. Wang; Y. Shi; M. Lu; B. Shanker; E. Michielssen; H. Bağcı","College of Electronics and Information Engineering, Nanjing University of Aeronautics and Astronautics, Nanjing, China; Department of Electronic Engineering, Jiangsu University of Technology, Changzhou, China; Department of Electrical and Computer Engineering, West Virginia University Institute of Technology, Beckley, WV, USA; Department of Electrical and Computer Engineering, Michigan State University, East Lansing, MI, USA; Department of Electrical Engineering and Computer Science, University of Michigan, Ann Arbor, MI, USA; Division of Computer, Electrical, and Mathematical Sciences and Engineering, King Abdullah University of Science and Engineering, Thuwal, Saudi Arabia",IEEE Transactions on Antennas and Propagation,"6 Apr 2021","2021","69","4","2218","2229","The development of time-domain integral equation solvers with robust late-time stability properties has been a long-standing quest. Among the many methods that have been investigated, those leveraging quasi-exact integration techniques appear to be most successful. This article presents stable and accurate marching-on-in-time (MOT) solvers for time-domain electric, magnetic, and combined field integral equations (EFIE, MFIE, and CFIE) based on quasi-exact integration techniques. The novel MOT solvers exhibit excellent stability while yielding highly accurate results, as demonstrated by various numerical examples. In addition, the solvers' excellent stability and accuracy properties are used to examine spurious modes encountered when time-domain integral equations are applied to closed surfaces. It is demonstrated that MOT solutions to the time domain EFIE and MFIE often are polluted by spurious modes at the cavity's resonant frequencies whereas those of the CFIE solver are devoid of such contamination.","1558-2221","","10.1109/TAP.2020.3026867","National Natural Science Foundation of China(grant numbers:61871220,61601207); Fundamental Research Funds for the Central Universities(grant numbers:NP2020106); ","https://ieeexplore.ieee.org/stamp/stamp.jsp?arnumber=9210841","Electromagnetic transient scattering;integral equations;moment methods;numerical stability;time-domain analysis","Time-domain analysis;Numerical stability;Integral equations;Antennas;Stability criteria;Current density","","15","","21","IEEE","1 Oct 2020","","","IEEE","IEEE Journals"
"Parallel Subdomain-Level DGTD Method With Automatic Load Balancing Scheme With Tetrahedral and Hexahedral Elements","J. Mi; Q. Ren; D. Su","School of Electronic and Information Engineering, Beihang University, Beijing, China; School of Electronic and Information Engineering, Beihang University, Beijing, China; School of Electronic and Information Engineering, Beihang University, Beijing, China",IEEE Transactions on Antennas and Propagation,"6 Apr 2021","2021","69","4","2230","2241","In this article, an automatic load balancing method for the parallel subdomain-level discontinuous Galerkin time-domain (DGTD) method has been proposed based on the message passing interface (MPI) library. First, a diagram that exhibits the relationship between the computation load (CPU time) and the DoFs has been extracted from numerical experiments for hexahedral and tetrahedral meshes, respectively. Then, an automatic iteration load balancing scheme has been employed to optimize the positions of the interfaces in order to minimize the CPU time differences between subdomains with the help of the diagram obtained in the first step. This scheme comes with a one-click solution using a greedy algorithm after an initial division of the original model, which is the only step that requires an external operation. In addition, the whole load balancing scheme is only involved in the preprocessing part of the code without modifying the system matrices iteratively. Consequently, the load balance can be relatively easily and efficiently implemented, which can significantly expedite the simulation of the large/multiscale models. The effectiveness of this load balancing strategy has been demonstrated via numerical cases.","1558-2221","","10.1109/TAP.2020.3026489","National Natural Science Foundation of China(grant numbers:61801009); Domain Foundation of Equipment Advance Research of the 13th Five-Year Plan(grant numbers:61402090603,61402080205); ","https://ieeexplore.ieee.org/stamp/stamp.jsp?arnumber=9210224","Automatic load balancing;message passing interface (MPI);parallel computing;subdomain-level discontinuous Galerkin time-domain (DGTD) method","Load management;Parallel processing;Load modeling;Silicon;Method of moments;Time-domain analysis;Computational modeling","","18","","41","IEEE","30 Sep 2020","","","IEEE","IEEE Journals"
"A Hybrid Mesh DGTD Algorithm Based on Virtual Element for Tetrahedron and Hexahedron","Z. Xiao; B. Wei; D. Ge","School of Physics and Optoelectronic Engineering, Xidian University, Xi’an, China; School of Physics and Optoelectronic Engineering, Xidian University, Xi’an, China; School of Physics and Optoelectronic Engineering, Xidian University, Xi’an, China",IEEE Transactions on Antennas and Propagation,"6 Apr 2021","2021","69","4","2242","2248","In the discontinuous Galerkin time-domain (DGTD) method, tetrahedral meshes are typically used to discretize the computational domain. However, due to their different topological structures, when tetrahedrons or hexahedrons of the same discrete scale are used to divide the same computational domain, there are more tetrahedral mesh units, resulting in higher temporal and spatial complexity. In this article, a hybrid mesh DGTD algorithm based on virtual elements for tetrahedra and hexahedra is proposed to improve the computational efficiency compared with the traditional DGTD method. The fine-structured computational domain and the outer region are computed using tetrahedral and hexahedral meshes, respectively. During calculation, the numerical flux of each interface element requires data from the other subdomain. In this article, virtual elements are established at each subdomain interface to enable the exchange of field values for ease of processing. Edge assignment or field interpolation is applied to sample points to create corresponding virtual units to calculate fringe fields. Finally, the field value of each virtual element is assigned to the corresponding real element for the numerical flux calculation. Numerical results verify the correctness and efficiency of the proposed method.","1558-2221","","10.1109/TAP.2020.3026861","National Natural Science Foundation of China(grant numbers:61901324); Pre-research Field Foundation(grant numbers:6140518020206); National Key Laboratory of Electromagnetic Environment(grant numbers:201702007,201903002); China Postdoctoral Science Foundation(grant numbers:2019M653548,2019M663928XB); State Key Laboratory Open Project of Simulation and Effects of Intense Pulse Radiation Environment(grant numbers:SKLIPR1705); Fundamental Research Funds for the Central Universities(grant numbers:XJS200501,XJS200507,JB200501); ","https://ieeexplore.ieee.org/stamp/stamp.jsp?arnumber=9210828","Discontinuous Galerkin time-domain (DGTD);hexahedron;hybrid mesh;tetrahedron;virtual element","Finite element analysis;Method of moments;Time-domain analysis;Antennas;Interpolation;Surface treatment;Physics","","9","","18","IEEE","1 Oct 2020","","","IEEE","IEEE Journals"
"A New Modeling Methodology for Multipath Parameter Estimation in Ultrawideband Channels","M. Ershadh; M. Meenakshi","Department of Electronics and Communication, Anna University, Chennai, India; Department of Electronics and Communication, Anna University, Chennai, India",IEEE Transactions on Antennas and Propagation,"6 Apr 2021","2021","69","4","2249","2255","A new modeling methodology for estimation of the parameters of the underlying multipath structure in an ultrawideband (UWB) indoor propagation channel is proposed in this article based on measurement campaign data available for a typical modern laboratory building. Issues inherent in generic multipath parameter estimation procedures such as limitations of curve fitting techniques, ambiguity in identifying cluster regions, and arbitrariness in estimating cluster and ray parameters accentuate a lack of transparency in the whole parameter estimation process and prevent the performance evaluation of different UWB physical layer proposals. A ramification of such techniques is that they are often too complex and intractable. The proposed approach, in this article, addresses these issues and offers a simple, tractable, easy to implement, and accurate solution based on a rationale proposing that the true behavior of the multipath structure is dependent on the structure of the considered environment itself and not on any additional reflectors. The results obtained from the proposed model are compared against the IEEE 802.15.4a CM1 and CM2 channel models. The proposed model establishes a normative to compare and evaluate performances between different UWB propagation models in realistic environments.","1558-2221","","10.1109/TAP.2019.2943396","","https://ieeexplore.ieee.org/stamp/stamp.jsp?arnumber=8852816","Channel modeling;ultrawideband (UWB);parameter estimation","Antenna measurements;Delays;Estimation;Parameter estimation;Channel estimation;Buildings;Data models","","8","","16","IEEE","30 Sep 2019","","","IEEE","IEEE Journals"
"An Entire Domain CFVIE-CDSE Method for EM Scattering on Electrically Large Highly Inhomogeneous Gyrotropic Circular Cylinders","K. Katsinos; G. P. Zouros; J. A. Roumeliotis","School of Electrical and Computer Engineering, National Technical University of Athens, Athens, Greece; School of Electrical and Computer Engineering, National Technical University of Athens, Athens, Greece; School of Electrical and Computer Engineering, National Technical University of Athens, Athens, Greece",IEEE Transactions on Antennas and Propagation,"6 Apr 2021","2021","69","4","2256","2266","A coupled-field volume integral equation (CFVIE) method for electromagnetic (EM) scattering on electrically large, highly inhomogeneous gyrotropic circular cylinders, under normal incidence, is developed in this work. The CFVIEs are solved by the cylindrical Dini series expansion (CDSE) method where the unknown fields are expanded by entire domain orthogonal vectorial basis functions. The main advantage of the present method is that it permits the scatterer to have continuously varying highly inhomogeneous gyrotropic characteristics, i.e., the constitutive parameters of the cylinder can be highly inhomogeneous in both gyroelectric and gyromagnetic tensors. Initially, the 2-D Green's function (GF) is expanded in a tensorial form using the cylindrical vector wave functions (CVWFs). Then, by employing the CDSE for the unknown fields, the 2-D volumetric integrals are carried out analytically, reducing the CFVIEs to a set of algebraic equations. The method is validated by comparisons with the exact solution based on the separation of variables method (SVM) for homogeneous gyroelectric/gyromagnetic cylinders, with HFSS commercial software for three-layered gyroelectric cylinders, as well as with the recently developed hybrid projection method (HPM) for electrically large continuously varying highly inhomogeneous isotropic cylinders. Results for combined gyroelectric-continuously varying highly inhomogeneous isotropic cylinders are presented and discussed.","1558-2221","","10.1109/TAP.2020.3026860","Greece and the European Union (European Social Fund-ESF) through the Operational Programme “Human Resources Development, Education and Lifelong Learning” in the context of the project “Strengthening Human Resources Research Potential via Doctorate Research”; State Scholarships Foundation (IKY)(grant numbers:MIS-5000432); ","https://ieeexplore.ieee.org/stamp/stamp.jsp?arnumber=9210818","Entire domain;gyroelectric;gyromagnetic;inhomogeneous;volume integral equation (VIE)","Nonhomogeneous media;Integral equations;Electromagnetic scattering;Tensile stress;Magnetic domains;Permeability","","15","","42","IEEE","1 Oct 2020","","","IEEE","IEEE Journals"
"ELF/VLF Communication Experiment by Modulated Heating of Ionospheric Auroral Electrojet at EISCAT","H. Lu; J. Yang; Q. Li; S. Hao; F. Guo; J. Wu; J. Chen; G. Ma; T. Xu","National Key Laboratory of Electromagnetic Environment, China Research Institute of Radiowave Propagation, Qingdao, China; National Key Laboratory of Electromagnetic Environment, China Research Institute of Radiowave Propagation, Qingdao, China; National Key Laboratory of Electromagnetic Environment, China Research Institute of Radiowave Propagation, Qingdao, China; National Key Laboratory of Electromagnetic Environment, China Research Institute of Radiowave Propagation, Qingdao, China; China Earthquake Administration (CEA), Institute of Crustal Dynamics, Beijing, China; National Key Laboratory of Electromagnetic Environment, China Research Institute of Radiowave Propagation, Qingdao, China; National Key Laboratory of Electromagnetic Environment, China Research Institute of Radiowave Propagation, Qingdao, China; National Key Laboratory of Electromagnetic Environment, China Research Institute of Radiowave Propagation, Qingdao, China; National Key Laboratory of Electromagnetic Environment, China Research Institute of Radiowave Propagation, Qingdao, China",IEEE Transactions on Antennas and Propagation,"6 Apr 2021","2021","69","4","2267","2273","Amplitude modulation high-frequency (HF) radio waves at extremely low frequencies (ELF, 0.3-3 kHz) or very low frequencies (VLF, 3-30 kHz), heating the ionosphere, can nonlinearly modulate the auroral electrojet to produce ELF/VLF waves for long-distance communication. This article presents the results of the first ELF/VLF communication experiments being conducted at Tromsø, where the European Incoherent Scatter Scientific Association (EISCAT) HF facility is located. The ELF/VLF waves from the ionosphere are modulated by quaternary phase shift keying (QPSK) and used for communication. The ELF signals of 2017 Hz at 20 and 100 b/s, as well as VLF signals of 3517 Hz at 20, 100, and 400 b/s, received by a ground-based receiver (15 km away from the heater) were decoded, albeit with a high bit error rate (BER) for 3517 Hz at 20 b/s. With the decoding principle of QPSK, we attempted to find a solution to reduce the BER for future communication experiments. Based on the results of the ground experiment, the transmitted signals of 2017 Hz at 20 b/s were selected in the China Seismo-Electromagnetic Satellite (CSES) reception experiments. In a first, we demonstrate that ELF communication signals generated by the amplitude modulation heating of the ionosphere have been successfully received by the satellite and the ground-based receiver. These experimental results confirm that the ELF/VLF waves radiated by amplitude modulation heating of the auroral electrojet can be used for long-distance communication in future.","1558-2221","","10.1109/TAP.2020.3026872","Innovation Fund of China Electronics Technology Group Corporation(grant numbers:KJ1602004); China Seismo-Electromagnetic Satellite (CSES) mission, a Project; China National Space Administration (CNSA) and China Earthquake Administration (CEA); ","https://ieeexplore.ieee.org/stamp/stamp.jsp?arnumber=9210831","Bit error rate (BER);bit rate;communication;extremely low frequency (ELF)/very low frequency (VLF) virtual antenna;modulated heating;transmission parameters","Heating systems;Phase shift keying;Receivers;Bit error rate;Ground penetrating radar;Geophysical measurement techniques;Antennas","","15","","32","IEEE","1 Oct 2020","","","IEEE","IEEE Journals"
