"Improving the Performance of Antenna-on-Chip by Effectively Illuminating the Artificial Magnetic Conductors Through Coupling Enhancement Structures","Y. Yu; Z. Akhter; A. Shamim","Electrical and Computer Engineering Program, King Abdullah University of Science and Technology, Thuwal, Saudi Arabia; Electrical and Computer Engineering Program, King Abdullah University of Science and Technology, Thuwal, Saudi Arabia; Electrical and Computer Engineering Program, King Abdullah University of Science and Technology, Thuwal, Saudi Arabia",IEEE Transactions on Antennas and Propagation,"4 May 2023","2023","71","5","4492","4497","An antenna-on-chip (AoC) suffers from low radiation efficiency and gain because of the highly conductive silicon (Si) substrate used in standard complementary metal–oxide–semiconductor (CMOS) processes. Placing an artificial magnetic conductor (AMC) surface underneath the AoC not only isolates the antenna from the lossy substrate but also boosts its performance through in- phase reflection. Ideally, the AMC, which has a periodic structure, should be infinite in size, but practical chip sizes limit its dimensions. The gain of an AMC-backed AoC shows a positive correlation with the AMC lateral area. However, in the ultrathin stack-up of standard CMOS processes, the AMC cannot be irradiated uniformly by the antenna because of the physical illumination issue, so the AoC gain does not increase with the AMC area after the initial increase. To improve the illumination of the AMC by an AoC, this work introduces coupling enhancement structures (CESs) that employ the available metal layers of the stack-up. The proposed AMC-backed AoC with CES demonstrates a gain of 9.8 dBi and a radiation efficiency of 71% at 94 GHz, which are improvements of 4.3 dB in gain and 23% in radiation efficiency, respectively, compared to an AoC backed by a conventional AMC.","1558-2221","","10.1109/TAP.2023.3239102","King Abdullah University of Science and Technology (KAUST) Research Funding (KRF)(grant numbers:ORA-2022-5314); ","https://ieeexplore.ieee.org/stamp/stamp.jsp?arnumber=10028749","Antenna-on-chip (AoC);artificial magnetic conductor (AMC);coupling enhancement structure (CES);effective illumination;system-on-chip","Antennas;Lighting;Gain;Substrates;Silicon;System-on-chip;Reflection","","7","","29","IEEE","27 Jan 2023","","","IEEE","IEEE Journals"
"Single-Layer Dual-/Tri-Band SIW Filtenna Based on Multifunctional Cavity-Backed Slots","Z. Zheng; D. Li; X. Tan; Q. Chen","School of Microelectronics and Communication Engineering, Chongqing University, Chongqing, China; School of Microelectronics and Communication Engineering, Chongqing University, Chongqing, China; School of Microelectronics and Communication Engineering, Chongqing University, Chongqing, China; Department of Communications Engineering, Tohoku University, Sendai, Japan",IEEE Transactions on Antennas and Propagation,"4 May 2023","2023","71","5","4498","4503","Single-layer dual-/tri-band substrate integrated waveguide (SIW) filtenna based on multifunctional cavity-backed slots is proposed in this communication. The cavity-backed slots etched on the SIW cavity can be considered as radiators as well as resonators. When a pair of back-to-back open-loop slots embedded with a straight slot is etched on the SIW cavity, three resonant modes generated by slots combine with the TE101 mode of the SIW cavity to form the superior dual-band filtering response. Moreover, four radiation nulls (RNs) located at both sides of two operational passbands are generated, resulting in sharp roll-offs and deep stopband rejection. To further prove this design concept, a tri-band SIW filtenna is designed by utilizing two pairs of back-to-back open-loop slots embedded with a straight slot, six RNs are introduced in the stopbands, realizing the excellent tri-band filtering performance. The operating mechanism of the proposed antennas is numerically analyzed. Two prototype antennas are fabricated and tested for validation, the center frequencies of the dual-band filtenna are 4.56 and 5.7 GHz, and the tri-band filtenna are centered at 4.1, 4.82, and 5.62 GHz, showing good radiation characteristics in each passband. Compared with other designs, the proposed antennas exhibit the advantages of single-layer structure, small size, and high selectivity, satisfying the requirements of 5G multifrequency communication applications.","1558-2221","","10.1109/TAP.2023.3242110","National Natural Science Foundation of China(grant numbers:61801059,U20A200726); FY2021 Japan Society for the Promotion of Science (JSPS) Postdoctoral Fellowship for Research in Japan(grant numbers:P21053); Grant-in-Aid for JSPS Research Fellow(grant numbers:21F21053); ","https://ieeexplore.ieee.org/stamp/stamp.jsp?arnumber=10041036","Cavity-backed slots;dual-band;filtenna;substrate integrated waveguide (SIW);tri-band","Dual band;Couplings;Resonant frequency;Filtering;Passband;Substrates;Microstrip","","23","","21","IEEE","8 Feb 2023","","","IEEE","IEEE Journals"
"Ultrawideband Compact Magnetoelectric Dipole Antenna/Array With Dual-Polarization","H. Zhu; G. Liu; K. Wang; J. Mou; Y. Zhou; S. Xie; G. Wang; Y. Di","School of Electronics and Information, Northwestern Polytechnical University, Xi’an, Shaanxi, China; School of Electronics and Information, Northwestern Polytechnical University, Xi’an, Shaanxi, China; School of Electronics and Information, Northwestern Polytechnical University, Xi’an, Shaanxi, China; Beijing Research Institute of Telemetry, Beijing, China; School of Electronics and Information, Northwestern Polytechnical University, Xi’an, Shaanxi, China; School of Electronics and Information, Northwestern Polytechnical University, Xi’an, Shaanxi, China; School of Electronics and Information, Northwestern Polytechnical University, Xi’an, Shaanxi, China; School of Electronics and Information, Northwestern Polytechnical University, Xi’an, Shaanxi, China",IEEE Transactions on Antennas and Propagation,"4 May 2023","2023","71","5","4504","4509","Design of ultrawideband (UWB) dual-polarized antenna with compact size is presented in this communication, which is composed of a triple-layer magnetoelectric (ME) dipole, a pair of cross-placed  $\Gamma $ -shaped feeding structure, and a box-shaped reflector. Three layers of the ME dipole cover low (around 1.5 GHz), middle (3.5 GHz), and high (4.5 GHz) bands, respectively, leading to an ultrawide operating band from 1 to 5 GHz. The total size of the design is 75 ( $0.75\lambda _{0}) \,\, \times75$  ( $0.75\lambda _{0}) \,\,\times55$  mm ( $0.55\lambda _{0}$ ). An array that consists of eight such antenna elements is designed, fabricated, and measured. Results show that the voltage standing wave ratio (VSWR) is less than two over the whole operating band for all ports. For the radiation characteristics, boresight gain ranging from 5.3 to 8.8 dBi is achieved for each antenna element, and when it comes to the array, a peak gain of 17.23 dBi occurs at 4 GHz when all the antenna elements are excited with identical amplitude and phase. Beam scanning is also realized in the whole operating band through phase disposing, and the scanning range is up to ±45° from 1 to 2 GHz and ±30° from 2 to 5 GHz.","1558-2221","","10.1109/TAP.2023.3240594","Beijing Nova Program(grant numbers:Z201100006820130); ","https://ieeexplore.ieee.org/stamp/stamp.jsp?arnumber=10035910","Dual-polarization;magnetoelectric (ME) dipole;phased array (PA);ultrawideband (UWB)","Dipole antennas;Antenna measurements;Broadband antennas;Surface impedance;Antenna arrays;Wideband;Ultra wideband technology","","9","","26","IEEE","2 Feb 2023","","","IEEE","IEEE Journals"
"A 28 GHz 8 × 8 Gapwaveguide Phased Array Employing GaN Front-End With 60 dBm EIRP","A. Bagheri; C. Bencivenni; M. Gustafsson; A. A. Glazunov","Gapwaves AB, Gothenburg, Sweden; Gapwaves AB, Gothenburg, Sweden; Gapwaves AB, Gothenburg, Sweden; Department of Electrical Engineering, University of Twente, Enschede, The Netherlands",IEEE Transactions on Antennas and Propagation,"4 May 2023","2023","71","5","4510","4515","A cost-efficient, high equivalent isotropic radiated power (60 dBm), large-bandwidth (26.5–29.5 GHz) active phased array antenna system has been designed and experimentally verified. The proposed design methodology results in a reduction of production costs by employing gallium nitride (GaN)-based radio frequency front-ends (RFFEs) with 31 dBm output power allowing a reduced number of antenna elements. A fully metallic gapwaveguide (GW) technology has been employed achieving efficient heat dissipation per aperture area of the array as well as low-loss easy-to-manufacture antenna elements. The phased array is realized by sub-arraying an  $8\times 8$  slot array antenna with horizontal polarization. A ±60° analog beamforming in the E-plane is demonstrated. The presented antenna is a potential candidate for compact-size high-performance fifth-generation (5G) base station antennas with excellent temperature stability.","1558-2221","","10.1109/TAP.2023.3240837","European Union Horizon 2020 Research and Innovation Program under the Marie Skłodowska-Curie(grant numbers:766231 WAVECOMBE H2020-MSCA-ITN-2017); ","https://ieeexplore.ieee.org/stamp/stamp.jsp?arnumber=10036379","28 GHz;fifth-generation (5G);gallium nitride (GaN);gapwaveguide (GW)-based antennas;millimeter-wave (mmWave);phased array","Phased arrays;Antenna arrays;Heating systems;Power generation;Silicon germanium;Gain;Power amplifiers","","14","","29","IEEE","3 Feb 2023","","","IEEE","IEEE Journals"
"Gain-Improved Wideband Circularly Polarized Magnetoelectric Dipole Antenna With Parasitic Helix","K. Ding; Y. Li; Y. Li; Y. Wu; J. -F. Li","School of Physics and Optoelectronic Engineering, Guangdong University of Technology, Guangzhou, China; Institute of Lightwave Technology and the Key Laboratory of All Optical Network and Advanced Telecommunication Network, Ministry of Education, Beijing Jiaotong University, Beijing, China; Research Center of Applied Electromagnetics, Nanjing University of Information Science and Technology, Nanjing, China; School of Physics and Optoelectronic Engineering, Guangdong University of Technology, Guangzhou, China; School of Physics and Optoelectronic Engineering, Guangdong University of Technology, Guangzhou, China",IEEE Transactions on Antennas and Propagation,"4 May 2023","2023","71","5","4516","4521","This communication presents a magnetoelectric (ME) dipole antenna with wideband circularly polarized (CP) and gain-improved performance. Two pairs of perpendicular sub-ME dipoles, which are realized by horizontal and vertical patches, constitute the original ME dipole. By connecting one pair of sub-ME dipole with metallic strip, CP operation is achieved at lower band first. Then, we change the coupling slot from rectangle to cross, which leads to the enhancement of impedance and axial-ratio (AR) bandwidth. Furthermore, a helix with different turn radii and uniform turn spacing is introduced to improve the gain in the whole band. The performance of the proposed design is verified by measured results. The fabricated antenna exhibits a −10 dB impedance bandwidth of 3.33–6.75 GHz, corresponding to 67.9%. Besides, the measured 3 dB AR bandwidth and 3 dB gain bandwidth are 3.6–6.25 GHz (53.8%) and 3.4–5.8 GHz (52.2%), respectively. The proposed design could provide promising application values for wideband wireless communication systems.","1558-2221","","10.1109/TAP.2023.3242420","National Natural Science Foundation of China(grant numbers:62201159,62271156); China Postdoctoral Science Foundation(grant numbers:2021M703660); ","https://ieeexplore.ieee.org/stamp/stamp.jsp?arnumber=10041852","Circularly polarized (CP);helix;magnetoelectric (ME) dipole;wideband","Dipole antennas;Helical antennas;Gain;Impedance;Wideband;Broadband antennas;Electric fields","","7","","24","IEEE","9 Feb 2023","","","IEEE","IEEE Journals"
"A Single-Layer Wideband Differential-Fed Filtering Antenna With High Selectivity","K. -Z. Hu; H. -Y. Huang; M. -C. Tang; Z. Chen; D. Yan; P. Wang","Key Laboratory of Industrial Internet of Things and Networked Control Ministry of Education, College of Automation, and the Institute of Industrial Internet, Chongqing University of Posts and Telecommunications, Chongqing, China; Key Laboratory of Industrial Internet of Things and Networked Control Ministry of Education, College of Automation, and the Institute of Industrial Internet, Chongqing University of Posts and Telecommunications, Chongqing, China; Key Laboratory of Dependable Service Computing in Cyber Physical Society Ministry of Education, College of Microelectronics and Communication Engineering, Chongqing University, Chongqing, China; Key Laboratory of Industrial Internet of Things and Networked Control Ministry of Education, College of Automation, and the Institute of Industrial Internet, Chongqing University of Posts and Telecommunications, Chongqing, China; Key Laboratory of Industrial Internet of Things and Networked Control Ministry of Education, College of Automation, and the Institute of Industrial Internet, Chongqing University of Posts and Telecommunications, Chongqing, China; Key Laboratory of Industrial Internet of Things and Networked Control Ministry of Education, College of Automation, and the Institute of Industrial Internet, Chongqing University of Posts and Telecommunications, Chongqing, China",IEEE Transactions on Antennas and Propagation,"4 May 2023","2023","71","5","4522","4527","In this communication, a single-layer, wideband, differential-fed filtering antenna with high selectivity is proposed. The developed filtering antenna possesses a simple structure and consists of a square patch, a square substrate integrated waveguide (SIW) cavity, a pair of symbiotic stepped impedance resonators (SSIRs), and a pair of complementary split ring resonators (CSRRs). The SIW cavity formed with sparse metalized posts is embedded in the square patch, and the impedance bandwidth can be broadened by merging the TM10 mode of the square patch, excited by the electromagnetic energy escaping from the sparse posts, with the TE210 mode in the SIW cavity through differential excitation. The SSIRs are connected with both radiating edges of the square patch. And two extra in-band resonances together with an upper-edge radiation null are simultaneously generated, so the impedance bandwidth and the frequency selectivity at the higher stopband can be significantly improved. The CSRRs, surrounding the differential excitation ports, are etched into the bottom surface of the SIW cavity, and a lower-edge radiation null is produced to further sharpen the roll-off rate. By adjusting the geometrical parameters of the SSIRs and CSRRs, the positions of the two radiation nulls can be independently controlled. For verifying the design method, a prototype of the developed single-layer filtering antenna has been fabricated and tested. The measurement results are well consistent with the simulated values, indicating good performance with a large −10 dB fractional impedance bandwidth of 21.2%, a peak realized gain of 9.3 dBi, two out-of-band rejection levels of more than 26 dB, and very high selectivity.","1558-2221","","10.1109/TAP.2023.3243980","National Key Research and Development Program of China(grant numbers:2022YFF0604200); National Natural Science Foundation of China(grant numbers:62031006); Natural Science Foundation of Chongqing(grant numbers:cstc2021jcyj-bsh0203); Chongqing Scientific Research Institution Performance Incentive and Guidance Special Project(grant numbers:cstc2021jxjl40008); China Postdoctoral Science Foundation(grant numbers:2021M700559); ","https://ieeexplore.ieee.org/stamp/stamp.jsp?arnumber=10045707","Complementary split ring resonator (CSRR);differential fed;filtering antenna;high selectivity;substrate integrated waveguide (SIW)","Filtering;Antennas;Impedance;Resonant frequency;Substrates;Wideband;Gain","","26","","23","IEEE","15 Feb 2023","","","IEEE","IEEE Journals"
"Compact, Wideband, Dual-Band Polarization and Pattern Diversity Antenna for Vehicle Communications","Z. Zhang; M. Li; Q. Dai; M. -C. Tang; L. Zhu","School of Microelectronics and Communication Engineering, Chongqing University, Chongqing, China; School of Microelectronics and Communication Engineering, Chongqing University, Chongqing, China; School of Microelectronics and Communication Engineering, Chongqing University, Chongqing, China; School of Microelectronics and Communication Engineering, Chongqing University, Chongqing, China; Department of Electrical and Computer Engineering, University of Macau, Macau, SAR, China",IEEE Transactions on Antennas and Propagation,"4 May 2023","2023","71","5","4528","4533","A new design approach of dual-band polarization and pattern diversity antenna for vehicle communications is presented. This antenna consists of three essential parts: monopole array, swastika-shaped gap-coupled patch, and customized L-shaped driven dipole. First, the monopole array composed of four monopoles beneath the patch is excited by the dipole-induced patch mode of the swastika-shaped gap-coupled patch so as to realize a bidirectional beam in the upper band. Second, the swastika-shaped gap-coupled patch is reused as the main radiator of the lower band to achieve wideband broadside right-handed circular polarization (RHCP) radiation, which is excited by a pair of customized parallel-lines-fed L-shaped driven dipoles. Finally, two short-circuited branches are etched in the long arm of the L-shaped driven dipole, bringing in the out-of-band suppression improvement between the lower and upper bands. In order to verify the developed design method, a dual-band antenna with different polarization and radiation properties over two bands was designed, fabricated, and tested. Measured results indicate that the developed antenna with a compact transversal size of  $0.36\lambda _{0} \times 0.36\lambda _{0}$  radiates broadside RHCP electromagnetic wave in 3.55–4.25 GHz and bidirectional vertical polarization (VP) in 5.62–6.38 GHz, which covers C-band and dedicated short-range communications (DSRC)-band, and especially serves as a promising candidate for applications in both vehicle-to-satellite (V2S) and vehicle-to-everything (V2X) communications.","1558-2221","","10.1109/TAP.2023.3243855","National Natural Science Foundation of China(grant numbers:62031006); Graduate Scientific Research and Innovation Foundation of Chongqing(grant numbers:CYB22067); National Science Foundation of Chongqing(grant numbers:CSTB2022NSCQ-MSX0597); Venture and Innovation Support Program for Chongqing Overseas Returnees(grant numbers:cx2022063); ","https://ieeexplore.ieee.org/stamp/stamp.jsp?arnumber=10044714","Dual-band antenna;in-vehicle antenna;polarization and pattern diversity antenna;vehicle-to-satellite (V2S);vehicle-to-vehicle (V2V);wideband antenna","Antenna radiation patterns;Dual band;Dipole antennas;Antenna arrays;Vehicle-to-everything;Slot antennas;Broadband antennas","","34","","23","IEEE","14 Feb 2023","","","IEEE","IEEE Journals"
"Mutual Coupling Reduction of a Dual-Band Four-Port Patch Antenna With Co-Polarized Radiation Pattern by Controlling Electric Fields","N. -W. Liu; Y. -D. Liang; L. Zhu; Z. -X. Liu; Y. Liu; S. Sun","National Key Laboratory of Antennas and Microwave Technology, Xidian University, Xi’an, China; National Key Laboratory of Antennas and Microwave Technology, Xidian University, Xi’an, China; Department of Electrical and Computer Engineering, Faculty of Science and Technology, University of Macau, Macau, China; National Key Laboratory of Antennas and Microwave Technology, Xidian University, Xi’an, China; National Key Laboratory of Antennas and Microwave Technology, Xidian University, Xi’an, China; School of Electronic Science and Engineering, University of Electronic Science and Technology of China, Chengdu, China",IEEE Transactions on Antennas and Propagation,"4 May 2023","2023","71","5","4534","4539","In this communication, a novel design approach to decrease the mutual coupling (MC) of a single dual-band four-port microstrip patch antenna (MPA) with a co-polarized radiation pattern is proposed via characteristic mode analysis (CMA). Initially, the traditional MPA under modes 1–4 is theoretically studied. This proves that the four modes maintain a high MC of approximately–2 dB. To address this issue, shorting pins 1 and 2 are inserted below the radiator, leading to a more than 12 dB MC reduction between the two ports along the  $x$ -axis. After that, the MC between the two ports along the  $y$ -axis is deeply studied. This proves that the electric field nulls of the MPA could be moved near unexcited ports and reduce the MC by combining modes 1 with 2 (or modes 3 with 4). Hence, shorting pin 3 is loaded for mode combination and low MC. In addition, shorting pin 4 is loaded to reshape the radiated fields in the upper band. Moreover, the impedance matching and the bandwidth are improved by cutting the ring slots. Finally, a four-port MPA is fabricated and tested. The results show that it has satisfactorily gained a low MC of below–15 dB between the four ports in dual bands. Meanwhile, it holds low-profile, single-layer, single-element, and co-polarized radiation pattern properties.","1558-2221","","10.1109/TAP.2023.3243803","National Natural Science Foundation of China through General Program(grant numbers:62271364,61971115,62201409); Key Research and Development Projects of Shaanxi Province(grant numbers:2023-GHZD-45); University of Macau(grant numbers:0080/2021/A2); Special(grant numbers:CPG2023-00020-FST); ","https://ieeexplore.ieee.org/stamp/stamp.jsp?arnumber=10044723","Characteristic mode analysis (CMA);co-polarization;four ports;mutual coupling (MC) reduction;single patch antenna","Electric fields;Scattering parameters;Pins;Mutual coupling;Dual band;Antenna radiation patterns;Patch antennas","","12","","35","IEEE","14 Feb 2023","","","IEEE","IEEE Journals"
"Improvement of the Gerchberg–Saxton Algorithm Convergence in Phaseless Antenna Measurements via Spherical-Wave Filtering","N. Mézières; L. Le Coq","IETR, UMR CNRS, Rennes, France; IETR, UMR CNRS, Rennes, France",IEEE Transactions on Antennas and Propagation,"4 May 2023","2023","71","5","4540","4545","The phaseless characterization of antennas enables configurations with reduced measurement efforts as the phase acquisition is highly sensitive to numerous error sources. However, both the magnitude and phase information are necessary to reconstruct the 3-D radiation pattern of the tested radiating system. The two scans technique allows for accurate phase retrievals from magnitude-only measurements. In this communication, the two concentric spheres setup is considered with a Gerchberg–Saxton (GS) algorithm as a phase retrieval procedure. These methods are known for their convergence problems, the price to pay for the easier, magnitude-only, measurements. A filtering approach is studied to mitigate these effects and a new, more efficient, filter is proposed. A loop of GS runs coupled with filters is shown to improve the radiation pattern reconstruction without much considerations. Validations are led by simulations and experimental data acquired using a commercial system.","1558-2221","","10.1109/TAP.2023.3249355","European Commission; European Regional Development Fund (ERDF); French Region of Brittany, Ministry of Higher Education and Research, Rennes Métropole and Conseil Départemental 35; CPER Project SOPHIE/STIC and Ondes; ","https://ieeexplore.ieee.org/stamp/stamp.jsp?arnumber=10058135","Antenna measurements;near field (NF);phase retrieval;phaseless measurement;spherical waves (SWs)","Antenna measurements;Filtering algorithms;Phase measurement;Noise measurement;Convergence;Low-pass filters;Indexes","","4","","21","IEEE","2 Mar 2023","","","IEEE","IEEE Journals"
