"Calibration of Aperture Arrays in Time Domain Using the Simultaneous Perturbation Algorithm","Y. Zhang; H. Xing; X. Lv; M. Temiz; Y. Fu; Q. Shi; A. El-Makadema; A. Zhang; J. Gao","School of Transportation, Nantong University, Nantong, China; School of Transportation, Nantong University, Nantong, China; School of Transportation, Nantong University, Nantong, China; Department of Electronic and Electrical Engineering, University College London, London, U.K; School of Transportation, Nantong University, Nantong, China; School of Transportation, Nantong University, Nantong, China; Department of Electrical and Electronic Engineering, School of Engineering, The University of Manchester, Manchester, U.K; School of Transportation, Nantong University, Nantong, China; School of Transportation, Nantong University, Nantong, China",IEEE Transactions on Antennas and Propagation,"4 May 2023","2023","71","5","4167","4182","Online calibration is desired in antenna arrays of ultrawide bandwidth. This study proposes a time-domain calibration method based on the simultaneous perturbation (SP) algorithm. Two objective functions were established: power of the received signal at array output or combination of power and correlation coefficient between the signal at array output and a target signal. For both criteria, the convergence settings require only two measurements at each iteration. One advantage of the method is that the entire signal operation for calibration is performed in the time domain. This is achieved by resolving the effects of distortion on time delay of each channel, which accounts for both amplitude and phase distortions at different frequencies. Therefore, the proposed method significantly increased the calibration efficiency for ultrawideband antenna arrays. Since time delay coefficients for calibration associated with array elements were determined independently due to characteristics of the SP, the estimation accuracy of the method is tangential to the number of elements in the array and is mainly dependent on the convergence conditions. This gives the method an additional distinct advantage for calibrating large-scale antenna arrays with ultrawide bandwidth. An estimation accuracy of 99% on time delay adjustments has been achieved and demonstrated.","1558-2221","","10.1109/TAP.2023.3255642","NSFC(grant numbers:62174091,62201294); Post-Doc International Exchange Programme(grant numbers:YJ20210098); ","https://ieeexplore.ieee.org/stamp/stamp.jsp?arnumber=10071954","Aperture array;calibration;simultaneous perturbation (SP);stochastic approximation (SA);time domain","Calibration;Antenna arrays;Delay effects;Phased arrays;Finite element analysis;Convergence;Loss measurement","","1","","45","CCBY","15 Mar 2023","","","IEEE","IEEE Journals"
"Spatiotemporal Evolution of Orbital Angular Momentum (OAM) Beams Based on a Uniform Circular Frequency Diverse Array (UC-FDA)","J. Ma; J. Cai; Z. Zheng; X. Gao; S. Huang","State Key Laboratory of Information Photonics and Optical Communications, School of Electronic Engineering, Beijing University of Posts and Telecommunications, Beijing, China; State Key Laboratory of Information Photonics and Optical Communications, School of Electronic Engineering, Beijing University of Posts and Telecommunications, Beijing, China; State Key Laboratory of Information Photonics and Optical Communications, School of Electronic Engineering, Beijing University of Posts and Telecommunications, Beijing, China; School of Science, Beijing University of Posts and Telecommunications, Beijing, China; State Key Laboratory of Information Photonics and Optical Communications, School of Electronic Engineering, Beijing University of Posts and Telecommunications, Beijing, China",IEEE Transactions on Antennas and Propagation,"4 May 2023","2023","71","5","4183","4193","Radar imaging based on orbital angular momentum (OAM) beams has become a significant approach to realize high resolution and multidimensional target detection. The irradiation of a target area with OAM beams with different modes has been proven to be a feasible solution to improve the azimuthal resolution of the target. This article is the first to propose and validate novel spatiotemporal OAM beams generated by a uniform circular frequency diverse array (UC-FDA). Unlike the conventional uniform circular array (UCA), signals with frequency intervals need to be fed to the antennas in the UC-FDA structure. The mode of the spatiotemporal OAM beam can be switched automatically with spatial transmission, which enhances the flexibility of mode switching and reduces the switching time. The evolution characteristics of the OAM beam are fully demonstrated. Meanwhile, the intrinsic spatiotemporal evolution rules and influence parameters are analyzed and summarized. Furthermore, an optimized dynamic mode decomposition (DMD) algorithm is proposed and used to implement mode detection. Finally, the spatiotemporal evolution of OAM beams is applied to a rudimentary exploration of radar imaging. The measured results indicate that azimuth imaging of targets can be successfully accomplished. Spatiotemporal OAM beams may unlock promising potential for new-tech radar scenarios.","1558-2221","","10.1109/TAP.2023.3256301","National Natural Science Foundation of China (NSFC)(grant numbers:61821001,62271071,62125103,62171050,62171059,62101065); Fundamental Research Funds for the Central Universities(grant numbers:2022RC07); ","https://ieeexplore.ieee.org/stamp/stamp.jsp?arnumber=10075363","Frequency diverse array (FDA);orbital angular momentum (OAM);radar imaging;spatiotemporal evolution","Spatiotemporal phenomena;Antennas;Radar imaging;Azimuth;Object detection;Frequency diversity;Optical vortices","","11","","40","IEEE","16 Mar 2023","","","IEEE","IEEE Journals"
"A THz-OAM Wireless Communication System Based on Transmissive Metasurface","H. Yang; S. Zheng; H. Zhang; N. Li; D. Shen; T. He; Z. Yang; Z. Lyu; X. Yu","College of Information Science and Electronic Engineering, Zhejiang University, Hangzhou, China; College of Information Science and Electronic Engineering, Zhejiang University, Hangzhou, China; College of Information Science and Electronic Engineering, Zhejiang University, Hangzhou, China; College of Information Science and Electronic Engineering, Zhejiang University, Hangzhou, China; Zhejiang Laboratory, Hangzhou, China; Zhejiang Laboratory, Hangzhou, China; College of Information Science and Electronic Engineering, Zhejiang University, Hangzhou, China; College of Information Science and Electronic Engineering, Zhejiang University, Hangzhou, China; College of Information Science and Electronic Engineering, Zhejiang University, Hangzhou, China",IEEE Transactions on Antennas and Propagation,"4 May 2023","2023","71","5","4194","4203","With the development of various emerging technologies, the capacity of current wireless communication system is gradually saturated, and terahertz (THz) and orbital angular momentum (OAM) have hereby attracted much attention as two key technologies to increase the communication capacity. In this article, a THz-OAM wireless communication system operating at 100 GHz based on a transmissive metasurface is proposed for the first time to the best of our knowledge. The operation principle of multiplexing metasurface, which allows simultaneous generation of two coaxial OAM beams at different modes of  $\boldsymbol {l}$  = 1 and −1, is studied. To meet the requirements of wireless communication and OAM multiplexing, a C-shaped transmissive unit is designed with characteristics of broad bandwidth, low transmission loss, and insensitive to the change of incident angle. Experimental measurements show that the generated two OAM beams feature high mode purity, providing the excellent orthogonality of modes. The generated two OAM modes are also employed as two OAM channels to transmit two independent communication signals with ON–OFF keying (OOK) modulation, and a data rate of 10 Gbit/s is achieved at a transmission distance of 300 mm ( $100\boldsymbol {\lambda }$  of 100 GHz) with bit error rates (BERs) below  $3.8\,\,\boldsymbol {\times }\,\,\boldsymbol {10^{-3}}$ . This work verifies the feasibility of the multiplexing metasurface supporting wireless communication and makes THz-OAM wireless communication systems potential for future large capacity wireless services.","1558-2221","","10.1109/TAP.2023.3255539","National Key Research and Development Program of China(grant numbers:2018YFB1801500); Zhejiang Laboratory(grant numbers:2020LC0AD01); Natural Science Foundation of Zhejiang Province, China(grant numbers:LY23F010006); ","https://ieeexplore.ieee.org/stamp/stamp.jsp?arnumber=10076405","Orbital angular momentum (OAM);OAM communication;OAM multiplexing;terahertz (THz) vortex beam","Multiplexing;Metasurfaces;Wireless communication;Gratings;Azimuth;Copper;Antenna feeds","","55","","54","IEEE","17 Mar 2023","","","IEEE","IEEE Journals"
"Dual-Polarized Ka-Band Phased Array Using Hybrid Magnetic-/Electric-Dipole With Low Profile for Low Cross-Polarization Leakage Inside ±60° Scan Volume","J. X. Sun; Y. J. Cheng","EHF Key Laboratory of Fundamental Science, School of Electronic Science and Engineering, University of Electronic Science and Technology of China, Chengdu, China; EHF Key Laboratory of Fundamental Science, School of Electronic Science and Engineering, University of Electronic Science and Technology of China, Chengdu, China",IEEE Transactions on Antennas and Propagation,"4 May 2023","2023","71","5","4204","4215","This article presents a 26–40 GHz  $16\times16$  dual-polarized phased array. For the dual-polarized phased array antennas, the sources of cross-polarization leakage mainly include the polarization coupling from the feedlines and the radiators. Electric-dipole (E-dipole) and magnetic-dipole (M-dipole) are the most common radiators, which both suffer from the deteriorated polarization isolation when scanning in D-plane. Here, the hybrid M-/E-dipole is employed to overcome this issue. To avoid the serious cross-polarization leakage from the typical 1/4 wavelength feedline of E-dipole, the M-dipole is chosen to form the primary radiator with the typical 1/10 wavelength feedline. Therefore, the excited electric-/magnetic-current field vectors on the radiators and the feedlines can be significantly weakened. However, the low-profile M-dipole introduces the half-patch TM11 mode due to the coupling between the horizontal feedline and the ground plane. This parasitic radiation mode with the slant polarization seriously deteriorates the polarization isolation of the M-dipole. The shorted posts are employed to suppress the half-patch TM11 mode without breaking the M-dipole mode. Through that, the high polarization isolation characteristic of the dual-polarized M-dipole radiator is maintained. Then, the double-layer meta-surface (MS) is designed to act as the secondary radiator, i.e., the E-dipole. The MS also plays the role of the impedance matching layer. Based on these methods, the cross-pol. level better than {−66, −59, −52} dB in E-/H-planes and {−66, −28, −17} dB in D-plane when scanning to {broadside, 30°, 60°} is achieved, respectively.","1558-2221","","10.1109/TAP.2023.3256486","National Key Research and Development Plan of China(grant numbers:2020YFB1807404,2021YFB2900402); National Natural Science Foundation of China(grant numbers:62031019); ","https://ieeexplore.ieee.org/stamp/stamp.jsp?arnumber=10076403","Dual-polarized phased array antenna;fifth-generation (5G);low cross-polarization leakage;millimeter wave;wide scanning;wideband","Phased arrays;Dipole antennas;Wideband;5G mobile communication;Millimeter wave technology;Couplings;Millimeter wave communication","","12","","69","IEEE","17 Mar 2023","","","IEEE","IEEE Journals"
"A Wide-Scanning Array Antenna of Connected Vertical Bowtie Elements Structurally Integrated Within an Aircraft Fuselage","P. Khanal; J. Yang; M. Ivashina; A. Höök; R. Luo; P. Hallander; M. Gebretnsae","Electrical Engineering Department, Chalmers University of Technology, Gothenburg, Sweden; Electrical Engineering Department, Chalmers University of Technology, Gothenburg, Sweden; Electrical Engineering Department, Chalmers University of Technology, Gothenburg, Sweden; SAAB AB AB, Gothenburg, Sweden; SAAB AB AB, Gothenburg, Sweden; SAAB AB, Linköping, Sweden; SAAB AB AB, Gothenburg, Sweden",IEEE Transactions on Antennas and Propagation,"4 May 2023","2023","71","5","4216","4227","A low-profile, wide-scanning phased-array antenna of vertical bowtie elements fully integrated with a structurally efficient radome and ribs of an aircraft fuselage is proposed in this article. The array is designed to simultaneously fulfill the electrical requirements of an airborne antenna sensor and the mechanical requirements of a load-carrying aircraft fuselage. The array antenna is capable of steering the beam up to  $\pm \mathrm{80}^{\circ} $  in the azimuth plane over a 20% bandwidth (2.4–3 GHz) with the active reflection coefficient ( $\Gamma _{act}$ ) below −10 dB in an infinite array environment. Experimental results of a  $16 \times 16$  element array demonstrator agree well with the simulation results. The  $16 \times 16$  array antenna is capable of steering the beam up to  $\pm \mathrm{60}^{\circ} $  and  $\pm \mathrm{75}^{\circ} $  with the bandwidth of 20% and 10%, respectively, at  $\Gamma _{act}\leq -10$  dB. The array antenna also achieved good stiffness and performed well in the vibration loads of commercial transport aircraft.","1558-2221","","10.1109/TAP.2023.3259727","Sweden’s Innovation Agency through the National Aeronautics Research Programme (NFFP) 7(grant numbers:2017-04871); ","https://ieeexplore.ieee.org/stamp/stamp.jsp?arnumber=10081262","Aircraft antenna;bowtie antenna;connected array;fuselage integration;wide-scanning antenna","Antenna arrays;Antennas;Aircraft;Radomes;Loaded antennas;Maintenance engineering;Mutual coupling","","4","","26","IEEE","24 Mar 2023","","","IEEE","IEEE Journals"
"Numerical Analysis of the New Wireless Relay Transmission Model Based on FEM","S. Li; X. Sun; Z. Li; P. Hao","School of Electronic Science and Engineering, University of Electronic Science and Technology of China, Chengdu, China; School of Electronic Science and Engineering, University of Electronic Science and Technology of China, Chengdu, China; School of Electronic Science and Engineering, University of Electronic Science and Technology of China, Chengdu, China; School of Electronic Science and Engineering, University of Electronic Science and Technology of China, Chengdu, China",IEEE Transactions on Antennas and Propagation,"4 May 2023","2023","71","5","4228","4235","In this article, a wireless relay transmission system in long-distance wells with new close-winding helical coils is proposed. This system can realize more efficient bottom–up superposition transmission of signals in long transmission wells. At the same time, by redesigning the structure of the transmitting and relay antennas, a close-winding helical coil structure with metal ring protection is proposed to excite quasi-TEM waves, which improves the efficiency of signal transmission in each channel and the compressive strength of the antenna. The simulation and experimental results demonstrate that under long-distance and harsh stratum conditions, the wireless transmission system in long-distance wells has excellent signal transmission performance at extremely low frequencies. Compared with previous antenna structures, the new helical coil has a better performance in transmission efficiency. This new wireless relay transmission system can greatly meet the long-distance transmission and conditions of oil and gas wells in the future.","1558-2221","","10.1109/TAP.2023.3247899","National Science Foundation of China(grant numbers:61727803); ","https://ieeexplore.ieee.org/stamp/stamp.jsp?arnumber=10054536","Close winding helical coil;electromagnetic field finite element method (FEM);extremely low frequency (ELF);quasi-TEM;wireless relay transmission","Relays;Wireless communication;Coils;Finite element analysis;Attenuation;Electromagnetic scattering;Electromagnetic fields","","3","","22","IEEE","28 Feb 2023","","","IEEE","IEEE Journals"
"A Quasi-Optimal Shape Design Method for Electromagnetic Scatterers Based on NURBS Surfaces and Filter-Enhanced GWO","H. Wang; Q. Zou; H. Lin","State Key Laboratory of CAD and CG, College of Computer Science and Technique, Zhejiang University, Hangzhou, China; State Key Laboratory of CAD and CG, College of Computer Science and Technique, Zhejiang University, Hangzhou, China; State Key Laboratory of CAD and CG, College of Computer Science and Technique, Zhejiang University, Hangzhou, China",IEEE Transactions on Antennas and Propagation,"4 May 2023","2023","71","5","4236","4245","This article presents a quasi-optimal and efficient method for designing the shape of electromagnetic (EM) scatterers. Optimizing the EM scatterer shape to achieve satisfactory scattering properties is a crucial, yet challenging problem due to the complex geometry involved and the high nonlinearity in the optimization. In this article, the geometric complexity is to be handled by modeling EM scatterer shapes as nonuniform rational basis spline (NURBS) surfaces, which enables an easy and intuitive shape control. Using the surfaces’ control points as optimization variables, the shape optimization problem is to be solved with the heuristic optimization strategy, which can effectively handle nonlinearity and the associated local optima. Specifically, the recently developed grey wolf optimizer (GWO) is employed. Although GWO can effectively avoid local optima and achieve quasi-optimal results, it requires repeated calls to time-consuming EM simulations. To solve this efficiency issue, a filter-enhanced version of GWO is proposed to reduce the times of calling EM simulations, and an efficient, adaptive remeshing method is proposed to accelerate the numerical analysis process within each EM simulation call. Altogether, they lead to a quasi-optimal and efficient method for optimizing EM scatterers. Its effectiveness has also been validated by several examples.","1558-2221","","10.1109/TAP.2023.3247179","National Key Research and Development Program of China(grant numbers:2020YFC2201302); National Natural Science Foundation (NNSF) of China(grant numbers:62102355); Natural Science Foundation (NSF) of Zhejiang Province(grant numbers:LQ22F020012); ","https://ieeexplore.ieee.org/stamp/stamp.jsp?arnumber=10054550","Electromagnetic (EM) scatterer optimization;grey wolf optimizer (GWO);nonuniform rational basis spline (NURBS) surfaces;quadtree-based remeshing;scattering simulation","Splines (mathematics);Shape;Surface topography;Surface reconstruction;Optimization;Mathematical models;Solid modeling","","4","","31","IEEE","28 Feb 2023","","","IEEE","IEEE Journals"
"Ultrawideband De-Embedding Calibration for Magnetic Field Probes by Using Symmetric GCPW Calibrators","X. Tian; S. Xue; W. Shao; D. -L. Wu","School of Physics and Optoelectronic Engineering, Guangdong University of Technology, Guangzhou, China; School of Physics and Optoelectronic Engineering, Guangdong University of Technology, Guangzhou, China; School of Physics and Optoelectronic Engineering, Guangdong University of Technology, Guangzhou, China; School of Physics and Optoelectronic Engineering and the State Key Laboratory of Precision Electronic Manufacturing Technology and Equipment, School of Electromechanical Engineering, Guangdong University of Technology, Guangzhou, China",IEEE Transactions on Antennas and Propagation,"4 May 2023","2023","71","5","4246","4253","Microstrip line (MS) is commonly used as a calibrator for probe calibration. However, some issues need to be addressed for high-frequency applications, such as ripple and attenuation caused by the embedded part of the calibrator. In this article, an ultrawideband de-embedding calibration method (DCM) for magnetic field probes is proposed. Two symmetric nonsoldering grounded coplanar waveguide (GCPW) calibrators, including Through and Line standards, are used to solve the de-embedded  $S$ -parameter matrix of a three-port calibration system. Compared with the traditional calibration method (TCM), the proposed method can reduce the influence of the reflection and attenuation caused by the embedded part and preserve the intrinsic properties of the probe itself. By using the DCM with a symmetric and good matched GCPW calibrator, the ripples of the DCM decrease by 6.57 dB, which is 82% of the TCM with an MS, and the attenuation has been compensated by about 0.7 dB at 10 GHz. In addition, a new characterization method of common mode electric field suppression ratio (CMSR) for  $H$ -field probe is also presented, and it is applicable to conduct emissions measurement in which a probe can detect signals without 90° rotation.","1558-2221","","10.1109/TAP.2023.3255584","National Natural Science Foundation of China (NSFC)(grant numbers:62001123); Natural Science Foundation of Guangdong Province(grant numbers:2022A1515012409); Guangzhou Science and Technology Plan Projects(grant numbers:202102020657); ","https://ieeexplore.ieee.org/stamp/stamp.jsp?arnumber=10071964","Calibration method;de-embedding;magnetic field probe;near-field measurement","Probes;Calibration;Transmission line measurements;Standards;Attenuation;Microstrip;Couplings","","18","","38","IEEE","15 Mar 2023","","","IEEE","IEEE Journals"
"An MLFMA-Based Eigenmode Theory for Electromagnetic Scattering Analysis From Electrically Large and Complex Conducting Objects","X. Chen","CAEP Software Center for High Performance Numerical Simulation, Beijing, China",IEEE Transactions on Antennas and Propagation,"4 May 2023","2023","71","5","4254","4261","The eigenmode theory, which uses the modal currents solved from surface differential equations (SDEs) as the basis functions of the method of moment (MoM), has been applied to the analysis of electromagnetic scattering and radiation problems of electrically small and simple perfect electrically conducting (PEC) objects. In this article, a multilevel fast multipole algorithm (MLFMA)-based eigenmode theory is presented for analyzing electromagnetic scattering from electrically large and complex PEC objects. The method applies the MLFMA to accelerate the matrix-vector multiplications involved in filling the dense impedance matrix and, therefore, is much more efficient than the conventional eigenmode theory, especially for electrically large objects. Meanwhile, the way to determine a priori the number of the required modal currents for arbitrarily shaped objects is presented, which makes the MLFMA-based eigenmode theory applicable to the scattering analysis from complex objects. Numerical results verify the accuracy and efficiency of the proposed method.","1558-2221","","10.1109/TAP.2023.3242451","National Natural Science Foundation of China (NSFC)(grant numbers:12001053,62231003); ","https://ieeexplore.ieee.org/stamp/stamp.jsp?arnumber=10041844","Eigenmode theory;electrically large and complex objects;electromagnetic scattering;multilevel fast multipole algorithm (MLFMA)","Impedance;Manganese;Method of moments;Electromagnetic scattering;Computational complexity;Testing;Surface impedance","","4","","21","IEEE","9 Feb 2023","","","IEEE","IEEE Journals"
"A High-Order-Accurate 3D Surface Integral Equation Solver for Uniaxial Anisotropic Media","J. Hu; C. Sideris","Department of Electrical and Computer Engineering, University of Southern California, Los Angeles, CA, USA; Department of Electrical and Computer Engineering, University of Southern California, Los Angeles, CA, USA",IEEE Transactions on Antennas and Propagation,"4 May 2023","2023","71","5","4262","4271","This article introduces a high-order accurate surface integral equation (SIE) method for solving 3-D electromagnetic scattering for dielectric objects with uniaxially anisotropic permittivity tensors. The N-Müller formulation is leveraged, resulting in a second-kind integral formulation, and a finite-difference (FD)-based approach is used to deal with the strongly singular terms resulting from the dyadic Green’s functions for uniaxially anisotropic media while maintaining the high-order accuracy of the discretization strategy. The integral operators are discretized via a Nyström-collocation approach, which represents the unknown surface densities in terms of Chebyshev polynomials on curvilinear quadrilateral surface patches. The convergence is investigated for various geometries, including a sphere, cube, a complicated non-uniform rational basis spline (NURBS) geometry imported from a 3-D computer-aided design (CAD) modeler software, and a nanophotonic silicon waveguide, and the results are compared against a commercial finite-element (FE) solver. To the best of our knowledge, this is the first demonstration of high-order accuracy for objects with uniaxially anisotropic materials using SIEs.","1558-2221","","10.1109/TAP.2023.3246084","Air Force Office of Scientific Research(grant numbers:FA9550-20-1-0087); National Science Foundation(grant numbers:CCF-1849965,CCF-2047433); ","https://ieeexplore.ieee.org/stamp/stamp.jsp?arnumber=10051648","High-order accuracy;integral equations;N-Müller formulation;scattering;spectral methods","Integral equations;Green's function methods;Permittivity;Dielectrics;Media;Tensors;Convergence","","2","","29","IEEE","23 Feb 2023","","","IEEE","IEEE Journals"
