"Dual-Band Base Station Antenna Array With Cross-Band Scattering and In-Band Coupling Suppression","H. Yuan; F. -C. Chen; W. -F. Zeng; Q. -X. Chu","School of Electronic and Information Engineering, South China University of Technology, Guangzhou, China; School of Electronic and Information Engineering, South China University of Technology, Guangzhou, China; School of Electronic and Information Engineering, South China University of Technology, Guangzhou, China; School of Electronic and Information Engineering, South China University of Technology, Guangzhou, China",IEEE Transactions on Antennas and Propagation,"4 May 2023","2023","71","5","3983","3991","Dual-band base station antenna array mainly suffers from the drawbacks of cross-band scattering and in-band coupling, which will disturb the radiation performances of the antennas, especially for the high-band (HB) antennas. In this article, a dual-band base station antenna array with cross-band scattering and in-band coupling suppression is proposed. It contains a low scattering low-band (LB) crisscross-shaped dipole antenna codesigned with four square rings and four patches and a  $2\times $  2 HB antenna array. The crisscross-shaped dipole antenna is fed by four L-shaped strips, and a photonic bandgap (PBG) cell is loaded in the middle of each arm of the LB antenna to achieve HB-induced current scattering suppression without affecting the LB antenna, so the distortion of radiation patterns from the cross-band scattering can be avoided. As the LB antenna employs a crisscross structure, the four rings and patches can be integrated together with the LB antenna on the same substrate, which not only helps to broaden the bandwidth but also acts as the array-antenna decoupling surface (ADS). With the codesign of LB antenna and ADS, no extra substrates are required for in-band decoupling. A dual-band base station antenna array prototype is fabricated and measured, showing good performances in LB and HB.","1558-2221","","10.1109/TAP.2023.3255644","National Natural Science Foundation of China(grant numbers:62022035); Science and Technology Planning Project of Guangdong Province(grant numbers:2022A0505050010); Guangdong Provincial Key Laboratory of Short-Range Wireless Detection and Communication; ","https://ieeexplore.ieee.org/stamp/stamp.jsp?arnumber=10071998","Base station antenna;cross-band scattering suppression;dual-band antenna array;in-band coupling improvement","Antenna arrays;Dipole antennas;Antenna measurements;Couplings;Antenna radiation patterns;Strips;Loaded antennas","","11","","25","IEEE","15 Mar 2023","","","IEEE","IEEE Journals"
"Experimental Measurement of Noise Figure and Radiation Efficiency With the Antenna Y-Factor Method at X-Band","D. Buck; M. C. Burnett; K. F. Warnick","Department of Electrical and Computer Engineering, Brigham Young University, Provo, UT, USA; Department of Electrical and Computer Engineering, Brigham Young University, Provo, UT, USA; Department of Electrical and Computer Engineering, Brigham Young University, Provo, UT, USA",IEEE Transactions on Antennas and Propagation,"4 May 2023","2023","71","5","3992","3996","To optimize the design of a high-sensitivity receiver, it is valuable to be able to assign noise budget contributions to various parts of the system. The system noise and aperture efficiency can be characterized using the antenna Y-factor method, which has been added recently to the IEEE Recommended Practice for Antenna Measurements, Std 149-2021. We extend the antenna Y-factor method by showing that it can be used to measure the noise figure of an active antenna and receiver system. With an additional measurement of the receiver noise, the antenna radiation efficiency can be determined. We demonstrate the extended antenna Y-factor method experimentally at X-band for antennas under test, including a horn with near 100% efficiency, microstrip patch antenna with efficiency near 80%, and a patch antenna array with 40% nominal efficiency.","1558-2221","","10.1109/TAP.2023.3256482","National Science Foundation(grant numbers:1636645,1727010); ","https://ieeexplore.ieee.org/stamp/stamp.jsp?arnumber=10076404","Antenna Y factor;noise figure;radiation efficiency","Antenna measurements;Receiving antennas;Temperature measurement;Temperature;Horn antennas;Measurement uncertainty;Microstrip antenna arrays","","5","","23","IEEE","17 Mar 2023","","","IEEE","IEEE Journals"
"A Pattern-Reconfigurable Cylindrical Dielectric Resonator Antenna With Three Switchable Radiation Patterns","X. Liu; K. W. Leung; N. Yang","Department of Electrical Engineering, State Key Laboratory of Terahertz and Millimeter Waves, City University of Hong Kong, Kowloon, Hong Kong, SAR, China; Department of Electrical Engineering, State Key Laboratory of Terahertz and Millimeter Waves, City University of Hong Kong, Kowloon, Hong Kong, SAR, China; School of Electronics and Information Technology, Sun Yat-sen University, Guangzhou, China",IEEE Transactions on Antennas and Propagation,"4 May 2023","2023","71","5","3997","4006","A pattern-reconfigurable antenna with three switchable radiation patterns is investigated. It consists of a three-layer cylindrical dielectric resonator antenna (DRA) and a parasitic monopole antenna. Its feed network comprises a Y-shaped feedline, a square ring slot, and seven diodes. For the first time, by controlling the operation states of the diodes, the radiation pattern of the antenna can be switched between the omnidirectional, broadside, and unilateral modes. The omnidirectional pattern is obtained by virtue of the parasitic monopole, whereas the broadside pattern can be obtained when the DRA and radiation mode of the feeding ring slot are excited. If the parasitic monopole, DRA, and radiation mode of the slot are all excited, their radiation fields can be superimposed to give a unilateral radiation pattern. The radiated E-field is vertically polarized for all of the three radiation modes. A prototype working in 2.4-GHz industrial science medical (ISM) band was fabricated and tested to verify the idea, and reasonable agreement between the measured and simulated results is observed.","1558-2221","","10.1109/TAP.2023.3256537","General Research Fund (GRF) Grant from the Research Grants Council of Hong Kong Special Administrative Region, China(grant numbers:CityU 11218020); Shenzhen-Hong Kong-Macau Science and Technology Project (CategoryC)(grant numbers:SGDX20210823104002018); 2022 Guangdong-Hong Kong-Macao Joint Innovation Funding Scheme(grant numbers:2022A050503002); International Cooperative Research Program of Guangzhou City GDD District(grant numbers:2021GH04); ","https://ieeexplore.ieee.org/stamp/stamp.jsp?arnumber=10080914","Broadside;dielectric resonator antenna (DRA);omnidirectional;reconfigurable radiation pattern;unilateral","Antenna radiation patterns;Switches;Slot antennas;Magnetic resonance;Signal to noise ratio;Microstrip;Substrates","","18","","43","IEEE","23 Mar 2023","","","IEEE","IEEE Journals"
"Antenna Phase Center Determination Using a Six-Port-Based Direction-of-Arrival Detector","B. Tegowski; M. Wenzel; A. Koelpin","Institute of High-Frequency Technology, Hamburg University of Technology, Hamburg, Germany; Institute of High-Frequency Technology, Hamburg University of Technology, Hamburg, Germany; Institute of High-Frequency Technology, Hamburg University of Technology, Hamburg, Germany",IEEE Transactions on Antennas and Propagation,"4 May 2023","2023","71","5","4007","4016","This article presents a novel technique to determine the antenna phase center. It relies on measuring the direction of arrival (DOA) of the radiated field. Therefore, no access of the measurement equipment to the antenna under test (AUT) is required. A direction-of-arrival detector is implemented that performs phase difference measurements in two orthogonal planes. Six-port interferometers are used for this purpose. By considering phase differences, the proposed method is robust against phase disturbances, which may occur at the feed of the AUT, e.g., due to flexible cables or rotary joints. Besides, impairments stemming from reflections in the measurement environment are addressed. Measurements of a K-band horn and a patch antenna in an anechoic chamber validate the approach. A single phase center is determined for each principle plane as well as for the 3-D main beam. In addition, the phase center locus is retrieved.","1558-2221","","10.1109/TAP.2023.3256485","","https://ieeexplore.ieee.org/stamp/stamp.jsp?arnumber=10076414","Anechoic chamber;angle of arrival (AOA);antenna phase center;direction of arrival (DOA);horn antenna;multipath interference;patch antenna;six-port","Antenna measurements;Phase measurement;Detectors;Receiving antennas;Antennas;Antenna feeds;Interferometers","","6","","55","IEEE","17 Mar 2023","","","IEEE","IEEE Journals"
"Ridged Meandered Waveguides for 3-D Routing and Phase Delay Control and Its Application to Discrete Lenses","L. Berretti; R. Loison; E. Menargues; S. Capdevila; L. Polo-López; G. Toso; M. García-Vigueras","Institut d’Électronique et des Technologies du numéRique (IETR), UMR CNRS, 6164, Institut National des Sciences Appliquées de Rennes (INSA Rennes), Rennes, France; Institut d’Électronique et des Technologies du numéRique (IETR), UMR CNRS, 6164, Institut National des Sciences Appliquées de Rennes (INSA Rennes), Rennes, France; SWISSto12 SA, Renens, Switzerland; SWISSto12 SA, Renens, Switzerland; Institut d’Électronique et des Technologies du numéRique (IETR), UMR CNRS, 6164, Institut National des Sciences Appliquées de Rennes (INSA Rennes), Rennes, France; Radio Frequency Payloads and Technology Division, European Space Research and Technology Centre (ESTEC), European Space Agency (ESA), Noordwijk, AG, The Netherlands; Institut d’Électronique et des Technologies du numéRique (IETR), UMR CNRS, 6164, Institut National des Sciences Appliquées de Rennes (INSA Rennes), Rennes, France",IEEE Transactions on Antennas and Propagation,"4 May 2023","2023","71","5","4017","4027","In this article, an innovative procedure to design ridged meandered waveguides (RMWs) is introduced. By modulating the meandered centerline of a waveguide connecting two fixed points, new degrees of freedom (DoFs) to control the phase delay are obtained. RMWs represent a good compromise between coaxial cables, which feature broadband operation and can be easily bended still introducing high losses and conventional waveguides, which are characterized by low losses but also narrow operational bandwidth. RMWs are especially well-suited for isophase lattice expanders that can be used in beamforming networks (BFNs), phased arrays, or discrete 3-D lens antennas. The article describes a methodology to design meandered waveguides (MWs), which is verified both analytically and experimentally through the synthesis, fabrication, and test of a discrete 3-D lens antenna in the Ka-band (27.5–30 GHz) made using additive manufacturing (AM).","1558-2221","","10.1109/TAP.2023.3255515","European Union through the European Regional Development Fund (ERDF);; French Region of Brittany, Ministry of Higher Education and Research, Rennes Métropole and Conseil Départemental 35, through the CPER Project SOPHIE / STIC & Ondes; European Space Agency through the OSIP program; ","https://ieeexplore.ieee.org/stamp/stamp.jsp?arnumber=10071953","3-D routing;additive manufacturing (AM);beamforming networks (BFNs);discrete lens;dual polarization;Ka-band;phase delay control;ridged meandered waveguide (RMW)","Delays;Trajectory;Three-dimensional displays;Routing;Lenses;Waveguide discontinuities;Insertion loss","","5","","32","IEEE","15 Mar 2023","","","IEEE","IEEE Journals"
"Holistic Analysis of Conformal Antennas Using the Cylindrical TLM Method","T. Dimitrijevic; A. Vukovic; A. Atanaskovic; J. Jokovic; P. Sewell; N. S. Dončov","Faculty of Electrical Engineering, University of Niš, Niš, Serbia; Faculty of Engineering, University of Nottingham, Nottingham, U.K; Faculty of Electrical Engineering, University of Niš, Niš, Serbia; Faculty of Electrical Engineering, University of Niš, Niš, Serbia; Faculty of Engineering, University of Nottingham, Nottingham, U.K; Faculty of Electrical Engineering, University of Niš, Niš, Serbia",IEEE Transactions on Antennas and Propagation,"4 May 2023","2023","71","5","4028","4035","The impact of deformations on wearable antenna performance has been analyzed both experimentally and computationally. The reported results have been inconsistent and often contradictory. This article highlights how the choice of computational mesh, namely, cubic and curvilinear cylindrical mesh, applied to the problem of a cylindrically bent antenna can affect the results and subsequent conclusions. Deploying both meshes within the same time-domain numerical algorithm means that the differences in results can only be attributable to the discretization method used. Finally, a cylindrical mesh is used to further characterize the impact of bending on antenna resonant frequency, bandwidth, and radiation pattern. Bending in both E- and H-plane is considered.","1558-2221","","10.1109/TAP.2023.3260633","Ministry of Education, Science and Technological Development of Serbia(grant numbers:451-03-47/2023-14/ 200102); Science Fund of Serbia(grant numbers:6394135); Royal Society International Exchanges(grant numbers:IES\R1\201311); ","https://ieeexplore.ieee.org/stamp/stamp.jsp?arnumber=10083071","Bending effect;patch antennas;textile antennas;transmission line modeling (TLM) method","Antennas;Bending;Resonant frequency;Computational modeling;Antenna radiation patterns;Bandwidth;Patch antennas","","6","","27","IEEE","27 Mar 2023","","","IEEE","IEEE Journals"
"Three-Dimensional Wireless Power Transfer System Using Multiple Orthogonal Resonators for Spatial Freedom","S. -Y. Kim; N. -R. Kwon; S. -H. Ahn; W. -S. Lee","Defense Agency for Technology and Quality, Changwon, Republic of Korea; Department of Electronic Engineering, Gyeongsang National University, Jinju, Republic of Korea; Department of Electronic Engineering, Gyeongsang National University, Jinju, Republic of Korea; Department of Electronic Engineering, Gyeongsang National University, Jinju, Republic of Korea",IEEE Transactions on Antennas and Propagation,"4 May 2023","2023","71","5","4036","4044","In this article, the 3-D wireless power transfer (WPT) system using multiple orthogonal resonators for spatial freedom is proposed. The proposed transmitter comprises three orthogonal resonators with a 3-D structure. The three orthogonal resonators are positioned on top and bottom of the substrate, and the proposed system has an open box-shaped structure due to the 3-D resonators. The proposed WPT system allows power transfer despite the receiver’s lateral and angular misalignments by generating magnetic fields in all directions generated by multiple resonators. For performance verification, the operating principle of the proposed WPT system is theoretically calculated and simulated. Also, the power transfer efficiency (PTE) under the lateral and angular misalignments is measured and compared with the conventional WPT system and the WPT system implemented on the 2-D plane using multiple orthogonal resonators. The proposed WPT system achieves a PTE from 46.8% to 71.6% when the receiving resonator is set to  $81 \times 51$  mm2, which can be built into the mobile phone, and the charging volume is  $201 \times 201\,\,\times51$  mm3.","1558-2221","","10.1109/TAP.2023.3256270","Institute of Information & Communications Technology Planning & Evaluation (IITP) grant funded by the Korean Government [Ministry of Science and ICT (MSIT)](grant numbers:2021-0-00169); ICAN (ICT Challenge and Advanced Network of HRD) Program(grant numbers:IITP-2023-RS-2022-00156409); National Research Foundation of Korea (NRF) grant funded by the Korean Government (MSIT)(grant numbers:2019R1C1C1008102); ","https://ieeexplore.ieee.org/stamp/stamp.jsp?arnumber=10075362","3-D wireless power transfer (WPT) system;lateral and angular misalignments;multiple orthogonal resonators;power transfer efficiency (PTE);spatial freedom","Resonators;Coils;Three-dimensional displays;Inductance;Magnetic resonance;Magnetic fields;Receivers","","9","","32","IEEE","16 Mar 2023","","","IEEE","IEEE Journals"
"Flat-Topped Radiation Pattern Synthesis of a Conformal Leaky-Wave Holographic Antenna","M. A. C. Zadeh; N. Komjani","Department of Electrical Engineering, Iran University of Science and Technology (IUST), Tehran, Iran; Department of Electrical Engineering, Iran University of Science and Technology (IUST), Tehran, Iran",IEEE Transactions on Antennas and Propagation,"4 May 2023","2023","71","5","4045","4054","A novel method to synthesize a flat-topped pattern in single-curvature conformal leaky-wave antennas (CLWAs) is presented. When synthesizing the antenna, aperture field estimation (AFE), the holographic principle, the transformation optic (TO) approach, and the effects of the geometrical parameters of a curved structure on the far-field radiation pattern are considered. In the design process, three software packages (HFSS, MATLAB, and CST) are used to achieve the desired far-field radiation pattern at the design frequency. The shaped beam is in the broadside direction at 10 GHz. This CLWA is composed of unit cells with square patches that are printed on a double-layer grounded substrate that consists of polylactic acid (PLA) and Rogers RO4003 having thicknesses of 4 and 0.127 mm, respectively. An edge-fed 1:8 power divider excitation with a substrate-integrated waveguide (SIW) structure is designed to illuminate the hologram. The proposed CLWA is fabricated and tested. The maximum realized gain of the novel antenna at the design frequency is about 13 dBi, and the weighted aperture efficiency of the proposed CLWA is about 0.86. There are also good agreement between the simulation and the measurement results of the proposed antenna frequency responses.","1558-2221","","10.1109/TAP.2023.3255556","","https://ieeexplore.ieee.org/stamp/stamp.jsp?arnumber=10071990","Aperture field estimation (AFE);conformal antennas;holography;leaky-wave antennas;surface impedance;transformation optic (TO)","Surface impedance;Surface waves;Antenna radiation patterns;Impedance;Optical surface waves;Leaky wave antennas;Aperture antennas","","13","","42","IEEE","15 Mar 2023","","","IEEE","IEEE Journals"
"An Ultrawideband Dual-Polarized Phased Array Antenna for Sub-3–GHz 5G Applications With a High Polarization Isolation","D. -M. Sun; Z. -C. Hao; W. -Y. Liu; C. -Y. Ding","State Key Laboratory of Millimeter-Waves, Frontiers Science Center for Mobile Information Communication and Security, School of Information Science and Engineering, Southeast University, Nanjing, China; State Key Laboratory of Millimeter-Waves, Frontiers Science Center for Mobile Information Communication and Security, School of Information Science and Engineering, Southeast University, Nanjing, China; State Key Laboratory of Millimeter-Waves, Frontiers Science Center for Mobile Information Communication and Security, School of Information Science and Engineering, Southeast University, Nanjing, China; State Key Laboratory of Millimeter-Waves, Frontiers Science Center for Mobile Information Communication and Security, School of Information Science and Engineering, Southeast University, Nanjing, China",IEEE Transactions on Antennas and Propagation,"4 May 2023","2023","71","5","4055","4065","A dual-polarized ultrawideband (UWB) phased array antenna with a wide scanning range and high isolation polarization characteristics is presented in this article. A tightly coupled dipole with an etched slot is proposed as the element antenna, which has a low active input impedance in a wideband and a wide scanning range. Thus, a simple feed strategy without requiring additional external matching networks and baluns could be adopted for the designed scheme. To obtain a large polarization isolation, a capacitively loaded cross-shaped metallic wall (CSMW) is proposed. It is also helpful to improve the in-band matching by mitigating the bandwidth-limiting loop mode at lower frequencies and removing the undesirable common-mode resonance. As a demonstration, an array is designed with a 4.1:1 bandwidth (0.69–2.88 GHz) and an active VSWR < 3.4 while scanning up to ±45° in the E-, H-, and D-planes. Its polarization isolation is better than 45 dB at the broadside and 35 dB within most of the bandwidth when scanning to ±45° in the E-/H-planes. Its cross-polarization level is more than 51 dB at broadside and 40 dB in scanning up to ±45° in the E- and H-planes. A dual-polarized  $8 \times $  8 array prototype (64 ports per polarization) is manufactured and evaluated. Results from the experiment demonstrate good agreement between the measurement and design. The designed antenna is scalable and has a high polarization isolation, a wide scanning range, an ultrawide bandwidth, and a low cost.","1558-2221","","10.1109/TAP.2023.3249342","National Natural Science Foundation of China(grant numbers:62131008); Fundamental Research Funds for the Central Universities(grant numbers:2242022k30003); ","https://ieeexplore.ieee.org/stamp/stamp.jsp?arnumber=10058139","Dual-polarized array;high polarization isolation;phased arrays;ultrawideband (UWB);wide-angle scanning","Dipole antennas;Phased arrays;5G mobile communication;Ultra wideband antennas;Slot antennas;Pins;Antennas","","20","","40","IEEE","2 Mar 2023","","","IEEE","IEEE Journals"
"Hybridization of Bayesian Compressive Sensing and Array Dilation Technique for Synthesis of Linear Isophoric Sparse Antenna Arrays","A. Kedar; P. Vangol; A. Mahesh","Electronics and Radar Development Establishment (LRDE), Bengaluru, India; Department of Electronics and Communication Engineering, R. V. College of Engineering (RVCE), Bengaluru, India; Department of Electronics and Communication Engineering, R. V. College of Engineering (RVCE), Bengaluru, India",IEEE Transactions on Antennas and Propagation,"4 May 2023","2023","71","5","4066","4074","This article presents a deterministic hybrid algorithm combining the merits of Bayesian compressive sensing (BCS) and array dilation technique (ADT) for the synthesis of aperiodic and isophoric (equally fed) linear sparse array antennas (LSAAs). The hybrid technique overcomes the shortcomings of BCS, i.e., nonuniform amplitude taper which results into a lower taper efficiency, using hybridization with ADT resulting into an isophoric LSAA, thereby improving the taper efficiency. The proposed algorithm can be used to synthesize arbitrary antenna array patterns as per the reference pattern while complementing the constraints on the aperture length and the desired thinning levels. The hybrid algorithm provides a computationally efficient and deterministic technique for synthesizing LSAAs with low sidelobe level (SLL) and demonstrates a wide angular scanning with minimal loss in directivity and SLL over the scan volume. The results demonstrated are comparable or better than the prior literature on LSAAs.","1558-2221","","10.1109/TAP.2023.3247913","","https://ieeexplore.ieee.org/stamp/stamp.jsp?arnumber=10054534","Array dilation technique (ADT);Bayesian compressive sensing (BCS);isophoric antenna array;sparse linear antenna array","Antenna arrays;Linear antenna arrays;Compressed sensing;Pattern matching;Bayes methods;Charge coupled devices;Perturbation methods","","10","","25","IEEE","28 Feb 2023","","","IEEE","IEEE Journals"
