"Regular Sparse Array Direction of Arrival Estimation in One Dimension","F. Knaepkens; A. Cuyt; W. -S. Lee; D. I. L. de Villiers","Department of Mathematics and Computer Science, University of Antwerp (CMI), Antwerp, Belgium; Department of Mathematics and Computer Science, University of Antwerp (CMI), Antwerp, Belgium; Department of Mathematics and Computer Science, University of Antwerp (CMI), Antwerp, Belgium; Department of Electrical and Electronic Engineering, Stellenbosch University, Stellenbosch, South Africa",IEEE Transactions on Antennas and Propagation,"5 May 2020","2020","68","5","3997","4006","Traditionally, regularly spaced antenna arrays follow the spatial Nyquist criterion to guarantee an unambiguous analysis. We present a novel technique that makes use of two sparse non-Nyquist regularly spaced antenna arrays, where one of the arrays is just a shifted version of the other. The method offers several advantages over the use of traditional dense Nyquist-spaced arrays, while maintaining a comparable algorithmic complexity for the analysis. Among the advantages we mention: an improved resolution for the same number of receivers and reduced mutual coupling effects between the receivers, both due to the increased separation between the antennas. Because of a shared structured linear system of equations between the two arrays, as a consequence of the shift between the two, the analysis of both is automatically paired, thereby avoiding a computationally expensive matching step as is required in the use of so-called co-prime arrays. In addition, an easy validation step allows to automatically detect the precise number of incoming signals, which is usually considered a difficult issue. At the same time, the validation step improves the accuracy of the retrieved results and eliminates unreliable results in the case of noisy data. The performance of the proposed method is illustrated with respect to the influence of noise as well as to the effect of mutual coupling.","1558-2221","","10.1109/TAP.2019.2963618","National Research Foundation of South Africa(grant numbers:75322,105717); Belgian FWO Project “Incorporating Error Control in Sparse Modelling”(grant numbers:G019316N); ","https://ieeexplore.ieee.org/stamp/stamp.jsp?arnumber=8952883","Array antennas;direction of arrival (DOA) estimation;sparse arrays","Antenna arrays;Direction-of-arrival estimation;Estimation;Mutual coupling;Sensor arrays;Directive antennas","","9","","42","IEEE","8 Jan 2020","","","IEEE","IEEE Journals"
"Orthogonal Code-Based Transmitted Radiation Pattern Measurement Method for 5G Massive MIMO Antenna Systems","S. Park; H. -S. Lee; J. -G. Yook","School of Electrical and Electronic Engineering, Yonsei University, Seoul, South Korea; School of Electrical and Electronic Engineering, Yonsei University, Seoul, South Korea; School of Electrical and Electronic Engineering, Yonsei University, Seoul, South Korea",IEEE Transactions on Antennas and Propagation,"5 May 2020","2020","68","5","4007","4013","This article presents a novel method to measure the transmitted radiation pattern by using orthogonal encoded signals during the process of hybrid analog-digital (HAD) beamformer development. One of the most important indicators in evaluating the performance of HAD beamforming systems is the measurement of the sub-array radiation patterns. However, as the number of elements increases, the number of combinations that can create sub-arrays increases significantly, and the conventional radiation pattern measurement process becomes exhaustive. However, when an orthogonal coded signal is used for the HAD beamforming system measurement, the magnitude and phase information of each element of the HAD beamforming system, including mutual coupling, can be simultaneously obtained from a single scan. Hence, it is possible to measure all feasible sub-array patterns very efficiently. Therefore, we propose an orthogonal code-based time-domain measurement technique and validate it with full-wave time-domain simulations. The results show that it is possible to receive element pattern information independently and that any sub-array pattern can be reconstructed with an accuracy greater than 99.99%.","1558-2221","","10.1109/TAP.2019.2963207","Ministry of Land, Infrastructure and Transport of Korean Government through the Technology Advancement Research Program(grant numbers:19CTAP-C151968-01); ","https://ieeexplore.ieee.org/stamp/stamp.jsp?arnumber=8951439","Antenna measurement system;far-field measurement;hybrid analog-digital (HAD) beamforming;massive multiple-input and multiple-output (m-MIMO);orthogonal code","Antenna measurements;Array signal processing;Antenna radiation patterns;Transmitting antennas;Time-domain analysis;Phase measurement;Linear antenna arrays","","8","","16","IEEE","7 Jan 2020","","","IEEE","IEEE Journals"
"Physical Insight Unveils New Imaging Capabilities of Orthogonality Sampling Method","M. T. Bevacqua; T. Isernia; R. Palmeri; M. N. Akinci; L. Crocco","Dipartimento di Ingegneria dell’Informazione, delle Infrastrutture e dell’Energia Sostenibile (DIIES), Università Mediterranea di Reggio Calabria, Reggio Calabria, Italy; Dipartimento di Ingegneria dell’Informazione, delle Infrastrutture e dell’Energia Sostenibile (DIIES), Università Mediterranea di Reggio Calabria, Reggio Calabria, Italy; Dipartimento di Ingegneria dell’Informazione, delle Infrastrutture e dell’Energia Sostenibile (DIIES), Università Mediterranea di Reggio Calabria, Reggio Calabria, Italy; Electrical and Electronics Engineering Faculty, Istanbul Technical University, Istanbul, Turkey; National Research Council of Italy (CNR-IREA), Institute for Electromagnetic Sensing of the Environment, Naples, Italy",IEEE Transactions on Antennas and Propagation,"5 May 2020","2020","68","5","4014","4021","The orthogonality sampling method (OSM) is a recently introduced qualitative inverse scattering approach for the estimation of the morphological properties of unknown targets. Both the simplicity of implementation and the applicability to various measurement configurations make this method very effective. In this article, a general physical understanding of this otherwise “pure mathematical” method is given for the first time. Such an interpretation is derived from the relationship between the currents induced in the investigated scenario and the so-called reduced scattered field, which is the core of the orthogonality sampling indicator function. Interestingly, the nature of such a relationship implies that the reduced scattered field can be related to the radiating component of the induced currents. A direct consequence of such a result is that the OSM is capable of imaging discontinuities within the unknown targets and hence identify regions with different electromagnetic properties. This possibility represents a unique feature among qualitative inverse scattering methods, as these latter have been introduced as tools to image just the external shape of the unknown targets. The new interpretation as well as the above distinctive capability of the OSM are proved with examples on both simulated and experimental data.","1558-2221","","10.1109/TAP.2019.2963229","","https://ieeexplore.ieee.org/stamp/stamp.jsp?arnumber=8951441","Inverse scattering problem;microwave imaging (MWI);orthogonality sampling method (OSM);shape reconstruction","Imaging;Inverse problems;Electromagnetics;Sampling methods;Shape;Scattering;Green's function methods","","39","","43","IEEE","7 Jan 2020","","","IEEE","IEEE Journals"
"Effects of Diffraction, Dispersion, and Absorption of Electromagnetic Waves in the Diagnostics of High-Power Microwave Pulses Using Wide-Aperture Liquid Calorimeters","P. V. Priputnev; A. I. Klimov; I. V. Pegel; V. P. Tarakanov; E. M. Totmeninov","Institute of High Current Electronics SB RAS, Tomsk, Russia; Institute of High Current Electronics SB RAS, Tomsk, Russia; Institute of High Current Electronics SB RAS, Tomsk, Russia; Joint Institute for High Temperatures RAS, Moscow, Russia; Institute of High Current Electronics SB RAS, Tomsk, Russia",IEEE Transactions on Antennas and Propagation,"5 May 2020","2020","68","5","4022","4028","Using a simple theory and finite-difference time domain (FDTD) simulations involving the Lorentz model, we demonstrate some problems in the determination of pulse waveform, amplitude, and peak power of high-power microwave pulses, when performed together with calorimetric measurement of the pulse energy, arising from the wave diffraction as well as from its dispersion in the absorbing liquid. Considering few typical pulse shapes and other experimental conditions, we outline the general limitations and recommendations for performing such measurements.","1558-2221","","10.1109/TAP.2019.2963641","Russian Foundation for Basic Research; Government of the Tomsk Region of the Russian Federation(grant numbers:18-42-700012); ","https://ieeexplore.ieee.org/stamp/stamp.jsp?arnumber=8954936","Absorbing media;diffraction;dispersion;finite-difference time domain (FDTD);high-power microwaves (HPMs);microwave power measurement;wide-aperture calorimeter","Oscillators;Microwave theory and techniques;Microwave measurement;Shape;Mathematical model;Dielectrics;Microwave antennas","","7","","19","IEEE","9 Jan 2020","","","IEEE","IEEE Journals"
"Electric Field Probe Used for Gradient Coil-Induced Field Measurements During Medical Device Testing: Design, Calibration, and Validation","A. Halder; A. Attaran; W. B. Handler; B. A. Chronik","Department of Physics and Astronomy, xMR Labs, Western University, London, Canada; Department of Physics and Astronomy, xMR Labs, Western University, London, Canada; Department of Physics and Astronomy, xMR Labs, Western University, London, Canada; Department of Physics and Astronomy, xMR Labs, Western University, London, Canada",IEEE Transactions on Antennas and Propagation,"5 May 2020","2020","68","5","4029","4037","In this article, an ultralow-frequency electric field probe capable of measuring time-varying gradient coil induced electric fields in a tissue-mimicking material was constructed, calibrated, and validated. This probe consisted of a 2 cm short dipole antenna followed by an instrumentation amplifier. The designed amplifier had a gain of 100 and a cutoff frequency of 31 kHz. The probe was fabricated on a four-layer printed circuit board (PCB), FR4 of thickness 1.57 mm and a copper thickness of 35 μm. A waterproofed 3-D probe holder was used to cover the electronics and expose the dipole tip to the saline solution. To calibrate this probe in a known environment, a parallelplate conductor was used. The calibrated probe was validated by measuring the electric field in a saline-filled cylindrical phantom placed within a cylindrically symmetric test coil. In order to do the validation, simulations were performed using an in-house tool developed in MATLAB and a validated tool in Sim4Life.","1558-2221","","10.1109/TAP.2020.2963940","Natural Sciences and Engineering Research Council of Canada; Ontario Research Fund (ORF); CMC Microsystems; ","https://ieeexplore.ieee.org/stamp/stamp.jsp?arnumber=8954912","Device safety;gradient coil induced electric fields;medical device testing;parallel-plate conductor;ultralow-frequency (ULF) electric field probe","Probes;Antenna measurements;Magnetic resonance imaging;Electric variables measurement;Phantoms;Dipole antennas;Impedance","","5","","20","IEEE","9 Jan 2020","","","IEEE","IEEE Journals"
"Improvement and Testing of Models for Field Level Evaluation in Urban Environment","A. Fanti; L. Schirru; S. Casu; M. B. Lodi; G. Riccio; G. Mazzarella","Department of Electrical and Electronic Engineering, University of Cagliari, Cagliari, Italy; Department of Electrical and Electronic Engineering, University of Cagliari, Cagliari, Italy; Department of Electrical and Electronic Engineering, University of Cagliari, Cagliari, Italy; Department of Electrical and Electronic Engineering, University of Cagliari, Cagliari, Italy; Department of Information and Electrical Engineering and Applied Mathematics, University of Salerno, Salerno, Italy; Department of Electrical and Electronic Engineering, University of Cagliari, Cagliari, Italy",IEEE Transactions on Antennas and Propagation,"5 May 2020","2020","68","5","4038","4047","Through the advent of mobile cellular networks the number of radio base stations installed in urban environments has increased exponentially. As a consequence, the level of the electromagnetic (EM) field has increased at the same pace, sometimes approaching the limits set by the national rules. The first step of a compliance test campaign is the field estimation, mainly close to the base stations. In this article, the estimation of EM field generated by UHF base station is presented. A rephrasing of the COST 231 - Walfisch-Ikegami model is used to evaluate the path loss at distances greater than 20 m from the base station. Then, the knowledge of the full antenna pattern allows to estimate the field level. Since antenna manufacturers measure, and publish, only the patterns on the principal planes, an extrapolation procedure is also presented. A measurement campaign in the specific small urban and irregular environments of Dorgali (NU), Cala Gonone (NU) and Lunamatrona (CA), Italy, done in the context of Onde Chiare project, has been used to assess the approach presented here.","1558-2221","","10.1109/TAP.2020.2969712","Sardinia Regional Government through the Onde Chiare Project(grant numbers:CUP: E68C14000200007); ","https://ieeexplore.ieee.org/stamp/stamp.jsp?arnumber=8979316","Electromagnetic (EM) field estimation;EM field measurements;propagation models;urban environment","Antennas;Antenna measurements;Estimation;Urban areas;Monitoring;Base stations;Electromagnetics","","14","","46","IEEE","3 Feb 2020","","","IEEE","IEEE Journals"
"A Low-Profile, Single-Ended and Dual-Polarized Patch Antenna for 5G Application","H. Huang; X. Li; Y. Liu","Key Laboratory of Equipment Efficiency in Extreme Environment, Ministry of Education, School of Aerospace Science and Technology, Xidian University, Xi’an, China; Key Laboratory of Equipment Efficiency in Extreme Environment, Ministry of Education, School of Aerospace Science and Technology, Xidian University, Xi’an, China; Key Laboratory of Equipment Efficiency in Extreme Environment, Ministry of Education, School of Aerospace Science and Technology, Xidian University, Xi’an, China",IEEE Transactions on Antennas and Propagation,"5 May 2020","2020","68","5","4048","4053","In this communication, a single-ended, dual-polarized patch antenna of extremely low profile is proposed. It consists of three substrates, which are, respectively, responsible for radiation, energy coupling, and feeding. A patch is printed on the top layer of the upper substrate. Four triangular slots are etched on the patch to direct the current in the slant direction and reduce the occlusion of the patch to other structures. Then two coupled lines are crosswise placed on the top layer of the medium substrate to improve the structural symmetry and couple the energy to the patch. The transition lines on the bottom side of the lowermost substrate are connected to the coupled lines plated through holes. The antenna can achieve high isolation and acceptable cross polarization discrimination (XPD) without complex differential feed network. Its size is only 0.257 × 0.257 × 0.06 λ03(λ0 is the free space wavelength at center frequency). To verify the design, the antenna element and its 1 × 2 subarray is processed and tested. Results show that the proposed antenna has a great deal of potential for 5G new radio (NR) application.","1558-2221","","10.1109/TAP.2019.2948743","National Natural Science Foundation of China(grant numbers:61901321,61627901); ","https://ieeexplore.ieee.org/stamp/stamp.jsp?arnumber=8884639","5G NR application;dual-polarized;low-profile;patch antenna;single-ended antenna","Substrates;Antenna feeds;Gain;Patch antennas;Dipole antennas","","47","","17","IEEE","28 Oct 2019","","","IEEE","IEEE Journals"
"Reconfigurable Fresnel Lens Based on an Active Second-Order Bandpass Frequency-Selective Surface","H. Li; C. Ma; T. Zhou; J. Wang; D. Ye; Y. Sun; W. Zhu; T. A. Denidni; L. Ran","Laboratory of Applied Research on Electromagnetics (ARE), Zhejiang University, Hangzhou, China; Laboratory of Applied Research on Electromagnetics (ARE), Zhejiang University, Hangzhou, China; Laboratory of Applied Research on Electromagnetics (ARE), Zhejiang University, Hangzhou, China; Laboratory of Applied Research on Electromagnetics (ARE), Zhejiang University, Hangzhou, China; Laboratory of Applied Research on Electromagnetics (ARE), Zhejiang University, Hangzhou, China; Nanjing Institute of Electronic Equipment, Nanjing, China; Nanjing Institute of Electronic Equipment, Nanjing, China; National Institute of Scientific Research (INRS), Montreal, Canada; Laboratory of Applied Research on Electromagnetics (ARE), Zhejiang University, Hangzhou, China",IEEE Transactions on Antennas and Propagation,"5 May 2020","2020","68","5","4054","4059","In this communication, we experimentally demonstrate a frequency- and beam-reconfigurable lens antenna based on an active second-order bandpass frequency-selective surface (FSS). The FSS lens is composed of three nonresonant metallic layers separated by two thin dielectric substrates. By integrating microwave varactors in FSS unit cells, the center frequency of this bandpass FSS can be tuned from 4.0 to 5.8 GHz by a direct-current (dc) bias voltage. Based on this wideband tunability, the phase-correction technique is used to implement a microwave Fresnel lens. The experimental results show that the proposed 1-D lens antenna can achieve frequency-reconfigurable beam steering within a 1 GHz bandwidth. With advantages of low cost and concise structure, the proposed reconfigurable lens antenna can be potentially used in a wide range of applications.","1558-2221","","10.1109/TAP.2019.2948392","NSFC(grant numbers:61701437,61771421,51607168,61771422); China Postdoctoral Science Foundation(grant numbers:2017M611989); ","https://ieeexplore.ieee.org/stamp/stamp.jsp?arnumber=8883206","Active;beam steering;frequency-selective surface (FSS);Fresnel lens;reconfigurable antenna","Lenses;Frequency selective surfaces;Capacitance;Beam steering;Varactors;Phased arrays","","51","","29","IEEE","25 Oct 2019","","","IEEE","IEEE Journals"
"DRGH Antenna With Improved Gain and Beamwidth Performance","M. Gerber; J. W. Odendaal; J. Joubert","Centre for Electromagnetism, University of Pretoria, Pretoria, South Africa; Centre for Electromagnetism, University of Pretoria, Pretoria, South Africa; Centre for Electromagnetism, University of Pretoria, Pretoria, South Africa",IEEE Transactions on Antennas and Propagation,"5 May 2020","2020","68","5","4060","4065","Double-ridge guide horn (DRGH) antennas are widely used in antenna and EMC testing facilities as feed antennas and gain transfer standards. Increasing the low-frequency gain to obtain a more constant 3 and 10 dB beamwidth, over the operating frequency band of 1-18 GHz, will result in a more uniform illumination of the devices under test. In this communication, the ridge profiles of a conventional DRGH antenna with dimensions complying with the requirements of MIL-STD-461F are modified to produce a more constant beamwidth, especially from 3 GHz upward. The width of the ridges is tapered along the axial length of the DRGH to increase effective radiating aperture and reduce the beamwidth, at lower frequencies. An accurate numerical model was developed of the conventional 1-18 GHz DRGH antenna and modified ridges were implemented. The radiation properties of a prototype antenna were measured in a compact antenna range. Simulated and measured results are presented for the modified DRGH antenna.","1558-2221","","10.1109/TAP.2019.2948655","National Research Foundation (NRF) of South Africa(grant numbers:114941); ","https://ieeexplore.ieee.org/stamp/stamp.jsp?arnumber=8884647","Broadband ridged horn antennas;electromagnetic compatibility (EMC) measurements","Antenna measurements;Antenna radiation patterns;Apertures;Horn antennas;Broadband antennas;Gain","","9","","19","IEEE","28 Oct 2019","","","IEEE","IEEE Journals"
"Differentially Fed Dual-Circularly Polarized Antenna With Slow Wave Delay Lines","H. D. Li; X. Y. Du; J. Y. Yin; J. Ren; Y. Yin","National Key Laboratory of Antennas and Microwave Technology, Xidian University, Xi’an, China; National Key Laboratory of Antennas and Microwave Technology, Xidian University, Xi’an, China; School of Physics and Optoelectronic Engineering, Xidian University, Xi’an, China; National Key Laboratory of Antennas and Microwave Technology, Xidian University, Xi’an, China; National Key Laboratory of Antennas and Microwave Technology, Xidian University, Xi’an, China",IEEE Transactions on Antennas and Propagation,"5 May 2020","2020","68","5","4066","4071","A differentially fed dual-circularly polarized (CP) antenna using slow wave delay lines (SWDLs) is investigated in this communication. The antenna consists of two pairs of dipoles, one of which is fed by slow wave feedlines and the other is fed by coplanar striplines (CPSs). Based on the slow wave effect, a 90° phase difference can be realized between the two pairs of dipoles. To achieve dual-CP operation, two orthogonally placed differentially fed baluns are used to drive the feedlines. Subsequently, four parasitic loops are introduced, aiming to obtain high isolation over a wide operation band. Meanwhile, a metal reflector is loaded for unidirectional radiation. Finally, a prototype of the proposed antenna is fabricated and tested. The measurements indicate that the dual-CP antenna realized a port isolation of 38.4% (1.43–2.11 GHz) for  $\vert S_{\mathrm {dd21}}\vert < -15$  dB. Further, the measured −10 dB reflection coefficient bandwidth for the two ports is 1.36–2.40 GHz. Moreover, the dual-CP 3 dB axial ratio (AR) bandwidth is approximately 50.0% from 1.41 to 2.35 GHz. Owing to differential excitation, stable radiation patterns are obtained.","1558-2221","","10.1109/TAP.2019.2949706","National Natural Science Foundation of China(grant numbers:61801354,61901316); ","https://ieeexplore.ieee.org/stamp/stamp.jsp?arnumber=8889515","Differentially fed;dual-circularly polarized (CP);wideband port isolation;slow wave","Dipole antennas;Delay lines;Antenna measurements;Substrates;Bandwidth;Microstrip","","16","","30","IEEE","31 Oct 2019","","","IEEE","IEEE Journals"
"Reconfigurable Dual-Fed Horn With Pattern Switchability Realized by SIW Technology","S. Choudhury; A. Mohan; P. K. Mishra; D. Guha","Department of Electronics and Electrical Communication Engineering, IIT Kharagpur, Kharagpur, India; Department of Electronics and Electrical Communication Engineering, IIT Kharagpur, Kharagpur, India; Department of Space, Satellite Antenna Characterization, Test and Design Section of ISRO Satellite Center, Government of India, Bengaluru, India; Department of Electronics and Electrical Communication Engineering, IIT Kharagpur, Kharagpur, India",IEEE Transactions on Antennas and Propagation,"5 May 2020","2020","68","5","4072","4076","A novel multihorn antenna using the substrate integrated waveguide (SIW) technology is discussed in this communication. Conventional SIW-inspired horns, being the extensions of planar H-plane horn antennas, portray a fan-shaped beam, with a narrow H-plane and a wide E-plane radiation characteristics. The present design employs this feature to produce a crossed horn, in which both E- and H-plane radiations can be realized by individually exciting the two sectoral horns, while terminating the other port to a matched load. When both the ports are excited, a spot beam is realized, representing a pattern similar to that of a pyramidal horn. Such an antenna should find its potential applications in systems requiring radiation switchability/pattern diversity from a single embodiment.","1558-2221","","10.1109/TAP.2019.2949710","Indian Institute of Technology Kharagpur; CAS in Radio Physics and Electronics, University of Calcutta; ","https://ieeexplore.ieee.org/stamp/stamp.jsp?arnumber=8889464","Horn antenna;multihorn;pattern switchable horn;substrate integrated waveguide (SIW)-inspired horn","Antenna radiation patterns;Feeds;Horn antennas;Fans;Three-dimensional displays;Electric fields","","5","","17","IEEE","31 Oct 2019","","","IEEE","IEEE Journals"
