"Programmable Multifunctional Device Based on Spoof Surface Plasmon Polaritons","X. Gao; H. C. Zhang; L. W. Wu; Z. X. Wang; P. H. He; Z. Gao; T. J. Cui","State Key Laboratory of Millimeter Waves, Southeast University, Nanjing, China; State Key Laboratory of Millimeter Waves, Southeast University, Nanjing, China; State Key Laboratory of Millimeter Waves, Southeast University, Nanjing, China; State Key Laboratory of Millimeter Waves, Southeast University, Nanjing, China; State Key Laboratory of Millimeter Waves, Southeast University, Nanjing, China; Linbou Near Field Technology Company, Shenzhen, China; State Key Laboratory of Millimeter Waves, Southeast University, Nanjing, China",IEEE Transactions on Antennas and Propagation,"5 May 2020","2020","68","5","3770","3779","The spoof surface plasmon polariton (SPP) waveguide, which could support well-confined surface waves along an ultrathin corrugated metallic strip, is one of the most advantageous candidates in integrated circuits due to the remarkable properties of low crosstalk, low loss, and packaging minimization. Many devices based on the spoof SPP waveguide have emerged, but it is still a challenge to manipulate the SPP waves freely in real-time. Here, we propose a programmable multifunctional spoof SPP device by loading varactor diodes between adjacent metallic teeth of SPP waveguides. By programming the bias voltages of the varactor diodes dynamically, the coupling waves propagating on two SPP waveguides can be freely controlled. Simulations and experiments demonstrate that the programmable SPP device can realize high-efficiency SPP through transmission, unequal coupling, 3 dB direction coupling, and crossover transmission with better isolation effect. Different functions and operational frequency ranges can be reconfigured in real-time. The proposed method lays the groundwork for applications in large-scale microwave integrated circuits and digital communication systems.","1558-2221","","10.1109/TAP.2020.2969745","National Natural Science Foundation of China(grant numbers:61735010,61731010,61871127,61890544,61801117,61722106,61701107,61701108,61631007); National Basic Research Program of China (973 Program)(grant numbers:2017YFA0700201,2017YFA0700202,2017YFA0700203); Higher Education Discipline Innovation Project(grant numbers:111-2-05); Fund for International Cooperation and Exchange of the National Natural Science Foundation of China(grant numbers:61761136007); ","https://ieeexplore.ieee.org/stamp/stamp.jsp?arnumber=8979266","A programmable multifunctional device;spoof surface plasmon polaritons (SPPs);the digital communication system","Couplings;Varactors;Capacitance;Dispersion;Surface waves;Real-time systems;Plasmons","","39","","45","IEEE","3 Feb 2020","","","IEEE","IEEE Journals"
"A Generalized Accurate Model for Complementary Periodic Subwavelength Metasurface Based on Babinet Principle","X. Liu; J. Zhang; X. Chen; Z. H. Jiang; A. Zhang","School of Electronic and Information Engineering, Xi’an Jiaotong University, Xi’an, China; School of Electronic and Information Engineering, Xi’an Jiaotong University, Xi’an, China; School of Electronic and Information Engineering, Xi’an Jiaotong University, Xi’an, China; State Key Laboratory of Millimeter Waves, School of Information Science and Engineering, Southeast University, Nanjing, China; School of Electronic and Information Engineering, Xi’an Jiaotong University, Xi’an, China",IEEE Transactions on Antennas and Propagation,"5 May 2020","2020","68","5","3780","3790","In this article, the Babinet principle is applied for complementary periodic sub wavelength metallic elements Ae and Ac at the interface between different substrates. For the problem, the restriction of the Babinet principle is mainly resulted from the inhomogeneity of the different substrates or the anisotropy of the metallic elements. In order to break the restriction, a virtual substrate with an effective permittivity is inserted into the interface to cover Ae and Ac as an updated physical boundary condition. As the thickness of such a virtual effective substrate layer approaches zero, the updated model will not only remain the same as the original one for Ae and Ac but also can be solved by the existing Babinet principle with a feasible mathematical method. Finally, according to the network transmission theory and Babinet principle, the proposed theory gives the specific mathematical relationship between the tangential transmission matrices of Ae and Ac. Two examples are simulated to verify the theory, regardless of the substrate, metallic elements, and incidence angle. This method not only greatly simplifies the solutions of complementary metasurfaces but also shows higher precision than the previous work.","1558-2221","","10.1109/TAP.2020.2969850","National Natural Science Foundation of China(grant numbers:61471292,61331005,61801366); ","https://ieeexplore.ieee.org/stamp/stamp.jsp?arnumber=8979280","Babinet principle;complementary periodic subwavelength metallic elements;effective permittivity;tangential transmission matrices","Substrates;Permittivity;Mathematical model;Transmission lines;Transmission line matrix methods;Boundary conditions","","9","","40","IEEE","3 Feb 2020","","","IEEE","IEEE Journals"
"A Posteriori Error Estimation and Adaptive Discretization Refinement Using Adjoint Methods in CEM: A Study With a 1-D Higher Order FEM Scattering Example","C. Key; A. P. Smull; D. Estep; T. Butler; B. M. Notaroš","Department of Electrical and Computer Engineering, Colorado State University, Fort Collins, USA; Department of Electrical and Computer Engineering, Colorado State University, Fort Collins, USA; Department of Statistics, Colorado State University, Fort Collins, USA; Department of Mathematical and Statistical Sciences, University of Colorado Denver, Denver, USA; Department of Electrical and Computer Engineering, Colorado State University, Fort Collins, USA",IEEE Transactions on Antennas and Propagation,"5 May 2020","2020","68","5","3791","3806","This study investigates and evaluates applications of the adjoint problem and its solution in frequency-domain computational electromagnetics (CEM). The study establishes and validates adjoint-based applications including higher order parameter sampling, a posteriori error estimate evaluation, and p- and h-refinements. These applications can improve the efficiency, automation, and robustness of CEM methods. We employ a 1-D finite-element-method scattering solver, simplifying the implementation, replicability, clarity, and intuitiveness of analysis results and conclusions, which then extend naturally to higher dimensional solvers and more complicated CEM problems. While demonstrated with a higher order solver, the derived techniques apply to low-order methodology as well. This is the first demonstration of the applicability of adjoint-based a posteriori error estimation techniques to adaptive discretization refinement in frequency-domain CEM with arbitrary-order basis functions. This work introduces the application of dual-weighted residual error estimation and selective adaptivity based on error cancellation. The proposed targeted, adaptive mesh/model p- and/or h-refinement heuristics informed by adjoint element-wise error contribution estimates show near-monotonic reduction of the quantity-of-interest error with increased numbers of refined elements. In general, adjoint techniques are underutilized in CEM, and another goal of this work is to promote their future use for refinement, optimization, and uncertainty quantification.","1558-2221","","10.1109/TAP.2020.2976657","US Air Force Research Laboratory, CREATE SENTRi, Riverside Research Institute(grant numbers:FA8650-14-D-1725(6F1957)); ","https://ieeexplore.ieee.org/stamp/stamp.jsp?arnumber=9024234","A posteriori error estimation;adaptive mesh refinement;adjoint methods;computational electromagnetics (CEM);element-wise error contribution estimates;finite-element method (FEM);h-refinement;higher order parameter sampling (HOPS);higher order techniques;optimization;p-refinement;uncertainty quantification","Finite element analysis;Optimization;Error analysis;Computational modeling;Frequency-domain analysis;Method of moments;Scattering","","11","","45","IEEE","4 Mar 2020","","","IEEE","IEEE Journals"
"Surface Integral Equation Method for Generalized Soft-and-Hard Boundary Condition","B. Kong; P. Ylä-Oijala; A. Sihvola","Department of Electronics and Nanoengineering, Aalto University, Espoo, Finland; Department of Electronics and Nanoengineering, Aalto University, Espoo, Finland; Department of Electronics and Nanoengineering, Aalto University, Espoo, Finland",IEEE Transactions on Antennas and Propagation,"5 May 2020","2020","68","5","3807","3814","A surface integral equation (SIE) method is developed for analyzing electromagnetic scattering by objects with generalized soft-and-hard (GSH) boundary conditions. GSH boundary condition is an anisotropic impedance boundary condition, which limits the tangential electric and magnetic fields in specified directions. In the developed SIE formulation, the GSH boundary condition is expressed in a vector form with two sets of orthogonal vectors, which can be combined with the field integral equations. The resulting equation can be discretized with the standard method of moments (MoM) using triangular elements and the Rao-Wilton-Glisson (RWG) functions. By varying the GSH condition, the direction of the tangential electric and magnetic fields on the surface can be flexibly changed.","1558-2221","","10.1109/TAP.2019.2963587","","https://ieeexplore.ieee.org/stamp/stamp.jsp?arnumber=8952910","Boundary conditions;electromagnetic scattering;generalized soft-and-hard (GSH) boundary;surface integral equation (SIE)","Boundary conditions;Surface impedance;Perpendicular magnetic anisotropy;Impedance;Integral equations;Surface waves","","4","","30","IEEE","8 Jan 2020","","","IEEE","IEEE Journals"
"Efficient Solution of Electromagnetic Scattering Problems Using Multilevel Adaptive Cross Approximation and LU Factorization","W. C. Gibson","Tripoint Industries, Inc., Huntsville, USA",IEEE Transactions on Antennas and Propagation,"5 May 2020","2020","68","5","3815","3823","The multilevel adaptive cross approximation (MLACA), previously described in the literature, extends the single-level ACA with a recursive multilevel algorithm that significantly improves compression of off-diagonal matrix blocks resulting from electromagnetic integral equations (IE) discretized via the method of moments (MoM). In this article, the MLACA approach is extended and applied to a direct solution of the MoM matrix system via LU factorization. It will be shown through numerical experiments that the off-diagonal LU blocks are also compressible using MLACA, yielding a compression rate superior to the single-level ACA and a memory complexity of O(N4/3 log N). In addition, the MLACA LU block updates are performed in rank-reduced form, yielding a very efficient software implementation via a Level 3 BLAS optimized for the CPU or GPU.","1558-2221","","10.1109/TAP.2019.2963619","","https://ieeexplore.ieee.org/stamp/stamp.jsp?arnumber=8952869","Adaptive cross approximation (ACA);electromagnetic scattering;fast integral equation methods;integral equations;matrix compression;method of moments (MoM)","Method of moments;Electromagnetic scattering;Graphics processing units;Integral equations;Matrix decomposition;Electromagnetics","","13","","24","IEEE","8 Jan 2020","","","IEEE","IEEE Journals"
"On the Use of Entire-Domain Basis Functions and Fast Factorizations for the Design of Modulated Metasurface","F. Vernì; M. Righero; G. Vecchi","Antenna and EMC Laboratory (LACE), Politecnico di Torino, Turin, Italy; Advanced Computing and Application, LINKS Foundation, Turin, Italy; Antenna and EMC Laboratory (LACE), Politecnico di Torino, Turin, Italy",IEEE Transactions on Antennas and Propagation,"5 May 2020","2020","68","5","3824","3833","Entire-domain, spectral basis functions (BFs) have witnessed recent interest in the integral-equation analysis of large metasurface (MS) antennas modeled via homogenized impedance boundary conditions. We present a formulation employing classical Galerkin test via Rao-Wilton-Glisson functions yet assembled to represent entire-domain div-conforming BFs for the shape of interest (e.g., circular/coaxial waveguide modes). On the one hand, the rationale is that entire-domain, spectral BFs afford a significant economy in the number of necessary unknowns; on the other hand, being expressed as combination of Rao-Wilton-Glisson functions, reaction integrals are computed with optimum cost via fast methods. This is applied to reduce the cost of the optimization process used to design MS antennas based on spatially modulated reactance profiles. The authors support the method proposed, presenting criteria to define the entire-domain functions, considering the overall numerical complexity in an optimization framework, and providing a convergence analysis and the numerical results for holographic leaky-wave antennas, relevant in the MS context.","1558-2221","","10.1109/TAP.2020.2966040","Italian Ministry of Education and Research (MIUR) under the Project Metasurface Antennas for Space Applications (MTSA)–PRIN 2017; ","https://ieeexplore.ieee.org/stamp/stamp.jsp?arnumber=8967245","Design optimization;integral equations (IEs);metasurfaces (MSs);method of moments (MoM)","Antennas;Method of moments;Optimization;Impedance;Surface impedance;Geometry","","12","","30","IEEE","23 Jan 2020","","","IEEE","IEEE Journals"
"Magnetic and Combined Field Integral Equations Based on the Quasi-Helmholtz Projectors","A. Merlini; Y. Beghein; K. Cools; E. Michielssen; F. P. Andriulli","Department of Electronics and Telecommunications, Politecnico di Torino, Turin, Italy; Department of Information Technology (INTEC), Ghent University, Ghent, Belgium; Department of Electrical Engineering, Delft University of Technology, Delf, The Netherlands; Department of Electrical Engineering and Computer Science, University of Michigan, Ann Arbor, USA; Department of Electronics and Telecommunications, Politecnico di Torino, Turin, Italy",IEEE Transactions on Antennas and Propagation,"5 May 2020","2020","68","5","3834","3846","Boundary integral equation methods for analyzing electromagnetic scattering phenomena typically suffer from several of the following shortcomings: 1) ill-conditioning when the frequency is low; 2) ill-conditioning when the discretization density is high; 3) ill-conditioning when the structure contains global loops (which are computationally expensive to detect); 4) incorrect solution at low frequencies due to a loss of significant digits; and 5) the presence of spurious resonances. In this article, quasi-Helmholtz projectors are leveraged to obtain magnetic field integral equation (MFIE) that is immune to drawbacks 1)-4). Moreover, when this new MFIE is combined with a regularized electric field integral equation (EFIE), a new quasi-Helmholtz projector-combined field integral equation (CFIE) is obtained that also is immune to 5). The numerical results corroborate the theory and show the practical impact of the newly proposed formulations.","1558-2221","","10.1109/TAP.2020.2964941","European Research Council (ERC) through the European Union’s Horizon 2020 Research and Innovation Program (ERC Project 321)(grant numbers:724846); ","https://ieeexplore.ieee.org/stamp/stamp.jsp?arnumber=8963862","Calderon strategies;electric;magnetic;combined field integral equations;preconditioning","Integral equations;Magnetic resonance;Geometry;Electric breakdown;Scattering;Frequency-domain analysis","","16","","56","IEEE","20 Jan 2020","","","IEEE","IEEE Journals"
"An Exponential-Based DGTD Method for Modeling 3-D Plasma-Surrounded Hypersonic Vehicles","H. Wang; L. Xu; B. Li; S. Descombes; S. Lanteri","National Key Laboratory of Science and Technology on Vacuum Electronics, School of Electronic Science and Engineering, University of Electronic Science and Technology of China, Chengdu, China; National Key Laboratory of Science and Technology on Vacuum Electronics, School of Electronic Science and Engineering, University of Electronic Science and Technology of China, Chengdu, China; National Key Laboratory of Science and Technology on Vacuum Electronics, School of Electronic Science and Engineering, University of Electronic Science and Technology of China, Chengdu, China; LJAD, CNRS, INRIA, Université Côte d’Azur, Sophia Antipolis, France; LJAD, CNRS, INRIA, Université Côte d’Azur, Sophia Antipolis, France",IEEE Transactions on Antennas and Propagation,"5 May 2020","2020","68","5","3847","3858","Plasma surrounding a hypersonic vehicle can lead to the absorption of incoming radar radiation or the interruption of communication. Therefore, the development of hypersonic vehicle relies on a clear understanding of the strong interaction between the surrounding plasma and the incident electromagnetic wave. However, because of the presence of complex geometrical features and heterogeneous media, these applications are often multiscale. The modeling of such applications in 3-D is extremely challenging for traditional numerical methods. In this work, an efficient discontinuous Galerkin time-domain (DGTD) method for the 3-D modeling of plasma-surrounded hypersonic vehicles is presented. To overcome the grid-induced stiffness problem arising from the modeling of such multiscale applications with dispersive media, and to improve the modeling efficiency, a high-order exponential-based time integration for the time-domain Maxwell's equations discretized by DG schemes with a general flux formulation is proposed. This time integration has excellent stability properties in the locally refined part of the mesh and hence enables the usage of larger time steps compared with the explicit time marching scheme. Additionally, the exponential-based time integration is developed to adapt an anisotropic perfectly matched layer for the modeling of open-domain problems. Finally, numerical experiments are presented to investigate the accuracy and convergence properties and to demonstrate the well-modeling capability of the proposed method.","1558-2221","","10.1109/TAP.2020.2963923","National Natural Science Foundation of China(grant numbers:61301054); ","https://ieeexplore.ieee.org/stamp/stamp.jsp?arnumber=8954924","3-D multiscale problems;discontinuous Galerkin time-domain (DGTD) method;dispersive media;exponential-based time integration;grid-induced stiffness;time-domain Maxwell’s equations","Plasmas;Media;Time-domain analysis;Mathematical model;Dispersion;Maxwell equations;Numerical models","","13","","47","IEEE","9 Jan 2020","","","IEEE","IEEE Journals"
"An Unconditionally Stable Single-Field Finite-Difference Time-Domain Method for the Solution of Maxwell Equations in Three Dimensions","M. Moradi; V. Nayyeri; O. M. Ramahi","School of Advanced Technologies, Iran University of Science and Technology, Tehran, Iran; School of Advanced Technologies, Iran University of Science and Technology, Tehran, Iran; Department of Electrical and Computer Engineering, University of Waterloo, Waterloo, Canada",IEEE Transactions on Antennas and Propagation,"5 May 2020","2020","68","5","3859","3868","The recently developed two-directional unconditionally stable single-field (US-SF) finite-difference time-domain (FDTD) method is generalized to a 3-D. The method is based on the application of the Crank-Nicolson scheme to only one of Maxwell curl equations which leads to an unconditionally stable finite-difference solution of the 3-D vector wave equation in the time domain. The method is designated as a single field because only the electric (or magnetic) field is updated in each time step. The implicit equations for each time step can be solved using a tridiagonal matrix algorithm without a need for matrix inversion. To achieve this, we introduced a new modified time-splitting scheme for the multilevel difference equations. Unlike the existing time-splitting method used to solve such equations which results in instability when dealing with inhomogeneous media, the presented method remains stable. As an important feature of the proposed US-SF-FDTD method, the updating of the three field components can be executed simultaneously (in parallel) by applying multithreading, thereby significantly reducing runtime. The unconditional stability of the proposed method is proved analytically. The accuracy and computational efficiency of the proposed method are demonstrated by providing numerical examples and by comparison to other FDTD methods and to the analytic solution when available.","1558-2221","","10.1109/TAP.2020.2975675","","https://ieeexplore.ieee.org/stamp/stamp.jsp?arnumber=9016359","Computational electromagnetics;Crank–Nicolson (CN) scheme;finite-difference time-domain (FDTD) method;Maxwell equations;partial differential equations;unconditional stability","Finite difference methods;Mathematical model;Time-domain analysis;Three-dimensional displays;Antennas;Propagation;Maxwell equations","","11","","38","IEEE","27 Feb 2020","","","IEEE","IEEE Journals"
"Modeling Equation for Multiple Knife-Edge Diffraction","S. A. Vavilov; M. S. Lytaev","Department of Economic Cybernetics, Saint Petersburg State University, Saint Petersburg, Russia; Bonch-Bruevich Saint Petersburg State University of Telecommunication, Saint Petersburg, Russia",IEEE Transactions on Antennas and Propagation,"5 May 2020","2020","68","5","3869","3877","This article is devoted to the canonical problem of the radio-wave propagation in the presence of multiple knife-edges. The system of integral equations in a spectral domain for the scattered field is derived. On the basis of its solution diffraction and reflection effects spawned by the multiple knife-edges may be accurately modeled. The electromagnetic field is generated by a source of the monochromatic radio waves with an arbitrary beam pattern. The efficient numerical solution to the proposed equation is given. The comparison with the two-way parabolic equation (PE) method, the uniform theory of diffraction (UTD) method, and the finite element method (FEM) is presented.","1558-2221","","10.1109/TAP.2019.2957085","","https://ieeexplore.ieee.org/stamp/stamp.jsp?arnumber=8930622","Diffraction;electromagnetic propagation;Helmholtz equations;integral equations","Mathematical model;Diffraction;Refractive index;Integral equations;Antennas;Scattering","","14","","28","IEEE","10 Dec 2019","","","IEEE","IEEE Journals"
"Modeling Microwave Propagation in Natural Caves Using LiDAR and Ray Tracing","M. D. Bedford; A. Hrovat; G. Kennedy; T. Javornik; P. Foster","Camborne School of Mines, University of Exeter, Penryn, U.K.; Jozef Stefan Institute, Ljubljana, Slovenia; Department of Natural Resources, Simtars, Redbank, Australia; Jozef Stefan Institute, Ljubljana, Slovenia; Camborne School of Mines, University of Exeter, Penryn, U.K.",IEEE Transactions on Antennas and Propagation,"5 May 2020","2020","68","5","3878","3888","Limited work has previously been conducted into microwave communication in natural caves, and although modal analysis has given acceptable results in some cave passages, multiple bends and highly irregular passages remained problematic. Recent advances in rapid capture laser scanning technology have permitted accurate 3-D models of cave passages to be created, prompting this article into modeling by ray tracing. Issues of model simplification and handling of roughness have been studied. The technique has been used in several cave passages-one in which modeling by modal analysis was especially unsuccessful-at three frequencies and the experimental results are obtained. Acceptable correlation was demonstrated despite the difficulty in accurately measuring or estimating average roughness.","1558-2221","","10.1109/TAP.2019.2957969","","https://ieeexplore.ieee.org/stamp/stamp.jsp?arnumber=8931265","Electromagnetic propagation;LiDAR;microwave propagation;ray tracing;underground electro- magnetic propagation","Ray tracing;Three-dimensional displays;Solid modeling;Software;Adaptation models;Laser radar;Modal analysis","","10","","27","IEEE","11 Dec 2019","","","IEEE","IEEE Journals"
