"Broadband Spin-Decoupled Metasurface for Dual-Circularly Polarized Reflector Antenna Design","W. -L. Guo; G. -M. Wang; W. -Y. Ji; Y. -L. Zheng; K. Chen; Y. Feng","School of Electronic Science and Engineering, Nanjing University, Nanjing, China; Air and Missile Defense College, Air Force Engineering University, Xi’an, China; Air and Missile Defense College, Air Force Engineering University, Xi’an, China; School of Electronic Science and Engineering, Nanjing University, Nanjing, China; School of Electronic Science and Engineering, Nanjing University, Nanjing, China; School of Electronic Science and Engineering, Nanjing University, Nanjing, China",IEEE Transactions on Antennas and Propagation,"5 May 2020","2020","68","5","3534","3543","In this article, we theoretically and experimentally demonstrate a single-layered spin-decoupled metasurface and its application to a dual-circularly polarized reflector antenna. A developed method is first analyzed to guide the design of broadband spin-decoupled metasurface. Then, a quasi-I-shaped meta-atom, which exhibits a phase coverage of 2π and high cross-polarization conversion efficiency within 12-21 GHz, is accordingly designed to actualize spin-decoupled phase change by simultaneously tuning the structural parameters and self-rotation of the element. To illustrate the independent phase control of orthogonal spins, a dual-circularly polarized multiplexing reflector antenna is designed with offset configuration. The experimentally measured results of the assembled reflector antenna are in good agreement with the simulated ones, showing a peak gain of 29.5 and 29.6 dBic, peak aperture efficiency (AE) of 53% and 54%, 3 dB gain bandwidth (BW) of 13.2-20.2 GHz (41.9%) and 13.4-20.2 GHz (40.5%), and 3 dB axial ratio (AR) BW of 11.8-21 GHz (56.1%) and 11.5-22 GHz (62.7%) for left-hand circular polarization (LHCP) and right-hand circular polarization (RHCP) radiations, respectively. The design strategy and the well-performed multiplexing reflector antenna may have promising perspective in many practical applications, for example, satellite communication system and long-distance wireless communication system.","1558-2221","","10.1109/TAP.2020.2963945","National Natural Science Foundation of China(grant numbers:61671231,61871394); National Basic Research Program of China (973 Program)(grant numbers:2017YFA0700201); ","https://ieeexplore.ieee.org/stamp/stamp.jsp?arnumber=8954906","Broadband;circularly polarized;multiplexing;reflector antenna;spin-decoupled metasurface","Broadband antennas;Broadband communication;Multiplexing;Geometry;Polarization;Satellite antennas","","85","","40","IEEE","9 Jan 2020","","","IEEE","IEEE Journals"
"S-Parameter-Based Theoretical Analysis of a Matching Network for Generic Multiport Antennas","P. Vilner; E. Cohen","Technion—Israel Institute of Technology, Haifa, Israel; Technion—Israel Institute of Technology, Haifa, Israel",IEEE Transactions on Antennas and Propagation,"5 May 2020","2020","68","5","3544","3556","This article describes a general method for finding an S-parameter of a matching network converting between arbitrary passive reciprocal multiport electrical circuits with the same amount of ports. In particular, the application to multiport antennas is explored. A quality of the matching is shown on a simulated 73 GHz 16-element 0.4λ-spaced bow-tie linear array, with its matched optimum realized gain achieving the theoretical maximum of the optimal gain over the [-π/2, π/2] scanning arc and showing a 5 dB improvement over the unmatched case. Degrees of freedom describing different matching network's realizations with the proposed method are enumerated, and their utilization for the transmitter amplifiers back-off reduction are presented. A fitness of the obtained matching network S-parameter for the conversion into a physical design is explored, and a practical method of obtaining a robust, feasibly realizable solution is given. The proposed network is estimated to require a quality factor 100 or better and demonstrates the useful bandwidth of 2 GHz and a good performance even with the coupling compensation reduced only to the neighboring ports.","1558-2221","","10.1109/TAP.2019.2955148","","https://ieeexplore.ieee.org/stamp/stamp.jsp?arnumber=8917916","Antenna arrays;impedance matching;linear circuits;scattering parameters","Antennas","","2","","16","IEEE","28 Nov 2019","","","IEEE","IEEE Journals"
"Multiple Beam Synthesis of Passively Cooled 5G Planar Arrays Using Convex Optimization","Y. Aslan; J. Puskely; A. Roederer; A. Yarovoy","Department of Microelectronics, Microwave Sensing Signals and Systems Group, Delft University of Technology, Delft, The Netherlands; Department of Microelectronics, Microwave Sensing Signals and Systems Group, Delft University of Technology, Delft, The Netherlands; Department of Microelectronics, Microwave Sensing Signals and Systems Group, Delft University of Technology, Delft, The Netherlands; Department of Microelectronics, Microwave Sensing Signals and Systems Group, Delft University of Technology, Delft, The Netherlands",IEEE Transactions on Antennas and Propagation,"5 May 2020","2020","68","5","3557","3566","An extended-feature, system-driven convex algorithm for the synthesis of uniform-amplitude, irregular planar phased arrays with simultaneous multi-beam optimization for mm-wave 5G base station applications in multi-user scenarios is presented. The inter-user interferences are suppressed by minimizing the maximum sidelobe level (SLL) for a beam scanned freely inside a given sector. The aperture size is restricted to the size of the heatsink baseplate dimensions. A minimum guaranteed inter-element spacing in the final layout is pre-defined, which prevents element overlapping, eases the thermal problem and helps reduce the effects of high mutual coupling (MC). The algorithm performance is tested via the synthesis of a 64-element integrated array with at least half a wavelength inter-element spacing. The optimized array results show that, compared to their regular counterparts, significant reduction in the SLLs is achieved for a beam scanned inside the defined sector, while keeping the maximum temperature of the array at a reliable level. The effect of MC on the results is also investigated via full-wave simulations and it is explained how embedded element patterns can potentially be included in the optimization. Superior capabilities of the proposed method are illustrated by comparing the algorithm output to those reported in the state-of-the-art literature.","1558-2221","","10.1109/TAP.2019.2955885","Netherlands Organisation for Scientific Research (NWO); NXP Semiconductors in the framework of the program on Advanced 5G Solutions—Antenna Topologies and Front-end Configurations for Multiple Beam Generation; ","https://ieeexplore.ieee.org/stamp/stamp.jsp?arnumber=8928955","Antenna synthesis;convex optimization;fifth generation (5G);irregular antenna array;multibeam optimization (MBO);passive cooling;space tapering","5G mobile communication;Optimization;Cooling;Heating systems;Phased arrays;Topology","","45","","40","IEEE","8 Dec 2019","","","IEEE","IEEE Journals"
"Conformal Near-Field Focus Radiation From Phased Array of Antennas to Enhance Power Transfer Between Transmitting and Receiving Antennas","H. -T. Chou","Graduate Institute of Communication Engineering, National Taiwan University, Taipei, Taiwan",IEEE Transactions on Antennas and Propagation,"5 May 2020","2020","68","5","3567","3577","In this article, the concept of conformal near-field focus (CNFF) radiation from a phased array of antennas is theoretically presented. The motivation intends to enhance the electromagnetic (EM) power reception by receiving antennas (RXAs) of relatively large sizes. Instead of enforcing an equal-phase radiation focusing at a single NFF point, which loses the freedom of phase control, the CNFF concept considers the wavefront of RXA radiation to design a CNFF antenna (CNFFA) for better power transfer. Its radiation produces a proper phase distribution in a customized fashion, which is conformal to the wavefront of selected RXA's radiation in the near-zone. The development considers power transfer between the CNFFA and RXA by defining a convenient power reaction factor (PRF) on the reaction equation, which naturally constructs a relationship between the CNFFA's excitations and an RXA. The intention to maximize the PRF in the reaction equation results in the conformal radiation characteristics of the CNFFA. In this study, the concept and design guidelines are presented, which are validated via theoretical and numerical simulations of practical examples. This concept is particularly useful for wireless power transfer at high frequencies where geometric optic (GO) interpretation of wave propagation is valid.","1558-2221","","10.1109/TAP.2019.2963557","Ministry of Science and Technology(grant numbers:MOST-107-2218-E-002-050); National Taiwan University, Taiwan(grant numbers:108L893702); ","https://ieeexplore.ieee.org/stamp/stamp.jsp?arnumber=8952897","Conformal antenna radiation;near-field focus (NFF) communication;phased array of antennas;reaction theorem;wireless power transfer","Phased arrays;Antenna radiation patterns;Receiving antennas;Transmitting antennas;Wireless power transfer;Electromagnetic propagation;Numerical analysis","","17","","43","IEEE","8 Jan 2020","","","IEEE","IEEE Journals"
"A Dual-Polarized Magnetoelectric Dipole Array Based on Printed Ridge Gap Waveguide With Dual-Polarized Split-Ring Resonator Lens","A. Dadgarpour; N. Bayat-Makou; M. A. Antoniades; A. A. Kishk; A. Sebak","Department of Electrical and Computer Engineering, Concordia University, Montreal, Canada; The Edward S. Rogers Sr., University of Toronto, Toronto, Canada; Department of Electrical, Computer, and Biomedical Engineering, Ryerson University, Toronto, Canada; Department of Electrical and Computer Engineering, Concordia University, Montreal, Canada; Department of Electrical and Computer Engineering, Concordia University, Montreal, Canada",IEEE Transactions on Antennas and Propagation,"5 May 2020","2020","68","5","3578","3585","In this article, a 1x4 dual-polarized magnetoelectric (ME) dipole antenna array is proposed. The antenna is excited by a dual-polarized fork-shaped microstrip line based on printed ridge gap waveguide technology. To achieve additional gain, a dual-polarized split-ring resonator (SRR) is designed, which has a mu-near zero (MNZ) feature. This scatterer works as a meta-lens to convert the radiated spherical wave to a plane wave for both polarizations. Integrating four layers of the proposed inclusions on top of the ME dipole antenna results in an increase in the antenna gain by a maximum of 3 dB. The proposed 1 x 4 antenna array was fabricated and tested, and the measured reflection coefficient at Port 1 is less than -10 dB over the frequency band of 28-35 GHz, while the measured realized gain varies from 14.3 to 15.4 dBi, and the measured radiation efficiency varies from 78% to 88%. The measured reflection coefficient at Port 2 for the orthogonal polarization is less than -8 dB over the frequency band of 28-35 GHz, with a measured gain of 14.8-16 dBi, and the measured radiation efficiency varies from 81% to 90%.","1558-2221","","10.1109/TAP.2020.2964940","","https://ieeexplore.ieee.org/stamp/stamp.jsp?arnumber=8959357","5G networks;dual-polarized high-gain antenna arrays;dual-polarized magnetoelectric (ME) dipole antenna;high efficiency;millimeter-wave antennas;printed ridge gap waveguide (PRGW) technology","Dipole antennas;Antenna arrays;Gain;Antenna measurements;Broadband antennas;Gain measurement;Slot antennas","","47","","18","IEEE","14 Jan 2020","","","IEEE","IEEE Journals"
"Low-Profile Circularly Polarized Transmitarray for Wide-Angle Beam Control With a Third-Order Meta-FSS","F. Zhang; G. -M. Yang; Y. -Q. Jin","Key Laboratory for Information Science of Electromagnetic Waves, School of Information Science and Technology, Fudan University, Shanghai, China; Key Laboratory for Information Science of Electromagnetic Waves, School of Information Science and Technology, Fudan University, Shanghai, China; Key Laboratory for Information Science of Electromagnetic Waves, School of Information Science and Technology, Fudan University, Shanghai, China",IEEE Transactions on Antennas and Propagation,"5 May 2020","2020","68","5","3586","3597","In this article, we develop a low-profile high-gain transmitarray antenna (TA) with a meta-frequency-selective surface (FSS) operating in the  $X$ -band. The employed meta-FSS element is designed to realize a third-order bandpass filter, which has a high transmission and wide angular stability. A phase difference of 180° can be introduced between the two orthogonal directions with optimized parameters. Based on element rotation theory, the meta-FSS elements are arranged with the desired rotation angles to convert the incident quasi-spherical wave to the outgoing plane wave with the reverse polarization, e.g., a left-hand circularly polarized (LHCP) wave to a right-hand circularly polarized (RHCP) wave. To experimentally validate the focusing ability and wide-angle beam control ability of the proposed structure, principle prototypes are designed, fabricated, and measured. The experimental results show that the full transmitarray can achieve a 1 dB gain bandwidth of 13.0%, an aperture efficiency of 40.2%, and a 3 dB axial ratio bandwidth of 24.0% in the broadside direction. In addition, good circular polarization radiation performance can be successfully realized with the proposed structure at beam tilt angles from  $\theta = 0^{\circ }$  to 60°.","1558-2221","","10.1109/TAP.2020.2964957","National Basic Research Program of China (973 Program)(grant numbers:2017YFA0700203); National Science Foundation of China(grant numbers:61571130,U1637213); ","https://ieeexplore.ieee.org/stamp/stamp.jsp?arnumber=8959425","Beam control;circularly polarized;frequency-selective surface (FSS);transmitarray antenna (TA)","Bandwidth;Gain;Frequency selective surfaces;Transmitting antennas;Polarization;Apertures;Propagation losses","","44","","37","IEEE","14 Jan 2020","","","IEEE","IEEE Journals"
"Modular Design of Hexagonal Phased Arrays Through Diamond Tiles","P. Rocca; N. Anselmi; A. Polo; A. Massa","ELEDIA@UniTN (DISI—University of Trento), Trento, Italy; ELEDIA@UniTN (DISI—University of Trento), Trento, Italy; ELEDIA@UniTN (DISI—University of Trento), Trento, Italy; ELEDIA@UniTN (DISI—University of Trento), Trento, Italy",IEEE Transactions on Antennas and Propagation,"6 May 2020","2020","68","5","3598","3612","The modular design of planar phased array antennas with hexagonal apertures is addressed by means of innovative diamond-shaped tiling techniques. Both tiling configuration and subarray coefficients are optimized to fit user-defined power-mask constraints on the radiation pattern. Toward this end, suitable surface-tiling mathematical theorems are customized to the problem at hand to guarantee optimal performance in case of low/medium-size arrays, while the computationally hard tiling of large arrays is yielded thanks to an effective integer-coded GA-based exploration of the arising high-cardinality solution spaces. By considering ideal as well as real array models, a set of representative benchmark problems is dealt with to assess the effectiveness of the proposed architectures and tiling strategies. Moreover, comparisons with alternative tiling architectures are also performed to show to the interested readers the advantages and the potentialities of the diamond subarraying of hexagonal apertures.","1558-2221","","10.1109/TAP.2019.2963561","Italian Ministry of Foreign Affairs and International Cooperation, Directorate General for Cultural and Economic Promotion and Innovation within the SNATCH Project (2017–2019); Italian Ministry of Education, University, and Research within the program “Smart cities and communities and Social Innovation” (CUP: E44G14000060008) for the Project “WATERTECH - Smart Community per lo Sviluppo e l’Applicazione di Tecnologie di Monitoraggio Innovative per le Reti di Distribuzione Idrica negli usi idropotabili ed agricoli”(grant numbers:SCN_00489); Program PRIN2017 (CUP: E64I19002530001) for the Project “CYBER-PHYSICAL ELECTROMAGNETIC VISION: Context-Aware Electromagnetic Sensing and Smart Reaction (EMvisioning)”(grant numbers:2017HZJXSZ); ","https://ieeexplore.ieee.org/stamp/stamp.jsp?arnumber=8952887","Diamond tiles;hexagonal array;irregular tiling;optimization;phased array antenna;planar array","Phased arrays;Apertures;Shape;Diamond;Lattices;Optimization","","43","","47","IEEE","8 Jan 2020","","","IEEE","IEEE Journals"
"Folded Reflectarray With Spherical Polarizer","A. Freni; A. Mazzinghi; G. Carluccio","Department of Information Engineering, University of Florence, Florence, Italy; Department of Information Engineering, University of Florence, Florence, Italy; NXP Semiconductors, Eindhoven, The Netherlands",IEEE Transactions on Antennas and Propagation,"5 May 2020","2020","68","5","3613","3624","This article concerns a novel solution for folded reflectarray antennas which makes use of a curved (spherical) polarizer. The proposed solution provides a high gain and stable performances on a large bandwidth. A gridded substrate is also employed to minimize the dielectric losses in each reflectarray element, allowing the use of low-cost dielectric materials. Furthermore, 3-D printing technology has been used to manufacture both the polarizer and the reflectarray substrate. A linearly polarized, 28 dBi gain, Ku-band, entirely plastic prototype has been designed, manufactured, and tested. Measurements confirm the feasibility of the proposed solution and show its good performances (54% aperture efficiency and 1 dB down gain bandwidth of about 17%).","1558-2221","","10.1109/TAP.2020.2963920","EU Seventh Framework Programme through the Project “moBile, Autonomous and Affordable System to Increase safetY in Large unpredIctable environmentS (BASYLIS)”(grant numbers:261786); ","https://ieeexplore.ieee.org/stamp/stamp.jsp?arnumber=8954938","3-D printing;antenna arrays;folded reflectarrays;reflectarrays","Gain;Bandwidth;Apertures;Radar antennas;Plastics;Substrates","","19","","41","IEEE","9 Jan 2020","","","IEEE","IEEE Journals"
"Transmit Beamforming Based on 4-D Antenna Arrays for Low Probability of Intercept Systems","K. Chen; S. Yang; Y. Chen; S. -W. Qu; J. Hu","School of Electronic Science and Engineering, University of Electronic Science and Technology of China (UESTC), Chengdu, China; School of Electronic Science and Engineering, University of Electronic Science and Technology of China (UESTC), Chengdu, China; School of Electronic Science and Engineering, University of Electronic Science and Technology of China (UESTC), Chengdu, China; School of Electronic Science and Engineering, University of Electronic Science and Technology of China (UESTC), Chengdu, China; School of Electronic Science and Engineering, University of Electronic Science and Technology of China (UESTC), Chengdu, China",IEEE Transactions on Antennas and Propagation,"5 May 2020","2020","68","5","3625","3634","This article has developed a new approach to combine transmit beamforming techniques and 4-D antenna array theory for simultaneously improving the detection and low probability of intercept (LPI) capabilities of radar. This new approach enjoys most of the advantages of multiple-input multiple-output (MIMO) and phased arrays, providing excellent detection and LPI capabilities. The essence of the proposed approach is to utilize a 4-D variable to extend the detection dimension and increase the signal uncertainty. Specifically, the flexible choices of a time-modulation scheme can greatly improve the detection and LPI capabilities of radar. The substantial improvements achieved by the proposed method compared with basic MIMO and phased-MIMO arrays are demonstrated by simulations through analyzing the corresponding beampatterns. In addition, a basic experiment with reference to transmit beampatterns of 4-D antenna arrays is presented to validate the effectiveness of the proposed method.","1558-2221","","10.1109/TAP.2019.2963593","National Natural Science Foundation of China(grant numbers:61631006,61721001,61571101); ","https://ieeexplore.ieee.org/stamp/stamp.jsp?arnumber=8952909","Antenna arrays;low probability of intercept (LPI);multiple-input multiple-output (MIMO);time modulation;transmit beamforming","Switches;Transmitting antennas;Radar detection;Phased arrays;Amplitude modulation","","20","","33","IEEE","8 Jan 2020","","","IEEE","IEEE Journals"
"Wide-Angle Scanning Lens Fed by Small-Scale Antenna Array for 5G in Millimeter-Wave Band","Z. Qu; S. -W. Qu; Z. Zhang; S. Yang; C. H. Chan","School of Electronic Science and Engineering, University of Electronic Science and Technology of China (UESTC), Chengdu, China; School of Electronic Science and Engineering, University of Electronic Science and Technology of China (UESTC), Chengdu, China; School of Electronic Science and Engineering, University of Electronic Science and Technology of China (UESTC), Chengdu, China; School of Electronic Science and Engineering, University of Electronic Science and Technology of China (UESTC), Chengdu, China; Department of Electronic Engineering, State Key Laboratory of Terahertz and Millimeter Waves, City University of Hong Kong, Hong Kong",IEEE Transactions on Antennas and Propagation,"5 May 2020","2020","68","5","3635","3643","This article aims at high-gain and wide-angle scanning lens antenna design in millimeter-wave (MMW) band. The proposed antenna consists of a novel gradient-index (GRIN) lens and a phased array antenna (PAA) feed with aperture-coupled microstrip antenna (ACMA) elements. A new design methodology of the GRIN lens antenna is proposed, which comprises a preliminary design for rough shapes of GRIN lenses and two successive optimization steps. In the first optimization step, parameters of the GRIN lens are determined to achieve high directivity and wide scanning angle based on particle swarm optimization (PSO) algorithm and a quasi-2-D model. In the second step, the excitation coefficients of all elements for beam-steering purpose are obtained by the PSO algorithm with the goal of maximum directivity. To validate the approach, an MMW lens antenna, operating at 28 GHz, is numerically demonstrated with high directivity and a wide scanning range up to ±58°. Finally, the proposed antenna is fabricated by 3-D printing techniques. The measured results are in acceptable agreement with simulations.","1558-2221","","10.1109/TAP.2020.2967086","Natural Science Foundation of China Project(grant numbers:61622104,61721001); ","https://ieeexplore.ieee.org/stamp/stamp.jsp?arnumber=8966609","Array feed;gradient-index lens;millimeter-wave antenna;optimization;wide beam scanning","Lenses;Antenna feeds;Phased arrays;Solid modeling","","50","","31","IEEE","22 Jan 2020","","","IEEE","IEEE Journals"
"Wideband RCS Reduction of a Slot Array Antenna Using a Hybrid Metasurface","Y. Liu; Y. Jia; W. Zhang; F. Li","Science and Technology on Antenna and Microwave Laboratory, Xidian University, Xi’an, China; Science and Technology on Antenna and Microwave Laboratory, Xidian University, Xi’an, China; Science and Technology on Antenna and Microwave Laboratory, Xidian University, Xi’an, China; Antenna and RF Specialist Department, 20th Research Institute of China Electronics Technology Group Corporation, Xi’an, China",IEEE Transactions on Antennas and Propagation,"5 May 2020","2020","68","5","3644","3652","A slot array antenna integrated with a hybrid metasurface (HM) for wideband monostatic and bistatic radar cross section (RCS) reduction is proposed in this article. The HM consists of an anisotropic frequency-selective absorber (AFSA) and a polarization rotation reflective surface (PRRS). The proposed AFSA absorbs the electromagnetic wave for one polarization while letting the cross-polarized wave pass through. When putting the PRRS under AFSA, the cross-polarized wave will be reflected by the PRRS with 90° polarization rotation and then the reflected wave will be absorbed by AFSA. Thus, both the co-polarized and cross-polarized incident waves are absorbed by HM. Because the incident energy is absorbed rather than reflected to the other directions, both the monostatic RCS and bistatic RCS are reduced in a wide frequency band. In addition, since the radiation wave emitted by the slot array antenna will not be reflected by the PRRS, the proposed antenna has a reasonable gain. The simulated results show that both the monostatic RCS and bistatic RCS of the proposed slot array antenna are significantly reduced in the frequency range from 6 to 18 GHz and the gain decreases about only 0.8 dB when compared with the reference antenna. The measured results are in good agreement with the simulated ones.","1558-2221","","10.1109/TAP.2019.2963575","National Natural Science Foundation of China(grant numbers:61801346,61871309); China Postdoctoral Science Foundation(grant numbers:2018M640953); ","https://ieeexplore.ieee.org/stamp/stamp.jsp?arnumber=8952881","Anisotropic frequency-selective absorber (AFSA);bistatic radar cross section (RCS);monostatic RCS;polarization rotation reflective surface (PRRS);RCS;slot array antenna","Antenna arrays;Slot antennas;Broadband antennas;Wideband;Antenna measurements;Surface waves","","95","","29","IEEE","8 Jan 2020","","","IEEE","IEEE Journals"
