"Introducing a Mixed-Mode Matrix for Investigation of Wireless Communication Related to Orbital Angular Momentum","W. Park; L. Wang; H. -D. Brüns; D. G. Kam; C. Schuster","Institute of Electromagnetic Theory, Hamburg University of Technology, Hamburg, Germany; Institute of Electromagnetic Theory, Hamburg University of Technology, Hamburg, Germany; Institute of Electromagnetic Theory, Hamburg University of Technology, Hamburg, Germany; Department of Electrical and Computer Engineering, Ajou University, Suwon, South Korea; Institute of Electromagnetic Theory, Hamburg University of Technology, Hamburg, Germany",IEEE Transactions on Antennas and Propagation,"5 Mar 2019","2019","67","3","1719","1728","This paper introduces a mixed-mode matrix representation of scattering parameters that is suitable for the investigation of wireless communication based on orbital angular momentum (OAM). For this purpose, a unitary transformation matrix is defined, which contains the transmitted and received amplitudes as basis vectors corresponding to OAM-based communication between two antenna arrays. The mixed-mode matrix is then obtained from the corresponding similarity transformation of the standard scattering matrix available, e.g., from numerical simulations or measurements. The mixed-mode matrix allows better physical insight into OAM-based communication by clearly separating all modes and is more efficient than postprocessing of single-antenna results in a system simulator. Mode conversion/isolation and proper mode termination can be easily quantified. Also, it allows generalizing the interpretation of OAM-based communication by focusing on the property of a constant phase difference within each antenna array. The usefulness of this approach is demonstrated using method of moments (MoM) simulations of dipole radiators in various arrangements of a transmitting and a receiving array. Systematic parameter studies that reveal dependencies of OAM-based communication are possible by using the mixed-mode matrix. As an application, communication patterns are studied, in order to obtain the suitable position and relative orientation in space for good mode isolation or communication.","1558-2221","","10.1109/TAP.2018.2889033","Alexander von Humboldt-Stiftung; ","https://ieeexplore.ieee.org/stamp/stamp.jsp?arnumber=8585088","Array antennas;method of moment (MoM);mixed-mode scattering parameter;orbital angular momentum (OAM);wireless communication","Antenna arrays;Scattering;Dipole antennas;Scattering parameters;Method of moments;Wireless communication","","32","","29","IEEE","21 Dec 2018","","","IEEE","IEEE Journals"
"Decoupled Potential Integral Equations for Electromagnetic Scattering From Dielectric Objects","J. Li; X. Fu; B. Shanker","Department of Electrical and Computer Engineering, Michigan State University, East Lansing, MI, USA; Department of Electrical and Computer Engineering, Michigan State University, East Lansing, MI, USA; Department of Physics and Astronomy, Michigan State University, East Lansing, MI, USA",IEEE Transactions on Antennas and Propagation,"5 Mar 2019","2019","67","3","1729","1739","Recent work on developing novel integral equation formulations has involved using potentials as opposed to fields as unknown variables. This is a consequence of additional flexibility offered by potentials that enable development of well-conditioned systems. Until recently, most of the work in this area focused on formulations for analysis of scattering perfectly conducting objects. In this paper, we present well-conditioned decoupled potential integral equations (DPIEs) formulated for electromagnetic scattering from homogeneous dielectric objects. The formulation is based on decoupled boundary conditions derived for scalar and vector potentials. The resulting DPIE is a second kind integral equation, and does not suffer from either low frequency or dense mesh breakdown. Analytical properties of the DPIE are studied for spherical systems, and results provided demonstrate well-conditioned nature (and bounded spectrum) of the resulting linear system.","1558-2221","","10.1109/TAP.2018.2883636","Michigan State University(grant numbers:NSF ECCS-1408115); ","https://ieeexplore.ieee.org/stamp/stamp.jsp?arnumber=8550720","Decoupled potential;dense-mesh breakdown;integral equation;low-frequency breakdown;transmission problem","Integral equations;Boundary conditions;Electric potential;Electric breakdown;Dielectrics;Electromagnetic scattering","","26","","38","IEEE","28 Nov 2018","","","IEEE","IEEE Journals"
"Scattering Analysis of Multiobject Electromagnetic Systems Using Stepwise Method of Moment","Y. Xu; H. Yang; R. Shen; L. Zhu; X. Huang","College of Electronic Science, National University of Defense Technology, Changsha, China; College of Electronic Science, National University of Defense Technology, Changsha, China; College of Electronic Science, National University of Defense Technology, Changsha, China; Xi’an Satellite Control Center, Xi’an, China; College of Electronic Science, National University of Defense Technology, Changsha, China",IEEE Transactions on Antennas and Propagation,"5 Mar 2019","2019","67","3","1740","1747","Stepwise method of moment is proposed to analyze scattering properties of multiobject electromagnetic systems. In this approach, the final current coefficients come from two parts: independent current coefficients and mutual coupling coefficients for each subblock. This approach avoids calculating the inverse matrix of dense impedance matrix by seeing each subblock as an independent element in the calculation of mutual coupling effects among different subblocks. This scheme greatly decreases memory cost of the approach and makes it have the ability to deal with large-scale multiobject problems. Finally, this approach is combined with an iterative process to further improve its accuracy.","1558-2221","","10.1109/TAP.2018.2883631","","https://ieeexplore.ieee.org/stamp/stamp.jsp?arnumber=8550737","Iteration;multiobject electromagnetic system;scattering analysis;stepwise method of moment (MoM)","Method of moments;Mutual coupling;Impedance;Mathematical model;Electromagnetic scattering;Sparse matrices","","6","","23","IEEE","28 Nov 2018","","","IEEE","IEEE Journals"
"Fast Solution of Electromagnetic Scattering for 3-D Inhomogeneous Anisotropic Objects Embedded in Layered Uniaxial Media by the BCGS-FFT Method","F. Han; J. Zhuo; N. Liu; Y. Liu; H. Liu; Q. H. Liu","Department of Electronic Science, Institute of Electromagnetics and Acoustics, Xiamen University, Xiamen, China; Department of Electronic Science, Institute of Electromagnetics and Acoustics, Xiamen University, Xiamen, China; Department of Electronic Science, Institute of Electromagnetics and Acoustics, Xiamen University, Xiamen, China; Global Big Data Technologies Centre, University of Technology Sydney, Ultimo, Australia; School of Civil Engineering, Guangzhou University, Guangzhou, China; Department of Electrical and Computer Engineering, Duke University, Durham, NC, USA",IEEE Transactions on Antennas and Propagation,"5 Mar 2019","2019","67","3","1748","1759","In this paper, the stabilized biconjugate gradient fast Fourier transform (BCGS-FFT) method is used to solve the electromagnetic scattering problem for 3-D inhomogeneous uniaxial anisotropic objects embedded in a layered uniaxial medium. The optical axis of the background medium is perpendicular to the layer boundaries. However, the optical axis of the scatterer can be rotated through any angles. The electric field integral equation (EFIE) is formulated in the layered uniaxial anisotropic background medium. The volumetric roof-top function is used for the basis function as well as the testing function. The dyadic Green's functions (DGFs) for both the electric field and the magnetic vector potential are used to solve the EFIE, and the results as well as the performance are compared. Several numerical simulations are carried out to validate the accuracy and efficiency of the proposed method. The major new contribution of this paper is to extend the BCGS-FFT method to accommodate the uniaxial anisotropy of the layered background medium. Therefore, the DGFs for the layered uniaxial medium are evaluated before solving the EFIE. In addition, the DGF for the electric field is also used to solve the 3-D scattering problem through BCGS-FFT iterations, which is different from the previous work.","1558-2221","","10.1109/TAP.2018.2883682","National Natural Science Foundation of China(grant numbers:41504120,41504111); Xiamen Science and Technology Development Funds of China(grant numbers:3502Z20173015); ","https://ieeexplore.ieee.org/stamp/stamp.jsp?arnumber=8550700","Dyadic Green’s functions (DGFs);electric field integral equation (EFIE);layered media;stabilized biconjugate gradient (BCGS);uniaxial anisotropic","Tensile stress;Nonhomogeneous media;Integral equations;Geometrical optics;Optical scattering;Magnetic anisotropy","","29","","42","IEEE","28 Nov 2018","","","IEEE","IEEE Journals"
"Efficient Spectral Domain MoM for the Design of Circularly Polarized Reflectarray Antennas Made of Split Rings","R. Florencio; R. R. Boix; J. A. Encinar","Department of Computer Science, Universidad de Alcalá de Henares, Alcalá de Henares, Spain; Microwaves Group, College of Physics, University of Seville, Seville, Spain; Department of Signals, Systems, and Radiocommunications, Universidad Politécnica de Madrid, Madrid, Spain",IEEE Transactions on Antennas and Propagation,"5 Mar 2019","2019","67","3","1760","1771","The method of moments (MoM) in the spectral domain is used for the analysis of the scattering of a plane wave by a multilayered periodic structure containing conducting concentric split rings in the unit cell. Basis functions accounting for edge singularities are used in the approximation of the current density on the split rings, which makes it possible a fast convergence of MoM with respect to the number of basis functions. Since the 2-D Fourier transforms of the basis functions cannot be obtained in closed-form, judicious tricks (controlled truncation of infinite summations, interpolations, etc.) are used for the efficient numerical determination of these Fourier transforms. The implemented spectral domain MoM software has been used in the design of a circularly polarized reflectarray antenna based on split rings under the local periodicity condition. The antenna has been analyzed with our spectral domain MoM software, with CST and with HFSS, and good agreement has been found among all sets of results. Our software has proven to be around 27 times faster than CST and HFSS.","1558-2221","","10.1109/TAP.2018.2888956","Agencia de Innovación y Desarrollo de Andalucía(grant numbers:P12-TIC-1435); Secretaría de Estado de Investigación, Desarrollo e Innovación(grant numbers:CICYT TEC2016-75103-C2-1-R,CICYT TEC2017-84724-P)); ","https://ieeexplore.ieee.org/stamp/stamp.jsp?arnumber=8584469","Circular polarization (CP);moment methods;multilayered media;periodic structures;reflectarrays","Method of moments;Periodic structures;Antennas;Spectral analysis;Structural rings;Microstrip;Software","","20","","25","IEEE","20 Dec 2018","","","IEEE","IEEE Journals"
"Calculation of Electromagnetic Scattering From an Inhomogeneous Sphere","E. Khodapanah","Faculty of Electrical and Computer Engineering, University of Tabriz, Tabriz, Iran",IEEE Transactions on Antennas and Propagation,"5 Mar 2019","2019","67","3","1772","1778","This paper presents a finite-element method (FEM), based on a new set of vector basis functions, for an efficient solution of the electromagnetic scattering problem from a continuously varying inhomogeneous sphere. The new bases lead to a large number of similar terms in the entries of the finite-element matrix and make the interaction between the inner and outer field expansions' diagonal. The method is compared with a tetrahedral-based FEM, and the efficiency of the method is investigated through some numerical examples.","1558-2221","","10.1109/TAP.2018.2883695","","https://ieeexplore.ieee.org/stamp/stamp.jsp?arnumber=8550757","Electromagnetic scattering;finite-element method (FEM);inhomogeneous sphere","Finite element analysis;Nonuniform electric fields;Electromagnetic scattering;Dielectrics;Integral equations;Antennas;Nonhomogeneous media","","3","","35","IEEE","28 Nov 2018","","","IEEE","IEEE Journals"
"Experimental Analysis of Ultra-Wideband Body-to-Body Communication Channel Characterization in an Indoor Environment","R. Bharadwaj; S. K. Koul","Microwave and RF Group, Centre for Applied Research in Electronics, IIT Delhi, New Delhi, India; Microwave and RF Group, Centre for Applied Research in Electronics, IIT Delhi, New Delhi, India",IEEE Transactions on Antennas and Propagation,"5 Mar 2019","2019","67","3","1779","1789","This paper presents an experimental and analytical investigation of ultra-wideband (3-8 GHz) body-to-body (B-to-B) channel characterization. The channel parameters obtained are compared with off-body (off-B) and no-body (no-B) links. Measurements have been carried out considering different body positions and orientation of the Tx-Rx pair. The type of channel link and position of the wearable antenna lead to significant changes in the radio link channel. Path loss (PL) computed shows the increase in magnitude for non line of sight (NLOS) in comparison to line of sight (LOS), though the variation over a distance of 5 m is more significant for LOS (10 dB) than NLOS links (4-5 dB). For total NLOS links, B-to-B channels have slightly higher PL and delay spread parameters in comparison to off-B channel. The B-to-B LOS channels have least PL (44-56 dB), rms delay spread (0.5-4 ns), and multipath components (3-20) which can be attributed to the directional radiation pattern due to the presence of the human body for both Tx and Rx nodes. For back-to-back antenna orientation of the B-to-B channel, maximum signal strength degradation and multipath are observed. It can be concluded that for certain links, the B-to-B channel shows a significant change in channel behavior in comparison to off-B/no-B scenario.","1558-2221","","10.1109/TAP.2018.2883634","Science and Engineering Research Board, Department of Science and Technology, Government of India, through the National Post-Doctoral Fellowship; ","https://ieeexplore.ieee.org/stamp/stamp.jsp?arnumber=8548569","Body-centric communication;channel characterization;healthcare;ultrawideband (UWB);wearable antennas","Antenna measurements;Biomedical monitoring;Delays;Directive antennas;Ultra wideband antennas","","23","","44","IEEE","27 Nov 2018","","","IEEE","IEEE Journals"
"Pedestrian-to-Vehicle Communications in an Urban Environment: Channel Measurements and Modeling","M. G. Doone; S. L. Cotton; D. W. Matolak; C. Oestges; S. F. Heaney; W. G. Scanlon","Centre for Wireless Innovation, Institute of Electronics, Communications, and Information Technology, Queen’s University Belfast, Belfast, U.K.; Centre for Wireless Innovation, Institute of Electronics, Communications, and Information Technology, Queen’s University Belfast, Belfast, U.K.; Department of Electrical Engineering, University of South Carolina, Columbia, SC, USA; Institute of Information and Communication Technologies, Electronics, and Applied Mathematics, Université Catholique de Louvain, Louvain-la-Neuve, Belgium; Jaguar Land Rover Gaydon, Warwick, U.K.; Tyndall National Institute, University College Cork, Cork, Ireland",IEEE Transactions on Antennas and Propagation,"5 Mar 2019","2019","67","3","1790","1803","As wireless connectivity becomes increasingly ubiquitous, a greater emphasis will be placed upon the seamless integration of dissimilar networking technologies. One such example of this will occur in urban environments, where wearable devices and vehicular networks will operate in close proximity to one another. Clearly, a natural extension to both types of network is their interconnectivity through vehicle-to-pedestrian (V2P) or equivalently pedestrian-to-vehicle (P2V) communications as part of a much greater vehicle-to-X (V2X)-based intelligent transportation system. To this end, we empirically investigate the P2V communications channel at 5.8 GHz for the case of a moving vehicle when a person positioned by the edge of a road was either stationary or walking parallel to the side of the highway. The measurements considered a chest-mounted transmitter and four receiver locations on the vehicle covering the front wing mirrors and two positions on the roof, which simultaneously recorded the received signal power. To characterize the propagation mechanisms which are responsible for shaping the received signal in the P2V channel, we decomposed it into its path loss (PL), large-scale, and small-scale fading components. We first show that although there was evidence of interference caused by multiple rays interacting with one another, the popular two-ray ground-reflection PL model was unable to adequately describe the compounded effects of the vehicle and pedestrian's body on the signal attenuation in the majority of the considered scenarios. Instead, we found that the overall PL was well characterized using a dual-slope log-distance model, with lognormal large-scale fading. Due to the often severe small-scale fading that was observed in the P2V channel, we have been able to utilize the κ-μ extreme distribution with considerable success to characterize the worse than Rayleigh fading conditions which were encountered.","1558-2221","","10.1109/TAP.2018.2885461","Engineering and Physical Sciences Research Council(grant numbers:EP/L026074/1); ","https://ieeexplore.ieee.org/stamp/stamp.jsp?arnumber=8576610","κ-μ distribution;κ-μ extreme distribution;channel measurements;fading channels;path loss (PL);two-ray ground-reflection;vehicular communications;wearable communications","Fading channels;Wireless communication;Antennas;Antenna measurements;Roads;Receivers;Shadow mapping","","15","","50","CCBY","14 Dec 2018","","","IEEE","IEEE Journals"
"Input-to-Output Instantaneous Polarization Characterization","T. G. Pratt; R. D. Kossler","Department of Electrical Engineering, University of Notre Dame, Notre Dame, IN, USA; Department of Electrical Engineering, University of Notre Dame, Notre Dame, IN, USA",IEEE Transactions on Antennas and Propagation,"5 Mar 2019","2019","67","3","1804","1818","This paper proposes a method to represent and predict received signal instantaneous polarization states as a function of arbitrary transmit polarization states for time-dispersive channels. The model incorporates frequency-dependent characterizations to represent the polarization dispersion behavior of a received signal across its bandwidth in a multipath channel. The representation takes advantage of signal dispersion features typical of depolarized signals, and employs subbanded characterizations to achieve polarization representations exhibiting high degrees of polarization in each subband. Experiments are conducted that demonstrate the utility of the modeling approach to predict polarization dispersion responses for arbitrary transmit polarizations based on measurements from two orthogonal transmit polarizations.","1558-2221","","10.1109/TAP.2018.2888824","Office of Naval Research(grant numbers:N00014-15-1-2057,N00014-18-1-2134); ","https://ieeexplore.ieee.org/stamp/stamp.jsp?arnumber=8581464","Dispersion;polarization estimation;radiowave propagation;Stokes parameters","Stochastic processes;Dispersion;Calculus;Delays;Analytical models;Receiving antennas;Optical polarization","","","","53","IEEE","19 Dec 2018","","","IEEE","IEEE Journals"
"DeepNIS: Deep Neural Network for Nonlinear Electromagnetic Inverse Scattering","L. Li; L. G. Wang; F. L. Teixeira; C. Liu; A. Nehorai; T. J. Cui","School of Electronics Engineering and Computer Sciences, Peking University, Beijing, China; School of Electronics Engineering and Computer Sciences, Peking University, Beijing, China; ElectroScience Laboratory, The Ohio State University, Columbus, OH, USA; State Key Laboratory of Millimeter Waves, Southeast University, Nanjing, China; Department of Electrical and Systems Engineering, Washington University in St. Louis, St. Louis, MO, USA; State Key Laboratory of Millimeter Waves, Southeast University, Nanjing, China",IEEE Transactions on Antennas and Propagation,"5 Mar 2019","2019","67","3","1819","1825","Nonlinear electromagnetic (EM) inverse scattering is a quantitative and super-resolution imaging technique, in which more realistic interactions between the internal structure of scene and EM wavefield are taken into account in the imaging procedure, in contrast to conventional tomography. However, it poses important challenges arising from its intrinsic strong nonlinearity, ill-posedness, and expensive computational costs. To tackle these difficulties, we, for the first time to our best knowledge, exploit a connection between the deep neural network (DNN) architecture and the iterative method of nonlinear EM inverse scattering. This enables the development of a novel DNN-based methodology for nonlinear EM inverse problems (termed here DeepNIS). The proposed DeepNIS consists of a cascade of multilayer complex-valued residual convolutional neural network modules. We numerically and experimentally demonstrate that the DeepNIS outperforms remarkably conventional nonlinear inverse scattering methods in terms of both the image quality and computational time. We show that DeepNIS can learn a general model approximating the underlying EM inverse scattering system. It is expected that the DeepNIS will serve as powerful tool in treating highly nonlinear EM inverse scattering problems over different frequency bands, which are extremely hard and impractical to solve using conventional inverse scattering methods.","1558-2221","","10.1109/TAP.2018.2885437","National Natural Science Foundation of China(grant numbers:61471006); 111 Project(grant numbers:111-2-05); AFOSR(grant numbers:FA9550-16-1-0386); ","https://ieeexplore.ieee.org/stamp/stamp.jsp?arnumber=8565987","Complex-valued residual convolutional neural network (CNN);CNN;nonlinear inverse scattering","Inverse problems;Neural networks;Electromagnetics;Electromagnetic scattering;Computer architecture;Imaging;Iterative methods","","361","","47","IEEE","6 Dec 2018","","","IEEE","IEEE Journals"
"Methodology for Multipath-Component Tracking in Millimeter-Wave Channel Modeling","C. Lai; R. Sun; C. Gentile; P. B. Papazian; J. Wang; J. Senic","Communications Technology Laboratory, National Institute of Standards and Technology, Gaithersburg, MD, USA; CableLabs, Louisville, CO, USA; Communications Technology Laboratory, National Institute of Standards and Technology, Gaithersburg, MD, USA; Communications Technology Laboratory, National Institute of Standards and Technology, Boulder, CO, USA; Communications Technology Laboratory, National Institute of Standards and Technology, Gaithersburg, MD, USA; Communications Technology Laboratory, National Institute of Standards and Technology, Boulder, CO, USA",IEEE Transactions on Antennas and Propagation,"5 Mar 2019","2019","67","3","1826","1836","We describe an extensive channel-measurement campaign, including 325 unique transmitter-receiver configurations, conducted in a lecture room with our 3-D double-directional 60 GHz channel sounder. The receiver was mounted on a mobile robot, with 40 cm spacing between channel acquisitions, enabling the tracking of clustered multipath components in the multidimensional delay-angle space. To mitigate against angle-estimation error and multipath blockage, we introduce a robust tracking algorithm based on the Assignment Problem. For the purpose of validation, the clusters were transformed from the delay-angle space onto a 2-D map of the environment and compared against the locations of cluster-generating reflectors, such as walls and tables. The location errors were typically within 30-50 cm. The clusters identified were then reduced to a stochastic map-based channel model, including reflection loss and dispersion characteristics such as the Ricean K-factor and angular spread. Given the 0.5 ns delay resolution of the channel sounder and angle-estimation error around 2°, the parameters were reported with high fidelity.","1558-2221","","10.1109/TAP.2018.2888686","","https://ieeexplore.ieee.org/stamp/stamp.jsp?arnumber=8581503","Assignment Problem;Hungarian algorithm;millimeter-wave (mmWave);wireless","Delays;Radar tracking;Antenna measurements;Channel models;Bandwidth;Stochastic processes;Dispersion","","48","","41","IEEE","19 Dec 2018","","","IEEE","IEEE Journals"
