"Power Gain Optimization Method for Wide-Beam Array Antenna via Convex Optimization","S. Lei; Y. Yang; H. Hu; Z. Zhao; B. Chen; X. Qiu","School of Electronic Science and Engineering, University of Electronic Science and Technology of China, Chengdu, China; School of Electronic Science and Engineering, University of Electronic Science and Technology of China, Chengdu, China; School of Electronic Science and Engineering, University of Electronic Science and Technology of China, Chengdu, China; School of Electronic Science and Engineering, University of Electronic Science and Technology of China, Chengdu, China; School of Electronic Science and Engineering, University of Electronic Science and Technology of China, Chengdu, China; Global Vision Media Technology Co., Ltd., Beijing, China",IEEE Transactions on Antennas and Propagation,"5 Mar 2019","2019","67","3","1620","1629","This paper focuses on the problem of maximizing the minimum power gain in a wide main lobe for an array antenna. To obtain the desired power gain pattern, current literatures solve the problem known as shaped beam pattern synthesis (SBPS) by setting the beam pattern expression as the cost function. The power gain in a certain direction of the array antenna is comprehensively decided by the array radiated power density and the total radiated power. Both these two parameters are affected by the selection of array elements' weights. However, the SBPS-based methods do not take the total radiated power into account. Therefore, the SBPS-based methods cannot obtain the power gain pattern directly, and the optimal power gain pattern, consequently, cannot be guaranteed. To overcome this deficiency, this paper maximizes the minimum power gain in the desired wide main lobe by directly setting the power gain expression as the cost function. Aiming at optimizing the cost function, this paper first sets up a power gain optimization problem which has concave form. Termed this optimization problem as the power gain pattern synthesis (PGPS) problem. The concave PGPS problem is then converted to a series of convex subproblems and an iterative algorithm is proposed to solve it efficiently. Solution to the PGPS problem is proven to be able to achieve higher minimum power gain in a desired wide main lobe than the results from the SBPS-based algorithms. Simulations are carried out with both linear array antenna and planar array antenna. Comparisons with the existed SBPS-based algorithms validate the effectiveness and advantages of the proposed PGPS-based algorithm. In addition, further improvement on suppressing the sidelobe level for the PGPS problem is discussed.","1558-2221","","10.1109/TAP.2018.2884814","Fundamental Research Funds For Central Universities of China(grant numbers:ZYGX2018J021); ","https://ieeexplore.ieee.org/stamp/stamp.jsp?arnumber=8558576","Adaptive beamforming;array pattern synthesis;convex optimization technique;power gain optimization;wide main lobe beam","Gain;Directive antennas;Linear antenna arrays;Optimization;Receiving antennas;Convex functions","","58","","18","IEEE","4 Dec 2018","","","IEEE","IEEE Journals"
"A Generalized Model for Two-Element Biomimetic Antenna Arrays","P. Grüner; T. Chaloun; C. Waldschmidt","Institute of Microwave Engineering, Ulm University, Ulm, Germany; Institute of Microwave Engineering, Ulm University, Ulm, Germany; Institute of Microwave Engineering, Ulm University, Ulm, Germany",IEEE Transactions on Antennas and Propagation,"5 Mar 2019","2019","67","3","1630","1639","Biomimetic antenna arrays (BMAAs) are antenna systems enabling an improved angle estimation for small apertures by mimicking the hearing system of the fly Ormia ochracea. This is achieved by a special kind of coupling applied to the antenna elements inspired by the insect. However, recent designs of BMAAs rely on a strong mutual coupling between the antenna elements. In this paper, it will be shown that the strong mutual coupling is not needed for a BMAA at the antenna side, and a generalized model of the biomimetic antenna system is theoretically derived, evaluated, and verified by measurements. This new model also gives an intuitive insight into the working principle of the biomimetic antenna system.","1558-2221","","10.1109/TAP.2018.2888829","Deutsche Forschungsgemeinschaft(grant numbers:WA 3506/6-1); ","https://ieeexplore.ieee.org/stamp/stamp.jsp?arnumber=8581459","Biomimetic antenna arrays (BMAAs);antenna arrays;biologically inspired antennas;direction-of-arrival estimation","Antenna arrays;Couplings;Biological system modeling;Bars;Estimation;Ear","","17","","27","IEEE","19 Dec 2018","","","IEEE","IEEE Journals"
"A Versatile Triangular Patch Array for Wideband Frequency Alteration With Concurrent Circular Polarization and Pattern Reconfigurability","B. Dwivedy; S. K. Behera; V. K. Singh","Department of Electronics and Communication Engineering, National Institute of Technology Rourkela, Odisha, India; Department of Electronics and Communication Engineering, National Institute of Technology Rourkela, Odisha, India; Society for Applied Microwave Electronics Engineering and Research Kolkata Centre, Kolkata, India",IEEE Transactions on Antennas and Propagation,"5 Mar 2019","2019","67","3","1640","1649","This paper focuses on the design with experimental verification of a circular polarization (CP) and pattern reconfigurable triangular patch array simultaneously operating at various tunable frequencies. The resonant frequency of the antenna can be altered from 1.97 to 2.54 GHz (25.3% tunable bandwidth) by varying the capacitance values from 4.27 to 1.15 pF of the six varactors fixed between the annular slots on the three triangular patches. A wideband phase shifting network with switching capability is also designed which facilitates the antenna to operate it in both types of CP and pattern reconfigurable modes at each frequency. The antenna is tested in receiving mode and it shows a maximum realized gain of 3.1 dBc when operated in any of the CP mode and 1.45 dB for pattern reconfigurability mode. It has a very wideband axial ratio (AR) value (<3 dB) at each reconfigured frequency and also covers the entire frequency agility bandwidth. Investigation confirms that the antenna produces circularly polarized radiation pattern with minimum AR beamwidth of 24° at all frequency bands for both types of CP radiation. It is also observed that the antenna pattern can be rotated at 120° angle in the complete azimuth plane with a wide 3 dB beamwidth of ±45° at its operating frequencies. The multifaceted reconfiguring ability of the antenna enables it to serve many futuristic communication system requirements such as supporting multiple radios and maintaining signal quality in diverse climatic conditions.","1558-2221","","10.1109/TAP.2018.2889371","","https://ieeexplore.ieee.org/stamp/stamp.jsp?arnumber=8586922","Axial ratio (AR);frequency reconfigurable;pattern;polarization;triangular patch","Antenna radiation patterns;Antenna arrays;Varactors;Resonant frequency;Polarization;Switches","","25","","32","IEEE","23 Dec 2018","","","IEEE","IEEE Journals"
"A Slot Array Antenna With Single-Layered Corporate-Feed Based on Ridge Gap Waveguide in the 60 GHz Band","J. Liu; A. Vosoogh; A. U. Zaman; J. Yang","Department of Electrical Engineering, Chalmers University of Technology, Gothenburg, Sweden; Microwave Electronics Laboratory, Chalmers University of Technology, Gothenburg, Sweden; Department of Electrical Engineering, Chalmers University of Technology, Gothenburg, Sweden; Department of Electrical Engineering, Chalmers University of Technology, Gothenburg, Sweden",IEEE Transactions on Antennas and Propagation,"5 Mar 2019","2019","67","3","1650","1658","This paper presents an 8 × 8-element slot array antenna with single-layered corporate-feed based on the ridge gap waveguide (RGW) technology in the 60 GHz band. As is well known, a corporate-feed slot array antenna usually has backed cavities to increase the bandwidth and provides a space for its distribution network, and therefore three layers in total: one layer for radiating slots and two layers for feed network with one layer of back cavities and the other one of power dividers. The antenna in this paper is designed by utilizing only two separate metallic layers-a corporate-feed network layer and a radiating slot layer. Compared with the conventional three-layered slot array antennas, the proposed antenna avoids the utilization of the backed cavity layer so that its complexity and manufacture cost decrease. In order to solve the problem of the narrow bandwidth caused by taking away the backed cavities, we utilize double-ridged radiating slots instead of the conventional rectangular ones. A compact transition power divider from standard waveguide WR-15 to the RGW is introduced to excite the proposed array antenna. The 8 × 8-element slot array antenna has been fabricated by computerized numerical control machining technique. The measured results demonstrate that the -10 dB reflection coefficient has around 17% bandwidth covering 56.5-67 GHz frequency range, and the measured gain is better than 26 dBi with more than 70% antenna efficiency over 58-66 GHz.","1558-2221","","10.1109/TAP.2018.2888730","European Research Council through an Advanced Investigator Grant(grant numbers:ERC-2012-ADG 20120216); Vinnova(grant numbers:2015-01387); ","https://ieeexplore.ieee.org/stamp/stamp.jsp?arnumber=8581479","60 GHz frequency band;double-layered slot array;ridge gap waveguide (RGW);single-layered corporate-feed network","Antenna arrays;Waveguide discontinuities;Pins;Slot antennas;Cavity resonators;Feeds","","109","","43","IEEE","19 Dec 2018","","","IEEE","IEEE Journals"
"Support Vector Regression to Accelerate Design and Crosspolar Optimization of Shaped-Beam Reflectarray Antennas for Space Applications","D. R. Prado; J. A. López-Fernández; M. Arrebola; G. Goussetis","Institute of Sensors, Signals and Systems, School of Engineering and Physical Sciences, Heriot-Watt University, Edinburgh, U.K.; Department of Electrical Engineering, Universidad de Oviedo, Gijón, Spain; Department of Electrical Engineering, Universidad de Oviedo, Gijón, Spain; Institute of Sensors, Signals and Systems, School of Engineering and Physical Sciences, Heriot-Watt University, Edinburgh, U.K.",IEEE Transactions on Antennas and Propagation,"5 Mar 2019","2019","67","3","1659","1668","A machine learning technique is applied to the design and optimization of reflectarray antennas to considerably accelerate computing time without compromising accuracy. In particular, support vector machines (SVMs), automatic learning structures that are able to deal with regression problems, are employed to obtain surrogate models of the reflectarray element to substitute the full-wave analysis tool for the characterization of the unit cell in the design and optimization algorithms. The analysis, design, and optimization of a very large reflectarray antenna for Direct Broadcast Satellite applications are accelerated up to three orders of magnitude. This is here demonstrated with three examples: one showing the design of a reflectarray and two for the crosspolar optimization, one with one coverage for each linear polarization (Europe and the Middle East) and another with a Middle East coverage working in dual-linear polarization. The accuracy of the proposed approach is validated by means of a comparison of the final designs with full-wave simulations based on local periodicity obtaining good agreement. The crosspolar dicrimination and crosspolar isolation are greatly improved using the SVMs while considerably reducing computing time.","1558-2221","","10.1109/TAP.2018.2889029","European Space Agency(grant numbers:ESTEC/AO/1-7064/12/NL/MH); European Space Agency(grant numbers:TEC2017-86619-R (ARTEINE)); Ministerio de Economía, Industria y Competitividad(grant numbers:TEC2016-75103-C2-1-R (MYRADA)); Gobierno del Principado de Asturias(grant numbers:ACA17-09); ","https://ieeexplore.ieee.org/stamp/stamp.jsp?arnumber=8585039","Direct Broadcast Satellite (DBS);machine learning techniques;reflectarray;shaped-beam antenna;space communications;support vector machine (SVM)","Support vector machines;Optimization;Acceleration;Training;Antennas;Manganese;Machine learning algorithms","","82","","33","IEEE","21 Dec 2018","","","IEEE","IEEE Journals"
"45 GHz Wideband Circularly Polarized Planar Antenna Array Using Inclined Slots in Modified Short-Circuited SIW","Y. Zhang; W. Hong; R. Mittra","State Key Laboratory of Millimeter Waves, School of Information Science and Engineering, Southeast University, Nanjing, China; State Key Laboratory of Millimeter Waves, School of Information Science and Engineering, Southeast University, Nanjing, China; Department of Electrical and Computer Engineering, King Abdulaziz University, Jeddah, Saudi Arabia",IEEE Transactions on Antennas and Propagation,"5 Mar 2019","2019","67","3","1669","1680","This paper presents a Q-band planar circularly polarized (CP) antenna array with a wide bandwidth, in terms of both impedance matching and axial ratio (AR). A centered 45°-inclined slot in the broad wall of a substrate-integrated waveguide (SIW) with a modified short-circuited termination is first introduced to realize a wideband 45° linearly polarized radiation, incorporated with a pair of inductive vias for impedance matching. Then, orthogonally integrating two proposed slots with an SIW 90° directional coupler, a wideband CP element is designed and its beam exhibits a good AR over a relatively wide angular region in one direction. Following this, a two-layer SIW is employed to design a CP antenna array. Four CP elements are arranged in a rotational manner in the top layer, and they are sequentially fed by a four-way power divider in the bottom layer with an incremental phase delay of 90° to achieve a conical CP beam and higher gain. The performances of the power divider and cross-layer coupling slot are examined in the wide operating band. The proposed CP array antenna is prototyped at Q-band, and measured results show that the antenna has |S11| <; -13 dB, AR <; 2.5 dB, and a gain of 8.2-10.5 dBic over 42.3-49 GHz (14.72%) and has a dimension of 30 mm × 30 mm × 1 mm.","1558-2221","","10.1109/TAP.2018.2888984","National Natural Science Foundation of China(grant numbers:61302019,61601121,61671147); ","https://ieeexplore.ieee.org/stamp/stamp.jsp?arnumber=8584400","Circular polarization (CP);inclined slot;millimeter-wave (mmW) antennas;sequentially rotated array;substrate-integrated waveguide (SIW)","Antenna arrays;Slot antennas;Impedance matching;Impedance;Wideband","","43","","25","IEEE","20 Dec 2018","","","IEEE","IEEE Journals"
"On the Exact Mutual Reactance of a Line Source Array: A Hilbert Transform Methodology","J. L. Young","School of Electrical and Computer Engineering, Oklahoma State University, Stillwater, OK, USA",IEEE Transactions on Antennas and Propagation,"5 Mar 2019","2019","67","3","1681","1687","The mutual reactance between two elements of a lineal array is formulated using Fourier transform, autocorrelation, convolution, and Hilbert transform concepts, with the invocation of the Hilbert transform being the novel contribution of this paper. It is shown herein that the mutual reactance of an array can be determined from the radiation pattern, if one considers the entire time-averaged power delivered to both the visible and the nonvisible far-field regions. Power to the nonvisible region corresponds to stored energy in the Poynting volume; stored energy corresponds to reactive power, which is in quadrature with the nonvisible, time-averaged power; and quadrature suggests the invocation of the Hilbert transform. The end result of the Hilbert transform process is a straightforward, closed-form analytical expression for the mutual reactance. Since the closed-form mutual resistance has been determined previously, both closed-form expressions can be combined to provide an elegant, but easy-to-use formulation for the mutual impedance. For a given current distribution, the results are exact and validated against data obtained numerically. Cases associated with the half-wave dipole, generalized dipole distribution, and the uniform distribution are provided herein as examples of the robustness of the presented theory.","1558-2221","","10.1109/TAP.2018.2888954","","https://ieeexplore.ieee.org/stamp/stamp.jsp?arnumber=8584464","Autocorrelation;convolution;Helmholtz operator;Hilbert transforms;line sources;mutual impedance;mutual reactance;Parseval’s identity;Poynting’s theorem;radiated power;stored energy","Current distribution;Antennas;Impedance;Fourier transforms;Convolution;Correlation","","2","","17","IEEE","20 Dec 2018","","","IEEE","IEEE Journals"
"A Compact Planar Omnidirectional MIMO Array Antenna With Pattern Phase Diversity Using Folded Dipole Element","L. Sun; Y. Li; Z. Zhang; M. F. Iskander","Beijing National Research Center for Information Science and Technology, Tsinghua University, Beijing, China; Beijing National Research Center for Information Science and Technology, Tsinghua University, Beijing, China; Beijing National Research Center for Information Science and Technology, Tsinghua University, Beijing, China; Hawaii Center for Advanced Communications, University of Hawai’i at Mānoa, Honolulu, HI, USA",IEEE Transactions on Antennas and Propagation,"5 Mar 2019","2019","67","3","1688","1696","This paper presents a planar omnidirectional multiple-input multiple-output (MIMO) antenna with pattern phase diversity. The profiles of conventional dual-polarized omnidirectional MIMO antennas are too high to be planar integrated due to the limited bandwidth of vertical-polarized element. Therefore, a dual-channel horizontal-polarized MIMO antenna is proposed for the planar integration of omnidirectional MIMO antenna. The antenna is formed with four-element folded dipole array, and a compact feed network with two sets of 90° progressive phases is employed to feed the two channels with shared elements, thus the antenna can be integrated into a sheet of substrate with an ultralow profile of 0.8 mm. Although the polarization and radiation pattern (amplitude) of the two colocated channels are the same with each other, a high isolation is still achieved as a result of the orthogonal pattern phase. A prototype was fabricated to validate the performance. The measured highest isolation between two channels is 31.7 dB, and -10 dB isolated bandwidth is 2.29-2.57 GHz (11.7%) with S11 <; -14 dB and envelope correlation coefficient less than 0.05, which shows a good diversity performance. Therefore, the proposed dual-channel antenna gives a feasible solution for the planar integration of the omnidirectional MIMO system.","1558-2221","","10.1109/TAP.2018.2889608","National Natural Science Foundation of China(grant numbers:61525104,61771280); Natural Science Foundation of Beijing Municipality(grant numbers:4182029); ","https://ieeexplore.ieee.org/stamp/stamp.jsp?arnumber=8587219","Antenna diversity;antenna radiation patterns;multiple-input multiple-output (MIMO);pattern phase diversity;planar integration","Antenna radiation patterns;Dipole antennas;MIMO communication;Phased arrays;Feeds;Azimuth","","31","","40","IEEE","23 Dec 2018","","","IEEE","IEEE Journals"
"Sampling Rules for an Inhomogeneous Plane-Wave Representation of Scattered Fields","Q. Gueuning; C. Craeye; C. Oestges","Institute of Information and Communication Technologies, Electronics and Applied Mathematics, Université catholique de Louvain, Louvain-la-Neuve, Belgium; Institute of Information and Communication Technologies, Electronics and Applied Mathematics, Université catholique de Louvain, Louvain-la-Neuve, Belgium; Institute of Information and Communication Technologies, Electronics and Applied Mathematics, Université catholique de Louvain, Louvain-la-Neuve, Belgium",IEEE Transactions on Antennas and Propagation,"5 Mar 2019","2019","67","3","1697","1708","Inhomogeneous plane waves (IPWs) based on a linear contour deformation provide an accurate and concise field representation for scattering problems in which source and observation domains are visible within a limited angular sector. Given an error level, we derive closed-form expressions for the truncation limit, the sampling step, and the contour slope that minimize the number of plane waves. A relation is drawn between the required number of plane waves and the degrees of freedom of the field, defined as the minimum number of orthonormal basis functions that represents scattered fields. The sampling rules are then applied to an efficient evaluation of the physical optics radiation integral.","1558-2221","","10.1109/TAP.2018.2885414","WB-Health Program of Walloon Region through the Research Project B-WARE; BESTCOM Interuniversity Belgian Research Program; F.R.S.-FNRS through the Research Project MACHAON; ","https://ieeexplore.ieee.org/stamp/stamp.jsp?arnumber=8565977","Computational electromagnetics;contour deformation;degrees of freedom (DoF);error analysis;fast algorithm;field representation;Green’s function;inhomogeneous plane waves (IPWs);physical optics (PO);scattering;spectral-domain method","Green's function methods;Antennas;Nonhomogeneous media;Physical optics;Spectral analysis;Acceleration;Mathematical model","","7","","33","IEEE","6 Dec 2018","","","IEEE","IEEE Journals"
"Novel Multifunctional Reconfigurable Active Frequency Selective Surface","R. Phon; S. Ghosh; S. Lim","School of Electrical and Electronics Engineering, Chung-Ang University, Seoul, South Korea; School of Electrical and Electronics Engineering, Chung-Ang University, Seoul, South Korea; School of Electrical and Electronics Engineering, Chung-Ang University, Seoul, South Korea",IEEE Transactions on Antennas and Propagation,"5 Mar 2019","2019","67","3","1709","1718","In this paper, a multifunctional active frequency selective surface (MAFSS) is presented based on the switching responses of active components. The proposed structure comprises periodic arrays of metallic patterns imprinted on both sides of an FR4 substrate on which p-i-n diodes are embedded with parallel feed networks. The novelty of the design lies in its multifunctional characteristics with independent control of the biasing states (ON/OFF) of the diodes mounted on opposite layers. This leads to four different working states (dual bandpass for OFF-OFF state, single-band absorber for OFF-ON state, single-bandpass for ON-OFF state, and reflector for ON-ON state) being facilitated by the proposed reconfigurable AFSS. Furthermore, the effects of the design parameters and active components on multifunctional responses are extensively analyzed by deriving equivalent circuit models. Even though the topology is polarization sensitive, multiple dividable working functions (transmission, absorption, and reflection) have been realized in single geometry, unlike the earlier reported designs. The proposed structure has also been fabricated, and the measured responses show reasonable agreement with the simulated results under normal incidence. An MAFSS with such diverse characteristics is an essential element for regulating electromagnetic wave propagation in manifold applications.","1558-2221","","10.1109/TAP.2018.2889002","National Research Foundation of Korea(grant numbers:2017R1A2B3003856); ","https://ieeexplore.ieee.org/stamp/stamp.jsp?arnumber=8584476","Active frequency selective surface (AFSS);multifunctional AFSS (MAFSS);p-i-n diode;reconfigurable structure","Geometry;Integrated circuit modeling;Equivalent circuits;Reflection;PIN photodiodes;Absorption;Topology","","98","","44","IEEE","20 Dec 2018","","","IEEE","IEEE Journals"
