"Tuned scattering of Electromagnetic Waves by a Finite Length Ferromagnetic Microwire","A. Hernando; V. Lopez-Dominguez; E. Ricciardi; K. Osiak; P. Marin","Institute of Applied Magnetism (IMA), University Complutense of Madrid-CSIC-Adif, Las Rozas de Madrid, Spain; Institute of Applied Magnetism (IMA), University Complutense of Madrid-CSIC-Adif, Las Rozas de Madrid, Spain; Institute of Applied Magnetism (IMA), University Complutense of Madrid-CSIC-Adif, Las Rozas de Madrid, Spain; Institute of Applied Magnetism (IMA), University Complutense of Madrid-CSIC-Adif, Las Rozas de Madrid, Spain; Institute of Applied Magnetism (IMA), University Complutense of Madrid-CSIC-Adif, Las Rozas de Madrid, Spain",IEEE Transactions on Antennas and Propagation,"1 Mar 2016","2016","64","3","1112","1115","In this communication, we report a theoretical and experimental research work related to the interaction between microwaves and hnite length Co-based ferromagnetic microwires exhibiting giant magnetoimpedance effect. The electric current induced along the microwire by the electromagnetic wave determines the scattering properties of the magnetic microwires. The electric current depends on the microwire impedance Zi as well as on the relationship between its length and the wavelength of the microwave. Numerical results describe the dependence of the induced current on the microwire magnetic permeability that determines Zi. Furthermore, it is shown how Zi can be effectively tuned through the application of a bias magnetic held. Suitable combination of magnetoimpedance effect and shape resonances opens the perspective to use this system as a wireless held microsensor element as well as a sensing element for constructing codihed tags.","1558-2221","","10.1109/TAP.2015.2513428","Spanish Ministry of Economy(grant numbers:TSI-020100-2011-280,CSD2007-0010,MAT2009-14741-C02-01,MAT2012-37109-C02-01,MAT2013-49847-EXP,IPT-2011-0893-420000); European Union(grant numbers:NMP.2012.4.1-3); ","https://ieeexplore.ieee.org/stamp/stamp.jsp?arnumber=7368885","Dipole antennas;electromagnetic theory;magnetic devices;Dipole antennas;electromagnetic theory;magnetic devices","Scattering;Permeability;Magnetic resonance;Modulation;Current;Microwave theory and techniques;Amorphous magnetic materials","","23","","28","IEEE","30 Dec 2015","","","IEEE","IEEE Journals"
"MIMO Antennas Efficiency Measurement Using Wheeler Caps","M. A. Moharram; A. A. Kishk","Department of Electrical and Computer Engineering, Concordia University, Montreal, QC, Canada; Department of Electrical and Computer Engineering, Concordia University, Montreal, QC, Canada",IEEE Transactions on Antennas and Propagation,"1 Mar 2016","2016","64","3","1115","1120","A simple and reliable measurement-based procedure is proposed to predict the radiation efficiency of multiple-input-multiple-output (MIMO) antennas using Wheeler caps. Based on only measuring the S-parameters of the MIMO antenna system in free-space and inside a shielded Wheeler cap, the method approximately predicts the radiation efficiency of each uncoupled MIMO antenna port. The method makes use of the recently developed contactless Wheeler cap concept and the improved quality factor method to facilitate the processing of the results. The procedure is verified by comparing full-wave results with prediction through measurements.","1558-2221","","10.1109/TAP.2015.2513420","","https://ieeexplore.ieee.org/stamp/stamp.jsp?arnumber=7368867","Antenna Measurement;Antenna Efficiency;Mobile Antennas;Q factor;Wheeler Cap;Antenna efficiency;antenna measurement;mobile antennas;Q-factor;Wheeler cap","Antenna measurements;MIMO;Ports (Computers);Q-factor;Antenna radiation patterns;Cavity resonators","","23","","36","IEEE","30 Dec 2015","","","IEEE","IEEE Journals"
"A Double-Layer Transmitarray Antenna Using Malta Crosses With Vias","W. An; S. Xu; F. Yang; M. Li","Department of Electronic Engineering, Tsinghua University, Beijing, China; Department of Electronic Engineering, Tsinghua University, Beijing, China; Department of Electronic Engineering, Tsinghua University, Beijing, China; Department of Electronic Engineering, Tsinghua University, Beijing, China",IEEE Transactions on Antennas and Propagation,"1 Mar 2016","2016","64","3","1120","1125","A novel transmitarray element consisting of only two layers of modified Malta crosses printed on a dielectric substrate is proposed, and vias are employed to augment the transmission magnitude and enhance its phase shift range. A prototype transmitarray with a circular aperture of 338 mm in diameter is then designed, fabricated, and tested to validate the proposed design. The simulation and measurement results show good radiation characteristics with measured gain of 33.0 dBi at 20 GHz and aperture efficiency of 40%. The proposed element considerably simplifies the complexity of a transmitarray, reducing its thickness, mass, and cost.","1558-2221","","10.1109/TAP.2015.2513427","","https://ieeexplore.ieee.org/stamp/stamp.jsp?arnumber=7368866","Antenna;radiation pattern;transmitarray;via;Antenna;radiation pattern;transmitarray;via","Couplings;Current distribution;Microstrip antenna arrays;Apertures;Antenna measurements;Microstrip;Metamaterials","","157","","20","IEEE","30 Dec 2015","","","IEEE","IEEE Journals"
"Fringe Waves from a Wedge With One Face Electric and the Other Face Magnetic","G. Apaydin; F. Hacivelioglu; L. Sevgi; P. Y. Ufimtsev","Department of Electrical and Computer Engineering, University of Illinois at Urbana-Champaign, Urbana, IL, USA; Mathematical Department, Gebze Technical University, Gebze, Turkey; Department of Electrical and Electronics Engineering, Okan University, Istanbul, Turkey; EM Consulting, Los Angeles, CA, USA",IEEE Transactions on Antennas and Propagation,"1 Mar 2016","2016","64","3","1125","1130","Fringe waves represent the diffracted field generated by the nonuniform/fringe surface currents concentrated in vicinity of sharp scattering edges. For perfectly conducting wedges, they have been studied in a number of publications. In this communication, fringe waves for a wedge with one face electric and the other magnetic are analyzed analytically and numerically.","1558-2221","","10.1109/TAP.2016.2515133","","https://ieeexplore.ieee.org/stamp/stamp.jsp?arnumber=7373573","asymptotic theory;diffraction;fringe waves;physical optics;physical theory of diffraction;scattering;impedance boundary conditions;method of moments;wedge diffraction;Asymptotic theory;diffraction;fringe waves;impedance boundary conditions;method of moments (MoMs);physical optics (PO);physical theory of diffraction (PTD);scattering;wedge diffraction","Face;Method of moments;Surface waves;Antennas;Optical surface waves;Surface impedance;Diffraction","","9","","26","IEEE","6 Jan 2016","","","IEEE","IEEE Journals"
"Determining the First-Null Mainlobe Region of an Arbitrary Pattern for 2-D Numerical Pattern Synthesis Algorithm","Y. Liu; S. -L. Chen; L. Zhang; Q. H. Liu","Department of Electronic Science, Xiamen University, Fujian, China; Department of Electronic Science, Xiamen University, Fujian, China; Department of Electronic Science, Xiamen University, Fujian, China; Department of Electrical and Computer Engineering, Duke University, Durham, NC, USA",IEEE Transactions on Antennas and Propagation,"1 Mar 2016","2016","64","3","1130","1136","Determining the mainlobe region of an arbitrary pattern is a critical problem in the two-dimensional numerical pattern synthesis (2-D-NPS) method in which a number of artificial interferences with appropriate powers are distributed outside of the mainlobe region. In this communication, a novel mainlobe region determination procedure based on the seeded region growing (SRG) method is proposed. Two different stopping criterions are introduced. Several numerical synthesis examples for uniformly and nonuniformly spaced planar arrays as well as a cylindrical array with directive elements, are presented to validate the effectiveness of the 2-D-NPS with the proposed mainlobe determination procedure. The two stopping criterions are also compared with these examples.","1558-2221","","10.1109/TAP.2016.2515135","National Natural Science Foundation of China(grant numbers:61301009,41390453); Specialized Research Fund for the Doctoral Program of Higher Education(grant numbers:20120121120027); Fundamental Research Funds for the Central Universities(grant numbers:20720160081); ","https://ieeexplore.ieee.org/stamp/stamp.jsp?arnumber=7373565","Radiation pattern synthesis;antenna array;twodimensional numerical pattern synthesis (2D-NPS);first-null mainlobe region;seeded region growing (SRG) method;Antenna array;first-null mainlobe region;radiation pattern synthesis;seeded region growing (SRG) method;two-dimensional numerical pattern synthesis (2-D-NPS)","Arrays;Robustness;Interference;Image segmentation;Planar arrays;Computational fluid dynamics","","15","","16","IEEE","6 Jan 2016","","","IEEE","IEEE Journals"
"Polarization Reconfigurable Broadband Rectenna With Tunable Matching Network for Microwave Power Transmission","P. Lu; X. -S. Yang; J. -L. Li; B. -Z. Wang","School of Physical Electronics, University of Electronic Science of Technology of China, Chengdu, China; School of Physical Electronics, University of Electronic Science of Technology of China, Chengdu, China; School of Physical Electronics, University of Electronic Science of Technology of China, Chengdu, China; School of Physical Electronics, University of Electronic Science of Technology of China, Chengdu, China",IEEE Transactions on Antennas and Propagation,"1 Mar 2016","2016","64","3","1136","1141","A broadband polarization reconfigurable rectenna is proposed, which can operate in three polarization modes. The receiving antenna of the rectenna is a polarization reconfigurable planar monopole antenna. By installing switches on the feeding network, the antenna can switch to receive electromagnetic (EM) waves with different polarizations, including linear polarization (LP), right-hand and left-hand circular polarizations (RHCP/LHCP). To achieve stable conversion efficiency of the rectenna (nr) in all the modes within a wide frequency band, a tunable matching network is inserted between the rectifying circuit and the antenna. The measured nr changes from 23.8% to 31.9% in the LP mode within 5.1-5.8 GHz and from 22.7% to 24.5% in the CP modes over 5.8-6 GHz. Compared to rectennas with conventional broadband matching network, the proposed rectenna exhibits more stable conversion efficiency.","1558-2221","","10.1109/TAP.2016.2518198","National Natural Science Foundation of China(grant numbers:61271027,61331007,61271025); ","https://ieeexplore.ieee.org/stamp/stamp.jsp?arnumber=7383268","Broadband;polarization reconfigurable rectenna;tunable matching network;stable efficiency;Broadband;polarization reconfigurable rectenna;stable efficiency;tunable matching network","Rectennas;Broadband antennas;Rectifying circuits;Antenna radiation patterns;Broadband communication;Receiving antennas","","80","","19","IEEE","14 Jan 2016","","","IEEE","IEEE Journals"
"Exploiting Intrinsic Dispersion of Metamaterials for Designing Broadband Aperture Antennas: Theory and Experimental Verification","D. Ramaccia; M. Barbuto; A. Monti; A. Verrengia; F. Trotta; D. Muha; S. Hrabar; F. Bilotti; A. Toscano","Department of Engineering, “RomaTre” University, Rome, Italy; “Niccolò Cusano” University, Rome, Italy; “Niccolò Cusano” University, Rome, Italy; Department of Engineering, “RomaTre” University, Rome, Italy; Elettronica S.p.A, Rome, Italy; Faculty of Electrical Engineering and Computing, University of Zagreb, Zagreb, Croatia; Faculty of Electrical Engineering and Computing, University of Zagreb, Zagreb, Croatia; Department of Engineering, “RomaTre” University, Rome, Italy; Department of Engineering, “RomaTre” University, Rome, Italy",IEEE Transactions on Antennas and Propagation,"1 Mar 2016","2016","64","3","1141","1146","The intrinsic frequency dispersion has usually been considered as a relevant drawback of metamaterials, limiting their application to narrowband microwave components. However, we have recently demonstrated that a particular metamaterial-based lens, consisting of a combination of an epsilon-near-zero (ENZ) material and air, is able to enhance the gain of short horn antennas over a broad frequency range. This result was achieved by exploiting the dispersive nature of ENZ metamaterials. In this communication, we further discuss the latter aspect, giving more details about the physical mechanism enabling broadband operation of shortened horns loaded with ENZ-air lenses. The discussion is supported by a set of experimental results obtained on a fabricated prototype.","1558-2221","","10.1109/TAP.2016.2521871","","https://ieeexplore.ieee.org/stamp/stamp.jsp?arnumber=7393496","Aperture antennas;Antenna radiation patterns;Electromagnetic metamaterials;Antenna radiation patterns;aperture antennas;electromagnetic metamaterials;gain control;horn antennas","Lenses;Horn antennas;Aperture antennas;Broadband antennas;Delays;Dispersion","","26","","30","IEEE","26 Jan 2016","","","IEEE","IEEE Journals"
"A Planar End-Fire Circularly Polarized Complementary Antenna With Beam in Parallel With Its Plane","W. -H. Zhang; W. -J. Lu; K. -W. Tam","Department of Electrical and Computer Engineering, Faculty of Science and Technology, University of Macau, Macao, China; Jiangsu Key Laboratory of Wireless Communications, Nanjing University of Posts and Telecommunications, Nanjing, China; Department of Electrical and Computer Engineering, Faculty of Science and Technology, University of Macau, Macao, China",IEEE Transactions on Antennas and Propagation,"1 Mar 2016","2016","64","3","1146","1152","Operation principle and design approach of a novel planar end-lire circularly polarized (CP) complementary antenna is proposed. A vertically polarized printed magnetic dipole and a horizontally polarized printed dipole are combined on the same substrate, and a planar CP antenna with end-lire beam in parallel with its plane is thus designed. Prototype antennas centered at 5.80 GHz are then fabricated and measured to validate the operation principle and the design approach. The experimental prototype reported that the impedance bandwidth (20 log |S11| ( <; -10 dB) is about 1.90%, from 5.75 to 5.86 GHz and the 3-dB axial ratio (AR) bandwidth is about 14.48%, from 5.19 to 6.00 GHz. Therefore, the proposed design is applicable as a low-prolile handheld reader antenna in radio-frequency identilication (RFID) systems.","1558-2221","","10.1109/TAP.2016.2518204","FDCT project(grant numbers:015/2013/A1); University of Macau and National Natural Science Foundation of China(grant numbers:61471204); ","https://ieeexplore.ieee.org/stamp/stamp.jsp?arnumber=7383253","Circularly polarized;end-fire;planar antenna;complementary antenna;hand-held RFID reader;Circularly polarized (CP);complementary antenna;end fire;handheld radio-frequency identification (RFID) reader;planar antenna","Dipole antennas;Apertures;Bandwidth;Antenna radiation patterns;Substrates;Impedance","","133","1","40","IEEE","14 Jan 2016","","","IEEE","IEEE Journals"
"Antenna Measurements in Reverberation Chamber Using USRP","A. Hussain; A. Alayón Glazunov; B. Þ. Einarsson; P. -S. Kildal","Chalmers University of Technology, Gothenburg, Sweden; Department of Signals and Systems, Chalmers University of Technology, Gothenburg, Sweden; Chalmers University of Technology, Gothenburg, Sweden; Department of Signals and Systems, Chalmers University of Technology, Gothenburg, Sweden",IEEE Transactions on Antennas and Propagation,"1 Mar 2016","2016","64","3","1152","1157","This paper shows that a universal software radio peripheral (USRP) can be used to measure the complete passive over-the-air (OTA) performance of multiport antennas for multiple-input multiple-output (MIMO) systems. The passive MIMO OTA measurements are performed in a reverberation chamber using the USRP as a measurement instrument. The total embedded radiation efficiencies, the correlation, and the resulting diversity gain are extracted from transmission measurements only. These are in good agreement with S-parameter measurements (both transmission and reflection) obtained with a vector network analyzer (VNA). The proposed measurement approach involving USRPs provide an economical alternative to these type of measurements as compared to high-end equipment.","1558-2221","","10.1109/TAP.2016.2518211","VINNOVA; ","https://ieeexplore.ieee.org/stamp/stamp.jsp?arnumber=7383242","OTA;MIMO;USRP;efficiency;correlation coefficient;diversity gain;reverberation chamber;Correlation coefficient;diversity gain;efficiency;multiple-input multiple-output (MIMO);over-the-air (OTA);reverberation chamber (RC);universal software radio peripheral (USRP)","Antenna measurements;MIMO;Reverberation chambers;Broadband antennas;Diversity methods;Wideband;Ports (Computers)","","9","","18","IEEE","14 Jan 2016","","","IEEE","IEEE Journals"
"Solid-Angle Error in the Magnetic-Field Integral Equation for Perfectly Electric Conducting Objects","W. -F. Huang; Y. Ren; Q. H. Liu","Department of Electrical and Computer Engineering, Duke University, Durham, NC, USA; Department of Electrical and Computer Engineering, Duke University, Durham, NC, USA; Department of Electrical and Computer Engineering, Duke University, Durham, NC, USA",IEEE Transactions on Antennas and Propagation,"1 Mar 2016","2016","64","3","1158","1163","For perfectly electric conducting (PEC) objects, one difference between the electric-field integral equation (EFIE) and the magnetic-field integral equation (MFIE) is related to the solid angle, which only exists in the latter. In this communication, the correct computation of solid-angle contribution in MFIE is first summarized and clarified. Through testing strictly inside triangles (TSIT) and testing on edges (TOE) with or without the correct limit value (CLV) for the solid-angle integral, six versions of MFIE are then implemented by utilizing Rao-Wilton-Glisson (RWG) functions for expansion and utilizing RWG or rotated Buffa-Christiansen (BC) functions for testing. Based on the simulations of typical sharp-edged targets and a sphere by the EFIE and six MFIEs, it is found that using CLVs for the solid-angle integral will improve the simulation accuracy substantially in comparison to that with incorrect limit values (ILVs). Moreover, if the singularities are properly handled, the MFIE implemented by TSIT can achieve the same accuracy with the MFIE implemented by TOE with CLVs.","1558-2221","","10.1109/TAP.2016.2518207","","https://ieeexplore.ieee.org/stamp/stamp.jsp?arnumber=7383262","Buffa-Christiansen (BC) functions;magnetic field integral equation (MFIE);method of moments (MoM);solid angle;Buffa–Christiansen (BC) functions;magnetic-field integral equation (MFIE);method of moments (MoM);solid angle","Solids;Testing;Manganese;Integral equations;Frequency modulation;Solid modeling;Method of moments","","13","","40","IEEE","14 Jan 2016","","","IEEE","IEEE Journals"
"Antenna Gain Enhancement Using a Holey Superstrate","J. H. Kim; C. -H. Ahn; J. -K. Bang","Korea Railroad Research Institute, Uiwang, Korea; Korea Railroad Research Institute, Uiwang, Korea; Samsung Electronics Co. Ltd, Suwon, Korea",IEEE Transactions on Antennas and Propagation,"1 Mar 2016","2016","64","3","1164","1167","Antenna gain enhancement using a holey dielectric superstrate on a microstrip patch antenna is presented. Antenna gain is increased by creating an in-phase electric-field area on the upper surface of the superstrate. In order to create the in-phase field, the effective permittivity of the superstrate is controlled by changing the radius of the holes in the superstrate. The proposed antenna is fabricated and measured. It achieves a 2.3-dB gain enhancement when the superstrate is added over the microstrip antenna at the design frequency of 5.8 GHz. The electric field is also simulated and it is observed to follow similar phase distributions on the superstrate.","1558-2221","","10.1109/TAP.2016.2518650","Korea Railroad Research Institute; ","https://ieeexplore.ieee.org/stamp/stamp.jsp?arnumber=7384460","Microstrip antennas;Permittivity;Antenna gain;Antenna gain;microstrip antennas;permittivity","Permittivity;Gain;Antenna measurements;Patch antennas;Antenna radiation patterns;Dielectrics","","86","","11","IEEE","18 Jan 2016","","","IEEE","IEEE Journals"
"An Integrated On-Chip Implantable Antenna in $0.18-\mu\text{m}$ CMOS Technology for Biomedical Applications","C. Liu; Y. -X. Guo; X. Liu; S. Xiao","Department of Electrical and Computer Engineering, National University of Singapore, Singapore; National University of Singapore Suzhou Research Institute, Suzhou, China; School of Electronic and Information Engineering, Soochow University, Jiangsu, China; School of Physical Electronics, University of Electronic Science and Technology of China, Chengdu, China",IEEE Transactions on Antennas and Propagation,"1 Mar 2016","2016","64","3","1167","1172","A differentially driven miniaturized integrated on-chip implantable antenna with a total area of 1.4 × 1.8 mm2 is designed and tested for biomedical applications in this communication. The antenna is fabricated on the 0.18 μm standard CMOS technology to make it be easily integrated with a transmitter designed using the same process. The proposed antenna is firstly optimized in a one-layer skin model. CST voxel human head model is used to evaluate the accuracy of the design concept. The simulated reflection coefficient and coupling strength are studied and compared in two simulation models. A simple dipole antenna is placed over the skin to demonstrate the communication link. A chip-to-SMA transition is designed for testing. The simulated and measured results are well agreed, which demonstrates the communication ability of the proposed antenna. The effect of various issues in the measurement setup is discussed.","1558-2221","","10.1109/TAP.2016.2518201","National Natural Science Foundation of China(grant numbers:61301076,61372012,61271028); Natural Science Foundation of Jiangsu Province(grant numbers:BK20130375,BK20130326); Open Research Program of State Key Laboratory of Millimeter Waves in China(grant numbers:K201417); ","https://ieeexplore.ieee.org/stamp/stamp.jsp?arnumber=7383258","Implantable antenna;on-chip antenna;small antenna;industrial;scientific and medical (ISM);Implantable antenna;industrial, scientific, and medical (ISM);on-chip antenna;small antenna","Dipole antennas;System-on-chip;Skin;Antenna measurements;Wires;Reflection coefficient","","22","","31","IEEE","14 Jan 2016","","","IEEE","IEEE Journals"
"A Frequency Reconfigurable Directive Antenna With Wideband Low-RCS Property","C. Huang; W. Pan; X. Ma; X. Luo","State Key Laboratory of Optical Technologies on Nano-Fabrication and Micro-Engineering, Institute of Optics and Electronics, Chinese Academy of Sciences, Chengdu, China; State Key Laboratory of Optical Technologies on Nano-Fabrication and Micro-Engineering, Institute of Optics and Electronics, Chinese Academy of Sciences, Chengdu, China; State Key Laboratory of Optical Technologies on Nano-Fabrication and Micro-Engineering, Institute of Optics and Electronics, Chinese Academy of Sciences, Chengdu, China; State Key Laboratory of Optical Technologies on Nano-Fabrication and Micro-Engineering, Institute of Optics and Electronics, Chinese Academy of Sciences, Chengdu, China",IEEE Transactions on Antennas and Propagation,"1 Mar 2016","2016","64","3","1173","1178","In this communication, a frequency reconfigurable directive antenna with low-radar cross section (RCS) property is presented. This antenna is composed of a slot-coupled microstrip patch and a two-layer metastructure. The top-layer metastructure integrates a partially reflection surface (PRS) with an absorbing surface, and the bottom-layer one consists of tunable reflection phase cells, which are loaded around the antenna source. The absorbing surface can absorb most of the incoming wave, and thus reduce the antenna RCS. The PRS and tunable reflection phase cells form a Fabry-Perot resonance cavity, making the antenna produce a highly directive beam. In addition, the operation frequency can be dynamically tuned by controlling the varactor diodes in the reflection phase cells. Both simulated and measured results have verified that employing the two-layer metastructure makes the antenna RCS largely reduced at a wide band ranging from 8 to 14 GHz. Compared with the traditional microstrip antenna, this antenna radiates a highly directive beam with gain enhancement of about 7 dB, and its operation frequency can be actively tuned from 9.05 to 10 GHz.","1558-2221","","10.1109/TAP.2016.2518199","973 Program of China(grant numbers:2013CBA01700); National Natural Science Funds(grant numbers:61475160); ","https://ieeexplore.ieee.org/stamp/stamp.jsp?arnumber=7383238","low-RCS;high-gain antenna;tunable frequency;metastructure;High-gain antenna;low-radar cross section (RCS);metastructure;tunable frequency","Reflection;Directive antennas;Cavity resonators;Surface waves;Reflector antennas;Capacitance","","83","","26","IEEE","14 Jan 2016","","","IEEE","IEEE Journals"
"Member Get-A-Member (MGM) Program","",,IEEE Transactions on Antennas and Propagation,"1 Mar 2016","2016","64","3","1179","1179","Advertisement, IEEE. Presents information on the Member Get-A-Member (MGM) Program.","1558-2221","","10.1109/TAP.2016.2537059","","https://ieeexplore.ieee.org/stamp/stamp.jsp?arnumber=7422877","","","","","","","IEEE","1 Mar 2016","","","IEEE","IEEE Journals"
