"A Novel Approach for the Efficient Computation of 1-D and 2-D Summations","E. P. Karabulut; V. B. Ertürk; L. Alatan; S. Karan; B. Alisan; M. I. Aksun","Department of Electrical and Electronics Engineering, Bahcesehir University, Istanbul, Turkey; Department of Electrical and Electronics Engineering, Bilkent University, Ankara, Turkey; Department of Electrical and Electronics Engineering, Middle East Technical University, Ankara, Turkey; Aselsan Electronics Inc., Ankara, Turkey; Aselsan Electronics Inc., Ankara, Turkey; Department of Electrical and Electronics Engineering, Koc University, Istanbul, Turkey",IEEE Transactions on Antennas and Propagation,"1 Mar 2016","2016","64","3","1014","1022","A novel computational method is proposed to evaluate 1-D and 2-D summations and integrals which are relatively difficult to compute numerically. The method is based on applying a subspace algorithm to the samples of partial sums and approximating them in terms of complex exponentials. For a convergent summation, the residue of the exponential term with zero complex pole of this approximation corresponds to the result of the summation. Since the procedure requires the evaluation of relatively small number of terms, the computation time for the evaluation of the summation is reduced significantly. In addition, by using the proposed method, very accurate and convergent results are obtained for the summations which are not even absolutely convergent. The efficiency and accuracy of the method are verified by evaluating some challenging 1-D and 2-D summations and integrals.","1558-2221","","10.1109/TAP.2016.2521860","","https://ieeexplore.ieee.org/stamp/stamp.jsp?arnumber=7393519","Numerical methods;acceleration techniques;Green’s functions;Sommerfeld integrals;cylindrically stratified media;planar layered structures;periodic structures;Acceleration techniques;cylindrically stratified media;Green’s functions;numerical methods;periodic structures;planar layered structures;Sommerfeld integrals","Niobium;Antennas;Poles and zeros;Green's function methods;Yttrium;Periodic structures;Geometry","","2","","17","IEEE","26 Jan 2016","","","IEEE","IEEE Journals"
"Parametric Modeling of Radiation Patterns and Scattering Parameters of Antennas","N. Mutonkole; E. R. Samuel; D. I. L. de Villiers; T. Dhaene","Department of Electrical and Electronic Engineering, Stellenbosch University, Stellenbosch, South Africa; Department of Information Technology (INTEC), Ghent University—iMinds, Ghent, Belgium; Department of Electrical and Electronic Engineering, Stellenbosch University, Stellenbosch, South Africa; Department of Information Technology (INTEC), Ghent University—iMinds, Ghent, Belgium",IEEE Transactions on Antennas and Propagation,"1 Mar 2016","2016","64","3","1023","1031","This paper describes a data-driven method to model the radiation patterns (over a large angular region) and scattering parameters of antennas as a function of the geometry of the antenna. The radiation pattern model consists of a linear combination of characteristic basis function patterns (CBFPs), where the expansion coefficients of the CBFPs are the functions of geometrical features of the antenna. Scattering parameters are modeled by means of parameterized state-space matrices. The obtained models are quick to evaluate and are thus suitable for design activities where multiple simulations are required. The proposed method is validated through illustrative examples.","1558-2221","","10.1109/TAP.2016.2521883","South African Research Chair Initiative of the Department of Science and Technology; ","https://ieeexplore.ieee.org/stamp/stamp.jsp?arnumber=7393518","Antenna radiation patterns;interpolation;modeling;state-space methods;Antenna radiation patterns;interpolation;modeling;state-space methods","Antenna radiation patterns;Parametric statistics;Analytical models;Estimation;Frequency modulation;Geometry","","19","","27","IEEE","26 Jan 2016","","","IEEE","IEEE Journals"
"Analysis of Electromagnetic Wave Scattering by Graphene Flakes Using the Generalized Multipole Technique","S. M. Raeis-Zadeh; S. Safavi-Naeini","Center of Intelligent Antenna and Radio Systems (CIARS), Department of Electrical and Computer Engineering, University of Waterloo, Waterloo, ON, Canada; Center of Intelligent Antenna and Radio Systems (CIARS), Department of Electrical and Computer Engineering, University of Waterloo, Waterloo, ON, Canada",IEEE Transactions on Antennas and Propagation,"1 Mar 2016","2016","64","3","1032","1038","The generalized multipole method is applied to the analysis of the electromagnetic wave scattered by graphene flakes. In the proposed method, the graphene flakes are modeled as surface current sheets causing a discontinuity in the magnetic field. This method is used to analyze the scattering from isolated islands of the graphene layer. In addition, the field enhancement between two nearby graphene flakes as well as the field distribution of a two dimensional periodic configuration of these flakes are investigated with the proposed method. To validate the developed method, its numerical results are compared with those of the finite element method (FEM). As compared to the model used in the FEM, the surface current model used in the proposed method significantly reduces the computational complexity.","1558-2221","","10.1109/TAP.2016.2515123","National Science and Engineering Research Council (NSERC) of Canada; BlackBerry (former Research In Motion).; ","https://ieeexplore.ieee.org/stamp/stamp.jsp?arnumber=7373566","graphene;nanoparticles;electromagnetic scattering;plasmons;Electromagnetic scattering;graphene;nanoparticles;plasmons","Graphene;Boundary conditions;Electromagnetic scattering;Optical surface waves;Numerical models;Surface waves","","10","","33","IEEE","6 Jan 2016","","","IEEE","IEEE Journals"
"Transient Electromagnetic Scattering by a Radially Uniaxial Dielectric Sphere: The Generalized Debye and Mie Series Solutions","M. Yazdani; J. R. Mautz; J. K. Lee; E. Arvas","Syracuse University, Syracuse, NY, USA; Syracuse University, Syracuse, NY, USA; Syracuse University, Syracuse, NY, USA; Syracuse University, Syracuse, NY, USA",IEEE Transactions on Antennas and Propagation,"1 Mar 2016","2016","64","3","1039","1046","In this paper, a theoretical study is carried out to determine the scattering of a transient electromagnetics wave by a radially uniaxial dielectric sphere. This is achieved by inverse Laplace transformation of the frequency-domain scattering solution. To improve understanding of the scattering mechanism from a uniaxial dielectric sphere, two different frequency-domain solutions are employed. In the first approach, the impulse and step responses of a uniaxial dielectric sphere are evaluated by the Mie series solution. Following the high-frequency (HF) scattering solution of a large uniaxial sphere, the Mie series summation is split into high-frequency (HF) and low-frequency terms where the HF term is replaced by its asymptotic expression allowing a significant reduction in computation time of the numerical Bromwich integral. In the second approach, the generalized Debye series solution is introduced, and the generalized Mie series coefficients are replaced by their equivalent Debye series formulations. The results are then applied to evaluate the transient response of each individual Debye term allowing the identification of impulse returns in the transient response of a uniaxial sphere. The effect of variation in permittivity on the arrival time as well as amplitudes of each impulse return is studied, and the results are compared with those computed using the Mie series solution. The numerical results obtained from both methods are in complete agreement.","1558-2221","","10.1109/TAP.2016.2515129","","https://ieeexplore.ieee.org/stamp/stamp.jsp?arnumber=7373559","Debye series solution;High frequency backscattering;Mie series solution;Transient scattering;Debye series solution;high-frequency backscattering;Mie series solution;transient scattering","Dielectrics;Transient analysis;Transient response;Geometrical optics;Electromagnetic scattering;Time-frequency analysis","","2","","20","IEEE","6 Jan 2016","","","IEEE","IEEE Journals"
"Full-Wave Computational Model of Electromagnetic Scattering by Arbitrarily Rotated 1-D Periodic Multilayer Structure","C. Li; D. Lesselier; Y. Zhong","Laboratoire des Signaux et Systèmes (L2S) UMR8506, CNRS—CentraleSupélec-Université Paris-Sud, Université Paris Saclay, Gif-sur-Yvette, France; Laboratoire des Signaux et Systèmes (L2S) UMR8506, CNRS—CentraleSupélec-Université Paris-Sud, Université Paris Saclay, Gif-sur-Yvette, France; A*Star, Institute of High Performance Computing, Singapore",IEEE Transactions on Antennas and Propagation,"1 Mar 2016","2016","64","3","1047","1060","A full-wave computational model of electromagnetic scattering of conically incident plane waves by arbitrarily rotated 1-D periodic multilayer structure is proposed. Each layer in the structure (overall sandwiched between two half-spaces) consists of a dielectric material within which an infinite chain of periodically arranged and arbitrarily orientated circular cylinders is embedded. The orientations of the cylinder arrays in different layers are arbitrary with respect to one another, offering full generality. The above is a model of fiber-reinforced composite laminates as in industry but also of multilayered photonic crystals. Combining Rayleigh's method and mode-matching produces scattering matrices for each layer cascaded from the top to the bottom in order to relate the reflection/transmission coefficients to the incident field. Power reflection and transmission coefficients follow from Poynting's theorem. The mathematical derivation insists on modal representations and building up proper S-matrices. Numerical simulations show that the model is accurate, known results on woodpile structures in photonics are in particular recovered. The model is also versatile in terms of illuminations, geometries, and material parameters. The results could also be used as benchmarks in view of lack of data in present-day literature on such arbitrarily orientated layerings. Calculations of pertinent dyadic Green functions is one of possible extensions in view of the imaging methods of possibly damaged multilayer structures.","1558-2221","","10.1109/TAP.2016.2521864","","https://ieeexplore.ieee.org/stamp/stamp.jsp?arnumber=7393515","Electromagnetic scattering;Computational physics;Photonic Crystals;Laminated fiber-reinforced composites;Woodpiles;Multipole expansion;Plane wave expansion;Computational physics;electromagnetic scattering;laminated fiber-reinforced composites;multipole expansion;photonic crystals;plane wave expansion;woodpiles","Periodic structures;Nonhomogeneous media;Computational modeling;Yttrium;Laminates;Scattering;Numerical models","","19","","29","IEEE","26 Jan 2016","","","IEEE","IEEE Journals"
"Design of Wavetraps for Isolation Improvement in Compact In-Band Full-Duplex Relay Antennas","M. Heino; S. N. Venkatasubramanian; C. Icheln; K. Haneda","Department of Radio Science and Engineering, Aalto University School of Electrical Engineering, Espoo, Finland; Department of Radio Science and Engineering, Aalto University School of Electrical Engineering, Espoo, Finland; Department of Radio Science and Engineering, Aalto University School of Electrical Engineering, Espoo, Finland; Department of Radio Science and Engineering, Aalto University School of Electrical Engineering, Espoo, Finland",IEEE Transactions on Antennas and Propagation,"1 Mar 2016","2016","64","3","1061","1070","In full-duplex (FDX) multiple-input and multiple-output (MIMO) systems, the self-interference between each transmitting and receiving antenna, caused by finite isolation between antennas, limits the obtainable signal-to-interference ratio of the system and thus the total capacity. In this paper, the design of planar wavetraps for isolation improvement between multiple antennas is introduced, with an emphasis on back-to-back relay structures. General guidelines for the design of planar wavetraps are deduced which could be applied also in isolation improvement of other antenna structures. A prototype back-to-back relay antenna with two dual-polarized patches for FDX MIMO is presented with the frequency of operation of 2.6 GHz. The prototype antenna is manufactured and the simulated results are validated with measurements. The minimum isolation among each antenna pair on the opposite sides of the relay is improved by 20 dB across a 18-MHz bandwidth, while 15-dB improvement can be obtained across 167-MHz bandwidth, yielding total isolation levels of 70 and 65 dB, respectively. The radiation pattern of the relay antenna is measured with and without wavetraps to show that the wavetraps do not have significant effect on the main lobe radiation properties.","1558-2221","","10.1109/TAP.2015.2513081","Academy of Finland(grant numbers:258364); Finnish Funding Agency for Technology and Innovation(grant numbers:40313/12); ","https://ieeexplore.ieee.org/stamp/stamp.jsp?arnumber=7368122","Electromagnetic coupling;interference cancellation;patch antennas;in-band full-duplex;MIMO;wavetrap;Electromagnetic coupling;in-band full-duplex (FDX);interference cancellation;multiple-input and multiple-output (MIMO);patch antennas;wavetrap","Relays;MIMO;Receiving antennas;Ports (Computers);Antenna radiation patterns;Couplings","","52","","18","IEEE","29 Dec 2015","","","IEEE","IEEE Journals"
"Study on the Prediction of Troposcatter Transmission Loss","L. Li; Z. -S. Wu; L. -K. Lin; R. Zhang; Z. -W. Zhao","School of Physics and Optoelectronic Engineering, Xidian University, Xi’an, 710071, China; School of Physics and Optoelectronic Engineering, Xidian University, Xi’an, 710071, China; National Key Laboratory of Electromagnetic Environment, China Research Institute of Radiowave Propagation (CRIRP), Qingdao, China; National Key Laboratory of Electromagnetic Environment, China Research Institute of Radiowave Propagation (CRIRP), Qingdao, China; National Key Laboratory of Electromagnetic Environment, China Research Institute of Radiowave Propagation (CRIRP), Qingdao, China",IEEE Transactions on Antennas and Propagation,"1 Mar 2016","2016","64","3","1071","1079","In this article, a novel semiempirical average annual troposcatter transmission loss prediction model is presented. The model is generated by optimizing the correlation coefficients of propagation path conditions utilizing the modern optimization algorithm. The statistical relativities of troposcatter transmission loss as captured by changing frequency, path length, scatter angle, and meteorological condition are each analyzed using the terrestrial trans-horizon propagation loss data banks released by the International Telecommunication Union (ITU). For the percentages of time transmission loss not falling below 50%, the model is combined with the model of anomalous propagation mechanism introduced in the Recommendation ITU-R P.2001. The prediction results of this new troposcatter model are compared with other troposcatter models and with the trans-horizon propagation loss data banks. The comparisons show that the new model has a better estimated accuracy.","1558-2221","","10.1109/TAP.2016.2515125","National Natural Science Foundation of China(grant numbers:61471329); National Key Laboratory of Electromagnetic Environment; ","https://ieeexplore.ieee.org/stamp/stamp.jsp?arnumber=7373584","Troposcatter;Transmission loss;Optimization algorithm;Trans-horizon propagation;Average year;Prediction model;Average year;optimization algorithm;prediction model;trans-horizon propagation;transmission loss;troposcatter","Propagation losses;Predictive models;Mathematical model;Meteorology;Transmitting antennas;Data models;Interference","","20","","27","IEEE","6 Jan 2016","","","IEEE","IEEE Journals"
"High-PRF UWB Optoelectronic Radar System: A CLEAN-Type Algorithm to Overcome Depth Limitation","R. Négrier; M. Lalande; J. Andrieu; B. M. Shalaby; V. Couderc; T. Fromenteze; C. Decroze; D. Carsenat","XLIM OSA, University of Limoges, Limoges, France; XLIM OSA, University of Limoges, Limoges, France; XLIM OSA, University of Limoges, Limoges, France; Department of Physics, Faculty of Science, Tanta University, Tanta, Egypt; XLIM OSA, University of Limoges, Limoges, France; XLIM OSA, University of Limoges, Limoges, France; XLIM OSA, University of Limoges, Limoges, France; XLIM OSA, University of Limoges, Limoges, France",IEEE Transactions on Antennas and Propagation,"1 Mar 2016","2016","64","3","1080","1088","The ultrafast speed and the large spatial area scanning autonomy are the two main advantages of the new radar presented in this paper. Indeed, the autonomous beam scanning capability with high pulse repetition frequency (PRF) is obtained by coherent combining of electrical fields emitted from active antennas' array integrating photoconductive switching devices. An original signal processing associated with this new radar system is presented. We show a hybrid version of a CLEAN algorithm able to overcome the depth limitation induced by high PRF with standard imaging signal processing. Simulations and measurements are performed to validate the proper operation of the algorithm.","1558-2221","","10.1109/TAP.2016.2517672","French Armament Procurement Agency DGA; French National Research Agency ANR; ","https://ieeexplore.ieee.org/stamp/stamp.jsp?arnumber=7381616","Ultra wideband Radar;Image processing;Optical switches;Ultrawideband radar (UWB);image processing;optical switches","Radar imaging;Radar antennas;Signal processing algorithms;Generators;Optical imaging","","8","","16","IEEE","13 Jan 2016","","","IEEE","IEEE Journals"
"Scaling Cloud Attenuation Statistics With Link Elevation in Earth-Space Applications","L. Luini; C. Capsoni","Dipartimento di Elettronica, Informazione e Bioingegneria (DEIB), Politecnico di Milano, Milano, Italy; Dipartimento di Elettronica, Informazione e Bioingegneria (DEIB), Politecnico di Milano, Milano, Italy",IEEE Transactions on Antennas and Propagation,"1 Mar 2016","2016","64","3","1089","1095","A methodology to scale cloud attenuation statistics with link elevation in Earth-space applications is presented in this contribution. The vertical and horizontal distribution of clouds is investigated by taking advantage of the liquid water content observed by the cloud profiling radar (CPR) onboard the CloudSat Earth Observation satellite. Besides casting some light on the actual validity of the customary assumption of horizontal uniformity for clouds, analytical expressions for the scaling factor are proposed to derive cloud attenuation statistics on slant paths from attenuation predictions at zenith. The proposed methodology could be beneficial to improve the accuracy of the model currently adopted by the ITU-R in recommendation P.840-6, especially when low elevation links (e.g., between 5° and 20°) are involved.","1558-2221","","10.1109/TAP.2016.2521872","","https://ieeexplore.ieee.org/stamp/stamp.jsp?arnumber=7393517","Electromagnetic propagation;cloud effects;satellite communications;Cloud effects;electromagnetic propagation;satellite communications","Clouds;Liquids;Attenuation;Cloud computing;Earth;Satellites;Spaceborne radar","","8","","18","IEEE","26 Jan 2016","","","IEEE","IEEE Journals"
"CPW-Fed Printed Antenna Array With Conical Beam","D. Hua; S. -S. Qi; W. Wu; D. -G. Fang","Ministerial Key Laboratory of JGMT, Nanjing University of Science and Technology, Nanjing, China; Ministerial Key Laboratory of JGMT, Nanjing University of Science and Technology, Nanjing, China; Ministerial Key Laboratory of JGMT, Nanjing University of Science and Technology, Nanjing, China; Ministerial Key Laboratory of JGMT, Nanjing University of Science and Technology, Nanjing, China",IEEE Transactions on Antennas and Propagation,"1 Mar 2016","2016","64","3","1096","1100","A printed antenna array with conical beam is presented. Coplanar waveguide (CPW) is used to feed the antenna. Loop slots with finite width of ground plane, which play the role of radiating elements are arranged collinearly to form a traveling wave antenna array. The widths of the loop slots are adjusted to achieve low sidelobe performance. The design procedures are proposed and a 16-element array with beam-pointing angle of 77° is fabricated and measured to verify the design. The measured 15-dB return loss bandwidth is 11.4% at central frequency of 10.5 GHz. The measured gain and the sidelobe level are 10.3 dBi and $-20\;\text{dB}$, respectively. The agreement between the measured and the simulated results is acceptable.","1558-2221","","10.1109/TAP.2015.2513087","National Natural Science Foundation of China(grant numbers:61301018); China Postdoctoral Science Foundation(grant numbers:2013M541670); Priority Academic Program Development of Jiangsu Higher Education Institutions; ","https://ieeexplore.ieee.org/stamp/stamp.jsp?arnumber=7368098","Conical beam;CPW;traveling wave antenna;Conical beam;CPW;traveling wave antenna","Arrays;Antenna arrays;Finite element analysis;Antenna measurements;Impedance;Power transmission lines","","9","","18","IEEE","29 Dec 2015","","","IEEE","IEEE Journals"
"Design of Compact F-Shaped Slot Triple-Band Antenna for WLAN/WiMAX Applications","A. K. Gautam; L. Kumar; B. K. Kanaujia; K. Rambabu","Department of Electronics and Communication Engineering, G. B. Pant Engineering College, Pauri Garhwal, India; Department of Electronics and Communication Engineering, G. B. Pant Engineering College, Pauri Garhwal, India; Department of Electronics and Communication Engineering, Ambedkar Institute of Advanced Communication Technologies and Research, New Delhi, India; Department of Electrical and Computer Engineering, University of Alberta, Edmonton, AB, Canada",IEEE Transactions on Antennas and Propagation,"1 Mar 2016","2016","64","3","1101","1105","This communication presents a small, low-profile planar triple-band microstrip antenna for WLAN/WiMAX applications. The goal of this communication is to combine WLAN and WiMAX communication standards simultaneously into a single device by designing a single antenna that can excite triple-band operation. The designed antenna has a compact size of $19 \times 25\;\text{mm}^{2}$ ($0.152 \lambda_{0}\;\times 0.2 \lambda_{0}$). The proposed antenna consists of F-shaped slot radiators and a defected ground plane. Since only two F-shaped slots are etched on either sides of the radiator for triple-band operation, the radiator is very compact in size and simple in structure. The antenna shows three distinct bands I from 2.0 to 2.76, II from 3.04 to 4.0, and III from 5.2 to 6.0 GHz, which covers entire WLAN (2.4/5.2/5.8 GHz) and WiMAX (2.5/3.5/5.5) bands. To validate the proposed design, an experimental prototype has been fabricated and tested. Thus, the simulation results along with the measurements show that the antenna can simultaneously operate over WLAN (2.4/5.2/5.8 GHz) and WiMAX (2.5/3.5/5.5 GHz) frequency bands.","1558-2221","","10.1109/TAP.2015.2513099","","https://ieeexplore.ieee.org/stamp/stamp.jsp?arnumber=7368111","Multiband antenna;Triple band;WiMAX;WLAN Application;Multiband antenna;triple band;WiMAX;WLAN application","Slot antennas;Wireless LAN;Microstrip antennas;WiMAX;Resonant frequency;Microstrip","","118","","15","IEEE","29 Dec 2015","","","IEEE","IEEE Journals"
"Simplified Modal Expansion to Analyze Frequency-Selective Surfaces: An Equivalent Circuit Approach","F. Mesa; R. Rodríguez-Berral; M. García-Vigueras; F. Medina; J. R. Mosig","Department of Applied Physics 1, ETS de Ingeniería Informática, Universidad de Sevilla, Seville, Spain; Department of Applied Physics 1, ETS de Ingeniería Informática, Universidad de Sevilla, Seville, Spain; Institut d’Electronique et de Teéleécommunications de Rennes, INSA de Rennes, Rennes, France; Microwaves Group, Department of Electronics and Electromagnetism, Faculty of Physics, Universidad de Sevilla, Sevilla, Spain; Laboratory of Electromagnetics and Acoustics, Ecole Polytechnique Federale de Laussane, Lausanne, Switzerland",IEEE Transactions on Antennas and Propagation,"1 Mar 2016","2016","64","3","1106","1111","This communication extends a previously reported analytical circuit that models the plane wave scattering by 2-D arrays of planar patches/apertures embedded in a layered media. In this extension, it is assumed that the current/electric field spatial profile in the patch/aperture region can directly be taken from the eigenfields of a waveguide whose cross section matches the scatterer boundaries. This methodology exploits all the advantages of the circuit modeling and gives place to a very efficient computational tool for many practical frequency-selective surfaces (FSSs). The circuit model is expected to work up to frequencies where the isolated scatterers have their third resonance. Thus, it allows us to provide unified equivalent circuits to deal with conical incidence and with certain symmetric cases involving two or three patches/apertures in the unit cell.","1558-2221","","10.1109/TAP.2015.2513423","Spanish Ministerio de Economía y Competitividad with European Union FEDER(grant numbers:TEC2013-41913-P); Spanish Junta de Andalucía(grant numbers:P12-TIC-1435); ","https://ieeexplore.ieee.org/stamp/stamp.jsp?arnumber=7368870","Equivalent circuits;electromagnetic scattering by periodic structures;frequency selective surfaces;Equivalent circuits;electromagnetic scattering by periodic structures;frequency selective surfaces","Integrated circuit modeling;Yttrium;Equivalent circuits;Harmonic analysis;Apertures;Frequency selective surfaces","","38","","25","IEEE","30 Dec 2015","","","IEEE","IEEE Journals"
