"Marching-on-in-Degree Method With Delayed Weighted Laguerre Polynomials for Transient Electromagnetic Scattering Analysis","D. Z. Ding; H. H. Zhang; R. S. Chen","Department of Communication Engineering, Nanjing University of Science and Technology, Nanjing, China; Department of Communication Engineering, Nanjing University of Science and Technology, Nanjing, China; Department of Communication Engineering, Nanjing University of Science and Technology, Nanjing, China",IEEE Transactions on Antennas and Propagation,"6 Apr 2015","2015","63","4","1822","1827","The large cost of computing resources has become a bottleneck of the marching-on-in-degree (MOD) solver of time-domain integral equation (TDIE). A set of delayed weighted Laguerre polynomials is proposed to address this problem in this paper. By incorporating the phase propagation information into itself, the proposed temporal basis function can model the phase variation of the induced current at different places of the scatterer, leading to a great reduction in the spatial unknowns. Moreover, the curvilinear Rao-Wilton-Glisson (CRWG) basis functions are adopted for the spatial discretization to improve the modeling precision of curve surfaces. Numerical results show that the proposed method can greatly reduce the mesh density of the scatterer and save the computing resources. It is both stable and efficient for the transient scattering analysis of perfect electrically conducting (PEC) objects with large smooth surfaces.","1558-2221","","10.1109/TAP.2015.2399511","National Natural Science Foundation of China(grant numbers:61431006,61171041,61271076); Jiangsu Natural Science Foundation(grant numbers:BK2012034); Foundation of Ministry of Education of China(grant numbers:20123219110018); ","https://ieeexplore.ieee.org/stamp/stamp.jsp?arnumber=7029644","Marching-on-in-degree method;time domain integral equation;delayed weighted Laguerre polynomials;transient scattering;Delayed weighted Laguerre polynomials;marching-on-in-degree (MOD) method;time-domain integral equation (TDIE);transient scattering","Manganese;Time-domain analysis;Polynomials;Integral equations;Testing;Transient analysis","","4","","28","IEEE","3 Feb 2015","","","IEEE","IEEE Journals"
"A New Wideband Circularly Polarized Stair-Shaped Dielectric Resonator Antenna","S. Fakhte; H. Oraizi; R. Karimian; R. Fakhte","Department of Electrical Engineering, Center of Excellence in Railway Transportation, Iran University of Science and Technology, Tehran, Iran; Department of Electrical Engineering, Center of Excellence in Railway Transportation, Iran University of Science and Technology, Tehran, Iran; Department of Electrical Engineering, Center of Excellence in Railway Transportation, Iran University of Science and Technology, Tehran, Iran; Department of Electrical Engineering, University of Guilan, Rasht, Iran",IEEE Transactions on Antennas and Propagation,"6 Apr 2015","2015","63","4","1828","1832","A circularly polarized stair-shaped dielectric resonator antenna (DRA) with a wideband circular polarization (CP) radiation is introduced for wireless local area network (WLAN) applications. This antenna is implemented by using two rectangular dielectric resonators (DRs), which are joined together to form a stair-shaped dielectric resonator antenna (DRA). In this structure, the excitation of multiple orthogonal modes leads to a wideband CP bandwidth. Measured results show that the proposed antenna has an axial ratio (AR) bandwidth of 22% (5.2–6.5 GHz), an impedance bandwidth of 37% (4.6–6.7 GHz), and a peak gain of 5.7 dB. In addition, the antenna radiation efficiency of more than 90% is achieved.","1558-2221","","10.1109/TAP.2015.2392131","","https://ieeexplore.ieee.org/stamp/stamp.jsp?arnumber=7009976","Axial ratio (AR);circular polarization (CP);dielectric resonator antenna (DRA);Dielectric resonator (DR);Axial ratio (AR);circular polarization (CP);dielectric resonator (DR);dielectric resonator antenna (DRA)","Dielectric resonator antennas;Dielectrics;Antenna measurements;Probes;Resonant frequency;Electric fields;Feeds","","134","","26","IEEE","14 Jan 2015","","","IEEE","IEEE Journals"
"A Printed Unidirectional Antenna With Improved Upper Band-Edge Selectivity Using a Parasitic Loop","J. Wu; Z. Zhao; Z. Nie; Q. -H. Liu","School of Electronic Engineering, University of Electronic Science and Technology of China, Chengdu, China; School of Electronic Engineering, University of Electronic Science and Technology of China, Chengdu, China; School of Electronic Engineering, University of Electronic Science and Technology of China, Chengdu, China; Department of Electrical and Computer Engineering, Duke University, Durham, NC, USA",IEEE Transactions on Antennas and Propagation,"6 Apr 2015","2015","63","4","1832","1837","In this communication, a printed unidirectional antenna with improved upper band-edge selectivity is proposed to realize bandpass filtering gain performance. This antenna consists of a printed rectangular loop with two gaps: 1) a parasitic strip and 2) a parasitic loop. The rectangular loop provides good lower band-edge selectivity and the parasitic strip decides the location of upper band-edge selectivity. The parasitic loop, which acts as a director, is used to improve the capacity of upper band-edge selectivity. In addition, the passband bandwidth controllability of the antenna has also been explored. To demonstrate the effectiveness of this design, an antenna prototype is fabricated and tested. Experimental results verified the effectiveness of the proposed design. Measured results show that the fabricated antenna provides a 56.6% passband bandwidth, ranging from 2.18 to 3.9 GHz. Good bandpass filtering gain performance with a flat passband gain better than 4.4 dBi is achieved. Stable unidirectional radiation patterns with nearly identical $E$- and $H$-plane patterns in the operating bandwidth are also achieved. The measured front-to-back ratio is better than 10 dB.","1558-2221","","10.1109/TAP.2015.2392112","National Natural Science Foundation of China(grant numbers:61171044,61231001); Fundamental Research Funds for the Central Universities of China(grant numbers:ZYGX2012YB010,ZYGX2012Z005); ","https://ieeexplore.ieee.org/stamp/stamp.jsp?arnumber=7010023","Filtering antenna;unidirectional radiation patterns;band-edge selectivity;bandwidth controllability;Band-edge selectivity;bandwidth controllability;filtering antenna;unidirectional radiation patterns","Antenna measurements;Antenna radiation patterns;Filtering;Gain;Bandwidth","","107","","12","IEEE","14 Jan 2015","","","IEEE","IEEE Journals"
"Electromagnetic Modeling of Spherically Stratified Lenses Illuminated by Arbitrary Sources","Z. Sipus; D. Bojanjac; T. Komljenovic","Faculty of Electrical Engineering and Computing, University of Zagreb, Zagreb, Croatia; Faculty of Electrical Engineering and Computing, University of Zagreb, Zagreb, Croatia; Faculty of Electrical Engineering and Computing, University of Zagreb, Zagreb, Croatia",IEEE Transactions on Antennas and Propagation,"6 Apr 2015","2015","63","4","1837","1843","This communication presents an accurate and computationally efficient method for designing spherical lens antennas. The method is based on spherical-wave modal expansion of both the electromagnetic field scattered by a multilayer lens and the far-field radiation pattern of a feed antenna. The two expansions are connected by transforming the fields from the local to the global coordinate system, i.e., by determining the equivalent current sources of the spherical lens Green's function. An important benefit of this method lies in the simplicity of implementing various feeding antennas in the design process. To verify the method, the results of the analysis are compared with measured radiation patterns of Luneburg lens antennas. Finally, the design guidelines for optimization of the whole lens antenna system are also discussed in the communication.","1558-2221","","10.1109/TAP.2015.2394801","ESF Research Networking Programme NEWFOCUS—New frontiers in millimeter/submillimeter waves integrated dielectric focusing systems; ","https://ieeexplore.ieee.org/stamp/stamp.jsp?arnumber=7017543","Spherical lens antennas;Luneburg antennas;spherical-wave expansion;vector-Legendre transformation;Luneburg antennas;spherical lens antennas;spherical-wave expansion;vector-Legendre transformation","Lenses;Antenna feeds;Antenna radiation patterns;Antenna measurements;Harmonic analysis","","11","","22","IEEE","21 Jan 2015","","","IEEE","IEEE Journals"
"Miniaturization of a Spiral Antenna Using Periodic Z-Plane Meandering","J. M. O’Brien; J. E. Grandfield; G. Mumcu; T. M. Weller","Center for Wireless and Microwave Information Systems (WAMI), University of South Florida, Tampa, FL, USA; Charles Stark Draper Laboratory, Petersburg, FL, USA; Center for Wireless and Microwave Information Systems (WAMI), University of South Florida, Tampa, FL, USA; Center for Wireless and Microwave Information Systems (WAMI), University of South Florida, Tampa, FL, USA",IEEE Transactions on Antennas and Propagation,"6 Apr 2015","2015","63","4","1843","1848","A new approach for miniaturizing an ultra-wideband spiral antenna, called the periodic spiral antenna (PSA), is presented. The combination of ${\bm{z}}$-directed meandering of the antenna element and a tapered substrate profile provides a volumetric style of miniaturization. In this design, the distributed inductance and capacitance, and therefore the impedance match, are tightly controlled as the footprint is reduced. The effectiveness of ${\bm{z}}$-directed meandering is confirmed through a loop antenna study that demonstrates a footprint reduction of 76.7% compared to the 57.1% reduction using planar meandering. Numerical simulations and measurements show that the PSA maintains similar performance as a traditional Archimedean spiral antenna with a miniaturization factor up to 1.2 prior to dielectric loading. A sinusoidal variation in the sidewall height of the back cavity is also shown to contribute to improved antenna performance. A 0.8–3 GHz cavity-backed PSA fabricated using a tapered ULTEM (${{\boldsymbol{\varepsilon}}_{\bm{r}}} = {\bf{2}}.{\bf{75}}$) substrate and 0.81 mm diameter copper wire is described.","1558-2221","","10.1109/TAP.2015.2394796","Charles Stark Draper Laboratory; ","https://ieeexplore.ieee.org/stamp/stamp.jsp?arnumber=7017514","Miniature antennas;periodic spiral antenna;three dimensional miniaturization;ultra-wideband antennas;Miniature antennas;periodic spiral antenna (PSA);three-dimensional (3-D) miniaturization;ultra-wideband antennas","Cavity resonators;Antennas;Spirals;Gain;Impedance matching;Substrates;Oscillators","","38","","15","IEEE","21 Jan 2015","","","IEEE","IEEE Journals"
"Multistep Cylindrical Structure Design for Wideband Radar Cross Section Reduction at Normal Incidence","S. -H. Chen; Y. -C. Hou; W. -J. Liao","Chung-Shan Institute of Science and Technology, Taoyuan, Taiwan, R.O.C.; Department of Electrical Engineering, National Taiwan University of Science and Technology, Taipei, Taiwan, R.O.C.; Department of Electrical Engineering, National Taiwan University of Science and Technology, Taipei, Taiwan, R.O.C.",IEEE Transactions on Antennas and Propagation,"6 Apr 2015","2015","63","4","1849","1853","A wideband radar cross section (RCS) reduction measure applicable to rod-like targets is proposed. This technique uses the differences in radii among multistep cylindrical structures to create a phase reversal for backscattering cancellation. In order to broaden the reduction bandwidth, a simple one-step design is evolved into a multistep one using the binomial expansion method. Its superior performance is verified via numerical simulations based on the physical optics (PO) and full-wave method. Under normal incidence, a 2.45:1 bandwidth ratio is achieved for more than 20-dB RCS reduction with a live-step design. Effects of critical design parameters such as the number of steps and the cylinder displacement order are examined. This approach can be employed on rod-like defense targets. A series of simulations that emulate a periscope protruding from the sea surface is conducted to demonstrate the applicability of the proposed technique.","1558-2221","","10.1109/TAP.2015.2394804","","https://ieeexplore.ieee.org/stamp/stamp.jsp?arnumber=7017500","Radar cross section;cylindrical structure;physical optics;stealth technique;binominal expansion;Binominal expansion;cylindrical structure;physical optics (PO);radar cross section (RCS);stealth technique","Radar cross-sections;Backscatter;Bandwidth;Radar antennas;Materials","","11","","17","IEEE","21 Jan 2015","","","IEEE","IEEE Journals"
"High-Efficiency W-Band Electroforming Slot Array Antenna","D. -y. Kim; Y. Lim; H. -S. Yoon; S. Nam","School of Electrical Engineering and Computer Science, Seoul National University, Seoul, Korea; Sungwon Forming Corporation, Ansan-si, Korea; Antenna R&D Group in Samsung Electronics Co., Ltd, Suwon-si, Korea; Sungwon Forming Corporation, Ansan-si, Korea",IEEE Transactions on Antennas and Propagation,"6 Apr 2015","2015","63","4","1854","1857","A W-band 8 × 8 slot array antenna is proposed and fabricated by electroforming for high-precision manufacturing. The external mutual coupling between radiating shunt slots is compensated for input impedance matching and a uniform held distribution. The overall antenna aperture area is 473.1 mm2 with slot spacings of 2.8 and 2.64 mm in the transverse and longitudinal direction, respectively. The measured maximum gain is 26.8 dBi and the corresponding antenna efficiency is 81.9% at 94 GHz. The measured impedance bandwidth when the VSWR is less than 2.0 (-10 dB) is 8.3%, with a range from 89.9 to 97.6 GHz.","1558-2221","","10.1109/TAP.2015.2398129","Korea Communications Commission (KCC), Korea; Korea Communications Agency (KCA)(grant numbers:KCA-2012-(12-911-01-102)); ","https://ieeexplore.ieee.org/stamp/stamp.jsp?arnumber=7027830","Electroforming;high-efficiency;waveguide slot array antenna.;Electroforming;high efficiency;millimeter wave antenna;waveguide slot array antenna;W-band","Arrays;Slot antennas;Antenna arrays;Antenna measurements;Bandwidth;Couplings","","56","","13","IEEE","30 Jan 2015","","","IEEE","IEEE Journals"
"Design of a Dual-Band Quadrifilar Helix Antenna Using Stepped-Width Arms","G. Byun; H. Choo; S. Kim","Department of Electronics and Computer Engineering, Hanyang University, Seoul 133-791, South Korea; School of Electronic and Electrical Engineering, Hongik University, Seoul 121-791, South Korea; Department of Electronics and Computer Engineering, Hanyang University, Seoul 133-791, South Korea",IEEE Transactions on Antennas and Propagation,"6 Apr 2015","2015","63","4","1858","1862","This communication proposes the design of a quadrifilar helix antenna (QHA) with stepped-width arms and a meander feeding network. The stepped-width arms are applied to reduce the antenna size and adjust the frequency interval for dual-band operation. The feeding network includes a 90°-hybrid chip coupler and two meander lines that are designed to give a 180°-phase delay. The proposed QHA is optimized using a genetic algorithm (GA) and then fabricated to measure its performances in a full anechoic chamber. The results demonstrate that the proposed antenna is suitable to be used for dual-band global positioning system (GPS) applications.","1558-2221","","10.1109/TAP.2015.2398463","Civil Military Technology Cooperation (CMTC); Basic Science Research Program through the National Research Foundation of Korea (NRF) funded by the Ministry of Education(grant numbers:NRF–2014R1A1A2055813); ","https://ieeexplore.ieee.org/stamp/stamp.jsp?arnumber=7027786","GPS antennas;Helix antennas;Quadrifilar helix antennas;Global positioning system (GPS) antennas;helix antennas;quadrifilar helix antennas (QHAs)","Helical antennas;Global Positioning System;Dual band;Antenna measurements;Antenna feeds;Gain","","48","","13","IEEE","30 Jan 2015","","","IEEE","IEEE Journals"
"Cross-Polarized Radiation in a Cylindrical Dielectric Resonator Antenna: Identification of Source, Experimental Proof, and Its Suppression","D. Guha; H. Gajera; C. Kumar","Institute of Radio Physics and Electronics, University of Calcutta, Kolkata, India; Institute of Radio Physics and Electronics, University of Calcutta, Kolkata, India; Department of Space, Communication Systems Group, ISRO Satellite Centre, Bangalore, India",IEEE Transactions on Antennas and Propagation,"6 Apr 2015","2015","63","4","1863","1867","In this communication, cross-polarized (XP) radiation of cylindrical dielectric resonator antenna (CDRA) has been investigated with a view to identify the source of the same. The study starts with a conjecture, which has been established through a systematic study using simulated results. The inference has been verified experimentally with the help of a set of prototypes. HEM21δ has been identified as the XP generating mode and a small metallic grounded post of circular cross section has been conceived to perturb the same to prove the conjecture. This insight has been extended to demonstrate a practical application indicating a possibility of achieving up to 8-10-dB suppression in XP radiation from a CDRA.","1558-2221","","10.1109/TAP.2015.2398127","National Basic Research Program of China (973 Program)(grant numbers:2014CB339900); University Grant Commission and Center of Advanced Study in Radio Physics and Electronics, University of Calcutta, India; ","https://ieeexplore.ieee.org/stamp/stamp.jsp?arnumber=7027219","Dielectric resonator antenna;cross polarized radiation;suppression of cross-polarized fields;Cross-polarized (XP) radiation;dielectric resonator antenna (DRA);suppression of cross-polarized (XP) fields","Metals;Prototypes;Dielectric resonator antennas;Probes;Dielectrics;Frequency measurement","","38","","9","IEEE","29 Jan 2015","","","IEEE","IEEE Journals"
"The Puck Antenna: A Compact Design With Wideband, High-Gain Operation","M. A. Al-Tarifi; D. E. Anagnostou; A. K. Amert; K. W. Whites","Department of Electrical, Computer, and Energy Engineering, University of Colorado Boulder, Boulder, CO, USA; Department of Electrical and Computer Engineering, South Dakota School of Mines and Technology, Rapid City, SD, USA; Osha Liang, Houston, TX, USA; Department of Electrical and Computer Engineering, South Dakota School of Mines and Technology, Rapid City, SD, USA",IEEE Transactions on Antennas and Propagation,"6 Apr 2015","2015","63","4","1868","1873","We develop a high-gain antenna with wideband operation and compact size by placing a small dielectric superstrate (puck) in front of the feeding antenna. The antenna performance is a combination of the leaky-wave effect, naturally existing in this type of antennas, and the edge diffraction effect occurring at the puck perimeter. Compared to the typical resonant cavity antenna utilizing a large superstrate, the proposed puck antenna has nearly four times enhanced performance (gain-bandwidth combination) while using a square puck of side slightly smaller than two wavelengths (at the design frequency). Further enhancement is achieved by making the puck circular in shape in order to add the diffracted fields in phase. The study is conducted through full-wave simulations and validated through measurements in the Ku band. The effect of puck misalignment is then discussed as a potential practical issue. Last, the ground plane is optimized for maximum antenna performance and relatively acceptable values of aperture efficiency (up to 51%).","1558-2221","","10.1109/TAP.2015.2398461","National Science Foundation (NSF) through a Communications, Circuits, and Sensing-Systems program(grant numbers:ECCS-0824034); NSF EPSCoR(grant numbers:ECCS-0824034); State of South Dakota, and in part by the Department of Defense DARPA MTO Young Faculty Award(grant numbers:N66001-11-1-4145); ","https://ieeexplore.ieee.org/stamp/stamp.jsp?arnumber=7027833","Cavity resonators;compact antennas;dielectric slabs;directive antennas;electromagnetic diffraction;leaky wave antennas;partially reflecting surfaces;Cavity resonators;compact antennas;dielectric slabs;directive antennas;electromagnetic diffraction;leaky-wave antennas (LWAs);partially reflecting surfaces (PRSs)","Bandwidth;Diffraction;Cavity resonators;Feeds;Antenna measurements","","28","","41","IEEE","30 Jan 2015","","","IEEE","IEEE Journals"
"A Compact UWB MIMO Antenna With Reflector to Enhance Isolation","T. K. Roshna; U. Deepak; V. R. Sajitha; K. Vasudevan; P. Mohanan","Department of Electronics, Cochin University of Science and Technology, Cochin, India; Department of Electronics, Cochin University of Science and Technology, Cochin, India; Department of Electronics, Cochin University of Science and Technology, Cochin, India; Department of Electronics, Cochin University of Science and Technology, Cochin, India; Department of Electronics, Cochin University of Science and Technology, Cochin, India",IEEE Transactions on Antennas and Propagation,"6 Apr 2015","2015","63","4","1873","1877","A compact ultrawideband (UWB) multiple-input multiple-output (MIMO) antenna, with high isolation, is proposed for portable UWB MIMO systems. Two coplanar stripline-fed staircase-shaped radiating elements are connected back-to-back. The prototype is designed on a substrate of dielectric constant 4.4 with an overall dimension of 25 mm × 30 mm × 1.6 mm. This antenna configuration with an isolating metal strip placed in between the two radiating elements ensures high isolation in the entire UWB band. The proposed antenna exhibits a good 2:1 VSWR impedance bandwidth covering the entire UWB band (3.1-10.6 GHz) with a high isolation better than 20 dB, peak gain of 5.2 dBi, peak efficiency of 90%, and guaranteed value of envelope correlation coefficient (ECC) ≤0.1641.","1558-2221","","10.1109/TAP.2015.2398455","Department of Science and Technology (DST), Government of India; Kerala State Council for Science, Technology and Environment (KSCSTE), Government of Kerala; ","https://ieeexplore.ieee.org/stamp/stamp.jsp?arnumber=7027826","Compact;Coplanar Stripline;MIMO;UWB;Compact;coplanar stripline;multiple-input multiple-output (MIMO);ultrawideband (UWB)","MIMO;Ultra wideband antennas;Antenna measurements;Dipole antennas;Reflector antennas;Metals","","141","","16","IEEE","30 Jan 2015","","","IEEE","IEEE Journals"
"Dual Circularly Polarized Reflectarray With Independent Control of Polarizations","S. Mener; R. Gillard; R. Sauleau; A. Bellion; P. Potier","Institut d’Electronique et de Télécommunications de Rennes (IETR), UMR CNRS 6164, Université Européenne de Bretagne, INSA de Rennes, Rennes, France; Institut d’Electronique et de Télécommunications de Rennes (IETR), UMR CNRS 6164, Université Européenne de Bretagne, INSA de Rennes, Rennes, France; Institut d’Electronique et de Télécommunications de Rennes (IETR), UMR CNRS 6164, Université de Rennes 1,, Rennes, France; CNES, Toulouse cedex 9, France; DGA Maîtrise de l’Information, Bruz, France",IEEE Transactions on Antennas and Propagation,"6 Apr 2015","2015","63","4","1877","1881","A reflectarray with independent dual-circular polarizations is proposed for the first time. The reflector panel operates in X-band and contains 97 unit-cells. It is made with a lego-type configuration allowing change manually the phase aperture distribution and demonstrating experimentally the independence of both polarizations in the same frequency band. To this end, various beam pointing directions are selected in right-hand and left-hand polarizations. The achieved bandwidth is 790 MHz (9.4% at the center frequency 8.37 GHz) for an axial ratio lower than 3.5 dB with 1.5 dB gain variations.","1558-2221","","10.1109/TAP.2015.2398458","Centre National d’Etudes Spatiales (CNES); Direction Générale de l’Armement (DGA); ","https://ieeexplore.ieee.org/stamp/stamp.jsp?arnumber=7027785","Dual-polarized passive reflectarray;Dualcircular polarizations;Dual-circular polarizations (CPs);dual-polarized passive reflectarray","Cavity resonators;Gain;Reflector antennas;Antenna radiation patterns;Antenna arrays;Antenna measurements","","67","","18","IEEE","30 Jan 2015","","","IEEE","IEEE Journals"
"Sidelobe Canceling for Reconfigurable Holographic Metamaterial Antenna","M. C. Johnson; S. L. Brunton; N. B. Kundtz; J. N. Kutz","Kymeta Corporation, Redmond, WA, USA; Department of Applied Mathematics, University of Washington, Seattle, WA, USA; Kymeta Corporation, Redmond, WA, USA; Department of Applied Mathematics, University of Washington, Seattle, WA, USA",IEEE Transactions on Antennas and Propagation,"6 Apr 2015","2015","63","4","1881","1886","Accurate and efficient methods for beam-steering of holographic metamaterial antennas is of critical importance for enabling consumer usage of satellite data capacities. We develop an algorithm capable of optimizing the beam pattern of the holographic antenna through software, reconfigurable controls. Our method provides an effective technique for antenna pattern optimization for a holographic antenna, which significantly suppresses sidelobes. The efficacy of the algorithm is demonstrated both on a computational model of the antenna and experimentally. Due to their exceptional portability, low-power consumption, and lack of moving parts, holographic antennas are an attractive and viable technology when combined with proven software-based strategies to optimize performance.","1558-2221","","10.1109/TAP.2015.2399937","","https://ieeexplore.ieee.org/stamp/stamp.jsp?arnumber=7031374","Satellite antennas;sidelobe canceling;holography;Holography;satellite antennas;sidelobe canceling","Metamaterials;Antenna arrays;Optimization;Antenna radiation patterns;Surface waves","","139","","26","IEEE","4 Feb 2015","","","IEEE","IEEE Journals"
