"A New Breast Phantom With a Durable Skin Layer for Microwave Breast Imaging","J. Garrett; E. Fear","Department of Electrical and Computer Engineering, University of Calgary, Calgary, AB, Canada; Department of Electrical and Computer Engineering, University of Calgary, Calgary, AB, Canada",IEEE Transactions on Antennas and Propagation,"6 Apr 2015","2015","63","4","1693","1700","Breast phantoms (BPs) are required to test and validate microwave breast imaging prototypes. For this purpose, a new BP made from carbon/rubber mixtures is proposed. These materials have: 1) electrical properties that are stable over time and representative of human target values and 2) mechanical properties that allow the material to be flexible and withstand reasonable stress. To characterize and optimize the carbon/rubber materials, samples made with varying carbon concentrations were created and the dielectric properties were measured. From these materials, a skin layer, fatty layer, glandular structures, and phantom tumors were cast from three-dimensional (3-D) printed molds and assembled into a complete BP. These phantoms mimic the anatomical structures of the breast, are reconfigurable for a variety of tests, and are easy to create in a typical lab environment. A microwave breast imaging prototype system was used to measure reflections from BPs. Comparison with reflections from human trials demonstrated that the phantom provides appropriate skin reflections. Phantoms incorporating glandular structures were imaged using a delay-and-sum technique. A response consistent with the position of the inclusions was observed. Overall, the carbon-based phantoms provide similar reflections to human tissue, and have proven useful for testing our imaging algorithms.","1558-2221","","10.1109/TAP.2015.2393854","Alberta Innovates - Health Solutions; Alberta Innovates - Technology Futures; Biovantage; ","https://ieeexplore.ieee.org/stamp/stamp.jsp?arnumber=7014232","Dielectric materials;Dielectric measurement;Biomedical engineering;Biomedical imaging;Biomedical engineering;biomedical imaging;dielectric materials;dielectric measurement","Skin;Breast;Carbon;Materials;Phantoms;Rubber;Antenna measurements","","73","","36","IEEE","19 Jan 2015","","","IEEE","IEEE Journals"
"Hybrid matching pursuit for distributed through-wall radar imaging","G. Li; R. J. Burkholder","Department of Electronic Engineering, Tsinghua University, Beijing, China; Department of Electrical and Computer Engineering, Ohio State University, Columbus, OH, USA",IEEE Transactions on Antennas and Propagation,"6 Apr 2015","2015","63","4","1701","1711","In this paper, we consider the problem of through-wall radar imaging (TWRI) with an antenna array and develop a distributed greedy algorithm named hybrid matching pursuit (HMP). By dividing all the antenna phase centers into some groups, the task of TWRI can be formulated as a problem of jointly sparse signal recovery based on distributed data subsets. In TWRI applications, existing distributed greedy algorithms such as the simultaneous orthogonal matching pursuit (SOMP) algorithm and the simultaneous subspace pursuit (SSP) algorithm suffer from high artifacts and low-resolution, respectively. The proposed HMP algorithm aims to combine the strengths of SOMP and SSP (i.e., the orthogonality among selected basis-signals and the backtracking strategy for basis-signal reevaluation) and, accordingly, to reconstruct high-resolution radar images with no visible artifacts. Experimental results on real through-wall radar data show that, compared to existing greedy methods, the proposed HMP algorithm significantly improves the radar image quality, at the cost of increased computational complexity.","1558-2221","","10.1109/TAP.2015.2398115","National Natural Science Foundation of China(grant numbers:61422110,41271011); Program for New Century Excellent Talents in University(grant numbers:NCET-11-0270); Tsinghua University Initiative Scientific Research Program; ","https://ieeexplore.ieee.org/stamp/stamp.jsp?arnumber=7027209","Compressive sensing (CS);joint sparsity pattern;sensor array system;through-wall radar","Vectors;Indexes;Antenna measurements;Matching pursuit algorithms;Radar imaging;Frequency measurement;Greedy algorithms","","43","","45","IEEE","29 Jan 2015","","","IEEE","IEEE Journals"
"Electromagnetic Optimization Using Mixed-Parameter and Multiobjective Covariance Matrix Adaptation Evolution Strategy","E. BouDaher; A. Hoorfar","Antenna Research Laboratory, Department of Electrical and Computer Engineering, Villanova University, Villanova, PA, USA; Antenna Research Laboratory, Department of Electrical and Computer Engineering, Villanova University, Villanova, PA, USA",IEEE Transactions on Antennas and Propagation,"6 Apr 2015","2015","63","4","1712","1724","Different variations of the covariance matrix adaptation evolution strategy (CMA-ES) are used in the design and optimization of electromagnetic (EM) problems. Two different schemes for the implementation of mixed-parameter CMA-ES and one scheme for the implementation of multiobjective CMAES are presented. Mixed-parameter CMA-ES is attractive in EM optimization when both continuous and discrete design parameters are involved. The first mixed-parameter scheme uses a Poisson mutation operator to update the discrete variables, and the second one forces an integer mutation on discrete variables with small variances. Multiobjective CMA-ES, developed in this paper, optimizes designs with respect to multiple objective functions simultaneously. It ranks the candidate solutions according to two levels: nondominated sorting and crowding distance. Several antenna and microwave design problems are presented to evaluate the performance of these schemes and compare them with other nature-based optimization algorithms.","1558-2221","","10.1109/TAP.2015.2398116","","https://ieeexplore.ieee.org/stamp/stamp.jsp?arnumber=7027190","CMA-ES;electromagnetic optimization;multiobjective optimization;Covariance matrix adaptation evolution strategy (CMA-ES);electromagnetic (EM) optimization;mixed-parameter optimization;multiobjective optimization","Optimization;Electromagnetics;Linear programming;Covariance matrices;Vectors;Algorithm design and analysis;Equations","","50","","40","IEEE","29 Jan 2015","","","IEEE","IEEE Journals"
"Time-Domain Wideband Adaptive Beamforming for Radar Breast Imaging","D. Byrne; I. J. Craddock","Department of Electrical and Electronic Engineering, University of Bristol, Bristol, U.K.; Department of Electrical and Electronic Engineering, University of Bristol, Bristol, U.K.",IEEE Transactions on Antennas and Propagation,"6 Apr 2015","2015","63","4","1725","1735","A novel wideband microwave radar imaging method is presented to detect regions of significant dielectric contrast within the breast. Clutter reduction is paramount to any radar imaging algorithm, especially with clinical patient data where the tissue composition of the breast is inhomogeneous. Time-domain data-adaptive imaging methods have been previously applied in a narrowband manner for microwave radar breast imaging when the received signal spectral content was wideband. In this study, a wideband time-domain adaptive imaging approach is presented to perform data-adaptive focusing across the spectrum to reduce clutter. An equalization filter is adapted to compensate for the propagation distortion through tissue using a calculated estimate of the average dielectric properties of the breast. The effectiveness of the proposed wideband adaptive imaging approach is evaluated in conjunction with the delay-and-sum (DAS) method using numerical, experimental, and clinical data. Target scatterers are clearly detected while clutter levels are reduced significantly, between 4 and 6 dB, when compared to the DAS technique.","1558-2221","","10.1109/TAP.2015.2398125","Engineering and Physical Sciences Research Council(grant numbers:EP/J00717X/1); ","https://ieeexplore.ieee.org/stamp/stamp.jsp?arnumber=7027175","Microwave Imaging;Biomedical Radar Imaging;Beamforming;Beamforming;biomedical radar imaging;microwave imaging;ultra-wideband","Radar imaging;Breast;Imaging;Wideband;Arrays;Skin;Vectors","","79","","32","IEEE","29 Jan 2015","","","IEEE","IEEE Journals"
"Nonlinear Power-Dependent Impedance Surface","Z. Luo; X. Chen; J. Long; R. Quarfoth; D. Sievenpiper","Department of Electrical and Computer Engineering, University of California, San Diego, La Jolla, CA, USA; College of Electronics and Information Engineering, Sichuan University, Chengdu, CA, China; Department of Electrical and Computer Engineering, University of California, San Diego, La Jolla, CA, USA; Department of Electrical and Computer Engineering, University of California, San Diego, La Jolla, CA, USA; Department of Electrical and Computer Engineering, University of California, San Diego, La Jolla, CA, USA",IEEE Transactions on Antennas and Propagation,"6 Apr 2015","2015","63","4","1736","1745","Impedance surfaces are artificially designed periodic structures that support surface waves. This paper presents a novel concept of a nonlinear impedance surface, whose impedance increases with the surface wave power. The proposed surface consists of a lattice of modified slotted mushroom-like cells loaded with varactor diodes and lumped circuits. The circuits are designed to sense the incoming surface wave power and feed back the signal to control the bias of the varactors, which eventually tunes the surface impedance. Such proposed power-dependent impedance surface has been demonstrated by a prototype consisting of 4 × 10 cells. It is observed from the experiments that as the power varies from 16 to 27 dBm, the surface exhibits a surface impedance range as much as j385 to j710 Ω. This characteristic enables the surface to be potentially useful in self-trapping surface-wave waveguide, power-dependent beam-steering antenna reflector, and other nonlinear applications.","1558-2221","","10.1109/TAP.2015.2399513","NSF(grant numbers:1306055); China Scholarship Council; ","https://ieeexplore.ieee.org/stamp/stamp.jsp?arnumber=7029660","Impedance surface;nonlinear;power-dependent;sensing circuit;varactor diodes;Impedance surface;nonlinear;power-dependent;sensing circuit;varactor diodes","Surface impedance;Surface waves;Impedance;Varactors;Optical surface waves;Integrated circuit modeling;Sensors","","49","","29","IEEE","3 Feb 2015","","","IEEE","IEEE Journals"
"Nonscattering Waveguides Based on Tensor Impedance Surfaces","R. G. Quarfoth; D. F. Sievenpiper","HRL Laboratories, LLC, Malibu, CA, USA; University of California, San Diego, La Jolla, CA, USA",IEEE Transactions on Antennas and Propagation,"6 Apr 2015","2015","63","4","1746","1755","A tensor impedance surface waveguide is built using anisotropic unit cells. The waveguide can propagate a confined waveguide mode along its axis while waves incident to the guide at an orthogonal direction pass through as if the waveguides were not present. Both straight and curved implementations are demonstrated. Surface waves incident at an angle to the waveguide show reflection and refraction at the impedance interface. A theoretical model for tensor impedance surface waveguides is generalized to include dispersive unit cells and bending loss around curves. Dispersion results for modes propagating in the waveguide show agreement between the theory, simulation, and experimental measurements. A curved waveguide is also constructed which guides surface waves around a curve and is transparent to surface waves incident at an orthogonal angle.","1558-2221","","10.1109/TAP.2015.2401051","Air Force Office of Scientific Research(grant numbers:FA9550-10-1-0313,FA9550-13-1-0014); ","https://ieeexplore.ieee.org/stamp/stamp.jsp?arnumber=7035009","artificial materials;impedance boundary conditions;impedance sheets;metamaterials;periodic structures;surface impedance;surface waves;Artificial materials;impedance boundary conditions;impedance sheets;metamaterials;periodic structures;surface impedance;surface waves","Impedance;Surface impedance;Surface waves;Dispersion;Optical surface waves;Tensile stress;Optical waveguides","","40","","34","IEEE","6 Feb 2015","","","IEEE","IEEE Journals"
"Manipulation of Characteristic Wave Modes by Impedance Loading","E. Safin; D. Manteuffel","University of Kiel, Kiel, Germany; University of Kiel, Kiel, Germany",IEEE Transactions on Antennas and Propagation,"6 Apr 2015","2015","63","4","1756","1764","The influence of the antenna impedance loading on the characteristic wave modes is investigated and evaluated. It is shown that the eigenvalue behavior of the characteristic modes can be modified by impedance loading at specific positions on the antenna. Thereby, it is possible to manipulate certain modes such that they resonate in the desired frequency band. These modes can then effectively be excited to achieve the desired antenna performance. It is found that using characteristic wave modes leads to better intuitive insight compared to the entire current distribution. Furthermore, we present a definition of the modal efficiency of the characteristic modes, which can be used to take into account the effect of losses in the matching components or the load elements.","1558-2221","","10.1109/TAP.2015.2401586","German Federal Ministry of Education and Research (BMBF)(grant numbers:FKZ 16BU1230); ","https://ieeexplore.ieee.org/stamp/stamp.jsp?arnumber=7035016","Antenna theory;Eigenvalues and eigen-functions;Impedance loading;Antenna theory;eigenvalues and eigen-functions;impedance loading","Eigenvalues and eigenfunctions;Surface impedance;Resonant frequency;Impedance;Current distribution;Loading;Loaded antennas","","48","","18","IEEE","6 Feb 2015","","","IEEE","IEEE Journals"
"Optimum Surface Plasmon Excitation and Propagation on Conductive Two-Dimensional Materials and Thin Films","F. Liang; A. B. Yakovlev; G. W. Hanson","School of Physical Electronics, University of Electronic Science and Technology of China, Chengdu, 610054, China; Department of Electrical Engineering, University of Mississippi, Oxford, MI, USA; Department of Electrical Engineering, University of Wisconsin–Milwaukee, Milwaukee, WI, USA",IEEE Transactions on Antennas and Propagation,"6 Apr 2015","2015","63","4","1765","1774","The surface conductivity of two-dimensional (2-D) materials and thin conductive films is considered for surface plasmon (SP) excitation and propagation. It is shown that an ideal surface conductivity exists to maximize the SP field at a given position, based on a tradeoff relating to propagation loss and near-field excitation amplitude associated with the local density of photonic states. Dispersionless and Drude dispersion models are considered, as well as the effect of interband transitions. Simple formulas are presented to obtain a maximal SP field at a given distance from a canonical source. Examples are shown for graphene and thin metal films, and a discussion of the competition between propagation loss and SP excitation is provided.","1558-2221","","10.1109/TAP.2015.2395440","National Natural Science Foundation of China(grant numbers:61204041,61331007); China Postdoctoral Science Foundation funded project(grant numbers:2014M552335); Fundamental Research Funds for the Central Universities of China(grant numbers:ZYGX2013J049); China Scholarship Council; ","https://ieeexplore.ieee.org/stamp/stamp.jsp?arnumber=7018000","Surface plasmon;graphene;thin films;Graphene;surface plasmon (SP);thin films","Plasmons;Materials;Propagation losses;Attenuation;Dispersion;Surface waves;Conductivity","","7","","37","IEEE","22 Jan 2015","","","IEEE","IEEE Journals"
"Anisotropic Mantle Cloaks for TM and TE Scattering Reduction","A. Monti; J. C. Soric; A. Alù; A. Toscano; F. Bilotti","Niccolò Cusano University, Rome, Italy; Department of Electrical and Computer Engineering, University of Texas at Austin, Austin, TX, USA; Department of Electrical and Computer Engineering, University of Texas at Austin, Austin, TX, USA; Department of Engineering, Roma Tre University, Rome, Italy; Department of Engineering, Roma Tre University, Rome, Italy",IEEE Transactions on Antennas and Propagation,"6 Apr 2015","2015","63","4","1775","1788","We present the design and realization of anisotropic mantle cloaks operating, at the same frequency, for both TM and TE incident polarizations. Starting from the analytical model of metasurfaces available in the literature, we first explore the potentials and limitations of the most common metasurface geometries for their application as mantle cloaks. Then, we introduce new types of patterned surfaces aimed at improving their polarization response. We demonstrate that, only by using four metasurface topologies, it is possible to obtain all required combinations of positive and negative reactance values in order to design effective mantle cloaks for planar, cylindrical, and three-dimensional (3-D) objects. We also show that the accuracy of the analytical formulas commonly used to design such metasurfaces is not necessarily sufficient for cloaking purposes. Therefore, we introduce and validate a numerical procedure to refine the analytical design and optimize the cloak performance. The effectiveness of the designed covers is checked with full-wave simulations. Finally, some antenna applications of dual-polarized mantle cloaks are proposed and several experimental measurements conducted on fabricated prototypes are also provided.","1558-2221","","10.1109/TAP.2015.2396532","NSF CAREER(grant numbers:ECCS-0953311); AFOSR YIP(grant numbers:FA9550-11-1-0009); DTRA YIP(grant numbers:HDTRA1-12-1-0022); ","https://ieeexplore.ieee.org/stamp/stamp.jsp?arnumber=7024114","Electromagnetic cloaking;mantle cloaking;frequency selective surfaces;metasurfaces;scattering;Electromagnetic cloaking;frequency selective surfaces;mantle cloaking;metasurfaces;scattering","Surface impedance;Impedance;Scattering;Strips;Analytical models;Geometry;Anisotropic magnetoresistance","","142","","51","IEEE","27 Jan 2015","","","IEEE","IEEE Journals"
"Angle-Based Chipless RFID Tag With High Capacity and Insensitivity to Polarization","C. Feng; W. Zhang; L. Li; L. Han; X. Chen; R. Ma","College of Physics and Electronics, Shanxi University, Shanxi, China; College of Physics and Electronics, Shanxi University, Shanxi, China; College of Physics and Electronics, Shanxi University, Shanxi, China; College of Physics and Electronics, Shanxi University, Shanxi, China; College of Physics and Electronics, Shanxi University, Shanxi, China; College of Physics and Electronics, Shanxi University, Shanxi, China",IEEE Transactions on Antennas and Propagation,"6 Apr 2015","2015","63","4","1789","1797","This paper presents a novel angle-based chipless radio frequency identification (RFID) tag with high capacity that is polarization-independent. Its scatterer is designed to be V-shaped. It encodes data using the space angle between two arms of the V-shape and is identified by measuring the scattered field in two orthogonal polarization directions. Even if it is tilted, the tag can be identified. The advantage of angle-based tag is that every element can encode three-bit data. This is helpful to get higher capacity. Also, for different codes of one element, the proposed tag uses the same spectrum. This is beneficial to improve the efficiency of the spectrum. First, the tag using the uniform impedance resonator (UIR) is designed. Then, the UIR chipless tag is reformed as stepped impedance resonator (SIR) tag to suppress the second harmonic. The realized tags operate in the frequency range 1.83-2.15 GHz and the identification errors are less than 3.9°. Every element of the realized tags can carry 3 bits of coding information.","1558-2221","","10.1109/TAP.2015.2393851","National Science Foundation of China(grant numbers:61271160); Shanxi Scholarship Council of China(grant numbers:2012-014); Research Fund for the Doctoral Program of Higher Education(grant numbers:20121401110009); Natural Science Foundation of Shanxi(grant numbers:2012011013-3); ","https://ieeexplore.ieee.org/stamp/stamp.jsp?arnumber=7014239","Chipless RFID;space angle;polarizationindependent;orthogonal polarization;Chipless radio frequency identification (RFID);orthogonal polarization;polarization-independent;space angle","Radiofrequency identification;Harmonic analysis;Resonant frequency;Backscatter;Surface acoustic waves;Calibration;Noise measurement","","71","","25","IEEE","19 Jan 2015","","","IEEE","IEEE Journals"
"On Cross Correlation in Antenna Arrays With Applications to Spatial Diversity and MIMO Systems","S. M. Mikki; Y. M. M. Antar","Department of Electrical and Computer Engineering, Royal Military College of Canada, Kingston, ON, Canada; Department of Electrical and Computer Engineering, Royal Military College of Canada, Kingston, ON, Canada",IEEE Transactions on Antennas and Propagation,"6 Apr 2015","2015","63","4","1798","1810","We develop a general approach to cross correlation in antenna systems suitable for applications to spatial diversity and MIMO systems. The far-field correlation is expressed in terms of the currents on the antennas. The basic strategy proposed here is to perform the overall evaluation of cross correlation by means of superposition integrals involving contributions emerging from all possible mutual correlations between the point sources on the antenna currents where interactions are mediated by a new cross-correlation Green's function. The method is verified and demonstrated in several numerical examples and a design methodology aiming at maximizing the diversity gain is outlined and illustrated. It is also shown that arbitrary antenna arrays can be reduced to suitable models involving only infinitesimal dipoles, in effect enabling us to compute the total diversity gain using the cross-correlation Green's function. The formulation provided here gives the electromagnetic aspect of spatial diversity an articulated form proper for design and development of practical communication links using multiple antenna systems.","1558-2221","","10.1109/TAP.2015.2398113","","https://ieeexplore.ieee.org/stamp/stamp.jsp?arnumber=7029004","Cross correlation;spatial diversity;MIMO;Cross correlation;multiple-input multiple-output (MIMO);spatial diversity","Correlation;Green's function methods;Antenna arrays;Method of moments;MIMO;Spatial diversity","","62","","18","IEEE","2 Feb 2015","","","IEEE","IEEE Journals"
"Analysis of Outdoor-to-Indoor Propagation at 169 MHz for Smart Metering Applications","F. Fuschini; M. Barbiroli; G. E. Corazza; V. Degli-Esposti; G. Falciasecca","Department of Electrical, Electronic, and Information Engineering “G. Marconi” (DEI), Alma Mater Studiorum—University of Bologna, Bologna, Italy; Department of Electrical, Electronic, and Information Engineering “G. Marconi” (DEI), Alma Mater Studiorum—University of Bologna, Bologna, Italy; Department of Electrical, Electronic, and Information Engineering “G. Marconi” (DEI), Alma Mater Studiorum—University of Bologna, Bologna, Italy; Department of Electrical, Electronic, and Information Engineering “G. Marconi” (DEI), Alma Mater Studiorum—University of Bologna, Bologna, Italy; Department of Electrical, Electronic, and Information Engineering “G. Marconi” (DEI), Alma Mater Studiorum—University of Bologna, Bologna, Italy",IEEE Transactions on Antennas and Propagation,"6 Apr 2015","2015","63","4","1811","1821","An experimental work aimed at assessing the outdoor-to-indoor propagation losses at 169 MHz is described in this paper. The building penetration loss, often considered as an additional constant value to be added to propagation losses in previous studies, is here on the contrary regarded as a random variable; its cumulative distribution is extracted from the measured data and is found to be approximately Gaussian. Moreover, in order to account for the critical installation conditions which may be experienced by indoor wireless devices in particular applications (e.g., wireless smart metering), an additional loss term, here indicated as installation loss, is introduced and its value is investigated in some reference cases. The achieved results are also embedded into a statistical procedure similar to those commonly adopted for wireless cellular networks planning.","1558-2221","","10.1109/TAP.2015.2399507","","https://ieeexplore.ieee.org/stamp/stamp.jsp?arnumber=7031411","Building Penetration Loss;Measurement;Radio Propagation;Smart Metering;Building penetration loss (BPL);measurement;radio propagation;smart metering","Power line communications;Loss measurement;Antenna measurements;Propagation losses;Floors;Wireless communication","","13","","30","IEEE","4 Feb 2015","","","IEEE","IEEE Journals"
