"Magneto-Mechanical Transmitters for Ultralow Frequency Near-Field Data Transfer","R. P. Thanalakshme; A. Kanj; J. Kim; E. Wilken-Resman; J. Jing; I. H. Grinberg; J. T. Bernhard; S. Tawfick; G. Bahl","Department of Mechanical Science and Engineering, University of Illinois at Urbana-Champaign, Urbana, IL, USA; Department of Mechanical Science and Engineering, University of Illinois at Urbana-Champaign, Urbana, IL, USA; Department of Mechanical Science and Engineering, University of Illinois at Urbana-Champaign, Urbana, IL, USA; Department of Electrical and Computer Engineering, University of Illinois at Urbana-Champaign, Urbana, IL, USA; Department of Mechanical Science and Engineering, University of Illinois at Urbana-Champaign, Urbana, IL, USA; Department of Mechanical Science and Engineering, University of Illinois at Urbana-Champaign, Urbana, IL, USA; Department of Electrical and Computer Engineering, University of Illinois at Urbana-Champaign, Urbana, IL, USA; Department of Mechanical Science and Engineering, University of Illinois at Urbana-Champaign, Urbana, IL, USA; Department of Mechanical Science and Engineering, University of Illinois at Urbana-Champaign, Urbana, IL, USA",IEEE Transactions on Antennas and Propagation,"5 May 2022","2022","70","5","3710","3722","Electromagnetic signals in the ultralow frequency (ULF) range below 3 kHz are well suited for underwater and underground wireless communication thanks to low signal attenuation and high penetration depth. However, it is challenging to design ULF transmitters that are simultaneously compact and energy efficient using traditional approaches, e.g., using coils or dipole antennas. Recent works have considered magneto-mechanical alternatives, in which ULF magnetic fields are generated using the motion of permanent magnets, since they enable extremely compact ULF transmitters that can operate with low energy consumption and are suitable for human-portable applications. Here we explore the design and operating principles of resonant magneto-mechanical transmitters (MMT) that operate over frequencies spanning a few 10 s of Hz up to 1 kHz. We experimentally demonstrate two types of MMT designs using both single-rotor and multirotor architectures. We study the nonlinear electro-mechanical dynamics of MMTs using point dipole approximation and magneto-static simulations. We further experimentally explore techniques to control the operation frequency and demonstrate amplitude modulation up to 10 bits-per-second. We additionally demonstrate how using oppositely polarized MMT modules can permit systems that have low dc-field but do not sacrifice the ac magnetic field produced.","1558-2221","","10.1109/TAP.2021.3137244","Defense Advanced Research Projects Agency (DARPA) through the AMEBA Program(grant numbers:HR0011-17-2-0057); ","https://ieeexplore.ieee.org/stamp/stamp.jsp?arnumber=9664498","Magnetic dipoles;magnetic modulators;magneto-mechanical systems;ultralow frequency (ULF) transmitters;wireless communication","Magnetic resonance;Rotors;Magnetomechanical effects;Magnetic fields;Magnetic moments;Magnetic levitation;Coils","","20","","48","CCBY","28 Dec 2021","","","IEEE","IEEE Journals"
"A Vector Modulation Approach for Secure Communications Based on 4-D Antenna Arrays","C. Qu; K. Chen; W. Long; Y. Chen; S. -W. Qu; J. Hu; S. Yang","School of Electronic Science and Engineering, University of Electronic Science and Technology of China (UESTC), Chengdu, China; School of Electronic Science and Engineering, University of Electronic Science and Technology of China (UESTC), Chengdu, China; School of Electronic Science and Engineering, University of Electronic Science and Technology of China (UESTC), Chengdu, China; School of Electronic Science and Engineering, University of Electronic Science and Technology of China (UESTC), Chengdu, China; School of Electronic Science and Engineering, University of Electronic Science and Technology of China (UESTC), Chengdu, China; School of Electronic Science and Engineering, University of Electronic Science and Technology of China (UESTC), Chengdu, China; School of Electronic Science and Engineering, University of Electronic Science and Technology of China (UESTC), Chengdu, China",IEEE Transactions on Antennas and Propagation,"5 May 2022","2022","70","5","3723","3732","A vector modulation approach based on 4-D antenna arrays is proposed for the directional modulation (DM) of physical-layer secure communication. This approach utilizes the time modulation function of 4-D arrays to generate identifiable vector information in desired directions while the vector information is distorted in undesired directions, thus increasing the transmission security as compared to previously reported DM schemes. The mutual coupling of antenna elements is taken into consideration for the accurate analysis of various scenarios. Moreover, in order to achieve multiuser secure communication and improve their security capability simultaneously, the dual-channel DM and dynamic DM are separately proposed and only high-speed radio frequency (RF) modulation switches are needed. Numerical and experimental results are presented for the demonstration of the capability and superiority of the proposed physical-layer secure communication based on 4-D arrays.","1558-2221","","10.1109/TAP.2021.3137246","National Natural Science Foundation of China(grant numbers:61631006,61721001); 111 Project of China(grant numbers:BP0719011); ","https://ieeexplore.ieee.org/stamp/stamp.jsp?arnumber=9664476","4-D antenna arrays;constellation pattern;directional modulation (DM);physical-layer secure communications","Antenna arrays;Modulation;Phased arrays;Phase shift keying;Directive antennas;Security;Wireless communication","","10","","38","IEEE","28 Dec 2021","","","IEEE","IEEE Journals"
"Generalized Formulation of Response Features for Reliable Optimization of Antenna Input Characteristics","A. Pietrenko-Dabrowska; S. Koziel","Faculty of Electronics, Telecommunications and Informatics, Gda´nsk University of Technology, Gda´nsk, Poland; Faculty of Electronics, Telecommunications and Informatics, Gda´nsk University of Technology, Gda´nsk, Poland",IEEE Transactions on Antennas and Propagation,"5 May 2022","2022","70","5","3733","3748","Electromagnetic (EM)-driven parameter adjustment has become imperative in the design of modern antennas. It is necessary because the initial designs rendered through topology evolution, parameter sweeping, or theoretical models are often of poor quality and need to be improved to satisfy stringent performance requirements. Given multiple objectives, constraints, and a typically large number of geometry parameters, the design closure should be carried out through numerical optimization. Unfortunately, standard algorithms entail high CPU expenses and are prone to failure. Feature-based optimization (FBO) is one of the methods developed to alleviate these difficulties by reformulating the design task in terms of the characteristic points extracted from EM-simulated responses. FBO capitalizes on a less nonlinear relationship between the feature point coordinates and antenna dimensions as compared to the original responses (e.g., frequency characteristics). This leads to flattening the functional landscape to be handled, faster convergence of the optimization algorithms, and a possibility of mitigating the issues pertinent to multimodality. Notwithstanding, the response features have to be individually defined for each type of antenna response and tailored to a particular type of design specifications. This requires user experience and hinders the widespread application of FBO. This article proposes a generalized and unified feature point definition, which is suitable for the majority of typical antenna input characteristics (narrowband, multiband, enhanced bandwidth, and wideband) and performance specifications (matching improvement, bandwidth enhancement, and a mixture thereof). Our framework allows for an automated definition of the feature points given the performance specifications, along with their extraction from EM-simulated responses. The operation of the framework is illustrated using a range of planar antennas and favorably compared to conventional (nonfeature-based) design closure task formulation.","1558-2221","","10.1109/TAP.2021.3137405","Icelandic Centre for Research (RANNIS)(grant numbers:217771); Gda´nsk University of Technology under the Argentum Triggering Research Grants Program–“Excellence Initiative-Research University”(grant numbers:DEC-41/2020/IDUB/I.3.3); ","https://ieeexplore.ieee.org/stamp/stamp.jsp?arnumber=9665246","Antenna design;computer-aided design;electromagnetic (EM)-driven design;optimization;parameter tuning;response features","Optimization;Antennas;Broadband antennas;Computational modeling;Feature extraction;Task analysis;Resonant frequency","","33","","69","IEEE","29 Dec 2021","","","IEEE","IEEE Journals"
"Reconfigurable Dual-Band Capsule-Conformal Antenna Array for In-Body Bioelectronics","D. Nikolayev; A. K. Skrivervik; J. S. Ho; M. Zhadobov; R. Sauleau","CNRS, IETR–UMR 6164, Université de Rennes, Rennes, France; Microwave and Antenna Group (MAG), École Polytechnique Fédérale de Lausanne, Lausanne, Switzerland; Department of Electrical and Computer Engineering, Institute for Health Innovation & Technology, National University of Singapore, Singapore; CNRS, IETR–UMR 6164, Université de Rennes, Rennes, France; CNRS, IETR–UMR 6164, Université de Rennes, Rennes, France",IEEE Transactions on Antennas and Propagation,"5 May 2022","2022","70","5","3749","3761","Wireless in-body bioelectronics offer powerful biosensing and therapeutic capabilities. Efficient and robust in-body antenna designs are required to ensure a reliable through-body link, increase data rates, and reduce power budgets. This study proposes and demonstrates a pattern- and frequency-reconfigurable capsule-conformal antenna array that responds to the challenges of next-generation in-body bioelectronics. The array comprises two mirrored dual-band elements operating at 434 MHz and 2.45 GHz ISM bands. Tissue-matched dielectric loading of the array improves the radiation efficiency and ensures quasi tissue-independent operation for both bands. Due to the full ground plane, the antenna is shielded from the capsule payload. The achieved efficiencies are compared to the fundamental limitations and closely approach them. The realized gains are −28.9 and −18.6 dBi at 434 MHz and 2.45 GHz, respectively, when the array is placed in the center of a ø100-mm diameter spherical phantom with muscle-equivalent properties. Using a single switch, the array can be reconfigured to adjust the angular position of the nulls in the radiation pattern in both bands thereby enabling synthesis of an effectively null-free omnidirectional pattern. The array prototypes are fabricated, and the impedance and far-field radiation patterns are characterized to validate the design in tissue-equivalent liquid phantoms.","1558-2221","","10.1109/TAP.2021.3138264","French Region of Brittany through the Stratégie d’attractivité durable (SAD) “EM-NEURO.”; ","https://ieeexplore.ieee.org/stamp/stamp.jsp?arnumber=9667256","Bioelectronics;biomedical telemetry;conformal array;dual-band antenna;microstrip antenna;implantable;in-body;ingestible;reconfigurable antenna;robustness","Antenna arrays;Antennas;Antenna theory;Antenna radiation patterns;Dielectrics;Microstrip;Loading","","42","","52","IEEE","31 Dec 2021","","","IEEE","IEEE Journals"
"Optimal Sampling in Spherical Near-Field Antenna Measurements by Utilizing the Information Content of Spherical Wave Harmonics","H. R. Behjoo; A. Pirhadi; R. Asvadi","Department of Telecommunications, Faculty of Electrical Engineering, Shahid Beheshti University, Tehran, Iran; Department of Telecommunications, Faculty of Electrical Engineering, Shahid Beheshti University, Tehran, Iran; Department of Telecommunications, Faculty of Electrical Engineering, Shahid Beheshti University, Tehran, Iran",IEEE Transactions on Antennas and Propagation,"5 May 2022","2022","70","5","3762","3771","In this article, we propose an efficient method that specifies the minimum number of samples and their locations to measure the spherical near-field (SNF) of antennas utilizing information-theoretic tools. To this end, spherical harmonics are investigated from the information-theoretic point of view. Our study determines the minimum required samples and provides a validation tool to assess the ability of a sampling scheme to recover the antenna characteristics by the measured data. Furthermore, an optimum sampling scheme is proposed by clustering the energy of vector spherical harmonics using the frame theory without any time-consuming iterative, which leads to a highly efficient SNF measurement procedure. The number of samples determined by the proposed method is only 50% of the Nyquist method, which provides significant advantages for storage and processing time. Our method additionally shows a great promise for the recovery of the far-field radiation pattern from near-field samples with the same performance as the Nyquist sampling on a sphere. To derive the proposed sampling scheme with the minimum redundancy, no prior information on the antenna is assumed. Finally, the proposed sampling scheme is validated on measurement data.","1558-2221","","10.1109/TAP.2021.3137194","","https://ieeexplore.ieee.org/stamp/stamp.jsp?arnumber=9664490","ϵ-entropy;antenna measurement;information theory;near-field far-field transformation;spherical near-field (SNF)","Antenna measurements;Measurement;Transmission line matrix methods;Antenna radiation patterns;Harmonic analysis;Antenna theory;Eigenvalues and eigenfunctions","","10","","35","IEEE","28 Dec 2021","","","IEEE","IEEE Journals"
"Contrast-Enhanced Microwave Cancer Detection Using Angle-of-Arrival Approach","Z. Gong; Y. Chen; X. Lin; M. J. Cree","School of Engineering, University of Waikato, Hamilton, New Zealand; School of Engineering, University of Waikato, Hamilton, New Zealand; School of Engineering, University of Waikato, Hamilton, New Zealand; School of Engineering, University of Waikato, Hamilton, New Zealand",IEEE Transactions on Antennas and Propagation,"5 May 2022","2022","70","5","3772","3780","This article proposes a novel contrast-enhanced microwave cancer detection (MCD) system to accurately detect the location of a tumor targeted by nanoscale contrast agents. This system adopts the angle-of-arrival (AoA) positioning approach that is conventionally applied to the region where plane waves dominate the propagation. Hence, to ensure the effectiveness of the AoA approach when it is working in close proximity to the human body, a new algorithm is proposed to transfer the antenna’s radiation pattern from the far-field to the detection region where spherical waves can still be observed. This AoA-based MCD system requires fewer antennas than other radar-based positioning approaches, thereby creating a low-profile hardware architecture. In addition, during the detection process, a differential technique is incorporated in order to track the signal change due to the administration of contrast agents, which can significantly suppress the noise inside the biological medium. The AoA-based differential MCD system is numerically studied on an anatomically realistic breast phantom subject to a variety of signal-to-noise ratios (SNRs). The results show that the proposed system can successfully locate the tumor with an average resolution of 0.6 mm. When the SNR in the biological medium is 10 dB, the average positioning error is less than 1.5 mm with sensitivity maintained above 60%, which surpasses the performance of other similar systems. The system is also experimentally validated with a physical breast phantom and stepper-motor-driven rotating antennas, where the reconstructed image shows a minor deviation of 3.61 mm with that of the simulated one.","1558-2221","","10.1109/TAP.2021.3137226","National Science Challenges of New Zealand(grant numbers:UOWX1901); Sichuan Science and Technology Program of China(grant numbers:2021JDRC0036); ","https://ieeexplore.ieee.org/stamp/stamp.jsp?arnumber=9664473","Angle-of-arrival (AoA) approach;contrast-enhanced microwave cancer detection (MCD);differential detection;tumor detection and localization","Manganese;Receiving antennas;Tumors;Antennas;Antenna radiation patterns;Antenna measurements;Phantoms","","10","","30","IEEE","28 Dec 2021","","","IEEE","IEEE Journals"
"Design of Miniaturized Incident Angle-Insensitive 2.45 GHz RF-Based Energy Harvesting System for IoT Applications","J. -S. Park; Y. -S. Choi; W. -S. Lee","Department of Electronic Engineering, Gyeongsang National University (GNU), Jinju, South Korea; Department of Electronic Engineering, Gyeongsang National University (GNU), Jinju, South Korea; Department of Electronic Engineering, Gyeongsang National University (GNU), Jinju, South Korea",IEEE Transactions on Antennas and Propagation,"5 May 2022","2022","70","5","3781","3788","Using a license-free industrial, scientific, and medical (ISM) frequency band as 2.45 GHz, a miniaturized incident angle-insensitive radio frequency (RF) energy harvester design for the Internet-of-Things (IoT) applications is proposed. For incident angle insensitivity of ambient RF energy and a low-profile compact design, the proposed harvester is used to a two-layer printed circuit board (PCB) substrate, which consists of orthogonally deployed antennas with an  $LC$  balun, impedance matching, and Dickson charge pump circuits at each layer. The dual-polarized antenna for miniaturized design uses a bowtie-shaped meander dipole antenna having orthogonal arrangement. By measuring the efficiency of each diode stage of the rectifier circuit, a two-stage Dickson charge pump circuit with optimal efficiency was selected, and the dc outputs of the two rectifier circuits are connected in parallel. This rectifier circuit has a conversion efficiency of up to 71.4% and harvests approximately 1.6 times more power than a single-polarized circuit from any incident ambient RF signal. Due to its compact size and improved harvesting power at various incident angles, the proposed energy harvester can act as a power source, such as many kinds of ultralow power consumption systems, such as IoT sensors and medical applications.","1558-2221","","10.1109/TAP.2021.3137481","Human Resources Program in Energy Technology of the Korea Institute of Energy Technology Evaluation and Planning (KETEP) funded by the Ministry of Trade, Industry and Energy, South Korea(grant numbers:20194030202430); Korean Government (MSIT) through the National Research Foundation of Korea(grant numbers:NRF-2019R1C1C1008102); ","https://ieeexplore.ieee.org/stamp/stamp.jsp?arnumber=9665373","Angle insensitive;dual-polarized;miniaturized;radio frequency (RF)-based energy harvesting system;rectifier circuit","Radio frequency;Energy harvesting;Dipole antennas;Antennas;Antenna measurements;Internet of Things;RF signals","","24","","29","IEEE","29 Dec 2021","","","IEEE","IEEE Journals"
"Active Millimeter Wave Imaging Using Leaky-Wave Focusing Antenna","K. K. Mutai; H. Sato; Q. Chen","Department of Communications Engineering, Graduate School of Engineering, Tohoku University, Sendai, Japan; Department of Communications Engineering, Graduate School of Engineering, Tohoku University, Sendai, Japan; Department of Communications Engineering, Graduate School of Engineering, Tohoku University, Sendai, Japan",IEEE Transactions on Antennas and Propagation,"5 May 2022","2022","70","5","3789","3798","In this article, an active millimeter-wave imaging system using two rectangular waveguide leaky-wave focusing antennas deployed in a quasi-monostatic transmitter and receiver pair is proposed. The broadband design method of the focusing antenna is presented, where the phase constant is derived from the radiation direction of a rectangular waveguide leaky-wave antenna. To eliminate the effect of mutual coupling between the transmitting and receiving antennas and scattering from the surrounding environment, the scattered field from the object is obtained by subtracting the incident field from the total field. The 1-D detection of conducting sphere, conducting and dielectric cylinders, and a conducting plate is performed by experiment to validate the imaging capability of the proposed system. The 2-D imaging of a conducting cylinder in free space and positioned in front of a human body phantom representing the human body is finally performed to simulate the practical application of the system.","1558-2221","","10.1109/TAP.2021.3137533","Japan Society for the Promotion of Science (JSPS) KAKENHI(grant numbers:20K04515); Ministry of Internal Affairs and Communications in Japan(grant numbers:JPJ000254); ","https://ieeexplore.ieee.org/stamp/stamp.jsp?arnumber=9665379","Antenna synthesis;focusing;leaky-wave antennas (LWAs);millimeter-wave (MMW) imaging;MMW radar","Focusing;Imaging;Rectangular waveguides;Mathematical models;Sensor arrays;Antennas;Antenna arrays","","20","","32","IEEE","29 Dec 2021","","","IEEE","IEEE Journals"
"Measurement of the Amplitude and Polarization of the Electric Field by Electromagnetic Infrared Thermography","D. Prost","French Aerospace Lab ONERA/DEMR, Université de Toulouse, Toulouse, France",IEEE Transactions on Antennas and Propagation,"5 May 2022","2022","70","5","3799","3805","The ElectroMagnetic InfraRed (EMIR) method developed and used at ONERA provides a map of the amplitude of the electric field radiated by an antenna: a thin film of low conductivity is placed in front of the EM source, the electric field induces currents which heat the film by Joule effect; this heating is measured by an infrared camera. A low-frequency modulation of the signal associated with synchronous demodulation of the images allows eliminating the parasitic thermal phenomena. By using anisotropic films with conductivity patterns, we propose here for the first time a vector measurement of the electric field. In the case of linear polarization, this technique allows to obtain the field direction, and in the case of circular polarization, to measure the axial ratio. Furthermore, we show, with the help of a patterned array, that we can obtain the spatial structure of the near field, both in amplitude and direction.","1558-2221","","10.1109/TAP.2021.3137491","French Space Agency CNES; internal resources from ONERA; ","https://ieeexplore.ieee.org/stamp/stamp.jsp?arnumber=9665315","Antenna;axial ratio;infrared thermography;near-field measurement;polarization;thin film pattern","Films;Antenna measurements;Electric fields;Heating systems;Surface impedance;Polarization;Resistance heating","","6","","13","IEEE","29 Dec 2021","","","IEEE","IEEE Journals"
"Investigation of Axial Mode Dielectric Helical Antenna","Z. Song; H. Zheng; Y. Li; E. Li","State Key Laboratory of Reliability and Intelligence of Electrical Equipment and the Key Laboratory of Electromagnetic Field and Electrical Apparatus Reliability of Hebei Province, School of Electrical Engineering, Hebei University of Technology, Tianjin, China; State Key Laboratory of Reliability and Intelligence of Electrical Equipment and the School of Electronics and Information Engineering, Hebei University of Technology, Tianjin, China; State Key Laboratory of Reliability and Intelligence of Electrical Equipment and the School of Electrical Engineering, Hebei University of Technology, Tianjin, China; State Key Laboratory of Reliability and Intelligence of Electrical Equipment, Hebei University of Technology, Tianjin, China",IEEE Transactions on Antennas and Propagation,"5 May 2022","2022","70","5","3806","3811","An axial mode solid dielectric helical antenna (DHA) has been proposed, which is fabricated by using the 3-D printing technique. Fed manners of this antenna have been studied, including conformal coaxial probe and conformal metal strip line. The operating mode of dielectric helix has been analyzed in detail. Circular polarization is achieved by choosing appropriate sizes of the dielectric helix. Furthermore, a miniaturized axial mode DHA with deployable property is implemented. Measured results indicate that the proposed antenna has good radiation performance, such as circular polarization, high gain, and high radiation efficiency. Specially, the radiation patterns of the DHA have good symmetry in the 2 dB axial ratio range. The significant advantage of miniaturized DHA is light in weight, which is only 2.7% of the weight of a metal helical antenna with similar radiation characteristics. The antenna is a good candidate in wireless communication system.","1558-2221","","10.1109/TAP.2021.3125365","National Natural Science Foundation of China(grant numbers:62071166,62071424); ","https://ieeexplore.ieee.org/stamp/stamp.jsp?arnumber=9611082","3-D printing;circular polarization;deployable;dielectric helical antenna (DHA);miniaturization","Dielectrics;Helical antennas;Metals;Electric fields;Probes;Solids;Dielectric resonator antennas","","9","","16","IEEE","10 Nov 2021","","","IEEE","IEEE Journals"
