"A High Out-of-Band Suppressed Compact Wideband Filtering Dipole Antenna With a Dual-Mode Compressed Parasitic Folded Dipole","C. Chen","Department of Electronic Information Engineering, Changzhou University, Changzhou, China",IEEE Transactions on Antennas and Propagation,"8 Nov 2022","2022","70","10","8996","9005","This article presents a design of a high out-of-band suppressed compact wideband filtering dipole antenna with a dual-mode compressed parasitic folded dipole. The proposed antenna consists of a half-wavelength dipole and a compressed parasitic folded dipole. The half-wavelength mode and the one and a half-wavelength mode of the parasitic folded dipole are excited simultaneously. A capacitive load is utilized to tune the resonance of the half-wavelength mode of the parasitic folded dipole to make it come close to the resonant frequency of the one and a half-wavelength mode. Then, the parasitic element and the driven dipole couple with each other to achieve a wide bandwidth. Moreover, mixed coupling is observed between the driven dipole and the parasitic folded dipole, which results in the radiation nulls at the lower and the upper band, respectively. The antenna is fabricated and measured. The measurements reveal that a wide bandwidth of 37.9% is attained with an omnidirectional radiation pattern. Three radiation nulls can be observed at 580, 990, and 1545 MHz. The level of the out-of-band suppression achieves 15.1 dB. Only two resonators are utilized in this design, which makes the proposed antenna simple and compact.","1558-2221","","10.1109/TAP.2022.3177479","Natural Science Foundation of the Jiangsu Higher Education Institutions of China(grant numbers:20KJB510003); ","https://ieeexplore.ieee.org/stamp/stamp.jsp?arnumber=9785451","Compact antenna;compressed dipole;dipole antenna;filtering antenna;parasitic element;wide bandwidth","Dipole antennas;Filtering;Capacitors;Resonant frequency;Inductors;Resonator filters;Dielectric resonator antennas","","16","","37","IEEE","30 May 2022","","","IEEE","IEEE Journals"
"A Beamwidth and Steering Reconfigurable Active Integrated Metasurface Antenna for Dynamic Radiation Control","T. Liang; Z. Wang; Y. Dong","School of Electronic Science and Engineering, University of Electronic Science and Technology of China (UESTC), Chengdu, China; School of Electronic Science and Engineering, University of Electronic Science and Technology of China (UESTC), Chengdu, China; School of Electronic Science and Engineering, University of Electronic Science and Technology of China (UESTC), Chengdu, China",IEEE Transactions on Antennas and Propagation,"8 Nov 2022","2022","70","10","9006","9016","In this article, a beamwidth and pattern-steering reconfigurable active integrated antenna (AiA) is proposed and studied in 2.4 GHz band. Two low noise amplifiers (LNAs) are applied as the switches to control the beamwidth in this work. Owing to their high ON/OFF state transmission ratio, using amplifiers as switches is an economic and easy way to realize excellent reconfigurability. An aperture coupled metasurface contributes to a unified radiation pattern and reflection coefficient. To highlight the applications, a pair of switchable phase shifters is cascaded to the amplifiers to realize beam steering. The coupling scheme of the AiA is illustrated, which exhibits a quasi-duplex communication function. Power compression and third-order intermodulation of the AiA are discussed and measured. The impedance bandwidth fully covers the range from 2.2 to 2.7 GHz. The measured tunable range of the beamwidth is from 111° to 32°, and the beam steering angle is from − 39° to 36° in the E-plane. The measured peak system gain is 14.7 dBi, while under the passive mode, it is 6.8 dBi. The peak system efficiency is measured up to 220% for the active mode and 80% for the passive mode. The peak power added efficiency (PAE) of the active mode is 40.4%. The measurement results agree well with the simulation.","1558-2221","","10.1109/TAP.2022.3177497","National Natural Science Foundation of China; ","https://ieeexplore.ieee.org/stamp/stamp.jsp?arnumber=9785423","Active integrated antenna (AiA);beam steering reconfigurable;beamwidth reconfigurable;low noise amplifier (LNA);noise figure (NF);nonlinearity;quasi-duplexing","Apertures;Gain;Beam steering;Antennas;Antenna measurements;Metasurfaces;Antenna radiation patterns","","8","","38","IEEE","30 May 2022","","","IEEE","IEEE Journals"
"Low Grating Lobe Cable-Network Reflector Antenna Design Using Integrated Structural-Electromagnetic Optimization Method","Z. Yali; L. Shuaipeng; Z. Duo; S. Wenlu","School of Electronics and Information, Northwestern Polytechnical University, Xi’an, China; School of Electronics and Information, Northwestern Polytechnical University, Xi’an, China; School of Electronics and Information, Northwestern Polytechnical University, Xi’an, China; School of Electronics and Information, Northwestern Polytechnical University, Xi’an, China",IEEE Transactions on Antennas and Propagation,"8 Nov 2022","2022","70","10","9017","9024","Geometric approximation errors of periodically distributed surface facets of cable-network reflector antennas can result in grating lobes undesired in some space missions. As the surface is shaped by the tensioned flexible cable-network structure, the electromagnetic (EM) and structural parameters are highly correlated, and the well-designed surface obtained only concerning the EM performance may not be shaped by the tension-only cable network with specified cable-tension constraints. To address the problem, this study proposes an integrated structural-EM optimization method to enable low grating lobe cable-network antenna design. In this method, force densities of the cables, which can determine both the cable tensions and surface node positions that decide the boundary conditions of the EM field, are selected as the design variables. An adaptive objective/constraint function is proposed, which enables the grating lobe level (GLL) to be minimized with constrained cable tensions, antenna gain, and first sidelobe level (SLL) in a simultaneous, feasible and relatively fast way. To demonstrate the feasibility and effectiveness of the proposed method, it was implemented on a 12 m-diameter cable-network antenna. The results indicate that the grating lobes are greatly degraded and the achieved surface can be formed by well tensioned cables.","1558-2221","","10.1109/TAP.2022.3184476","National Natural Science Foundation of China(grant numbers:51705423); Natural Science Basic Research Program of Shaanxi(grant numbers:2020JQ-188); Open Fund of Key Laboratory of Electronic Equipment Structure Design (Ministry of Education) in Xidian University(grant numbers:EESD1802); ","https://ieeexplore.ieee.org/stamp/stamp.jsp?arnumber=9806301","Antenna gain;cable-network reflector antenna;first sidelobe;force densities;grating lobes;integrated structural-electromagnetic (EM) optimization method","Gratings;Reflector antennas;Antennas;Electromagnetics;Power cables;Approximation error;Force","","4","","25","IEEE","24 Jun 2022","","","IEEE","IEEE Journals"
"Broadband 400 GHz On-Chip Antenna With a Metastructured Ground Plane and Dielectric Resonator","B. Gashi; D. Meier; L. John; B. Baumann; M. Rösch; A. Tessmann; A. Leuther; R. Quay","Fraunhofer Institute for Applied Solid State Physics (IAF), Freiburg im Breisgau, Germany; Fraunhofer Institute for Applied Solid State Physics (IAF), Freiburg im Breisgau, Germany; AP Sensing GmbH, Böblingen, Germany; Fraunhofer Institute for Applied Solid State Physics (IAF), Freiburg im Breisgau, Germany; Fraunhofer Institute for Applied Solid State Physics (IAF), Freiburg im Breisgau, Germany; Fraunhofer Institute for Applied Solid State Physics (IAF), Freiburg im Breisgau, Germany; Fraunhofer Institute for Applied Solid State Physics (IAF), Freiburg im Breisgau, Germany; Fraunhofer Institute for Applied Solid State Physics (IAF), Freiburg im Breisgau, Germany",IEEE Transactions on Antennas and Propagation,"8 Nov 2022","2022","70","10","9025","9038","The analysis, modeling, design, simulation, and experimental evaluation of a 400 GHz on-chip antenna is presented, with a novel combination of metastructures, a microstrip patch, a quartz-based dielectric resonator, and a diamond-based antireflex layer—all integrated on a 35 nm InGaAs metamorphic high-electron-mobility transistor (mHEMT) technology. The said combination represents a first-time implementation for all submillimeter-wave-capable semiconductor technologies. Circumventing a substrate-thickness limitation of  $4.98 \mu \text{m}$ , a state-of-the-art broadband, efficient, and to-the-broadside radiating on-chip antenna solution is realized. It achieves a measured impedance bandwidth of 100 GHz, 25.6%, spanning from 340 to 440 GHz. A consistent pattern bandwidth of 75 GHz is recorded, with an efficiency of 50%–66% and a directivity of up to 10.4 dBi—or 27 dBi, with the utilization of a polypropylene-based dielectric lens. The theoretical analysis of the proposed on-chip antenna is presented, and two modeling approaches are shown and compared. Between the analytical and the 3-D electromagnetic (EM) model, the latter is chosen as it offers greater precision in defining the metastructure unit cell and enables the inclusion of the remaining components of the proposed antenna setup. The measured reflection coefficient and far-field patterns are compared to simulations via the utilized model, and a strong agreement is observed. These far-field patterns are acquired with the on-chip antenna inserted within a broadband 400 GHz transmitter submillimeter-wave monolithic integrated circuit, processed on the 35 nm mHEMT technology.","1558-2221","","10.1109/TAP.2022.3177527","German Federal Ministry of Defence (BMVg) and the Bundeswehr Technical Center for Information Technology and Electronics (WTD81) in the framework of the RADKOM Program; ","https://ieeexplore.ieee.org/stamp/stamp.jsp?arnumber=9785469","Dielectric resonator;metamorphic high-electron-mobility transistor (mHEMT);metastructures;on-chip antenna;transmitter","Broadband antennas;System-on-chip;Dielectrics;mHEMTs;Dielectric resonator antennas;Substrates;Microstrip","","11","","51","CCBY","30 May 2022","","","IEEE","IEEE Journals"
"ELF-VLF Transmissions via Motion-Induced Radiation of Charges","M. J. Brandsema; T. D. Bufler","The Penn State Applied Research Laboratory, State College, PA, USA; The Penn State Applied Research Laboratory, State College, PA, USA",IEEE Transactions on Antennas and Propagation,"8 Nov 2022","2022","70","10","9039","9050","Mechanical antennas have garnered interest as a potential method of transmitting extremely low-frequency (ELF) to very-low-frequency (VLF) radiation in a manner that possesses a high efficiency of radiation and a low form factor. In this article, we investigate these claims by solving for the exact field solutions for one particular example, a rotational-oscillating charged thin spherical shell. The field solutions allow the analysis of the radiation pattern, radiation efficiency, and spectral output as a function of several geometric and kinematic quantities of the sphere. The results indicate that high efficiency with a low form-factor appears to be plausible, assuming that the required mechanical conditions for the motion can be achieved.","1558-2221","","10.1109/TAP.2022.3177503","","https://ieeexplore.ieee.org/stamp/stamp.jsp?arnumber=9785413","Extremely low frequency (ELF);high efficiency;mechanical antennas;motion-induced;radiation;very low frequency (VLF)","Current density;Transmitting antennas;Mathematical models;Antenna feeds;Ground penetrating radar;Geophysical measurement techniques;Geometry","","1","","20","IEEE","30 May 2022","","","IEEE","IEEE Journals"
"Penta-Mode Ultrawideband Circularly Polarized Stacked Patch Antennas Using Characteristic Mode Analysis","J. Zeng; Z. Zhang; F. H. Lin; F. Guan","State Key Laboratory of Surface Physics, Institute for Nanoelectronic Devices and Quantum Computing, Fudan University, Shanghai, China; State Key Laboratory of Surface Physics and the Department of Physics, Fudan University, Shanghai, China; School of Information Science and Technology, ShanghaiTech University, Shanghai, China; State Key Laboratory of Surface Physics, Institute for Nanoelectronic Devices and Quantum Computing, Fudan University, Shanghai, China",IEEE Transactions on Antennas and Propagation,"8 Nov 2022","2022","70","10","9051","9060","A penta-mode concept is proposed for the design of single-fed ultrawideband circularly polarized (CP) antennas. The concept involves five linearly polarized (LP) modes in a way that each two adjacent LP modes are designed with orthogonal polarizations of equal amplitude and quadrature phase difference. In this manner, each LP mode is shared by two LP modes nearby except for the first and the last mode in the band. As a result, the CP bandwidth is significantly improved. For proof of concept, a stacked U-slot patch antenna is proposed and designed with a characteristic mode analysis (CMA). The five modes are designed by optimizing the U-slot and the coupling between stacked patches. With the single-fed CP antenna element, a  $2\times $  2 CP array is further designed and prototyped. The measured CP bandwidths of antenna element and array are 52.7% [within 2:1 voltage standing wave ratio (VSWR) and 3 dB axial ratio] and 74% (within 2:1 active VSWR and 3 dB gain), respectively, a significant improvement compared with the conventional CP stacked structures of similar thickness or volume.","1558-2221","","10.1109/TAP.2022.3177485","China National Key Basic Research Program(grant numbers:2021YFA1400603,2020YFB1806405); Shanghai Pujiang Program(grant numbers:20PJ1411400); ","https://ieeexplore.ieee.org/stamp/stamp.jsp?arnumber=9785448","Axial ratio (AR);characteristic mode analysis (CMA);circularly polarized (CP);penta-mode resonance;single fed;stacked patch antenna;ultrawideband (UWB);U-slot","Patch antennas;Antennas;Antenna arrays;Substrates;Resonant frequency;Couplings;Wideband","","30","","58","IEEE","30 May 2022","","","IEEE","IEEE Journals"
"Metamaterial-Based Wide-Beam Dielectric Resonator Antenna for Broadband Wide-Angle Beam-Scanning Phased Array Applications","Z. Wang; S. Zhao; Y. Dong","School of Electronic Science and Engineering, University of Electronic Science and Technology of China (UESTC), Chengdu, China; School of Electronic Science and Engineering, University of Electronic Science and Technology of China (UESTC), Chengdu, China; School of Electronic Science and Engineering, University of Electronic Science and Technology of China (UESTC), Chengdu, China",IEEE Transactions on Antennas and Propagation,"8 Nov 2022","2022","70","10","9061","9072","A novel metamaterial-loaded, miniaturized, broadband, wide-beam dielectric resonator (DR) antenna is presented for low-cost wide-angle beam-scanning applications. The mushroom structure is loaded on the DR structure, so the proposed DR radiator reduces the size reduction (low profile,  $0.09\lambda _{0}$ ) and achieves a broadened bandwidth with a dual-mode response. The realized 3 dB beamwidth of the DR radiator is widened from 90° to 194° by introducing a pair of miniaturized equal-amplitude and out-of-phase Huygens sources. Owing to its compact size and wide beamwidth, a five-element low-cost wide-angle beam-scanning phased array is presented by using the proposed wide-beam DR elements. The measured −10 dB impedance bandwidth covers the 5G-78 band well (3.30–3.80 GHz, 14.1%). The realized scanning angle of the fabricated linear array can be extended from ±36° to ±65°, and its 3 dB beamwidth scanning coverage can up to ±90°. In virtue of miniaturized size, wideband, low cost, and good beam-scanning ability, the presented element, and the resulting wide-angle beam-scanning array are promising candidates for wireless communication and low-cost phased array applications.","1558-2221","","10.1109/TAP.2022.3178114","National Natural Science Foundation of China(grant numbers:62171091,62161160310); ","https://ieeexplore.ieee.org/stamp/stamp.jsp?arnumber=9787080","Dielectric resonator (DR) antenna;metamaterial;miniaturization;mushroom;wide-angle beam-scanning phased array;wide beamwidth","Phased arrays;Broadband antennas;Bandwidth;Loading;Dielectric resonator antennas;Loaded antennas;Wireless communication","","36","","47","IEEE","2 Jun 2022","","","IEEE","IEEE Journals"
"Analytical Study on the Resonance Frequency of Tunable Surface-Wave-Excited Plasma Antennas","M. -R. Dorbin; A. K. Horestani; F. Sadeghikia; M. T. Noghani; H. Jaafar","Center of Excellence on Applied Electromagnetic Systems, School of Electrical and Computer Engineering (ECE), College of Engineering, University of Tehran, Tehran, Iran; Wireless Telecommunication Group, ARI, Ministry of Science, Research and Technology, Tehran, Iran; Wireless Telecommunication Group, ARI, Ministry of Science, Research and Technology, Tehran, Iran; Wireless Telecommunication Group, ARI, Ministry of Science, Research and Technology, Tehran, Iran; Antenna Research Centre, Faculty of Electrical Engineering, Universiti Teknologi MARA, Dungun, Terengganu, Malaysia",IEEE Transactions on Antennas and Propagation,"8 Nov 2022","2022","70","10","9073","9082","In this article, an accurate analytical model for the calculation of the resonant length of a surface-wave-excited plasma antenna based on the distribution of the plasma density along the column is presented. In the proposed method, the propagation and attenuation constants for a surface-wave-excited plasma column are derived by solving the surface wave propagation problem on a three-layer tube, and as a result, the distribution of the plasma density along the column is investigated. Specifically, it is shown that a plasma column acts as a slow wave medium. Therefore, the resonant length of a plasma antenna is less than the resonant length of its metallic counterpart. For the experimental validation of the presented model, an efficient coupling structure for feeding the excitation wave to the plasma antenna is proposed that allows frequency tunability and reconfigurability of the antenna. A prototype of the proposed structure has been designed and fabricated. Good agreement between the analytical, numerical, and measurement results validates the proposed model.","1558-2221","","10.1109/TAP.2022.3184510","","https://ieeexplore.ieee.org/stamp/stamp.jsp?arnumber=9806325","Plasma antenna;resonance frequency;surface-wave-excited plasma;tunable plasma antenna","Plasmas;Antennas;Surface waves;Electron tubes;Antenna feeds;Plasma density;Analytical models","","15","","20","IEEE","24 Jun 2022","","","IEEE","IEEE Journals"
"An Antenna Based on Three Coupled Dipoles With Minimized E-Field for Ultra-High-Field MRI","R. Balafendiev; G. Solomakha; M. Dubois; R. Abdeddaim; S. Enoch; C. R. Simovski; S. Glybovski","School of Physics and Engineering, ITMO University, St. Petersburg, Russia; School of Physics and Engineering, ITMO University, St. Petersburg, Russia; Multiwave Imaging, Marseille, France; Institut Fresnel, Institut Marseille Imaging, Aix Marseille Univ, CNRS, Centrale Marseille, Marseille, France; Institut Fresnel, Institut Marseille Imaging, Aix Marseille Univ, CNRS, Centrale Marseille, Marseille, France; Department of Electronics and Nanoengineering, School of Electrical Engineering, Aalto University, Aalto, Finland; School of Physics and Engineering, ITMO University, St. Petersburg, Russia",IEEE Transactions on Antennas and Propagation,"8 Nov 2022","2022","70","10","9083","9092","In this work, we demonstrate an approach for local reduction of the electric field amplitude of the transmitted radio-frequency signal in ultrahigh-field magnetic resonance imaging (MRI). We excite a suitable combination of three coupled dipole hybrid resonances composing a single transmit antenna array element. Using numerical optimization, we designed a feeding network for three coupled dipoles placed over an electromagnetic phantom mimicking a human body. This network of discrete elements provides the appropriate amplitudes and phases of three dipole currents excited by a single input port. It allows controlling the electric field distribution in the vicinity of the antenna. Our goal was to obtain a minimum of the electric field at the given relatively small depth inside the phantom, where body implants are typically located while keeping a tolerable level of the magnetic field toward the phantom’s center. We designed and manufactured a three-dipole antenna prototype optimized for MRI of the human body at 7 T (proton Larmor frequency of 298 MHz). The experimental validation showed a 40 dB reduction of the electric field amplitude at a depth of 4 cm compared to a conventional single-dipole antenna. The coupling network can be rearranged to target different depths. Therefore, a principle of electric field minimization at a controllable position inside the body has been shown, which may be useful for designing transmit MRI antennas with improved safety of implants.","1558-2221","","10.1109/TAP.2022.3195515","Russian Science Foundation(grant numbers:21-19-00707); Matlab optimization by the FET-PROACT M-ONE(grant numbers:#952106); European Union Horizon 2020 Research and Innovation Program(grant numbers:736937); ","https://ieeexplore.ieee.org/stamp/stamp.jsp?arnumber=9852114","7 T;antenna;dipole;magnetic resonance imaging (MRI);modes;specific absorption rate (SAR);ultrahigh field","Magnetic resonance imaging;Electric fields;Dipole antennas;Antennas;Transmitting antennas;Radio frequency;Phased arrays","","3","","39","CCBY","8 Aug 2022","","","IEEE","IEEE Journals"
"An Eight-Port Planar Antenna for 3-D Beam Steering","S. J. Hosseini; M. K. Amirhosseini","School of Electrical Engineering, Iran University of Science and Technology, Tehran, Iran; School of Electrical Engineering, Iran University of Science and Technology, Tehran, Iran",IEEE Transactions on Antennas and Propagation,"8 Nov 2022","2022","70","10","9093","9100","An eight-port planar leaky-wave antenna (LWA) is proposed. This antenna has the capability of beam steering at an elevation angle by changing the frequency at eight azimuth angles. The antenna is planar and has an array of ring slots embedded in a microstrip parallel plate waveguide. We investigate the simulation and experimental results. The measured results have good agreement with the simulation and confirmed the leaky-wave (LW) concept. The proposed antenna yields an attractive, simple, and cost-effective beam scanning over the 3-D space.","1558-2221","","10.1109/TAP.2022.3184475","","https://ieeexplore.ieee.org/stamp/stamp.jsp?arnumber=9834237","Antenna array;beam steering;frequency beam scanning;leaky-wave antenna (LWA);pencil beam;periodic leaky-wave (LW);planar antenna","Antennas;Slot antennas;Substrates;Microstrip;Antenna feeds;Permittivity;Microstrip antennas","","6","","29","IEEE","20 Jul 2022","","","IEEE","IEEE Journals"
"A Shared-Aperture Antenna for (3.5, 28) GHz Terminals With End-Fire and Broadside Steerable Beams in Millimeter Wave Band","W. -W. Yang; X. -H. Ding; T. -W. Chen; L. Guo; W. Qin; J. -X. Chen","School of Information Science and Technology, Nantong University, Nantong, China,; School of Information Science and Technology, Nantong University, Nantong, China,; School of Information Science and Technology, Nantong University, Nantong, China,; School of Information Science and Technology, Nantong University, Nantong, China,; School of Information Science and Technology, Nantong University, Nantong, China,; School of Information Science and Technology, Nantong University, Nantong, China,",IEEE Transactions on Antennas and Propagation,"8 Nov 2022","2022","70","10","9101","9111","In this article, a concept of partial structure reuse is presented, and on this basis, a 3.5/28 GHz shared-aperture antenna supporting 2-D (endfire and broadside) steerable beams in the millimeter-wave (MMW) band is developed. The antenna consists of a 3.5 GHz planar inverted-F antenna (PIFA) and two 1  $\times $  6 28 GHz substrate-integrated DRA (SIDRA) beam-steerable arrays, in which partial structures of the PIFA are reused by the two MMW arrays. To improve the performance of PIFA, two narrow slots and one lumped capacitor are introduced to reduce its H-plane cross-polarization and enhance the operating bandwidth, respectively. To verify the design, antenna prototypes were fabricated and measured. Measured results show that the antenna can cover a dual-band of 3.28–3.67 (11.2%) and 26–29.7 (13.2%) for the endfire and 25.9–29.7 GHz (13.8%) for the broadside. The peak gains of 4.8 and 10 (endfire) and 10.8 dBi (broadside) are obtained by the MW element and two 1  $\times $  4 MMW arrays, respectively. Each of the MMW arrays can steer the beams from − 50° to + 50°, covering different parts of the space. The shared-aperture antenna has a compact size of 0.45  $\times $  0.3  $\times \,\,0.03\lambda _{01}^{3}$  ( $\lambda _{01}$  is the free-space wavelength at 3.5 GHz), making it suitable for terminal applications.","1558-2221","","10.1109/TAP.2022.3178159","National Natural Science Foundation of China(grant numbers:62071256); National Natural Science Foundation of Jiangsu(grant numbers:BK20201438); Qing Lan Project of Jiangsu Province; ","https://ieeexplore.ieee.org/stamp/stamp.jsp?arnumber=9787339","Beam steering array;broadside;dielectric resonator antenna;endfire;millimeter-wave;shared-aperture","Antenna arrays;Antennas;Substrates;Dielectric resonator antennas;Aperture antennas;Bandwidth;Capacitors","","30","","40","IEEE","2 Jun 2022","","","IEEE","IEEE Journals"
