"ELF Near-Field Propagation of a Vertical Electric Dipole Due to Lightning Discharges","H. L. Xu; X. Wang; M. Pang; X. Ji; H. Lin; T. T. Gu","Nanjing Institute of Electronic Equipment, Qinhuai, Nanjing, China; Nanjing Institute of Electronic Equipment, Qinhuai, Nanjing, China; State Key Laboratory of CAD&CG, Zhejiang University, Hangzhou, China; State Key Laboratory of CAD&CG, Zhejiang University, Hangzhou, China; State Key Laboratory of CAD&CG, Zhejiang University, Hangzhou, China; State Key Laboratory of CAD&CG and the Department of Information Science and Electronic Engineering, Zhejiang University, Hangzhou, China",IEEE Transactions on Antennas and Propagation,"2 Feb 2022","2022","70","2","1250","1264","The Sommerfeld integrals (SIs) representing the electromagnetic (EM) wave propagation of a vertical electric dipole (VED), which has been established over a century, is essential for the understanding of EM radiation scheme of the natural extremely low-frequency (ELF) noises due to lightning discharges. The classical treatments providing with analytical formulas, such as “quasi-static” method and branch-cut integrations, however, rely on their validity of the applicable conditions, leading to considerable discrepancies in near zone for results between theoretical predictions and experimental observations in estimating the ELF radiation process of lightning discharges. By exploiting the assumptions of  $\gamma _{0}\approx {\mathrm{ i}}\lambda $  and  $|\gamma _{0}\gamma _{1}|/k_{0}^{2}\gg 1$  (wavelength-scale), we re-visit the SIs to derive simplified formulas, where the ground medium is treated as a homogeneous highly conducting medium (i.e., all relevant ELF frequency scales below about 30 Hz). In the meanwhile, the exact formulas are derived by an inverse Fourier transformation (IFT) from SIs for ELF transient pulses. Computation and discussion are carried out by obtained formulas for the modeling of the near-field propagation (distance-scale) caused by lightning, which would provide with higher accuracies than using traditional approaches.","1558-2221","","10.1109/TAP.2021.3122867","Chinese National Key Research and Development Program(grant numbers:2020YFC2201303); National Natural Science Foundation of China(grant numbers:62001020); ","https://ieeexplore.ieee.org/stamp/stamp.jsp?arnumber=9597468","Dual-exponential function;electromagnetic (EM) pulse;extremely low frequency (ELF) near-field;lightning discharge;vertical electric dipole (VED)","Lightning;Ground penetrating radar;Geophysical measurement techniques;Silicon;Discharges (electric);Dipole antennas;Receivers","","3","","38","IEEE","1 Nov 2021","","","IEEE","IEEE Journals"
"Ray-Optical Evaluation of Scattering From Electrically Large Metasurfaces Characterized by Locally Periodic Surface Susceptibilities","S. Stewart; Y. L. C. de Jong; T. J. Smy; S. Gupta","Department of Electronics, Carleton University, Ottawa, ON, Canada; Communications Research Centre Canada (CRC), Ottawa, ON, Canada; Department of Electronics, Carleton University, Ottawa, ON, Canada; Department of Electronics, Carleton University, Ottawa, ON, Canada",IEEE Transactions on Antennas and Propagation,"2 Feb 2022","2022","70","2","1265","1278","This work continues the development of the ray-tracing method of de Jong (2021) for computing the scattered fields from metasurfaces characterized by locally periodic reflection and transmission coefficients. In this work, instead of describing the metasurface in terms of scattering coefficients that depend on the incidence direction, its scattering behavior is characterized by the surface susceptibility tensors that appear in the generalized sheet transition conditions (GSTCs). As the latter quantities are constitutive parameters, they do not depend on the incident field and, thus, enable a more compact and physically motivated description of the surface. The locally periodic susceptibility profile is expanded into a Fourier series subject to a spatially varying phase parameter, and the GSTCs are rewritten in a form that enables them to be numerically solved for the reflected and transmitted surface fields. The phase parameter can either be determined from a prescribed surface transformation or extracted from known surface susceptibilities. A method for the extraction of this phase parameter from a susceptibility profile using a spatial variant of the short-time Fourier transform (STFT) is proposed. The scattered field at arbitrary detector locations is constructed by evaluating critical-point contributions of the first and second kinds using a forward ray-tracing (FRT) scheme. The accuracy of the resulting framework has been verified with an integral equation-based boundary element method (BEM)-GSTC full-wave solver for a variety of examples, such as a periodically modulated metasurface, a metasurface diffuser, and a beam collimator.","1558-2221","","10.1109/TAP.2021.3111665","","https://ieeexplore.ieee.org/stamp/stamp.jsp?arnumber=9540248","Electromagnetic (EM) metasurfaces;generalized sheet transition conditions (GSTCs);high-frequency methods;periodic structures;short-time Fourier Transformation;uniform theory of diffraction (UTD)","Metasurfaces;Optical surface waves;Scattering;Surface waves;Tensors;Integral equations;Diffraction","","10","","45","IEEE","16 Sep 2021","","","IEEE","IEEE Journals"
"Angular Clustering of Millimeter-Wave Propagation Channels With Watershed Transformation","P. Lyu; A. Benlarbi-Delaï; Z. Ren; J. Sarrazin","Chinese Academy of Sciences, Institute of Microelectronics, Beijing, China; CNRS, Laboratoire de Génie Electrique et Electronique de Paris, Sorbonne Université, Paris, France; CNRS, Laboratoire de Génie Electrique et Electronique de Paris, Sorbonne Université, Paris, France; CNRS, Laboratoire de Génie Electrique et Electronique de Paris, Sorbonne Université, Paris, France",IEEE Transactions on Antennas and Propagation,"2 Feb 2022","2022","70","2","1279","1290","An angular clustering method based on image processing is proposed in this article. It is used to identify clusters in 2-D representations of propagation channels. The approach uses operations such as watershed segmentation and is particularly well suited for clustering directional channels obtained by beam steering at millimeter wave. This situation occurs for instance with electronic beam steering using analog antenna arrays during beam-training process or channel modeling measurements using either electronic or mechanical beam steering. In particular, the proposed technique is used here to cluster 2-D power angular spectrum maps. The proposed clustering is unsupervised and is well suited to preserve the shape of clusters by considering the angular connection between neighbor samples, which is useful to obtain more accurate descriptions of channel angular properties. The approach is found to outperform approaches based on K-power-means in terms of accuracy as well as computational resources. The technique is assessed in simulation using the IEEE 802.11ad channel model and in measurement using experiments conducted at 60 GHz in an indoor environment.","1558-2221","","10.1109/TAP.2021.3119051","National Key Research and Development Program of China(grant numbers:2017YFB0203500); National Science Foundation of China(grant numbers:61501454); Indo-French Center for the Promotion of Advanced Research (CEFPRA) through the NOVIS60 Project; ","https://ieeexplore.ieee.org/stamp/stamp.jsp?arnumber=9576574","2-D angular measurements at 60 GHz;millimeter wave (mm-wave);propagation channel angular clustering;watershed transformation","Clustering methods;Antenna arrays;Shape;Antenna measurements;Channel models;Three-dimensional displays;Feature extraction","","4","","58","IEEE","15 Oct 2021","","","IEEE","IEEE Journals"
"A Unified Line-of-Sight Probability Model for Commercial 5G Mobile Network Deployments","D. Townend; S. D. Walker; A. Sharples; A. Sutton","Department of Wireless Research, British Telecom, Ipswich, U.K.; School of Computer Science and Electronic Engineering, University of Essex, Colchester, U.K.; Department of Wireless Research, British Telecom, Ipswich, U.K.; Department of BT Technology, British Telecom, London, U.K.",IEEE Transactions on Antennas and Propagation,"2 Feb 2022","2022","70","2","1291","1297","In this article, we present a novel analytical approach used to derive a new multiscenario line-of-sight (LOS) probability model for cellular network deployments in the U.K. The approach considers the use of lamp post databases as statistically representative geospatial data points for the evaluation of LOS likelihood from macrocellular base stations. Crucially, the proposed model is built on a high-resolution (0.25–1 m) 3-D digital surface model underpinned by real network and environmental datasets and validated with supporting field measurements. This work unifies all common cell site classification types: urban, suburban, and rural into a single 3-D LOS statistical probability model while also addressing the influence of endpoint height properties up to 10 m. The contributions outlined in this article have applications in statistical path loss modeling and coverage/outage probability. They also have direct application in deployment modeling of millimeter-wave (mmWave) mobile access networks (24.25–52.6 GHz) and wireless x-haul transport networks (71–174.8 GHz).","1558-2221","","10.1109/TAP.2021.3119099","","https://ieeexplore.ieee.org/stamp/stamp.jsp?arnumber=9576581","Channel modeling;deployment modeling;line-of-sight (LOS) probability;millimeter wave (mmWave);mobile network","3GPP;Solid modeling;Data models;Three-dimensional displays;Base stations;Probability;ITU","","3","","18","IEEE","15 Oct 2021","","","IEEE","IEEE Journals"
"A Spatially Confined, Platform-Based HF Direction Finding Array","R. Ma; N. Behdad","Department of Electrical and Computer Engineering, University of Wisconsin–Madison, Madison, WI, USA; Department of Electrical and Computer Engineering, University of Wisconsin–Madison, Madison, WI, USA",IEEE Transactions on Antennas and Propagation,"2 Feb 2022","2022","70","2","1298","1308","A spatially confined, platform-based high-frequency (HF) antenna array with enhanced bandwidth and direction-finding (DF) accuracy is presented. As the HF band is widely used in many important civilian and military applications, HF DF systems are of great interest in electronic warfare support applications. However, due to the large wavelength, practical DF arrays mounted on moving platforms tend to be electrically small, resulting in fundamental limitations on antenna bandwidth and DF accuracy. Furthermore, many applications require mounting the array at a single location on the platform due to limited space and mobility considerations. To alleviate these issues, we employ the platform as the major radiator by exciting several of its significant characteristic modes (CMs) using a spatially confined antenna array. Specifically, we examined four DF array designs mounted on a representative, mid-size passenger airplane operating at 10 MHz in simulation, each of which is confined within a virtual sphere with a 3 m diameter. A scaled model of one design was fabricated and characterized. Cramer–Rao bounds and Monte Carlo test results are also reported. Our results demonstrate that the proposed DF array can provide a 15% lower direction-of-arrival estimation error than the theoretical limit of a standalone array possessing the same volume and having the same bandwidth.","1558-2221","","10.1109/TAP.2021.3111311","Department of Navy, Office of Naval Research(grant numbers:N00014-15-1-2207,N00014-16-1-2098); ","https://ieeexplore.ieee.org/stamp/stamp.jsp?arnumber=9539088","Antenna arrays;array signal processing;characteristic mode (CM) theory;direction-of-arrival (DoA) estimation;electrically small antenna","Antenna arrays;Harmonic analysis;Bandwidth;Direction-of-arrival estimation;Antenna theory;Couplings;Signal to noise ratio","","10","","30","IEEE","15 Sep 2021","","","IEEE","IEEE Journals"
"Considerations of Dielectric Property Deviation and Mechanical Limitations for Antenna-in-Package Fabrication by SiP-Based Stacked Organic Dielectric Substrates at Millimeter-Wave Frequencies","H. -T. Chou; Z. -H. Lin; D. -B. Lin; C. -S. Yang; P. -Z. Shen; C. -L. Pan","Graduate Institute of Communication Engineering, National Taiwan University, Taipei, Taiwan; Graduate Institute of Communication Engineering, National Taiwan University, Taipei, Taiwan; Department of Electronic Engineering, National Taiwan University of Science and Technology, Taipei, Taiwan; Department of Electrical Engineering, Ming Chi University of Technology, New Taipei City, Taiwan; Department of Electronic Engineering, National Taiwan University of Science and Technology, Taipei, Taiwan; Powertech Technology Inc., Hsinchu, Taiwan",IEEE Transactions on Antennas and Propagation,"2 Feb 2022","2022","70","2","1309","1319","Wireless communications at millimeter-wave (mmW) frequencies suffer high propagation loss and low energy efficiency. The feeding circuits in dielectric substrates may also result in antenna excitation distortions in both phases and amplitudes. Antenna-in-package (AiP) integrating active RF transceivers is considered a reliable means to shorten RF circuit path lengths and connectors to enhance user equipment (UE) antennas’ radiation characteristics. However, due to the several mechanical limitations and fabrication uncertainty at mmW frequencies, AiP implementation should better consider geometric parameter effects, which may degrade its radiation performance, to reduce beamforming complexity for easy design and low-cost fabrication. Besides, by taking advantage of active RF transceiver modules to provide output amplitude ratios and phase variations, the feeding circuits can be simplified to shorten the feeding microstrip line lengths. These effects are examined and presented in this article for a practical design of an AiP fabricated for validation by comparing full-wave simulations and measurement results. Simulations and measurements also validate using the calibration technique to simplify the feeding structures to demonstrate the feasibility.","1558-2221","","10.1109/TAP.2021.3111340","Powertech Technology Inc. (PTI); Ministry of Science and Technology, Taiwan; ","https://ieeexplore.ieee.org/stamp/stamp.jsp?arnumber=9538994","Antenna array;antenna in package (AiP);millimeter wave (mmW) frequency;organic dielectric substrate;system in package (SiP)","Substrates;Fabrication;Dielectric substrates;Copper;Microstrip;Radio frequency;Dielectric constant","","10","","56","IEEE","15 Sep 2021","","","IEEE","IEEE Journals"
"Near Field Radio Frequency Electromagnetic Field Exposure of a Western Honey Bee","D. Toribio; W. Joseph; A. Thielens","Department of Information Technology, Ghent University, Ghent, Belgium; Department of Information Technology, Ghent University, Ghent, Belgium; Department of Information Technology, Ghent University, Ghent, Belgium",IEEE Transactions on Antennas and Propagation,"2 Feb 2022","2022","70","2","1320","1327","It has been suggested that the wireless network evolution to smaller carrier wavelengths (from 2G to 5G) increases radio frequency electromagnetic field (RF-EMF) absorption in western honey bees (Apis mellifera). It is unknown whether the radiation performance of antennas is stable when an insect appears in their vicinity. In this research, the absorbed power in a worker honey bee and the influence of the bee’s presence on antennas’ radiation performance are investigated for the newly used frequencies in 5G networks from 6 to 240 GHz. To these aims, numerical simulations using the finite-difference time-domain (FDTD) method were performed, in which a bee model, obtained by micro-CT scanning, was employed. These simulations showed that, in the near field, the absorbed power can increase by a factor of 53 from 6 to 240 GHz. This is a factor of 7 higher than the increase reported in the far-field in previous studies. Furthermore, the simulations revealed that antennas’ radiation efficiency can decrease by up to −40% when a bee appears in the near field. Likewise, it was found that the gain pattern depends on the separation distance between the bee and the antenna with a stronger dependency for higher frequencies.","1558-2221","","10.1109/TAP.2021.3111286","Research Foundation Flanders (FWO)(grant numbers:G033220N); FWO(grant numbers:12U1417N); ","https://ieeexplore.ieee.org/stamp/stamp.jsp?arnumber=9539081","Dipole antenna;finite-difference time-domain (FDTD) method;millimeter waves;near field;radio-frequency electromagnetic fields (RF-EMFs);RF-EMF exposure;western honey bees","Insects;Dielectrics;Antennas;Dipole antennas;Numerical models;Absorption;Solid modeling","","13","","31","IEEE","15 Sep 2021","","","IEEE","IEEE Journals"
"On the Design of Complex EM Devices and Systems Through the System-by-Design Paradigm: A Framework for Dealing With the Computational Complexity","A. Massa; M. Salucci","Department of Civil, Environmental, and Mechanical Engineering (DICAM), ELEDIA Research Center (ELEDIA@UESTC - UESTC), School of Electronic Engineering, Chengdu, China; Department of Civil, Environmental, and Mechanical Engineering (DICAM), ELEDIA Research Center (ELEDIA@UESTC - UESTC), School of Electronic Engineering, Trento, Italy",IEEE Transactions on Antennas and Propagation,"2 Feb 2022","2022","70","2","1328","1343","The system-by-design (SbD) is an emerging engineering framework for the optimization-driven design of complex electromagnetic (EM) devices and systems. More specifically, the computational complexity of the design problem at hand is addressed by means of a suitable selection and integration of functional blocks comprising problem-dependent and computationally efficient modeling and analysis tools as well as reliable prediction and optimization strategies. Due to the suitable reformulation of the problem at hand as an optimization one, the profitable minimum-size coding of the degrees of freedom (DoFs), and the “smart” replacement of expensive full-wave (FW) simulators with proper surrogate models (SMs), which yield fast yet accurate predictions starting from minimum size/reduced CPU-costs training sets, a favorable “environment” for optimal exploitation of the features of global optimization tools in sampling wide/complex/nonlinear solution spaces is built. This research summary is then aimed at: 1) providing a comprehensive description of the SbD framework and of its pillar concepts and strategies; 2) giving useful guidelines for its successful customization and application to different EM design problems characterized by different levels of computational complexity; and 3) envisaging future trends and advances in this fascinating and high-interest (because of its relevant and topical industrial and commercial implications) topic. Representative benchmarks concerned with the synthesis of complex EM systems are presented to highlight advantages and potentialities as well as current limitations of the SbD paradigm.","1558-2221","","10.1109/TAP.2021.3111417","“WATERTECH - Smart Community per lo Sviluppo e l’Applicazione di Tecnologie di Monitoraggio Innovative per le Reti di Distribuzione Idrica negli usi idropotabili ed agricoli”(grant numbers:SCN_00489); Italian Ministry of Education, University, and Research within the Program “Smart cities and communities and Social Innovation”(grant numbers:CUP: E44G14000060008); “SMARTOUR - Piattaforma Intelligente per il Turismo”(grant numbers:SCN_00166); Italian Ministry of Education, University, and Research within the Program “Smart cities and communities and Social Innovation”(grant numbers:CUP: E44G14000040008); “CYBER-PHYSICAL ELECTROMAGNETIC VISION: Context-Aware Electromagnetic Sensing and Smart Reaction (EMvisioning)”(grant numbers:2017HZJXSZ); Italian Ministry of Education, University, and Research within the PRIN2017 Program(grant numbers:CUP: E64I19002530001); Project SPEED(grant numbers:61721001); National Science Foundation of China under Chang-Jiang Visiting Professorship Program; ","https://ieeexplore.ieee.org/stamp/stamp.jsp?arnumber=9539042","Complex EM problems;learning-by-examples (LBEs);optimization;surrogate modeling (SM);system-by-design (SbD)","Cost function;Computational modeling;Mathematical model;Computational complexity;Tools;Splines (mathematics);Smart cities","","61","","61","IEEE","15 Sep 2021","","","IEEE","IEEE Journals"
"Experimental Investigation of Body-Centric Indoor Localization Using Compact Wearable Antennas and Machine Learning Algorithms","R. Bharadwaj; A. Alomainy; S. K. Koul","Microwave and RF Group, Centre for Applied Research in Electronics, IIT Delhi, New Delhi, India; School of Electronic Engineering and Computer Science, Queen Mary University of London, London, U.K; Microwave and RF Group, Centre for Applied Research in Electronics, IIT Delhi, New Delhi, India",IEEE Transactions on Antennas and Propagation,"2 Feb 2022","2022","70","2","1344","1354","A simple and effective body-centric localization algorithm has been proposed in this article using ultra-wideband (UWB) wearable technology. The algorithm has been validated through measurement campaigns with a human subject volunteer in an indoor environment. The algorithm takes into account statistical channel parameter analysis, machine learning (ML) algorithms, and time-of-arrival (TOA)-based range estimation/data fusion techniques. Two channel parameters namely path loss magnitude and rms delay spread are proposed as classification features to be applied to the ML algorithm to accurately classify the off-body channel links into LOS, PNLOS, and NLOS scenarios. Multiclass support vector machine (MC-SVM) classifier along with SMOTE algorithm to take into account class imbalance is applied with the channel classification accuracy of 98.63%. Threshold-based range estimation algorithms are applied in order to mitigate NLOS scenarios caused mainly due to the presence of the human subject. Results report human localization accuracy in 0.5–3 cm range using TDOA data fusion technique for target estimation. Further validation is presented considering wide range of Tx–Rx distance, presence of another obstruction between the Tx and Rx links, and performance in different environment which shows the suitability of the proposed methodology.","1558-2221","","10.1109/TAP.2021.3111308","","https://ieeexplore.ieee.org/stamp/stamp.jsp?arnumber=9538971","Body-centric communication;channel characterization;indoor localization;machine learning (ML);wearable antennas","Location awareness;Classification algorithms;Machine learning algorithms;Wireless communication;Delays;Ultra wideband antennas;Indoor environment","","24","","50","IEEE","15 Sep 2021","","","IEEE","IEEE Journals"
"A 403 MHz Wireless Power Transfer System With Tuned Split-Ring Loops for Implantable Medical Devices","J. Wang; E. G. Lim; M. P. Leach; Z. Wang; R. Pei; Z. Jiang; Y. Huang","School of Advanced Technology, Xi&#x2019;an Jiaotong&#x2013;Liverpool University, Suzhou, China; School of Advanced Technology, Xi&#x2019;an Jiaotong&#x2013;Liverpool University, Suzhou, China; School of Advanced Technology, Xi&#x2019;an Jiaotong&#x2013;Liverpool University, Suzhou, China; School of Advanced Technology, Xi&#x2019;an Jiaotong&#x2013;Liverpool University, Suzhou, China; School of Advanced Technology, Xi&#x2019;an Jiaotong&#x2013;Liverpool University, Suzhou, China; School of Advanced Technology, Xi&#x2019;an Jiaotong&#x2013;Liverpool University, Suzhou, China; Department of Electrical Engineering and Electronics, University of Liverpool, Liverpool, U.K",IEEE Transactions on Antennas and Propagation,"2 Feb 2022","2022","70","2","1355","1366","A near-field wireless power transfer (WPT) system for implantable medical devices, such as pacemakers, is proposed. Operating at 403 MHz within the medical implants communication service (MICS) band, the WPT link constitutes a primary loop to be based outside the body as a transmitter and an implantable loop with a single-turn as a receiver. Simulation and experimental results show that the proposed link offers good power transfer efficiency (PTE) performance. The maximum measured PTE of the proposed link is 57.9% at a transfer distance of 6 mm through 1 mm of air and 5 mm of body tissue. The maximum input power that can be supplied to stay within specific absorption rate safety guidelines is 159 mW. A rectifying circuit is designed to convert 403 MHz RF signals to dc for a 1.5 <inline-formula> <tex-math notation=""LaTeX"">$\text{k}\Omega $ </tex-math></inline-formula> load with a measured conversion efficiency of 73.2%. The measured end-to-end PTE of the proposed WPT system is 42.4%.","1558-2221","","10.1109/TAP.2021.3111520","AI University Research Center through the Xi'an Jiaotong-Liverpool University (XJTLU) Key Program Special Fund(grant numbers:KSF-P-02); XJTLU Research Development Fund(grant numbers:PGRS-13-03-06,RDF-14-03-24,RDF-14-02-48,PGRS 2006007,PGRS 2012013); ","https://ieeexplore.ieee.org/stamp/stamp.jsp?arnumber=9539001","Implantable medical devices;magnetic resonance coupling (MRC);near-filed;split-ring loops;wireless power transfer (WPT)","Frequency measurement;Wireless power transfer;Skin;Implants;Coils;Capacitors;Muscles","","40","","44","IEEE","15 Sep 2021","","","IEEE","IEEE Journals"
