"Mode-Counteraction Based Self-Decoupling in Circularly Polarized MIMO Microstrip Patch Array","Q. X. Lai; Y. M. Pan; S. Y. Zheng","School of Electronic and Information Engineering, South China University of Technology, Guangzhou, China; School of Electronic and Information Engineering, South China University of Technology, Guangzhou, China; Department of Electronics and Communication Engineering, Sun Yat-sen University, Guangzhou, China",IEEE Transactions on Antennas and Propagation,"8 Nov 2022","2022","70","10","9337","9346","A mode-counteraction-based self-decoupling method is proposed for the circularly polarized (CP) multi-input multi-output (MIMO) microstrip patch antenna (MPA) array. The array simply consists of two identical diagonal-fed rectangular MPAs, without any extra decoupling structure. It is found that by properly adjusting the patch dimensions and feeding positions, the orthogonal TM1, 0 and TM0, 1 modes can be simultaneously excited in the active MPA to generate the CP field. Meanwhile, the coupled  $E$ -fields of the two modes in the adjacent passive MPA can counteract each other, generating a null-field region. When the feeding probe of the passive MPA is placed within the null-field region, no signal can be received at the port, and consequently, an extremely low mutual coupling of −59.4 dB is achieved, without scarifying any other radiation performance of the MPA. In addition, this self-decoupling method is also applicable to other types of MPA arrays and four-element MPA arrays, exhibiting great versatility and extensibility.","1558-2221","","10.1109/TAP.2022.3184508","National Natural Science Foundation of China(grant numbers:61922031,61871187); ","https://ieeexplore.ieee.org/stamp/stamp.jsp?arnumber=9806377","Circularly polarized (CP) antenna;microstrip patch antenna (MPA);multi-input multi-output (MIMO) antenna;mutual coupling;self-decoupling","MIMO communication;Microstrip antenna arrays;Couplings;Antenna arrays;Mutual coupling;Probes;Microstrip","","34","","35","IEEE","24 Jun 2022","","","IEEE","IEEE Journals"
"Time Delay Unit Architecture Optimization for Phased Antenna Arrays Using Integer Linear Programming","D. A. Ramirez; W. J. D. Johnson; G. Mumcu","L3Harris Technologies, Palm Bay, FL, USA; L3Harris Technologies, Palm Bay, FL, USA; Electrical Engineering Department, University of South Florida, Tampa, FL, USA",IEEE Transactions on Antennas and Propagation,"8 Nov 2022","2022","70","10","9347","9356","A systematic method for optimizing the time delay unit architecture (TDU-A) of a phased antenna array (PAA) is introduced. The problem is cast in the standard form of integer linear programming optimization with an objective function that targets minimizing the total number of TDUs within the RF fan-out while maintaining phase error and manufacturability constraints. The presented optimization method can reduce the cost, power, and complexity of a broadband PAA in contrast to prior methods that converge on a manufacturable architecture without considering the total number of TDUs. Three optimization examples are presented with a requirement of a maximum of 5° phase error. These examples clearly show that there are many TDU-As that can satisfy the phase error requirement, yet only one architecture is superior by exhibiting the minimum number of TDUs. The superior architecture is highly likely to be missed in a traditional design approach that places the TDUs in the RF fan-out as close as possible to the antenna elements if the presented optimization approach is omitted.","1558-2221","","10.1109/TAP.2022.3185504","L3Harris Technologies, Inc; ","https://ieeexplore.ieee.org/stamp/stamp.jsp?arnumber=9810820","Broadband;integer programming;phased antenna array (PAA);true-time delay","Delay effects;Broadband antennas;Phased arrays;Optimization;Complexity theory;Linear antenna arrays;Delays","","6","","24","IEEE","29 Jun 2022","","","IEEE","IEEE Journals"
"3-D Printed Millimeter-Wave Metal-Only Dual-Band Circularly Polarized Reflectarray","J. Zhu; S. Liao; Q. Xue","Guangdong Principle Key Laboratory of Millimeter-Wave and Terahertz, School of Electronic and Information Engineering, South China University of Technology, Guangzhou, China; Guangdong Principle Key Laboratory of Millimeter-Wave and Terahertz, School of Electronic and Information Engineering, South China University of Technology, Guangzhou, China; Guangdong Principle Key Laboratory of Millimeter-Wave and Terahertz, School of Electronic and Information Engineering, South China University of Technology, Guangzhou, China",IEEE Transactions on Antennas and Propagation,"8 Nov 2022","2022","70","10","9357","9364","This article presents 3-D printed metal-only dual-band millimeter-wave circularly polarized (CP) reflectarrays (RAs). The RAs’ unit cell (UC) is made of an anisotropic metal brick mounted on a full metal ground. In-plane rotating the metal brick introduces geometric Pancharatnam–Berry (PB) phase shifting, and vertically adjusting the position of the UC provides propagation phase shifting. The geometric PB and propagation phase shifting offer two different degrees of freedom, enabling independent wavefront shaping of CP wave over dual-band. Specifically, the low-band CP beam shaping solely depends on the propagation phase. In contrast, the high-band CP beam shaping depends on the geometric PB and the propagation phases. The coupling issue between dual-band is minimal because of the unique dual-band phase-shifting methods. In addition, 3-D printed dual-band left-hand CP (LHCP) horn antennas are designed, printed, and used as the feed. To demonstrate, two RA antennas with different dual-band CP beam directions are fabricated and measured.","1558-2221","","10.1109/TAP.2022.3184483","Guangdong Province Natural Science Outstanding Youth Fund Project(grant numbers:2021B1515020039); ","https://ieeexplore.ieee.org/stamp/stamp.jsp?arnumber=9806369","3-D printing;circularly polarized (CP);dual-band;metal-only;reflectarray (RA)","Dual band;Reflection;Metals;Reflector antennas;Phased arrays;Antenna feeds;Millimeter wave technology","","22","","47","IEEE","24 Jun 2022","","","IEEE","IEEE Journals"
"3-D Printed Annular Linear-to-Circular Dielectric Polarizer and Its Applications to Omnidirectional and Multibeam Antennas","Z. L. Ma; S. C. Peng; Q. -X. Chu; Q. Xue","School of Electronic and Information Engineering, South China University of Technology, Guangzhou, China; School of Electronic and Information Engineering, South China University of Technology, Guangzhou, China; School of Electronic and Information Engineering, South China University of Technology, Guangzhou, China; School of Electronic and Information Engineering, South China University of Technology, Guangzhou, China",IEEE Transactions on Antennas and Propagation,"8 Nov 2022","2022","70","10","9365","9375","This article presents a 3-D printed dielectric polarizer. It is constituted by a number of annually arranged dielectric slabs, and each slab is 45° rotated with respect to the azimuth plane. It is able to transform the polarization state of the waves in azimuth plane from linear to circular. Based on the polarizer, two circularly polarized (CP) antenna designs are proposed. One of them is an omnidirectional CP antenna, and the other is a multibeam CP antenna with capability of full azimuthal scanning. They are fed by a dielectric filled biconical structure and six corner reflectors, respectively. Their polarizers are individually designed with different geometric parameters. Both antennas are one-piece configurations and can be directly 3-D printed without assemblies in later stage. Partial surfaces of the antennas are coated with copper films by an electroplating technique to act as the necessary metal components. To validate the design ideas, two prototypes are demonstrated in X-band. Experimental results show that the omnidirectional antenna can achieve a wide 3 dB axial ratio (AR) bandwidth of 28.3% from 8.5 to 11.3 GHz and a peak gain of 3.3 dBic. Meanwhile, the multibeam antenna is with a wide 3 dB AR bandwidth of 22.4% from 8.7 to 10.9 GHz and a peak gain of 9.2 dBic. Within the AR bandwidth, the AR values in full azimuth plane are lower than 3 dB.","1558-2221","","10.1109/TAP.2022.3177562","National Natural Science Foundation of China(grant numbers:61901175); Guangzhou Science and Technology Foundation Basic and Applied Basic Research Project(grant numbers:202102020861); Funds for Construction of Double World Class Project(grant numbers:x2dx/D6192120); ","https://ieeexplore.ieee.org/stamp/stamp.jsp?arnumber=9785421","3-D printing;annular polarizer;circularly polarized (CP) antenna;multibeam antenna;omnidirectional antenna","Dielectrics;Antennas;Slabs;Azimuth;Horn antennas;Dipole antennas;Bandwidth","","10","","31","IEEE","30 May 2022","","","IEEE","IEEE Journals"
"An Ultrawideband and High-Absorption Circuit-Analog Absorber With Incident Angle-Insensitive Performance","Z. Ma; C. Jiang; W. Cao; J. Li; X. Huang","Powder Metallurgy Research Institute, Central South University, Changsha, China; Powder Metallurgy Research Institute, Central South University, Changsha, China; Powder Metallurgy Research Institute, Central South University, Changsha, China; Powder Metallurgy Research Institute, Central South University, Changsha, China; Powder Metallurgy Research Institute, Central South University, Changsha, China",IEEE Transactions on Antennas and Propagation,"8 Nov 2022","2022","70","10","9376","9384","This work presents an ultrawideband and high-absorption structure (UHAS) obtained by a fast design method. The proposed analytic approach can simply design single-FSS-layer absorber with ideal performance stability under oblique incidence. With this method, a composite material reinforced circuit-analog (CA) absorber is designed, which unit cell of CA sheet is a square ring loaded with chip resistors. At normal incidence, both TE and TM polarization simulation results demonstrate that the reflection coefficient below −10 dB is from 5.8 to 22.2 GHz; meanwhile, the reflection coefficient less than −20 dB covers a bandwidth of 7.4–19.1 GHz; also, there is a −30 dB absorption band in 8.6–17.2 GHz. Furthermore, under TE polarization, experimental results indicate that UHAS can maintain a −20 dB absorption band from 7.4 to 18.0 GHz within 40° oblique angle of incidence; −10 dB absorption is from 6.1 to 18.0 GHz within 50° oblique angle of incidence. The good agreement between simulation and measurement validates the proposed method and UHAS. Finally, the UHAS, with a protective layer, will be more stable in practical applications.","1558-2221","","10.1109/TAP.2022.3177490","Science and Technology Program of Hunan Province(grant numbers:2015TP1007); Initial Research Funding for Special Associate Professor by Central South University(grant numbers:202045002); Hunan Science and Technology Innovation Talents Program(grant numbers:2021RC3003); ","https://ieeexplore.ieee.org/stamp/stamp.jsp?arnumber=9785419","Electromagnetic absorber;radar cross section (RCS) reduction;square ring;ultrawideband","Absorption;Slabs;Reflection;Reflection coefficient;Impedance;Bandwidth;Ultra wideband technology","","24","","21","IEEE","30 May 2022","","","IEEE","IEEE Journals"
"Direct Synthesis and Design of Wideband Linear-to-Circular Polarizers on 3-D Frequency Selective Structures","H. Li; B. Li; L. Zhu","School of Electronic and Optical Engineering, Nanjing University of Posts and Telecommunications, Nanjing, China; School of Electronic and Optical Engineering, Nanjing University of Posts and Telecommunications, Nanjing, China; Department of Electrical and Computer Engineering, University of Macau, Macau, SAR, China",IEEE Transactions on Antennas and Propagation,"8 Nov 2022","2022","70","10","9385","9395","A novel direct synthesis method for wideband linear-to-circular polarizers on 3-D frequency selective structures is presented. The proposed linear-to-circular polarizer consists of two orthogonal linearly polarized (LP) transmission paths, both of which are comprised by three cascaded sections of slotline structures. Under the incidence of an LP wave with its electric-field ( $E$ -field) vector of a titled angle 45°, each path can achieve a transmission passband for one of the two orthogonal components decomposed by the incident  $E$ -field vector. To obtain a transmitted wave with circularly polarized (CP) property, the well-known conditions on magnitude and phase difference of these two paths are presented. Then, to develop a unified synthesis method, two new conditions of phase difference and phase slope at the center frequency are introduced to replace the typical phase condition. The closed-form equations are derived, and a synthesis procedure is given. It can be obtained that all the involved circuit parameters can be derived from the specifications of these two paths, such as in-band insertion loss (IL) ripples and fractional bandwidths. Moreover, the phase difference condition of these two paths is further modified to obtain an arbitrary axial ratio (AR) at the center frequency and enhance the AR bandwidth of the polarizer. A group of design examples are theoretically investigated to demonstrate and verify the design concept. An alternative design example is finally selected and fabricated. Good agreement between simulated and measured results features its advantages of wide AR bandwidth and low IL. Therefore, the proposed synthesis method can provide a promising solution to design many other types of wideband linear-to-circular polarizers.","1558-2221","","10.1109/TAP.2022.3177491","National Key Research and Development Program of China(grant numbers:2021YFE0205900); National Natural Science Foundation of China(grant numbers:62071243,61971475); Macao Science and Technology Development Fund under The Science and Technology Development Fund of Macao (FDCT)(grant numbers:0085/2020/AMJ,0095/2019/A2); ","https://ieeexplore.ieee.org/stamp/stamp.jsp?arnumber=9785416","Circular polarization;frequency selective structures (FSSs);slotline;synthesis method;wideband","Wideband;Slot lines;Frequency synthesizers;Filtering;Polarization;Integrated circuit modeling;Electric fields","","10","","34","IEEE","30 May 2022","","","IEEE","IEEE Journals"
"Generalized Theory of PT-Symmetric Radio-Frequency Systems With Divergent Exceptional Points","M. Sakhdari; Z. Ye; M. Farhat; P. -Y. Chen","Department of Electrical and Computer Engineering, University of Illinois at Chicago, Chicago, IL, USA; Department of Electrical and Computer Engineering, University of Illinois at Chicago, Chicago, IL, USA; Computer, Electrical and Mathematical Sciences and Engineering Division, King Abdullah University of Science and Technology, Thuwal, Saudi Arabia; Department of Electrical and Computer Engineering, University of Illinois at Chicago, Chicago, IL, USA",IEEE Transactions on Antennas and Propagation,"8 Nov 2022","2022","70","10","9396","9405","The emergence of exceptional point (EP) and its divergent form, so-called divergent EP (DEP), in parity-time (PT)-symmetric trimer opens a new pathway for making radio frequency (RF) telemetric sensor systems with unprecedented sensitivity. Here, we put forward a rigorous and formally exact analysis for PT -symmetric electronic multimers, shedding light on the lower bound of the inductive coupling coefficient required to achieve DEPs. One clear observation is that there exists a subtle compromise among the degree of diverging bifurcation, critical inductive coupling strength, and spectral noises arising from modal interferences. We conclude that an electronic PT -symmetric trimer, although not sufficient to work at the lowest inductive coupling strength, may be the simplest structure that enables the emergence of DEPs. Our findings may provide the theoretical underpinnings and open avenues for various RF telemetry and wireless sensing systems.","1558-2221","","10.1109/TAP.2022.3179528","National Science Foundation (NSF)(grant numbers:ECCS-1917678); ","https://ieeexplore.ieee.org/stamp/stamp.jsp?arnumber=9789959","Exceptional points (EPs);non-Hermitian physics;parity-time (PT) symmetry;radio frequency (RF) telemetry;wireless sensors","Oscillators;Couplings;Telemetry;Radio frequency;Wireless sensor networks;Wireless communication;Eigenvalues and eigenfunctions","","20","","69","IEEE","7 Jun 2022","","","IEEE","IEEE Journals"
"Reconfigurable Frequency Selective Surfaces With Complementary Reflection and Transmission Responses Using Duality Theorem-Based Elements","W. -J. Liao; Y. -F. Chen; C. -L. Liao; Y. -C. Hou","Department of Electrical Engineering, National Taiwan University of Science and Technology, Taipei, Taiwan; Department of Electrical Engineering, National Taiwan University of Science and Technology, Taipei, Taiwan; Department of Electrical Engineering, National Taiwan University of Science and Technology, Taipei, Taiwan; Department of Electrical Engineering, National Taiwan University of Science and Technology, Taipei, Taiwan",IEEE Transactions on Antennas and Propagation,"8 Nov 2022","2022","70","10","9406","9414","Reconfigurable frequency-selective surface (FSS) designs that come with switchable reflection and transmission bands are developed. According to the duality theorem, complementary periodic structures made of similar wire and slot elements shall yield opposite scattering responses. This is facilitated by placing diodes between tips of the proposed #-shaped wire elements. In the reverse-bias state, disconnected elements act as a band-stop-type FSS. By providing a forward bias, connected elements are transformed into a slot array, which generates an inverted passband at the designated resonant frequency. The proposed periodic structure comprises one layer of microstrip line laid on a thin substrate. The #-shaped elements also act as the biasing network for serially connected diodes. Only one bias voltage is needed to control the FSS panel. Range setups and signal processing techniques are devised so that simulated results of infinite FSS can be compared with measured results. By including diode’s equivalent circuits in simulation models, good agreements with prototype measurement results are observed. The complementary reflection and transmission characteristics can be forwarded to advance radome and antenna designs to achieve versatile performance features.","1558-2221","","10.1109/TAP.2022.3177500","Ministry of Science and Technology, Taiwan(grant numbers:MOST109-2221-E-011-035-MY2); ","https://ieeexplore.ieee.org/stamp/stamp.jsp?arnumber=9785504","Duality theorem;radar cross section (RCS);radomes;reconfigurable frequency-selective surface (FSS);radio frequency (RF) diodes","Resonant frequency;Band-pass filters;Switches;Scattering;Periodic structures;Geometry;Wires","","13","","32","IEEE","30 May 2022","","","IEEE","IEEE Journals"
"Ultrawideband RCS Reduction Metasurface Based on Hybrid Mechanism of Absorption and Phase Cancellation","J. Su; W. Li; M. Qu; H. Yu; Z. Li; K. Qi; H. Yin","State Key Laboratory of Media Convergence and Communication, School of Information and Communication Engineering, Communication University of China, Beijing, China; State Key Laboratory of Media Convergence and Communication, School of Information and Communication Engineering, Communication University of China, Beijing, China; State Key Laboratory of Media Convergence and Communication, School of Information and Communication Engineering, Communication University of China, Beijing, China; State Key Laboratory of Media Convergence and Communication, School of Information and Communication Engineering, Communication University of China, Beijing, China; State Key Laboratory of Media Convergence and Communication, School of Information and Communication Engineering, Communication University of China, Beijing, China; Science and Technology on Electromagnetic Scattering Laboratory, Beijing, China; Science and Technology on Electromagnetic Scattering Laboratory, Beijing, China",IEEE Transactions on Antennas and Propagation,"8 Nov 2022","2022","70","10","9415","9424","In this article, an ultrawideband radar scattering cross-sectional (RCS) reduction metasurface is proposed combining with absorption and phase cancellation mechanisms. A two-lossy-layer absorber is designed first, which is responsible for low-frequency RCS reduction from 1.3 to 13 GHz (163.6%). The equivalent circuit of the proposed absorber is extracted, proving that the wideband characteristic is due to the occurrence of multiple resonant points. To further improve the RCS reduction bandwidth, the absorber unit cells are arranged with three different heights. The proposed metasurface consists of 3  $\times $  3 lattice and each lattice has  $5\times $  5 absorber unit cells. The reflection phase cancellation can be achieved owing to the wave path difference by introducing a certain height difference among subregions. Resultantly, high-frequency RCS reduction from 13 to 40 GHz can be realized since the backward scattering can be canceled effectively. Finally, an extraordinary ultrawideband RCS reduction from 1.5 to 40 GHz (185.5%) can be acquired successfully. A prototype with the thickness of 0.104  $\lambda _{L}$  (the wavelength of the lowest working frequency) is fabricated and measured for demonstration. The measured results prove that the proposed design has numerous advantages including minimization, ultrawideband RCS reduction, wide angle stability, and polarization insensitivity.","1558-2221","","10.1109/TAP.2022.3184538","National Natural Science Foundation of China(grant numbers:U2141233,62101416,62101515); Fundamental Research Funds for the Central Universities(grant numbers:CUC210A001,CUC220B002); ","https://ieeexplore.ieee.org/stamp/stamp.jsp?arnumber=9806368","Absorption;metasurface;phase cancellation;ultrawideband radar cross-sectional (RCS) reduction","Metasurfaces;Absorption;Ultra wideband technology;Resistors;Equivalent circuits;Admittance;Wideband","","48","","32","IEEE","24 Jun 2022","","","IEEE","IEEE Journals"
"Electromagnetic Functional Surfaces Related to Frequency Response Control Using Back-Loaded Radio Frequency Circuits","B. Wang; W. Wu; Z. -Y. Zong; B. -Y. Sima; D. -G. Fang","Ministerial Key Laboratory of JGMT, Nanjing University of Science and Technology, Nanjing, China; Ministerial Key Laboratory of JGMT, Nanjing University of Science and Technology, Nanjing, China; Ministerial Key Laboratory of JGMT, Nanjing University of Science and Technology, Nanjing, China; Ministerial Key Laboratory of JGMT, Nanjing University of Science and Technology, Nanjing, China; Ministerial Key Laboratory of JGMT, Nanjing University of Science and Technology, Nanjing, China",IEEE Transactions on Antennas and Propagation,"8 Nov 2022","2022","70","10","9425","9434","A novel scheme for designing electromagnetic functional surfaces (EMFSs) is proposed in this article. Different from traditional frequency selective surface (FSS), this scheme uses the antenna array and the back-loaded radio frequency circuit (BLRFC) to control the frequency response of EMFSs. The antenna array and the BLRFC can be designed independently resulting in great design flexibility and functional diversity. The sharp skirt out-of-band suppression and tunable frequency response can be achieved by using this scheme. Three design levels (element level, subarray level, and array level) are introduced to illustrate the design philosophy. Several EMFSs are designed, and one of them has been fabricated and measured. Actually, the prototype is a dual-polarized absorptive frequency selective reflector (AFSR). For both TE and TM polarizations with normal incidence, the AFSR exhibits one reflection band with 3 dB bandwidth from 10.6 to 16.3 GHz, two absorption bands with the absorptivity greater than 90% from 6 to 10 GHz, and from 16.8 to 19 GHz. The AFSR has a stable angular performance up to 50°. All the design examples and fabricated prototype verify the flexibility and the superiority of the novel scheme, and a multiplicity of EMFSs can be realized by using the BLRFC technique.","1558-2221","","10.1109/TAP.2022.3184496","National Natural Science Foundation of China(grant numbers:62101262); ","https://ieeexplore.ieee.org/stamp/stamp.jsp?arnumber=9806385","Absorptive frequency selective reflector (AFSR);antenna;back-loaded radio frequency circuit (BLRFC);frequency response;electromagnetic functional surface (EMFS)","Antenna arrays;Microstrip;Frequency response;Reflection;Antennas;Radio frequency;Microstrip antennas","","11","","39","IEEE","24 Jun 2022","","","IEEE","IEEE Journals"
